hotel,price,score,avg review,reviews count,image_links,hotel_url,description
Hotel de la Torre,US$88,"8,3",Muy bien,225,https://cf.bstatic.com/xdata/images/hotel/square600/511582007.webp?k=52ad9b0cb4b26b3a9672e1bd0e989eea8805bff89dabca57d6064b5c0989aa1f&o=,https://www.booking.com/hotel/uy/el-de-la-torre.es.html?aid=304142&label=gen173nr-1FCAQoggI46wdIClgEaO0BiAEBmAEKuAEXyAEM2AEB6AEB-AEDiAIBqAIDuAKj66etBsACAdICJGFkNzE0YTJmLWU5MGUtNDk5OS05ZjA4LWMwNWRhMzJmODRhMNgCBeACAQ&ucfs=1&arphpl=1&checkin=2024-01-23&checkout=2024-01-24&group_adults=1&req_adults=1&no_rooms=1&group_children=0&req_children=0&hpos=16&hapos=66&sr_order=popularity&srpvid=147a1d11292e00cc&srepoch=1705637292&all_sr_blocks=44335101_385712533_0_1_0&highlighted_blocks=44335101_385712533_0_1_0&matching_block_id=44335101_385712533_0_1_0&sr_pri_blocks=44335101_385712533_0_1_0__8800&from_sustainable_property_sr=1&from=searchresults#hotelTmpl,"Hotel de la Torre se encuentra en La Paloma frente a la playa Anaconda y cuenta con piscina al aire libre, spa y gimnasio. Se ofrece conexión Wi-Fi gratuita.

Las habitaciones de Hotel de la Torre disponen de TV por cable, armario y baño privado. Además, se ofrece servicio de habitaciones.

En temporada alta se sirve un desayuno bufé y hay conexión Wi-Fi gratuita en las zonas comunes. El establecimiento también dispone de sauna, servicio de masajes, servicio de alquiler de bicicletas y sala de juegos.

Hotel de la Torre se encuentra a 3 km de la zona comercial y la estación de autobuses. El aeropuerto de Punta del Este está a 117 km."
Compay Hostel La Pedrera,US$16,"8,4",Muy bien,159,https://cf.bstatic.com/xdata/images/hotel/square600/422663626.webp?k=6865ad3b1aacbc092a56dca160f14f3930542ad74d3f20c9dcac000017b0829e&o=,https://www.booking.com/hotel/uy/compay-hostel.es.html?aid=304142&label=gen173nr-1FCAQoggI46wdIClgEaO0BiAEBmAEKuAEXyAEM2AEB6AEB-AEDiAIBqAIDuAKj66etBsACAdICJGFkNzE0YTJmLWU5MGUtNDk5OS05ZjA4LWMwNWRhMzJmODRhMNgCBeACAQ&ucfs=1&arphpl=1&checkin=2024-01-23&checkout=2024-01-24&group_adults=1&req_adults=1&no_rooms=1&group_children=0&req_children=0&hpos=17&hapos=67&sr_order=popularity&srpvid=147a1d11292e00cc&srepoch=1705637292&all_sr_blocks=57522201_363658715_1_1_0&highlighted_blocks=57522201_363658715_1_1_0&matching_block_id=57522201_363658715_1_1_0&sr_pri_blocks=57522201_363658715_1_1_0__1600&from_sustainable_property_sr=1&from=searchresults#hotelTmpl,"El Compay Hostel La Pedrera se encuentra en La Pedrera y ofrece jardín con piscina y zona de barbacoa, cocina compartida y habitaciones con conexión Wi-Fi gratuita y vistas al mar. Se pueden solicitar clases de surf. La playa de El Desplayado está a 300 metros.

Las habitaciones del Compay Hostel La Pedrera están equipadas con taquillas privadas. Todas tienen baño compartido con agua caliente.

Todos los días se sirve un desayuno continental. El establecimiento cuenta con cocina compartida y zona de barbacoa. En el salón compartido hay ordenadores. Se proporciona información turística.

También hay una sala de lectura. La playa de El Barco está a 700 metros.

El Compay Hostel La Pedrera se encuentra a 800 metros de la zona comercial y a 500 metros de la estación de autobuses."
Costa Colonia - Riverside Boutique Hotel,US$127,"9,0",Fantástico,1.981,https://cf.bstatic.com/xdata/images/hotel/square600/246546722.webp?k=be6d529ca1d782f495c67272dcde2482b0529b24683beb1f59e9a1381899097d&o=,https://www.booking.com/hotel/uy/costa-colonia.es.html?aid=304142&label=gen173nr-1FCAQoggI46wdIClgEaO0BiAEBmAEKuAEXyAEM2AEB6AEB-AEDiAIBqAIDuAKj66etBsACAdICJGFkNzE0YTJmLWU5MGUtNDk5OS05ZjA4LWMwNWRhMzJmODRhMNgCBeACAQ&ucfs=1&arphpl=1&checkin=2024-01-23&checkout=2024-01-24&group_adults=1&req_adults=1&no_rooms=1&group_children=0&req_children=0&hpos=18&hapos=68&sr_order=popularity&srpvid=147a1d11292e00cc&srepoch=1705637292&all_sr_blocks=31098501_265589205_0_41_0&highlighted_blocks=31098501_265589205_0_41_0&matching_block_id=31098501_265589205_0_41_0&sr_pri_blocks=31098501_265589205_0_41_0__12665&from=searchresults#hotelTmpl,"Este hotel de última generación ofrece habitaciones con vistas a la tranquila ciudad de Colonia del Sacramento. También alberga varias instalaciones de ocio, como piscina al aire libre y spa de bienestar. Además, hay WiFi gratuita.

Los lofts y suites del Costa Colonia son amplios y presentan una decoración elegante en colores crema y beige. Todos los alojamientos incluyen aire acondicionado, TV LCD, reproductor de DVD, zona de estar y balcón privado.

El Costa Colonia disfruta de vistas al río y alberga un bar restaurante al aire libre que prepara platos a la carta. Por las mañanas se sirve un desayuno continental.

El Costa Colonia goza de una ubicación privilegiada, a solo 2 km del faro, de la estación de Buquebus y del casino Radisson. Asimismo, el establecimiento se halla a 54 km del aeropuerto Jorge Newbery y a 60 minutos en ferry de Buenos Aires.

El Costa Colonia también ofrece servicios de alquiler de coches y bicicletas. Además, se proporciona servicio de enlace con el aeropuerto."
La Araucana,US$53,"8,8",Fabuloso,99,https://cf.bstatic.com/xdata/images/hotel/square600/157275054.webp?k=13a13047cf7ee7972a49171e685681b84cfedda1250a0980c66aa5250ff13b07&o=,https://www.booking.com/hotel/uy/la-araucana.es.html?aid=304142&label=gen173nr-1FCAQoggI46wdIClgEaO0BiAEBmAEKuAEXyAEM2AEB6AEB-AEDiAIBqAIDuAKj66etBsACAdICJGFkNzE0YTJmLWU5MGUtNDk5OS05ZjA4LWMwNWRhMzJmODRhMNgCBeACAQ&ucfs=1&arphpl=1&checkin=2024-01-23&checkout=2024-01-24&group_adults=1&req_adults=1&no_rooms=1&group_children=0&req_children=0&hpos=19&hapos=69&sr_order=popularity&srpvid=147a1d11292e00cc&srepoch=1705637292&all_sr_blocks=282254901_125122264_1_0_0&highlighted_blocks=282254901_125122264_1_0_0&matching_block_id=282254901_125122264_1_0_0&sr_pri_blocks=282254901_125122264_1_0_0__5300&from=searchresults#hotelTmpl,"La Araucana se encuentra en Tacuarembó y ofrece alojamiento con wifi gratis, aire acondicionado y acceso a un jardín.

Algunas unidades también tienen una cocina americana equipada con nevera y microondas."
Compay Hostel Punta del Diablo,US$22,"8,3",Muy bien,356,https://cf.bstatic.com/xdata/images/hotel/square600/507947716.webp?k=819c7c3609d1a266965a94b4b2d75e5370294af5d88870f9ef9624727f7fa355&o=,https://www.booking.com/hotel/uy/compay-hostel-punta-del-diablo.es.html?aid=304142&label=gen173nr-1FCAQoggI46wdIClgEaO0BiAEBmAEKuAEXyAEM2AEB6AEB-AEDiAIBqAIDuAKj66etBsACAdICJGFkNzE0YTJmLWU5MGUtNDk5OS05ZjA4LWMwNWRhMzJmODRhMNgCBeACAQ&ucfs=1&arphpl=1&checkin=2024-01-23&checkout=2024-01-24&group_adults=1&req_adults=1&no_rooms=1&group_children=0&req_children=0&hpos=20&hapos=70&sr_order=popularity&srpvid=147a1d11292e00cc&srepoch=1705637292&all_sr_blocks=57531915_363658700_1_1_0&highlighted_blocks=57531915_363658700_1_1_0&matching_block_id=57531915_363658700_1_1_0&sr_pri_blocks=57531915_363658700_1_1_0__2200&from_sustainable_property_sr=1&from=searchresults#hotelTmpl,"El Compay Hostel se encuentra a solo 300 metros de la playa El Rivero y ofrece zonas comunes confortables, jardín con hamacas y zona de acampada. Este alojamiento proporciona WiFi gratuita y está a 300 metros del centro de la localidad. En el establecimiento se sirve un desayuno continental.

Las habitaciones del Compay Hostel Punta del Diablo son prácticas e incluyen taquillas que se pueden cerrar y baño compartido con agua caliente. Algunas de estas habitaciones gozan de vistas al océano.

Hay zona de barbacoa y cocina compartida. También se proporciona una sala de uso común con ordenadores y recepción 24 horas que ofrece información turística.

La playa de La Viuda se encuentra a 700 metros y la estación de autobuses de Punta del Diablo se halla a 2,5 km del Compay Hostel. La recepción permanece abierta las 24 horas."
Salto Hotel y Casino,US$120,"8,4",Muy bien,728,https://cf.bstatic.com/xdata/images/hotel/square600/81050862.webp?k=0119713138b3878ffcae2a80bdf4320989e720d6dbf56b2e4db571e6fb9657d6&o=,https://www.booking.com/hotel/uy/salto-y-casino.es.html?aid=304142&label=gen173nr-1FCAQoggI46wdIClgEaO0BiAEBmAEKuAEXyAEM2AEB6AEB-AEDiAIBqAIDuAKj66etBsACAdICJGFkNzE0YTJmLWU5MGUtNDk5OS05ZjA4LWMwNWRhMzJmODRhMNgCBeACAQ&ucfs=1&arphpl=1&checkin=2024-01-23&checkout=2024-01-24&group_adults=1&req_adults=1&no_rooms=1&group_children=0&req_children=0&hpos=21&hapos=71&sr_order=popularity&srpvid=147a1d11292e00cc&srepoch=1705637292&all_sr_blocks=42036209_340852308_1_1_0&highlighted_blocks=42036209_340852308_1_1_0&matching_block_id=42036209_340852308_1_1_0&sr_pri_blocks=42036209_340852308_1_1_0__12040&from=searchresults#hotelTmpl,"El Salto Hotel y Casino, ubicado en Salto, cuenta con piscina, gimnasio, casino y restaurante. Ofrece habitaciones con conexión Wi-Fi gratuita y TV de plasma y aparcamiento gratuito. La plaza principal de Artigas se encuentra a 15 metros.

Las habitaciones del Salto Hotel están decoradas en tonos suaves y disponen de calefacción, aire acondicionado y baño privado. Algunas ofrecen vistas al parque.

Todos los días se sirve el desayuno. El restaurante La Botica ofrece platos de cocina internacional y regional. También hay un bar que ofrece aperitivos y bebidas.

El establecimiento cuenta con casino, piscina y gimnasio. Además, se puede visitar la catedral de San Juan Bautista, que se encuentra a sólo 10 metros.

El Salto Hotel y Casino está a 1 km de la terminal de autobuses de Salto."
Bali Hotel Boutique,US$79,"8,6",Fabuloso,219,https://cf.bstatic.com/xdata/images/hotel/square600/38859427.webp?k=32d202ea14b217f69217407486c4853f53ea6793392ec6cc021b6f50db05ff40&o=,https://www.booking.com/hotel/uy/bali-san-gregorio-de-polanco.es.html?aid=304142&label=gen173nr-1FCAQoggI46wdIClgEaO0BiAEBmAEKuAEXyAEM2AEB6AEB-AEDiAIBqAIDuAKj66etBsACAdICJGFkNzE0YTJmLWU5MGUtNDk5OS05ZjA4LWMwNWRhMzJmODRhMNgCBeACAQ&ucfs=1&arphpl=1&checkin=2024-01-23&checkout=2024-01-24&group_adults=1&req_adults=1&no_rooms=1&group_children=0&req_children=0&hpos=22&hapos=72&sr_order=popularity&srpvid=147a1d11292e00cc&srepoch=1705637292&all_sr_blocks=123806402_137115934_2_1_0&highlighted_blocks=123806402_137115934_2_1_0&matching_block_id=123806402_137115934_2_1_0&sr_pri_blocks=123806402_137115934_2_1_0__7900&from_sustainable_property_sr=1&from=searchresults#hotelTmpl,"El Bali Hotel Boutique está situado en San Gregorio de Polanco y ofrece alojamiento, una piscina al aire libre y un centro de fitness. Además, proporciona conexión WiFi gratuita y un desayuno continental diario.

Todas las habitaciones del Bali Hotel Boutique están decoradas en un estilo indonesio y gozan de bonitas vistas al jardín y a la piscina. Cuentan con baño completo, TV de pantalla plana, minibar y aire acondicionado. Además, algunas están equipadas con bañera de hidromasaje y suelo de baldosa.

El establecimiento alberga una bañera de hidromasaje, una zona de barbacoa y un bar. Además, ofrece bicicletas gratuitas, consigna de equipaje y un servicio de traslado, disponible por un suplemento.

El establecimiento se encuentra a 500 metros del río Negro y facilita aparcamiento gratuito bajo petición."
Arapey Thermal All Inclusive Resort & Spa,US$300,"8,9",Fabuloso,1.001,https://cf.bstatic.com/xdata/images/hotel/square600/61383221.webp?k=6639f12b82effd222222887f962dd848d244b76cefa8a15d32c7b2154d82567e&o=,https://www.booking.com/hotel/uy/arapey-thermal-resort.es.html?aid=304142&label=gen173nr-1FCAQoggI46wdIClgEaO0BiAEBmAEKuAEXyAEM2AEB6AEB-AEDiAIBqAIDuAKj66etBsACAdICJGFkNzE0YTJmLWU5MGUtNDk5OS05ZjA4LWMwNWRhMzJmODRhMNgCBeACAQ&ucfs=1&arphpl=1&checkin=2024-01-23&checkout=2024-01-24&group_adults=1&req_adults=1&no_rooms=1&group_children=0&req_children=0&hpos=23&hapos=73&sr_order=popularity&srpvid=147a1d11292e00cc&srepoch=1705637292&all_sr_blocks=31582504_332477452_2_85_0&highlighted_blocks=31582504_332477452_2_85_0&matching_block_id=31582504_332477452_2_85_0&sr_pri_blocks=31582504_332477452_2_85_0__30000&from_sustainable_property_sr=1&from=searchresults#hotelTmpl,"Este complejo termal de tipo todo incluido tiene piscinas termales cubiertas y al aire libre y un spa con sauna y servicio de masajes. También cuenta con un jardín y una terraza. Está a 80 km de Salto.

Las habitaciones del Arapey Thermal Resort & Spa ofrecen vistas al jardín. Disponen de TV de plasma y una zona de estar amplia con ventanas grandes.

Por las mañanas se sirve un desayuno bufé. Además, los cócteles del bar se pueden disfrutar en la terraza.

Al lado de la piscina hay tumbonas. En el establecimiento también hay una sala de juegos. El club infantil ofrece actividades divertidas y creativas para niños. También hay una pista de tenis y una sala con varias consolas Wii. A 3 km del Arapey Thermal hay un campo de golf.

El aeropuerto de Carrasco está a 496 km. Buenos Aires se encuentra a 513 km del establecimiento."
Marinas del Riachuelo,US$64,"9,5",Excepcional,139,https://cf.bstatic.com/xdata/images/hotel/square600/397636202.webp?k=be3bc5250678996decabfe0bdda7146ef3b61d36377ce7031431ed0d1d9f9386&o=,https://www.booking.com/hotel/uy/marinas-del-riachuelo.es.html?aid=304142&label=gen173nr-1FCAQoggI46wdIClgEaO0BiAEBmAEKuAEXyAEM2AEB6AEB-AEDiAIBqAIDuAKj66etBsACAdICJGFkNzE0YTJmLWU5MGUtNDk5OS05ZjA4LWMwNWRhMzJmODRhMNgCBeACAQ&ucfs=1&arphpl=1&checkin=2024-01-23&checkout=2024-01-24&group_adults=1&req_adults=1&no_rooms=1&group_children=0&req_children=0&hpos=24&hapos=74&sr_order=popularity&srpvid=147a1d11292e00cc&srepoch=1705637292&all_sr_blocks=59597303_90927967_0_2_0&highlighted_blocks=59597303_90927967_0_2_0&matching_block_id=59597303_90927967_0_2_0&sr_pri_blocks=59597303_90927967_0_2_0__6400&from_sustainable_property_sr=1&from=searchresults#hotelTmpl,"El Marinas del Riachuelo, situado en Colonia del Sacramento, ofrece habitaciones con WiFi gratis y aire acondicionado, así como piscina al aire libre. Se halla a 10 km del centro histórico y proporciona aparcamiento gratuito.

Las habitaciones del Marinas del Riachuelo tienen el suelo de baldosa y están decoradas con pinturas contemporáneas. Cuentan con TV vía satélite, minibar y baño privado.

El Marinas del Riachuelo se encuentra a 5 km de la playa El Calabrés y a 10 km de la estación de autobuses."
Radisson Montevideo Victoria Plaza Hotel,US$126,"8,5",Muy bien,2.521,https://cf.bstatic.com/xdata/images/hotel/square600/521231809.webp?k=027f95adbab00476833adb1f5461cbaa2502bbd79e575c87d39dcba7fc01bbcd&o=,https://www.booking.com/hotel/uy/radisson-montevideo-victoria-plaza.es.html?aid=304142&label=gen173nr-1FCAQoggI46wdIClgEaO0BiAEBmAEKuAEXyAEM2AEB6AEB-AEDiAIBqAIDuAKj66etBsACAdICJGFkNzE0YTJmLWU5MGUtNDk5OS05ZjA4LWMwNWRhMzJmODRhMNgCBeACAQ&ucfs=1&arphpl=1&checkin=2024-01-23&checkout=2024-01-24&group_adults=1&req_adults=1&no_rooms=1&group_children=0&req_children=0&hpos=25&hapos=75&sr_order=popularity&srpvid=147a1d11292e00cc&srepoch=1705637292&all_sr_blocks=0_0_1_0_0&highlighted_blocks=0_0_1_0_0&matching_block_id=0_0_1_0_0&sr_pri_blocks=0_0_1_0_0__12644&from_sustainable_property_sr=1&from=searchresults#hotelTmpl,"El Radisson Montevideo Victoria Plaza está ubicado en pleno centro de la ciudad, frente a la plaza Independencia, y ofrece vistas impresionantes a la bahía del puerto. Este hotel cuenta con gimnasio, piscina cubierta, spa, salón de masajes, sauna, zona para correr, casino y conserje. 

Las habitaciones del Radisson Montevideo Victoria Plaza son confortables y disponen de WiFi gratuita, TV por cable, cafetera, minibar y baño privado con bañera. Las suites son amplias y tienen zona de estar independiente y vistas impresionantes al Río de la Plata.

El Radisson Victoria alberga varios sitios para comer, entre ellos un restaurante de especialidades uruguayas y el Bistró Victoria, que sirve una selección de cócteles. También alberga el Baccarat Café. Se sirve un desayuno buffet a diario.

El mostrador de información turística del hotel ofrece un servicio de reserva de excursiones al Mercado del Puerto, al Museo del Gaucho y al centro histórico (Ciudad Vieja). Este hotel cuenta con solárium, centro de negocios y club infantil. 

El Radisson Montevideo se encuentra a solo 13,2 km del aeropuerto internacional de Carrasco."
Salty House Cabo Polonio,US$37,"8,4",Muy bien,99,https://cf.bstatic.com/xdata/images/hotel/square600/377675575.webp?k=80a1f95275f1358a034c08f9d7bfd3333716f5b05ac1626e13a1f30e27a27aed&o=,https://www.booking.com/hotel/uy/cabo-polonio-hostel.es.html?aid=304142&label=gen173nr-1FCAQoggI46wdIClgEaO0BiAEBmAEKuAEXyAEM2AEB6AEB-AEDiAIBqAIDuAKr66etBsACAdICJDdjMzZmZTg4LTI0MjQtNGMyYi05ZGEzLWI2MzdlZDk3ZjYzNdgCBeACAQ&ucfs=1&arphpl=1&checkin=2024-01-23&checkout=2024-01-24&group_adults=1&req_adults=1&no_rooms=1&group_children=0&req_children=0&hpos=1&hapos=76&sr_order=popularity&srpvid=e19c1d151bdd0037&srepoch=1705637301&all_sr_blocks=166826703_89549711_0_2_0&highlighted_blocks=166826703_89549711_0_2_0&matching_block_id=166826703_89549711_0_2_0&sr_pri_blocks=166826703_89549711_0_2_0__3660&from_sustainable_property_sr=1&from=searchresults#hotelTmpl,"El Salty House Cabo Polonio se encuentra en Cabo Polonio, en el departamento de Rocha, a 45 km de Punta del Diablo, y cuenta con solárium y zona de playa privada. El establecimiento funciona con energía solar.

Algunas habitaciones tienen vistas al mar o al jardín. Todas disponen de baño compartido.

La recepción está abierta las 24 horas.

Se pueden realizar diversas actividades en la zona, como snorkel, pesca y senderismo. La Paloma se encuentra a 45 km del Salty House Cabo Polonio, mientras que La Pedrera está a 38 km."
Dolores Hotel - Uruguay,US$56,"8,5",Muy bien,177,https://cf.bstatic.com/xdata/images/hotel/square600/89209938.webp?k=18c761081f40548fde9e16c47edaa572b1d6825ffe827cabb06fa5bbbcdd496e&o=,https://www.booking.com/hotel/uy/dolores.es.html?aid=304142&label=gen173nr-1FCAQoggI46wdIClgEaO0BiAEBmAEKuAEXyAEM2AEB6AEB-AEDiAIBqAIDuAKr66etBsACAdICJDdjMzZmZTg4LTI0MjQtNGMyYi05ZGEzLWI2MzdlZDk3ZjYzNdgCBeACAQ&ucfs=1&arphpl=1&checkin=2024-01-23&checkout=2024-01-24&group_adults=1&req_adults=1&no_rooms=1&group_children=0&req_children=0&hpos=2&hapos=77&sr_order=popularity&srpvid=e19c1d151bdd0037&srepoch=1705637301&all_sr_blocks=152389001_165717411_1_0_0&highlighted_blocks=152389001_165717411_1_0_0&matching_block_id=152389001_165717411_1_0_0&sr_pri_blocks=152389001_165717411_1_0_0__5565&from=searchresults#hotelTmpl,"El Dolores Hotel se encuentra en Dolores y ofrece WiFi gratuita en todas las instalaciones. El establecimiento alberga un bar y sirve un desayuno buffet diario. Se facilita aparcamiento privado gratuito.

Todas las habitaciones de este hotel tienen aire acondicionado y TV de pantalla plana. El baño es privado e incluye bañera o ducha, bidet y artículos de aseo gratuitos. Hay TV vía satélite.

La recepción está abierta las 24 horas.

El Dolores Hotel está a 36 km de Mercedes y a 45 km de Fray Bentos.

Si necesita una cama supletoria, deberá solicitarla directamente con el establecimiento (si está disponible)."
De la Plaza Hotel,US$166,"8,5",Muy bien,328,https://cf.bstatic.com/xdata/images/hotel/square600/21227706.webp?k=5caa18ebd40da405c50dc4f34681d5e12f2049e65b0333126c7431da305dfac3&o=,https://www.booking.com/hotel/uy/sf-plaza.es.html?aid=304142&label=gen173nr-1FCAQoggI46wdIClgEaO0BiAEBmAEKuAEXyAEM2AEB6AEB-AEDiAIBqAIDuAKr66etBsACAdICJDdjMzZmZTg4LTI0MjQtNGMyYi05ZGEzLWI2MzdlZDk3ZjYzNdgCBeACAQ&ucfs=1&arphpl=1&checkin=2024-01-23&checkout=2024-01-24&group_adults=1&req_adults=1&no_rooms=1&group_children=0&req_children=0&hpos=3&hapos=78&sr_order=popularity&srpvid=e19c1d151bdd0037&srepoch=1705637301&all_sr_blocks=32843306_89163077_1_1_0&highlighted_blocks=32843306_89163077_1_1_0&matching_block_id=32843306_89163077_1_1_0&sr_pri_blocks=32843306_89163077_1_1_0__16632&from=searchresults#hotelTmpl,"El De la Plaza Hotel, situado en un lugar estratégico del centro histórico de Maldonado, frente a la plaza principal y junto a la catedral, ofrece WiFi gratuita y sirve un desayuno buffet. La calle Sarandí se encuentra a solo 100 metros y alberga una gran variedad de tiendas, restaurantes y servicios. El De la Plaza Hotel se sitúa a 1,5 km de la playa Mansa y a 6 km de Punta del Este.

Las habitaciones del De la Plaza Hotel están equipadas con aire acondicionado, TV por cable, secador de pelo, caja fuerte y minibar. El establecimiento cuenta con recepción 24 horas y sirve un desayuno buffet completo con numerosas opciones todos los días.

El establecimiento también ofrece aparcamiento para motocicletas.

El establecimiento se encuentra a 15 km de la zona de La Barra, a 14 km de Punta Ballena y a 30 km de la ciudad de José Ignacio."
Gran Hotel Fray Bentos,US$85,"8,1",Muy bien,358,https://cf.bstatic.com/xdata/images/hotel/square600/129625030.webp?k=741167dabacedd859017c5bb6b910633dba8e960391b762f8da3b0619d12867a&o=,https://www.booking.com/hotel/uy/gran-fray-bentos.es.html?aid=304142&label=gen173nr-1FCAQoggI46wdIClgEaO0BiAEBmAEKuAEXyAEM2AEB6AEB-AEDiAIBqAIDuAKr66etBsACAdICJDdjMzZmZTg4LTI0MjQtNGMyYi05ZGEzLWI2MzdlZDk3ZjYzNdgCBeACAQ&ucfs=1&arphpl=1&checkin=2024-01-23&checkout=2024-01-24&group_adults=1&req_adults=1&no_rooms=1&group_children=0&req_children=0&hpos=4&hapos=79&sr_order=popularity&srpvid=e19c1d151bdd0037&srepoch=1705637301&all_sr_blocks=31582001_89161242_0_1_0&highlighted_blocks=31582001_89161242_0_1_0&matching_block_id=31582001_89161242_0_1_0&sr_pri_blocks=31582001_89161242_0_1_0__8505&from_sustainable_property_sr=1&from=searchresults#hotelTmpl,"El Gran Hotel Fray Bentos ofrece piscina y centro de fitness frente al paseo marítimo. Dispone de conexión Wi-Fi gratuita y de restaurante a 8 km de la playa de Las Cañas.

Las habitaciones del Hotel Fray Bentos cuentan con TV por cable, escritorio y conexión a internet por cable. Algunas tienen balcón y terraza privados con vistas a la costa.

Todos los días se sirve el desayuno.

El establecimiento ofrece piscina con tumbonas, jardín y centro de fitness con sauna finlandesa y gimnasio.

El establecimiento alberga una sala de conferencias y está a 10 minutos en coche del puente de Fray Bentos."
San Remo Punta Hotel,US$97,"6,9",Puntuación,2.675,https://cf.bstatic.com/xdata/images/hotel/square600/280536748.webp?k=fa655f3ab60c38b5a0bf7f886382cac3dd663669dbc0579a6f6aff647c8cfe5b&o=,https://www.booking.com/hotel/uy/san-remo-punta.es.html?aid=304142&label=gen173nr-1FCAQoggI46wdIClgEaO0BiAEBmAEKuAEXyAEM2AEB6AEB-AEDiAIBqAIDuAKr66etBsACAdICJDdjMzZmZTg4LTI0MjQtNGMyYi05ZGEzLWI2MzdlZDk3ZjYzNdgCBeACAQ&ucfs=1&arphpl=1&checkin=2024-01-23&checkout=2024-01-24&group_adults=1&req_adults=1&no_rooms=1&group_children=0&req_children=0&hpos=5&hapos=80&sr_order=popularity&srpvid=e19c1d151bdd0037&srepoch=1705637301&all_sr_blocks=26859104_89154887_0_1_0&highlighted_blocks=26859104_89154887_0_1_0&matching_block_id=26859104_89154887_0_1_0&sr_pri_blocks=26859104_89154887_0_1_0__9677&from=searchresults#hotelTmpl,"El San Remo Hotel tiene una piscina cubierta y se encuentra a 300 metros de las playas Brava y Mansa de Punta del Este. Ofrece alojamientos con aire acondicionado y WiFi gratuita.

Las habitaciones del San Remo Punta Hotel son sencillas y disponen de baño privado y suelo de baldosa. Además, hay servicio de habitaciones.

El establecimiento alberga jardín, parque infantil, recepción abierta las 24 horas y aparcamiento.

El San Remo Punta Hotel se halla a 150 metros del puente peatonal y a 3 calles del famoso casino Conrad."
La Capilla - Punta del Este,US$246,"9,3",Fantástico,2.026,https://cf.bstatic.com/xdata/images/hotel/square600/349350229.webp?k=32f7d79b92d2e808b73b26a7c9c64ee070d2e6c6b96a47b43daed37da1ceec3e&o=,https://www.booking.com/hotel/uy/la-capilla.es.html?aid=304142&label=gen173nr-1FCAQoggI46wdIClgEaO0BiAEBmAEKuAEXyAEM2AEB6AEB-AEDiAIBqAIDuAKr66etBsACAdICJDdjMzZmZTg4LTI0MjQtNGMyYi05ZGEzLWI2MzdlZDk3ZjYzNdgCBeACAQ&ucfs=1&arphpl=1&checkin=2024-01-23&checkout=2024-01-24&group_adults=1&req_adults=1&no_rooms=1&group_children=0&req_children=0&hpos=6&hapos=81&sr_order=popularity&srpvid=e19c1d151bdd0037&srepoch=1705637301&all_sr_blocks=33180412_89163662_2_1_0&highlighted_blocks=33180412_89163662_2_1_0&matching_block_id=33180412_89163662_2_1_0&sr_pri_blocks=33180412_89163662_2_1_0__24570&from_sustainable_property_sr=1&from=searchresults#hotelTmpl,"La Capilla - Punta del Este ofrece jardín con piscina cubierta y exterior, restaurante, habitaciones y suites con WiFi gratuita y desayuno. El alojamiento está a 450 metros de la playa La Brava.

Las habitaciones de La Capilla - Punta del Este ofrecen vistas al jardín desde los ventanales e incluyen aire acondicionado y TV por cable. Los apartamentos están equipados con minibar y caja fuerte. Las suites disponen de balcón y bañera de hidromasaje.

Se sirve un desayuno buffet diario que incluye cereales, zumos, yogur, jamón y bebidas calientes. Las bebidas del bar pueden tomarse en el jardín.

Hay tumbonas junto a la piscina y en el jardín. También hay una sala de juegos. El spa incluye sauna, baño turco y jacuzzi.

El personal de la recepción, abierta las 24 horas, puede organizar un servicio de enlace con el aeropuerto Laguna del Sauce, situado a 20 km. La Capilla - Punta del Este se encuentra a 1 km del centro comercial Punta Shopping y a 5 minutos en coche del centro de Punta del Este."
