hotel,price,score,avg review,reviews count,image_links,hotel_url,description
Gran Hotel Brisas del Hum,US$84,"7,9",Bien,476,https://cf.bstatic.com/xdata/images/hotel/square600/73816134.webp?k=e77dbf5f69a22a1f32c9769e415b83889c1021d6b8ea4a25a9247abc4d732234&o=,https://www.booking.com/hotel/uy/gran-brisas-del-hum.es.html?aid=304142&label=gen173nr-1FCAQoggI46wdIClgEaO0BiAEBmAEKuAEXyAEM2AEB6AEB-AEDiAIBqAIDuAKa66etBsACAdICJDdmNDVkYzA0LTg4MzUtNDNlMC04ZTM3LWMxYTIxY2Y5MTYxYdgCBeACAQ&ucfs=1&arphpl=1&checkin=2024-01-23&checkout=2024-01-24&group_adults=1&req_adults=1&no_rooms=1&group_children=0&req_children=0&hpos=25&hapos=50&sr_order=popularity&srpvid=66691d0db14e0045&srepoch=1705637284&all_sr_blocks=31582701_89161243_0_1_0&highlighted_blocks=31582701_89161243_0_1_0&matching_block_id=31582701_89161243_0_1_0&sr_pri_blocks=31582701_89161243_0_1_0__8400&from_sustainable_property_sr=1&from=searchresults#hotelTmpl,"Este establecimiento se encuentra en el centro de Mercedes, a solo 4 calles del río Negro, y dispone de piscina al aire libre con zona de terraza y gimnasio. Algunas tienen balcón privado.

El Gran Hotel Brisas del Hum cuenta con un vestíbulo de estilo moderno. Hay conexión Wi-Fi gratuita en las zonas comunes.

Las habitaciones disponen de aire acondicionado, cortinas hasta el suelo, colchas de color oliva pálido y accesorios de madera oscura. Hay detalles de arte contemporáneo. TV por cable y minibar.


El Brisas del Hum está a solo 1 calle de la pintoresca catedral de Mercedes. El castillo Maua, un monumento arquitectónico local, está a 6 km."
"Holiday Inn Montevideo, an IHG Hotel",US$85,"8,1",Muy bien,1.412,https://cf.bstatic.com/xdata/images/hotel/square600/274094058.webp?k=d0cacd225816303fa1aec84e7a953dbad64a52b2c1abda6070019a97859c8ec1&o=,https://www.booking.com/hotel/uy/holiday-inn.es.html?aid=304142&label=gen173nr-1FCAQoggI46wdIClgEaO0BiAEBmAEKuAEXyAEM2AEB6AEB-AEDiAIBqAIDuAKj66etBsACAdICJGFkNzE0YTJmLWU5MGUtNDk5OS05ZjA4LWMwNWRhMzJmODRhMNgCBeACAQ&ucfs=1&arphpl=1&checkin=2024-01-23&checkout=2024-01-24&group_adults=1&req_adults=1&no_rooms=1&group_children=0&req_children=0&hpos=1&hapos=51&sr_order=popularity&srpvid=147a1d11292e00cc&srepoch=1705637285&all_sr_blocks=30287709_95437447_2_34_0&highlighted_blocks=30287709_95437447_2_34_0&matching_block_id=30287709_95437447_2_34_0&sr_pri_blocks=30287709_95437447_2_34_0__8460&from=searchresults#hotelTmpl,"El Holiday Inn cuenta con piscina cubierta y gimnasio, así como elegantes habitaciones con TV por cable y desayuno, a solo 500 metros del ayuntamiento de Montevideo. La terminal de autobuses de Tres Cruces está a 2 km.

Las habitaciones del Holiday Inn Montevideo son amplias y luminosas y presentan una decoración elegante en tonos suaves. Todas tienen escritorio y minibar, mientras que algunas disponen de zona de estar amplia y bañera de hidromasaje privada.

A diario se sirve un desayuno buffet con repostería, jamón y queso. El bar salón ofrece bebidas y aperitivos.

Este establecimiento alberga una sauna y una terraza con tumbonas. Hay WiFi gratuita en las zonas comunes y conexión a Internet por cable en las habitaciones.

Se pueden reservar excursiones en el mostrador de información turística. El Holiday Inn Montevideo se halla a 5 minutos en coche del puerto de Montevideo y a 30 km del aeropuerto internacional de Carrasco.

De conformidad con las leyes fiscales uruguayas, durante la temporada alta (del 15 de noviembre al domingo de Pascua), los ciudadanos uruguayos deben pagar un suplemento del 10% en concepto de IVA. Dicho impuesto no está incluido en el precio total de la reserva.

El pago se efectuará en moneda local (UYU) según el tipo de cambio vigente el día del pago.

De conformidad con la normativa fiscal del país, los ciudadanos uruguayos están obligados a pagar un suplemento del 10%. Este importe no se incluye de forma automática en el importe total de la reserva."
Hotel Solerios,US$280,"9,3",Fantástico,1.719,https://cf.bstatic.com/xdata/images/hotel/square600/333601159.webp?k=0e0d9038a424f83870841d8652d758f185853d18c6af8feadb65cec861d526d9&o=,https://www.booking.com/hotel/uy/solerios.es.html?aid=304142&label=gen173nr-1FCAQoggI46wdIClgEaO0BiAEBmAEKuAEXyAEM2AEB6AEB-AEDiAIBqAIDuAKj66etBsACAdICJGFkNzE0YTJmLWU5MGUtNDk5OS05ZjA4LWMwNWRhMzJmODRhMNgCBeACAQ&ucfs=1&arphpl=1&checkin=2024-01-23&checkout=2024-01-24&group_adults=1&req_adults=1&no_rooms=1&group_children=0&req_children=0&hpos=2&hapos=52&sr_order=popularity&srpvid=147a1d11292e00cc&srepoch=1705637292&all_sr_blocks=778297401_336194648_2_1_0&highlighted_blocks=778297401_336194648_2_1_0&matching_block_id=778297401_336194648_2_1_0&sr_pri_blocks=778297401_336194648_2_1_0__28000&from_sustainable_property_sr=1&from=searchresults#hotelTmpl,"El Hotel Solerios se encuentra en Punta del Este, a 200 metros de la playa Mansa, y ofrece alojamiento de 4 estrellas, restaurante, centro de fitness y bar. El establecimiento está a menos de 1 km del centro comercial Punta Shopping, a 2,3 km de la feria de artesanía y a 2,9 km del puerto de Punta del Este. El hotel cuenta con terraza y bañera de hidromasaje.

Las habitaciones disponen de aire acondicionado, armario, caja fuerte, TV de pantalla plana, balcón y baño privado con bidet. Algunas habitaciones del Hotel Solerios gozan de vistas al mar. Las habitaciones incluyen ropa de cama.

Todas las mañanas se sirve un desayuno buffet.

El establecimiento cuenta con sauna.

La recepción puede proporcionar información sobre la zona.

Cerca del alojamiento hay varios lugares de interés, como la playa Mansa, el casino Nogaro y el supermercado. El aeropuerto más cercano es el aeropuerto internacional Capitán de Corbeta Carlos A. Curbelo, ubicado a 18 km del Hotel Solerios.

El aparcamiento está sujeto a disponibilidad."
Alquimia Posada,US$45,"9,2",Fantástico,97,https://cf.bstatic.com/xdata/images/hotel/square600/19593297.webp?k=dff56c0b715de10ff6b00de0ca0ee939a9fbc9486723f5fde8cbe64822966633&o=,https://www.booking.com/hotel/uy/alquimia-spa-y-posada.es.html?aid=304142&label=gen173nr-1FCAQoggI46wdIClgEaO0BiAEBmAEKuAEXyAEM2AEB6AEB-AEDiAIBqAIDuAKj66etBsACAdICJGFkNzE0YTJmLWU5MGUtNDk5OS05ZjA4LWMwNWRhMzJmODRhMNgCBeACAQ&ucfs=1&arphpl=1&checkin=2024-01-23&checkout=2024-01-24&group_adults=1&req_adults=1&no_rooms=1&group_children=0&req_children=0&hpos=3&hapos=53&sr_order=popularity&srpvid=147a1d11292e00cc&srepoch=1705637292&all_sr_blocks=63306901_230872730_1_1_0&highlighted_blocks=63306901_230872730_1_1_0&matching_block_id=63306901_230872730_1_1_0&sr_pri_blocks=63306901_230872730_1_1_0__4500&from_sustainable_property_sr=1&from=searchresults#hotelTmpl,"El Alquimia Spa y Posada ofrece piscina al aire libre y cubierta, un spa, un jardín, conexión Wi-Fi gratuita y bicicletas de uso gratuito. Está en Guichón, a 300 metros de una parada de autobús y a 5 km de las aguas termales de Almirón.

Las habitaciones del Alquimia Spa y Posada proporcionan un ambiente tranquilo y cuentan con baño privado, aire acondicionado y vistas panorámicas. También hay servicio de habitaciones.

En el spa se ofrecen masajes antiestrés, tratamientos con piedras calientes, shiatsu, biomagnetismo, reflexología, terapias con flores de Bach y sesiones de reiki, taichi y yoga. El establecimiento alberga un salón de belleza y una bañera de hidromasaje.

Además, ofrece aparcamiento privado gratuito y conexión Wi-Fi gratuita en las zonas comunes."
RocaMar Hostel Boutique,US$26,"7,9",Bien,828,https://cf.bstatic.com/xdata/images/hotel/square600/115481237.webp?k=b81f8ad96041ada64ad034e14c00cfbf837105084d0438f91142f2814c1eee4e&o=,https://www.booking.com/hotel/uy/rocamar-hostel.es.html?aid=304142&label=gen173nr-1FCAQoggI46wdIClgEaO0BiAEBmAEKuAEXyAEM2AEB6AEB-AEDiAIBqAIDuAKj66etBsACAdICJGFkNzE0YTJmLWU5MGUtNDk5OS05ZjA4LWMwNWRhMzJmODRhMNgCBeACAQ&ucfs=1&arphpl=1&checkin=2024-01-23&checkout=2024-01-24&group_adults=1&req_adults=1&no_rooms=1&group_children=0&req_children=0&hpos=4&hapos=54&sr_order=popularity&srpvid=147a1d11292e00cc&srepoch=1705637292&all_sr_blocks=271156114_146326809_0_42_0&highlighted_blocks=271156114_146326809_0_42_0&matching_block_id=271156114_146326809_0_42_0&sr_pri_blocks=271156114_146326809_0_42_0__2565&from_sustainable_property_sr=1&from=searchresults#hotelTmpl,"El RocaMar Hostel Boutique ofrece WiFi gratuita en todas las instalaciones y se encuentra en Punta del Este, a 200 metros de Playa Brava. Los huéspedes podrán disfrutar del bar.

El alojamiento dispone de TV de pantalla plana con canales por cable.

El RocaMar Hostel Boutique está a 1,2 km del centro comercial y a 3,1 km de la feria de artesanía. El aeropuerto internacional Capitán Carlos A. Curbelo, el aeropuerto más cercano, está a 19 km."
Dazzler by Wyndham Colonia,US$117,"8,4",Muy bien,2.539,https://cf.bstatic.com/xdata/images/hotel/square600/90025395.webp?k=d9514ee49aade0dd4b5afc193884f711cdcf2bb5de5487c4445dba4fc58ebd34&o=,https://www.booking.com/hotel/uy/dazzler-colonia.es.html?aid=304142&label=gen173nr-1FCAQoggI46wdIClgEaO0BiAEBmAEKuAEXyAEM2AEB6AEB-AEDiAIBqAIDuAKj66etBsACAdICJGFkNzE0YTJmLWU5MGUtNDk5OS05ZjA4LWMwNWRhMzJmODRhMNgCBeACAQ&ucfs=1&arphpl=1&checkin=2024-01-23&checkout=2024-01-24&group_adults=1&req_adults=1&no_rooms=1&group_children=0&req_children=0&hpos=5&hapos=55&sr_order=popularity&srpvid=147a1d11292e00cc&srepoch=1705637292&all_sr_blocks=199447010_94126398_2_1_0&highlighted_blocks=199447010_94126398_2_1_0&matching_block_id=199447010_94126398_2_1_0&sr_pri_blocks=199447010_94126398_2_1_0__11700&from_sustainable_property_sr=1&from=searchresults#hotelTmpl,"El Dazzler by Wyndham Colonia ofrece alojamiento frente a la playa, alberga un centro de spa y está situado en Colonia del Sacramento, en el departamento de Colonia. El parque nacional Anchorena está a 20 km. El centro histórico de Colonia de Sacramento se encuentra a 2,5 km.

El Dazzler by Wyndham Colonia sirve un desayuno buffet.

Todas las habitaciones tienen TV de pantalla plana. Algunas habitaciones disponen de zona de estar. Todas las habitaciones cuentan con baño privado. Se proporcionan artículos de aseo gratuitos y secador de pelo. El Dazzler by Wyndham Colonia ofrece WiFi gratuita en todas las instalaciones.

En este establecimiento hay pasillos al aire libre y recepción 24 horas.

Se admiten mascotas por un suplemento de 35 USD por mascota y noche. Todas las peticiones deberán ser confirmadas por el establecimiento."
En calma,US$75,"9,0",Fantástico,121,https://cf.bstatic.com/xdata/images/hotel/square600/276361486.webp?k=5678f9bb9430499b7402fb267d2d5939e06080817e75c73ad962895974a73d75&o=,https://www.booking.com/hotel/uy/en-calma.es.html?aid=304142&label=gen173nr-1FCAQoggI46wdIClgEaO0BiAEBmAEKuAEXyAEM2AEB6AEB-AEDiAIBqAIDuAKj66etBsACAdICJGFkNzE0YTJmLWU5MGUtNDk5OS05ZjA4LWMwNWRhMzJmODRhMNgCBeACAQ&ucfs=1&arphpl=1&checkin=2024-01-23&checkout=2024-01-24&group_adults=1&req_adults=1&no_rooms=1&group_children=0&req_children=0&hpos=6&hapos=56&sr_order=popularity&srpvid=147a1d11292e00cc&srepoch=1705637292&all_sr_blocks=134675501_383328147_2_0_0&highlighted_blocks=134675501_383328147_2_0_0&matching_block_id=134675501_383328147_2_0_0&sr_pri_blocks=134675501_383328147_2_0_0__7500&from=searchresults#hotelTmpl,"El En Calma ofrece alojamientos independientes y pintorescos con vistas al mar y se encuentra en Punta del Diablo. Este lodge está situado a solo 500 metros de la extensa playa Rivero y ofrece conexión WiFi gratuita.

Los alojamientos del En Calma son cómodos y tienen revestimientos de madera, una terraza con vistas al mar, una zona de barbacoa, aire acondicionado, una cocina bien equipada con horno y microondas y un baño con ducha.

El En calma alberga un jardín y aparcamiento gratuito.

El establecimiento se halla a 800 metros de la Playa de los Pescadores, que cuenta con un mercado de alimentos frente a la playa, y a 1 km del parque nacional de Santa Teresa."
Lobo Hostel Bar,US$22,"8,4",Muy bien,522,https://cf.bstatic.com/xdata/images/hotel/square600/518922440.webp?k=123fb980e27d6f4eeb1157dffb5e373a417c27f2268ed2d25ddcc170e8a77129&o=,https://www.booking.com/hotel/uy/lobo-hostel-bar.es.html?aid=304142&label=gen173nr-1FCAQoggI46wdIClgEaO0BiAEBmAEKuAEXyAEM2AEB6AEB-AEDiAIBqAIDuAKj66etBsACAdICJGFkNzE0YTJmLWU5MGUtNDk5OS05ZjA4LWMwNWRhMzJmODRhMNgCBeACAQ&ucfs=1&arphpl=1&checkin=2024-01-23&checkout=2024-01-24&group_adults=1&req_adults=1&no_rooms=1&group_children=0&req_children=0&hpos=7&hapos=57&sr_order=popularity&srpvid=147a1d11292e00cc&srepoch=1705637292&all_sr_blocks=132456401_265773545_1_42_0&highlighted_blocks=132456401_265773545_1_42_0&matching_block_id=132456401_265773545_1_42_0&sr_pri_blocks=132456401_265773545_1_42_0__2160&from_sustainable_property_sr=1&from=searchresults#hotelTmpl,"El Lobo Hostel Bar ofrece un restaurante, espectáculos en directo y alojamientos cómodos en Cabo Polonio. Las instalaciones de playa son gratuitas y el bar del establecimiento sirve bebidas deliciosas.

Las habitaciones compartidas disponen de roperos y baños compartidos.

Se pueden preparar comidas en la cocina y la zona de barbacoa de uso común del Lobo Hostel Bar. La recepción 24 horas facilita información útil para desplazarse por la zona y el establecimiento también cuenta con una discoteca, salón compartido y mostrador de información turística."
Hotel Sayonara by Las Calas,US$50,"7,7",Bien,50,https://cf.bstatic.com/xdata/images/hotel/square600/410572404.webp?k=c304e82cfb7da98e7f0136bf17211e49ef296889b7e138380ce7cd16f0157b8f&o=,https://www.booking.com/hotel/uy/sayonara-by-las-calas.es.html?aid=304142&label=gen173nr-1FCAQoggI46wdIClgEaO0BiAEBmAEKuAEXyAEM2AEB6AEB-AEDiAIBqAIDuAKj66etBsACAdICJGFkNzE0YTJmLWU5MGUtNDk5OS05ZjA4LWMwNWRhMzJmODRhMNgCBeACAQ&ucfs=1&arphpl=1&checkin=2024-01-23&checkout=2024-01-24&group_adults=1&req_adults=1&no_rooms=1&group_children=0&req_children=0&hpos=8&hapos=58&sr_order=popularity&srpvid=147a1d11292e00cc&srepoch=1705637292&all_sr_blocks=562827401_212033185_1_1_0&highlighted_blocks=562827401_212033185_1_1_0&matching_block_id=562827401_212033185_1_1_0&sr_pri_blocks=562827401_212033185_1_1_0__5040&from=searchresults#hotelTmpl,"Hotel Sayonara by Las Calas se encuentra en Paso de los Toros y dispone de jardín, salón de uso común, bar y wifi gratis en todo el alojamiento. El alojamiento ofrece servicio de habitaciones, recepción 24 horas y cambio de moneda.

Todas las unidades de este alojamiento están equipadas con TV de pantalla plana. En el hotel, todas las habitaciones cuentan con aire acondicionado y baño privado."
Salinas del Almiron Resort Termal,US$180,"8,7",Fabuloso,736,https://cf.bstatic.com/xdata/images/hotel/square600/201529938.webp?k=dc03f828c8d7bc51b11b6ed095680b88c7f680c94e5e95a65cc6f28058b2bbb8&o=,https://www.booking.com/hotel/uy/salinas-del-almiron-resort-termal.es.html?aid=304142&label=gen173nr-1FCAQoggI46wdIClgEaO0BiAEBmAEKuAEXyAEM2AEB6AEB-AEDiAIBqAIDuAKj66etBsACAdICJGFkNzE0YTJmLWU5MGUtNDk5OS05ZjA4LWMwNWRhMzJmODRhMNgCBeACAQ&ucfs=1&arphpl=1&checkin=2024-01-23&checkout=2024-01-24&group_adults=1&req_adults=1&no_rooms=1&group_children=0&req_children=0&hpos=9&hapos=59&sr_order=popularity&srpvid=147a1d11292e00cc&srepoch=1705637292&all_sr_blocks=163633303_231703221_0_21_0&highlighted_blocks=163633303_231703221_0_21_0&matching_block_id=163633303_231703221_0_21_0&sr_pri_blocks=163633303_231703221_0_21_0__18000&from_sustainable_property_sr=1&from=searchresults#hotelTmpl,"El Salinas del Almiron Resort Termal está situado en Guichón y ofrece WiFi gratuita en todas las dependencias. El establecimiento alberga un centro de spa, una piscina al aire libre abierta durante todo el año y un restaurante. Se sirve desayunos todos los días.

Las habitaciones incluyen TV de pantalla plana y baño privado con bidet, ducha y artículos de aseo gratuitos.

El establecimiento cuenta con recepción 24 horas y tienda de regalos. Se proporciona aparcamiento privado gratuito.

Los huéspedes podrán jugar al ping pong en el establecimiento. El complejo también cuenta con bicicletas de uso gratuito"
Balconada Beach ROOMS,US$60,"8,1",Muy bien,334,https://cf.bstatic.com/xdata/images/hotel/square600/403805781.webp?k=f77184c328404a390e79ce9ffba17d53966da1076ead86954c6a03cc651d6a2d&o=,https://www.booking.com/hotel/uy/balconada-beach-hostel.es.html?aid=304142&label=gen173nr-1FCAQoggI46wdIClgEaO0BiAEBmAEKuAEXyAEM2AEB6AEB-AEDiAIBqAIDuAKj66etBsACAdICJGFkNzE0YTJmLWU5MGUtNDk5OS05ZjA4LWMwNWRhMzJmODRhMNgCBeACAQ&ucfs=1&arphpl=1&checkin=2024-01-23&checkout=2024-01-24&group_adults=1&req_adults=1&no_rooms=1&group_children=0&req_children=0&hpos=10&hapos=60&sr_order=popularity&srpvid=147a1d11292e00cc&srepoch=1705637292&all_sr_blocks=211817313_270919794_2_0_0&highlighted_blocks=211817313_270919794_2_0_0&matching_block_id=211817313_270919794_2_0_0&sr_pri_blocks=211817313_270919794_2_0_0__6000&from=searchresults#hotelTmpl,"El Balconada Beach ROOMS está situado en La Paloma, a 46 km de Cabo Polonio. Tiene barbacoa, vistas al mar, restaurante y bar. El Balconada Beach ROOMS dispone de WiFi gratuita en todas las instalaciones.

Todas las habitaciones incluyen baño compartido.

La recepción está abierta las 24 horas. También hay servicio de préstamo de bicicletas.

La Pedrera se halla a 9 km del Balconada Beach ROOMS, mientras que Rocha se encuentra a 25 km. El aeropuerto internacional Capitán Carlos A. Curbelo queda a 88 km."
Posada Campotinto,US$179,"8,8",Fabuloso,520,https://cf.bstatic.com/xdata/images/hotel/square600/487960934.webp?k=df328f8bc6442b78ca6c12a8ea997306acbe0598ccadba38e16f13d6db78917e&o=,https://www.booking.com/hotel/uy/posada-campotinto.es.html?aid=304142&label=gen173nr-1FCAQoggI46wdIClgEaO0BiAEBmAEKuAEXyAEM2AEB6AEB-AEDiAIBqAIDuAKj66etBsACAdICJGFkNzE0YTJmLWU5MGUtNDk5OS05ZjA4LWMwNWRhMzJmODRhMNgCBeACAQ&ucfs=1&arphpl=1&checkin=2024-01-23&checkout=2024-01-24&group_adults=1&req_adults=1&no_rooms=1&group_children=0&req_children=0&hpos=11&hapos=61&sr_order=popularity&srpvid=147a1d11292e00cc&srepoch=1705637292&all_sr_blocks=69983903_129829213_0_1_0&highlighted_blocks=69983903_129829213_0_1_0&matching_block_id=69983903_129829213_0_1_0&sr_pri_blocks=69983903_129829213_0_1_0__17850&from_sustainable_property_sr=1&from=searchresults#hotelTmpl,"Discover an inn inspired by nature with a view of the vineyards, the San Roque Chapel in the midst of silence, peace and tranquility.

A beauty made destination, one of those authentic locations that become a perfect place to seek rest and peace.

The stay includes breakfast, very comfortable trek bikes to explore the area, a welcome drink, cleaning service on the day and turndown service at sunset.

We have an outdoor swimming pool and a jacuzzi with towel service and lounge chairs, for the summer, a gift shop, billiards, a wine bar, a bar and a stove.

There is a restaurant on site with a charming outside seating area where guests can enjoy lunch or dine on weekends.

Carmelo’s historic district, Seré Beach and the harbour are 4 km away. Zagarzazu Airport is also 4 km from Posada Campotinto."
El Legado Wine Lodge,US$207,"9,4",Fantástico,306,https://cf.bstatic.com/xdata/images/hotel/square600/247454109.webp?k=9da748fb71d4552142ba84927d4a607292b79e14ab9dd2906d97b49a10fb4ad7&o=,https://www.booking.com/hotel/uy/el-legado-wine-lodge.es.html?aid=304142&label=gen173nr-1FCAQoggI46wdIClgEaO0BiAEBmAEKuAEXyAEM2AEB6AEB-AEDiAIBqAIDuAKj66etBsACAdICJGFkNzE0YTJmLWU5MGUtNDk5OS05ZjA4LWMwNWRhMzJmODRhMNgCBeACAQ&ucfs=1&arphpl=1&checkin=2024-01-23&checkout=2024-01-24&group_adults=1&req_adults=1&no_rooms=1&group_children=0&req_children=0&hpos=12&hapos=62&sr_order=popularity&srpvid=147a1d11292e00cc&srepoch=1705637292&all_sr_blocks=631124503_361382910_2_9_0&highlighted_blocks=631124503_361382910_2_9_0&matching_block_id=631124503_361382910_2_9_0&sr_pri_blocks=631124503_361382910_2_9_0__20700&from_sustainable_property_sr=1&from=searchresults#hotelTmpl,"El Legado Wine Lodge está en Carmelo y dispone de wifi gratis, jardín, salón de uso común y restaurante.

El lodge ofrece terraza, vistas al jardín, zona de estar, TV de pantalla plana, zona de cocina totalmente equipada con nevera y microondas, y baño privado con bidet y artículos de aseo gratuitos. También hay minibar y tostadora, además de cafetera y hervidor.

El aeropuerto más cercano (Aeroparque Jorge Newbery) está a 146 km."
Hotel La Posta del Dayman,US$95,"8,4",Muy bien,1.029,https://cf.bstatic.com/xdata/images/hotel/square600/131307353.webp?k=02fe8633d451e9c9c40b3d237decbeef7b19d7b3f9b124203b1e7af9531a7d1a&o=,https://www.booking.com/hotel/uy/la-posta-del-dayman.es.html?aid=304142&label=gen173nr-1FCAQoggI46wdIClgEaO0BiAEBmAEKuAEXyAEM2AEB6AEB-AEDiAIBqAIDuAKj66etBsACAdICJGFkNzE0YTJmLWU5MGUtNDk5OS05ZjA4LWMwNWRhMzJmODRhMNgCBeACAQ&ucfs=1&arphpl=1&checkin=2024-01-23&checkout=2024-01-24&group_adults=1&req_adults=1&no_rooms=1&group_children=0&req_children=0&hpos=13&hapos=63&sr_order=popularity&srpvid=147a1d11292e00cc&srepoch=1705637292&all_sr_blocks=33539601_265590975_0_1_0&highlighted_blocks=33539601_265590975_0_1_0&matching_block_id=33539601_265590975_0_1_0&sr_pri_blocks=33539601_265590975_0_1_0__9500&from=searchresults#hotelTmpl,"El hotel La Posta del Dayman, que se encuentra a solo 200 metros de las termas del Daymán, ocupa una casa muy bonita de estilo colonial rodeada por un jardín con una piscina. Ofrece desayuno, un restaurante, un gimnasio y spa y, de forma gratuita, conexión Wi-Fi y aparcamiento.

Las habitaciones de La Posta del Dayman presentan una decoración en tonos pastel y disponen de calefacción, TV por cable, camas cómodas y mesitas de noche de madera.

Todos los días se sirve un desayuno continental a base de café, té, leche, bollería, mermelada, zumo, yogur y cereales. El restaurante ofrece platos internacionales y caseros.

Podrá relajarse en las tumbonas junto a la piscina o en las instalaciones del spa, que incluyen una bañera de hidromasaje y una sala de masajes. También hay una biblioteca y una terraza con sombra.

La Posta del Dayman está situada a 20 km de la presa de Salto Grande y a 8 km del aeropuerto internacional de Nueva Hespérides."
Hotel Sunset Beach,US$162,"8,3",Muy bien,2.242,https://cf.bstatic.com/xdata/images/hotel/square600/124801116.webp?k=765377cd80b0e56a4fb622a70a988c84717da17733ab3f0e2b87f54189552d04&o=,https://www.booking.com/hotel/uy/uy-sunset-beach.es.html?aid=304142&label=gen173nr-1FCAQoggI46wdIClgEaO0BiAEBmAEKuAEXyAEM2AEB6AEB-AEDiAIBqAIDuAKj66etBsACAdICJGFkNzE0YTJmLWU5MGUtNDk5OS05ZjA4LWMwNWRhMzJmODRhMNgCBeACAQ&ucfs=1&arphpl=1&checkin=2024-01-23&checkout=2024-01-24&group_adults=1&req_adults=1&no_rooms=1&group_children=0&req_children=0&hpos=14&hapos=64&sr_order=popularity&srpvid=147a1d11292e00cc&srepoch=1705637292&all_sr_blocks=36329601_89167853_0_1_0&highlighted_blocks=36329601_89167853_0_1_0&matching_block_id=36329601_89167853_0_1_0&sr_pri_blocks=36329601_89167853_0_1_0__16150&from_sustainable_property_sr=1&from=searchresults#hotelTmpl,"El Uy Sunset Beach Hotel está situado en Punta del Este, a solo 50 metros de la playa Mansa, y ofrece habitaciones con conexión WiFi gratuita y TV de plasma. Se proporciona desayuno y aparcamiento gratuito. Cuenta con una pequeña piscina cubierta.

Con una decoración elegante, las habitaciones del Uy Sunset Beach tienen aire acondicionado y algunas ofrecen vistas al mar.

Todos los días se sirve un desayuno buffet con zumos en la sala de desayunos. También hay un bar. Frente al establecimiento se prestan servicios de playa, incluyendo toallas, sillas de playa y sombrillas, por un suplemento.

Los huéspedes pueden hacer uso de la piscina cubierta o reservar excursiones en el mostrador de información turística. El Museo Ralli está a 4 km. El Uy Sunset Beach Hotel se encuentra a 20 km del aeropuerto de Laguna del Sauce.

El servicio de playa, toallas, sillas y sombrilla están incluidos en la tarifa, sin necesidad de pagar un suplemento."
Apart Hotel Natural del Daymán,US$55,"8,2",Muy bien,186,https://cf.bstatic.com/xdata/images/hotel/square600/87678654.webp?k=575c032aeb25b0e586c9eeec8fcb5b3f0138e23b6dda68dc84008373f3af39cb&o=,https://www.booking.com/hotel/uy/del-pasaje-natural.es.html?aid=304142&label=gen173nr-1FCAQoggI46wdIClgEaO0BiAEBmAEKuAEXyAEM2AEB6AEB-AEDiAIBqAIDuAKj66etBsACAdICJGFkNzE0YTJmLWU5MGUtNDk5OS05ZjA4LWMwNWRhMzJmODRhMNgCBeACAQ&ucfs=1&arphpl=1&checkin=2024-01-23&checkout=2024-01-24&group_adults=1&req_adults=1&no_rooms=1&group_children=0&req_children=0&hpos=15&hapos=65&sr_order=popularity&srpvid=147a1d11292e00cc&srepoch=1705637292&all_sr_blocks=213951702_377633724_0_1_0&highlighted_blocks=213951702_377633724_0_1_0&matching_block_id=213951702_377633724_0_1_0&sr_pri_blocks=213951702_377633724_0_1_0__5500&from=searchresults#hotelTmpl,"Apart Hotel Natural del Daymán está en Salto y tiene piscina al aire libre, centro de fitness, jardín y wifi gratis en todo el alojamiento. Este alojamiento, que tiene servicio de habitaciones, también ofrece zona de juegos infantil. El hotel dispone de vistas a la piscina y barbacoa.

En el hotel, todas las habitaciones incluyen armario. Todas las habitaciones del alojamiento tienen baño privado con bidet y artículos de aseo gratuitos, además de TV de pantalla plana y aire acondicionado. Algunas habitaciones incluyen patio. En Apart Hotel Natural del Daymán, las habitaciones tienen ropa de cama y toallas."
