hotel,price,score,avg review,reviews count,image_links,hotel_url,description
La Viuda de José Ignacio,US$248,"8,9",Fabuloso,446,https://cf.bstatic.com/xdata/images/hotel/square600/266761318.webp?k=8c0d14c51e6593d7d8a83a34710736b917609ba80b84e5bffe9f48e53087f930&o=,https://www.booking.com/hotel/uy/la-viuda-de-jose-ignacio.es.html?aid=304142&label=gen173nr-1FCAQoggI46wdIClgEaO0BiAEBmAEKuAEXyAEM2AEB6AEB-AEDiAIBqAIDuAKa66etBsACAdICJDdmNDVkYzA0LTg4MzUtNDNlMC04ZTM3LWMxYTIxY2Y5MTYxYdgCBeACAQ&ucfs=1&arphpl=1&checkin=2024-01-23&checkout=2024-01-24&group_adults=1&req_adults=1&no_rooms=1&group_children=0&req_children=0&hpos=9&hapos=34&sr_order=popularity&srpvid=66691d0db14e0045&srepoch=1705637284&all_sr_blocks=33697301_89164345_0_41_0&highlighted_blocks=33697301_89164345_0_41_0&matching_block_id=33697301_89164345_0_41_0&sr_pri_blocks=33697301_89164345_0_41_0__24795&from_sustainable_property_sr=1&from=searchresults#hotelTmpl,"Este hotel, situado a 200 metros de la playa, ofrece piscina exterior, spa y habitaciones modernas y elegantes con bañera de hidromasaje y conexión Wi-Fi gratuita. Algunas tienen vistas al mar.

La Viuda de José Ignacio también dispone de sombrillas y tumbonas para la playa. Asimismo, el establecimiento cuenta con servicio de préstamo gratuito de bicicletas.

Las habitaciones están equipadas con aire acondicionado, minibar, TV de pantalla plana, balcón y caja fuerte para ordenador portátil, mientras que el baño incluye toallas y albornoz de calidad.

Además, se proporciona un desayuno a base de pan, mermeladas caseras y fruta. Los huéspedes también tienen la posibilidad de disfrutar de un desayuno a la carta, que se sirve hasta las 13:00.

Hay aparcamiento gratuito en el establecimiento. Punta del Este se halla a unos 35 minutos en coche."
Mon Petit Hotel,US$70,"8,8",Fabuloso,221,https://cf.bstatic.com/xdata/images/hotel/square600/84466126.webp?k=f1f7858d7bc5012884f3e3fa256c98b180030f7ab914b9136c8adf66913b2a6e&o=,https://www.booking.com/hotel/uy/mon-petit.es.html?aid=304142&label=gen173nr-1FCAQoggI46wdIClgEaO0BiAEBmAEKuAEXyAEM2AEB6AEB-AEDiAIBqAIDuAKa66etBsACAdICJDdmNDVkYzA0LTg4MzUtNDNlMC04ZTM3LWMxYTIxY2Y5MTYxYdgCBeACAQ&ucfs=1&arphpl=1&checkin=2024-01-23&checkout=2024-01-24&group_adults=1&req_adults=1&no_rooms=1&group_children=0&req_children=0&hpos=10&hapos=35&sr_order=popularity&srpvid=66691d0db14e0045&srepoch=1705637284&all_sr_blocks=119314409_184448294_0_1_0&highlighted_blocks=119314409_184448294_0_1_0&matching_block_id=119314409_184448294_0_1_0&sr_pri_blocks=119314409_184448294_0_1_0__7000&from=searchresults#hotelTmpl,"El Mon Petit Hotel, situado en Rosario, ofrece una gran zona verde y una piscina al aire libre. Cuenta con conexión WiFi gratuita e instalaciones de spa.

Todas las habitaciones del Mon Petit Hotel presentan una decoración de estilo clásico y tienen camas cómodas, TV vía satélite, baño privado y bonitas vistas al jardín. Algunas incluyen aire acondicionado.

El Mon Petit Hotel dispone de recepción 24 horas, zona de barbacoa, instalaciones para reuniones y mostrador de información turística. Se realizan masajes bajo petición y por un suplemento.

El precio incluye un desayuno completo, que se sirve todos los días en la zona de comedor del hotel. Hay aparcamiento gratuito.

El Mon Petit Hotel se encuentra a 50 km de Colonia del Sacramento y a 125 km de Montevideo."
Hotel Posada La Comandancia,US$56,"8,7",Fabuloso,89,https://cf.bstatic.com/xdata/images/hotel/square600/68036934.webp?k=2babbd7e018daa790cbdee48542079e06c907457a9d82b06b6c86c5aa74d5f02&o=,https://www.booking.com/hotel/uy/posada-la-comandancia.es.html?aid=304142&label=gen173nr-1FCAQoggI46wdIClgEaO0BiAEBmAEKuAEXyAEM2AEB6AEB-AEDiAIBqAIDuAKa66etBsACAdICJDdmNDVkYzA0LTg4MzUtNDNlMC04ZTM3LWMxYTIxY2Y5MTYxYdgCBeACAQ&ucfs=1&arphpl=1&checkin=2024-01-23&checkout=2024-01-24&group_adults=1&req_adults=1&no_rooms=1&group_children=0&req_children=0&hpos=11&hapos=36&sr_order=popularity&srpvid=66691d0db14e0045&srepoch=1705637284&all_sr_blocks=172021201_200593863_1_1_0&highlighted_blocks=172021201_200593863_1_1_0&matching_block_id=172021201_200593863_1_1_0&sr_pri_blocks=172021201_200593863_1_1_0__5600&from=searchresults#hotelTmpl,"Hotel Posada La Comandancia ofrece alojamiento en Melo. Este hotel de 3 estrellas ofrece salón de uso común y tiene habitaciones con aire acondicionado, wifi gratis y baño privado. El hotel ofrece piscina al aire libre y servicio de habitaciones.

Todas las unidades de este alojamiento incluyen TV de pantalla plana con canales por cable y caja fuerte. En el hotel, todas las habitaciones disponen de ropa de cama y toallas.

En Hotel Posada La Comandancia se sirve todas las mañanas un desayuno continental.

El personal de recepción habla inglés, español y portugués, y está dispuesto a ayudar en cualquier momento."
Park Hotel,US$168,"7,9",Bien,178,https://cf.bstatic.com/xdata/images/hotel/square600/500210618.webp?k=4a15f4d5b4892c6ffaca8c248811f0935ef179dfec4b37cbe301538ea41a8096&o=,https://www.booking.com/hotel/uy/sisai-boutique.es.html?aid=304142&label=gen173nr-1FCAQoggI46wdIClgEaO0BiAEBmAEKuAEXyAEM2AEB6AEB-AEDiAIBqAIDuAKa66etBsACAdICJDdmNDVkYzA0LTg4MzUtNDNlMC04ZTM3LWMxYTIxY2Y5MTYxYdgCBeACAQ&ucfs=1&arphpl=1&checkin=2024-01-23&checkout=2024-01-24&group_adults=1&req_adults=1&no_rooms=1&group_children=0&req_children=0&hpos=12&hapos=37&sr_order=popularity&srpvid=66691d0db14e0045&srepoch=1705637284&all_sr_blocks=36868310_89168231_2_33_0&highlighted_blocks=36868310_89168231_2_33_0&matching_block_id=36868310_89168231_2_33_0&sr_pri_blocks=36868310_89168231_2_33_0__16808&from_sustainable_property_sr=1&from=searchresults#hotelTmpl,"El Park Hotel cuenta con piscina, jardín y solárium y se encuentra a 700 metros de la playa Brava y a 1 km de la playa Mansa. Hay WiFi gratuita.

Las habitaciones del Park Hotel gozan de vistas maravillosas a la calle o al jardín y disponen de baño privado con secador de pelo, minibar, caja fuerte, escritorio, aire acondicionado, TV LCD por cable y reproductor de DVD. Se ofrece servicio de habitaciones.

El establecimiento alberga un centro de fitness con ducha escocesa, sala de masajes y bañera de hidromasaje. Todas las mañanas se sirve un desayuno buffet con brownies, muffins y pasteles. Además, este hotel boutique cuenta con un restaurante que prepara platos de cocina mediterránea.

La avenida Gorlero está a 5 minutos en coche y el aeropuerto de Laguna del Sauce, a 20 minutos en coche. Se ofrece aparcamiento cubierto por un suplemento."
La Tahona,US$79,"8,7",Fabuloso,98,https://cf.bstatic.com/xdata/images/hotel/square600/112727494.webp?k=ff4c079db9f43950a4ff2554ad91813d0bc0d29dc5731ecd13754e2eb01be21a&o=,https://www.booking.com/hotel/uy/la-tahona.es.html?aid=304142&label=gen173nr-1FCAQoggI46wdIClgEaO0BiAEBmAEKuAEXyAEM2AEB6AEB-AEDiAIBqAIDuAKa66etBsACAdICJDdmNDVkYzA0LTg4MzUtNDNlMC04ZTM3LWMxYTIxY2Y5MTYxYdgCBeACAQ&ucfs=1&arphpl=1&checkin=2024-01-23&checkout=2024-01-24&group_adults=1&req_adults=1&no_rooms=1&group_children=0&req_children=0&hpos=13&hapos=38&sr_order=popularity&srpvid=66691d0db14e0045&srepoch=1705637284&all_sr_blocks=198210202_201240315_0_2_0&highlighted_blocks=198210202_201240315_0_2_0&matching_block_id=198210202_201240315_0_2_0&sr_pri_blocks=198210202_201240315_0_2_0__7900&from=searchresults#hotelTmpl,"El establecimiento La Tahona está situado en Rocha, a 40 km de La Paloma, y dispone de solárium y vistas al río y a la montaña. La Pedrera queda a 36 km. Hay WiFi gratuita.

Todos los alojamientos tienen vistas a las montañas, chimenea, baño privado, aparcamiento privado gratuito, toallas y ropa de cama.

El establecimiento alberga una cocina común y un restaurante, disponibles bajo petición.

En la zona también se puede practicar equitación, pesca y senderismo. El aeropuerto internacional Capitán Carlos A. Curbelo, el más cercano, queda a 84 km de La Tahona."
Dazzler by Wyndham Montevideo,US$125,"8,0",Muy bien,5.993,https://cf.bstatic.com/xdata/images/hotel/square600/514745014.webp?k=48c74f20d4012cfee7722140bf5323d9cfdf3a713f08123f092daaf70c6e5239&o=,https://www.booking.com/hotel/uy/dazzler-montevideo.es.html?aid=304142&label=gen173nr-1FCAQoggI46wdIClgEaO0BiAEBmAEKuAEXyAEM2AEB6AEB-AEDiAIBqAIDuAKa66etBsACAdICJDdmNDVkYzA0LTg4MzUtNDNlMC04ZTM3LWMxYTIxY2Y5MTYxYdgCBeACAQ&ucfs=1&arphpl=1&checkin=2024-01-23&checkout=2024-01-24&group_adults=1&req_adults=1&no_rooms=1&group_children=0&req_children=0&hpos=14&hapos=39&sr_order=popularity&srpvid=66691d0db14e0045&srepoch=1705637284&all_sr_blocks=55450714_266394543_2_1_0&highlighted_blocks=55450714_266394543_2_1_0&matching_block_id=55450714_266394543_2_1_0&sr_pri_blocks=55450714_266394543_2_1_0__12500&from_sustainable_property_sr=1&from=searchresults#hotelTmpl,"El Dazzler by Wyndham Montevideo se encuentra en Montevideo y ofrece piscina al aire libre, centro de fitness, spa, WiFi gratuita y desayuno buffet. El establecimiento está situado en el barrio de Punta Carretas, rodeado de una zona comercial con restaurantes y lugares de interés cultural. El establecimiento se halla a 500 metros del paseo marítimo y a 3 km del centro histórico.

Las habitaciones del Dazzler by Wyndham Montevideo gozan de un ambiente tranquilo y cuentan con TV de pantalla plana, minibar, calefacción central, armario y caja fuerte. El baño privado está equipado con bañera y secador de pelo. 

El spa del Dazzler by Wyndham Montevideo incluye sauna, baño turco y bañera. 

El Dazzler by Wyndham Montevideo tiene un bonito jardín y un centro de negocios. Además, hay servicio de habitaciones y servicio de lavandería disponibles bajo petición.

El Dazzler Montevideo se sitúa a 2,1 km del centro de la ciudad y a 19 km del aeropuerto internacional de Carrasco. Se facilita aparcamiento por un suplemento y sujeto a disponibilidad."
"Posada Buscavida Close to CABO POLONIO, Oceanía del Polonio",US$60,"7,5",Bien,40,https://cf.bstatic.com/xdata/images/hotel/square600/222903677.webp?k=55c653de9b9aff0a5de7e62dd48b390ad7e1d5f327edfb41b0fbef42a0369a6a&o=,https://www.booking.com/hotel/uy/posada-buscavida.es.html?aid=304142&label=gen173nr-1FCAQoggI46wdIClgEaO0BiAEBmAEKuAEXyAEM2AEB6AEB-AEDiAIBqAIDuAKa66etBsACAdICJDdmNDVkYzA0LTg4MzUtNDNlMC04ZTM3LWMxYTIxY2Y5MTYxYdgCBeACAQ&ucfs=1&arphpl=1&checkin=2024-01-23&checkout=2024-01-24&group_adults=1&req_adults=1&no_rooms=1&group_children=0&req_children=0&hpos=15&hapos=40&sr_order=popularity&srpvid=66691d0db14e0045&srepoch=1705637284&all_sr_blocks=212082314_383057160_2_2_0&highlighted_blocks=212082314_383057160_2_2_0&matching_block_id=212082314_383057160_2_2_0&sr_pri_blocks=212082314_383057160_2_2_0__6000&from=searchresults#hotelTmpl,"La Posada Buscavida Close to CABO POLONIO, Oceanía del Polonio, ubicada entre acacias y pinos, está a 200 metros del océano con dunas de arenas vírgenes y vistas espectaculares que conducen a una playa privada y kilómetros de una costa prístina.

Todas las habitaciones tienen baño privado con ducha de agua caliente y terraza privada con sofá, mesa y hamaca.

La Posada Buscavida Close to CABO POLONIO, Oceanía del Polonio se encuentra en Oceanía del Polonio, en el departamento de Rocha, a 34 km de La Paloma. Ofrece zona de barbacoa y restaurante con terraza.

El establecimiento cuenta con bar y aparcamiento privado gratuito.

En la zona se pueden practicar diversas actividades, como equitación y senderismo. La Posada Buscavida Close to CABO POLONIO, Oceanía del Polonio se halla a 12 km de Cabo Polonio y a 26 km de La Pedrera."
Bemar Carmelo Hotel,US$157,"9,2",Fantástico,208,https://cf.bstatic.com/xdata/images/hotel/square600/406259900.webp?k=d4c08936ed75006121f33ce5b03574679e1e69f5c7017de87d277e1e8b48b97b&o=,https://www.booking.com/hotel/uy/bemar-carmelo.es.html?aid=304142&label=gen173nr-1FCAQoggI46wdIClgEaO0BiAEBmAEKuAEXyAEM2AEB6AEB-AEDiAIBqAIDuAKa66etBsACAdICJDdmNDVkYzA0LTg4MzUtNDNlMC04ZTM3LWMxYTIxY2Y5MTYxYdgCBeACAQ&ucfs=1&arphpl=1&checkin=2024-01-23&checkout=2024-01-24&group_adults=1&req_adults=1&no_rooms=1&group_children=0&req_children=0&hpos=16&hapos=41&sr_order=popularity&srpvid=66691d0db14e0045&srepoch=1705637284&all_sr_blocks=909937702_376787251_2_1_0&highlighted_blocks=909937702_376787251_2_1_0&matching_block_id=909937702_376787251_2_1_0&sr_pri_blocks=909937702_376787251_2_1_0__15680&from_sustainable_property_sr=1&from=searchresults#hotelTmpl,"El Bemar Carmelo Hotel se encuentra en Carmelo, a 700 metros de Sere, y ofrece alojamiento con bicicletas gratuitas, aparcamiento privado gratuito, piscina exterior de temporada y centro de fitness. Cuenta con restaurante, salón compartido, servicio de habitaciones y WiFi gratuita en todas las instalaciones. Hay recepción 24 horas, servicio de conserjería y cambio de divisa.

Todas las habitaciones incluyen armario. Todos los alojamientos del Bemar Carmelo Hotel disponen de baño privado con bidet y artículos de aseo gratuitos, TV de pantalla plana y aire acondicionado. Algunas habitaciones tienen terraza. Todas las habitaciones incluyen ropa de cama y toallas.

El Bemar Carmelo Hotel sirve un desayuno americano diario.

La zona es ideal para practicar ciclismo. Este hotel de 4 estrellas ofrece servicio de alquiler de coches.

El aeropuerto más cercano es el de Zagarzazú, ubicado a 12 km del hotel."
Valizas Hostel,US$21,"8,6",Fabuloso,193,https://cf.bstatic.com/xdata/images/hotel/square600/329779136.webp?k=76a0e0f62ffd0b2b03ef107f469192d65c082ce17dd5f8782c55444c01668685&o=,https://www.booking.com/hotel/uy/valizas-hostel.es.html?aid=304142&label=gen173nr-1FCAQoggI46wdIClgEaO0BiAEBmAEKuAEXyAEM2AEB6AEB-AEDiAIBqAIDuAKa66etBsACAdICJDdmNDVkYzA0LTg4MzUtNDNlMC04ZTM3LWMxYTIxY2Y5MTYxYdgCBeACAQ&ucfs=1&arphpl=1&checkin=2024-01-23&checkout=2024-01-24&group_adults=1&req_adults=1&no_rooms=1&group_children=0&req_children=0&hpos=17&hapos=42&sr_order=popularity&srpvid=66691d0db14e0045&srepoch=1705637284&all_sr_blocks=45433214_126011897_1_1_0&highlighted_blocks=45433214_126011897_1_1_0&matching_block_id=45433214_126011897_1_1_0&sr_pri_blocks=45433214_126011897_1_1_0__2100&from=searchresults#hotelTmpl,"El Valizas Hostel se encuentra en la avenida principal, a 100 metros de la playa, y ofrece conexión Wi-Fi gratuita y desayuno en Rocha. Cuenta con un jardín, un solárium y una zona de barbacoa. A 300 metros hay una parada de autobús.

Las habitaciones del Valizas cuentan con baño privado o compartido.

Los huéspedes pueden relajarse en el jardín o con un aperitivo del bar. Hay un centro de negocios y servicio de lavandería.

El Valizas Hostel dispone de aparcamiento gratuito."
Wanderlust José Ignacio,US$180,"9,0",Fantástico,223,https://cf.bstatic.com/xdata/images/hotel/square600/313497554.webp?k=9c6bba4d56d6bb14734c7efee1e1bbc9fbfb1241b7af1d7e502cc17332d112d4&o=,https://www.booking.com/hotel/uy/posada-jose-ignacio.es.html?aid=304142&label=gen173nr-1FCAQoggI46wdIClgEaO0BiAEBmAEKuAEXyAEM2AEB6AEB-AEDiAIBqAIDuAKa66etBsACAdICJDdmNDVkYzA0LTg4MzUtNDNlMC04ZTM3LWMxYTIxY2Y5MTYxYdgCBeACAQ&ucfs=1&arphpl=1&checkin=2024-01-23&checkout=2024-01-24&group_adults=1&req_adults=1&no_rooms=1&group_children=0&req_children=0&hpos=18&hapos=43&sr_order=popularity&srpvid=66691d0db14e0045&srepoch=1705637284&all_sr_blocks=349876203_222365529_0_1_0&highlighted_blocks=349876203_222365529_0_1_0&matching_block_id=349876203_222365529_0_1_0&sr_pri_blocks=349876203_222365529_0_1_0__18000&from_sustainable_property_sr=1&from=searchresults#hotelTmpl,"La Wanderlust José Ignacio, situada a 500 metros de Mansa, ofrece servicio de conserjería, habitaciones, bar, conexión WiFi gratuita y salón compartido.

Las habitaciones están equipadas con armario. Todas las habitaciones de la Wanderlust José Ignacio cuentan con aire acondicionado y baño privado.

José Ignacio se encuentra a 600 metros de la Wanderlust José Ignacio. El aeropuerto internacional Capitán de Corbeta Carlos A. Curbelo es el más cercano y se halla a 50 km."
Pizzorno Lodge & Wine,US$90,"9,2",Fantástico,154,https://cf.bstatic.com/xdata/images/hotel/square600/170543652.webp?k=874e0f642d71f6aed4def7f8220a34707a0fafc4d2168fcd51843573d21915f1&o=,https://www.booking.com/hotel/uy/pizzorno-lodge-amp-wine.es.html?aid=304142&label=gen173nr-1FCAQoggI46wdIClgEaO0BiAEBmAEKuAEXyAEM2AEB6AEB-AEDiAIBqAIDuAKa66etBsACAdICJDdmNDVkYzA0LTg4MzUtNDNlMC04ZTM3LWMxYTIxY2Y5MTYxYdgCBeACAQ&ucfs=1&arphpl=1&checkin=2024-01-23&checkout=2024-01-24&group_adults=1&req_adults=1&no_rooms=1&group_children=0&req_children=0&hpos=19&hapos=44&sr_order=popularity&srpvid=66691d0db14e0045&srepoch=1705637284&all_sr_blocks=422456903_377690356_2_34_0&highlighted_blocks=422456903_377690356_2_34_0&matching_block_id=422456903_377690356_2_34_0&sr_pri_blocks=422456903_377690356_2_34_0__9000&from=searchresults#hotelTmpl,"Pizzorno Lodge & Wine se encuentra en Progreso, a 26 km de Terminal Tres Cruces, y ofrece alojamiento con piscina de temporada al aire libre, parking privado gratis, jardín y salón de uso común. Este alojamiento ofrece restaurante, cocina compartida y servicio de habitaciones, además de wifi gratisen todo el alojamiento. Hay bar.

La posada u hostería ofrece habitaciones con aire acondicionado, escritorio, cafetera, nevera, microondas, caja fuerte, TV de pantalla plana, terraza y baño privado con ducha. En Pizzorno Lodge & Wine, todas las habitaciones disponen de ropa de cama y toallas.

En el alojamiento se puede disfrutar de un desayuno continental.

Plaza Cagancha está a 26 km del alojamiento, y Plaza de la Independencia está a 27 km. El aeropuerto más cercano (Aeropuerto internacional de Carrasco) está a 23 km."
Posada IRSIS,US$60,"9,2",Fantástico,205,https://cf.bstatic.com/xdata/images/hotel/square600/97088806.webp?k=7f59e301788fc09d38b343e4c713e2cd7e666a2c22e33b7bad0cddb0716ba4ac&o=,https://www.booking.com/hotel/uy/posada-irsis.es.html?aid=304142&label=gen173nr-1FCAQoggI46wdIClgEaO0BiAEBmAEKuAEXyAEM2AEB6AEB-AEDiAIBqAIDuAKa66etBsACAdICJDdmNDVkYzA0LTg4MzUtNDNlMC04ZTM3LWMxYTIxY2Y5MTYxYdgCBeACAQ&ucfs=1&arphpl=1&checkin=2024-01-23&checkout=2024-01-24&group_adults=1&req_adults=1&no_rooms=1&group_children=0&req_children=0&hpos=20&hapos=45&sr_order=popularity&srpvid=66691d0db14e0045&srepoch=1705637284&all_sr_blocks=87952501_335403404_2_1_0&highlighted_blocks=87952501_335403404_2_1_0&matching_block_id=87952501_335403404_2_1_0&sr_pri_blocks=87952501_335403404_2_1_0__6000&from_sustainable_property_sr=1&from=searchresults#hotelTmpl,"La Posada IRSIS está situada en Punta Rubia, a solo 1 km de la localidad de La Pedrera, y presenta un aspecto acorde con su entorno. El establecimiento tiene jardín y es ideal para visitar las playas de la zona.

Las habitaciones de la Posada IRSIS incluyen balcón con vistas al jardín, baño privado con ducha y WiFi gratuita.

La Posada IRSIS ofrece servicio de lavandería, aparcamiento gratuito y desayunos, incluidos en la tarifa.

La Posada IRSIS se encuentra a 1 km de las playas de Desplayado y del Barco, a 10 km de La Paloma y a 15 km de la laguna de Rocha."
Viejo Lobo,US$22,"8,6",Fabuloso,489,https://cf.bstatic.com/xdata/images/hotel/square600/111491159.webp?k=80b947dac6af54d9cf3fa6a6da65a514597d65ab68907194ada099250e79b26a&o=,https://www.booking.com/hotel/uy/viejo-lobo.es.html?aid=304142&label=gen173nr-1FCAQoggI46wdIClgEaO0BiAEBmAEKuAEXyAEM2AEB6AEB-AEDiAIBqAIDuAKa66etBsACAdICJDdmNDVkYzA0LTg4MzUtNDNlMC04ZTM3LWMxYTIxY2Y5MTYxYdgCBeACAQ&ucfs=1&arphpl=1&checkin=2024-01-23&checkout=2024-01-24&group_adults=1&req_adults=1&no_rooms=1&group_children=0&req_children=0&hpos=21&hapos=46&sr_order=popularity&srpvid=66691d0db14e0045&srepoch=1705637284&all_sr_blocks=40015703_198082797_0_0_0&highlighted_blocks=40015703_198082797_0_0_0&matching_block_id=40015703_198082797_0_0_0&sr_pri_blocks=40015703_198082797_0_0_0__2208&from_sustainable_property_sr=1&from=searchresults#hotelTmpl,"El establecimiento Viejo Lobo ocupa un encantador rancho situado a 1 minuto a pie de la Playa Norte y a 15 minutos a pie del faro de Cabo Polonio. Ofrece chimenea, cocina común y alojamientos económicos con vistas al mar.

Las luminosas habitaciones del establecimiento Viejo Lobo están decoradas con suelo de baldosa y tienen baño compartido.

Los huéspedes pueden utilizar la cocina común y la zona de barbacoa.

También hay guardaequipaje, una chimenea en el vestíbulo y un mostrador de información turística para reservar excursiones. Además, el monumento natural de Dunas está a 30 minutos a pie.

El establecimiento Viejo Lobo se halla a 7 km de la terminal de autobuses de Cabo Polonio, mientras que la Playa Sur queda a 3 minutos a pie."
Club Hotel Casapueblo,US$460,"8,7",Fabuloso,666,https://cf.bstatic.com/xdata/images/hotel/square600/22050644.webp?k=aaa7cf61310df2e2c06f33d48fb8faa2566612bb2e2f53ed5757f2e2bd0e36f5&o=,https://www.booking.com/hotel/uy/club-casapueblo.es.html?aid=304142&label=gen173nr-1FCAQoggI46wdIClgEaO0BiAEBmAEKuAEXyAEM2AEB6AEB-AEDiAIBqAIDuAKa66etBsACAdICJDdmNDVkYzA0LTg4MzUtNDNlMC04ZTM3LWMxYTIxY2Y5MTYxYdgCBeACAQ&ucfs=1&arphpl=1&checkin=2024-01-23&checkout=2024-01-24&group_adults=1&req_adults=1&no_rooms=1&group_children=0&req_children=0&hpos=22&hapos=47&sr_order=popularity&srpvid=66691d0db14e0045&srepoch=1705637284&all_sr_blocks=33647901_89164290_0_1_0&highlighted_blocks=33647901_89164290_0_1_0&matching_block_id=33647901_89164290_0_1_0&sr_pri_blocks=33647901_89164290_0_1_0__45990&from_sustainable_property_sr=1&from=searchresults#hotelTmpl,"El Club Hotel Casapueblo ocupa un pintoresco edificio de estilo mediterráneo diseñado por el famoso artista local Paez Vilaro y cuenta con spa, gimnasio, piscina y restaurante con vistas a la playa Mansa. La plaza de Las Grutas está a 200 metros.

Las habitaciones del Hotel Casapueblo son amplias y luminosas y disponen de calefacción y aire acondicionado. Están decoradas con suelo de parquet y muebles elegantes.

Todos los días se sirve un desayuno buffet que incluye café, té, pan, mermelada y huevos. El restaurante Terrazas sirve platos internacionales en una terraza encantadora con vistas a la costa.

Este hotel dispone de un spa con sauna y sala de masajes. El establecimiento cuenta con tumbonas junto a la piscina y centro de fitness.

El Club Hotel Casapueblo está justo enfrente de la playa. El centro de Punta del Este está a 10 km. El aeropuerto de Laguna del Sauce está a 5 km."
Posada El Bambu,US$108,"9,6",Excepcional,160,https://cf.bstatic.com/xdata/images/hotel/square600/129392207.webp?k=f87dd71e4209a4ff293dd64fd10f6f50421d1dbb7e17a98415397f76d3918cb5&o=,https://www.booking.com/hotel/uy/posada-el-bambu.es.html?aid=304142&label=gen173nr-1FCAQoggI46wdIClgEaO0BiAEBmAEKuAEXyAEM2AEB6AEB-AEDiAIBqAIDuAKa66etBsACAdICJDdmNDVkYzA0LTg4MzUtNDNlMC04ZTM3LWMxYTIxY2Y5MTYxYdgCBeACAQ&ucfs=1&arphpl=1&checkin=2024-01-23&checkout=2024-01-24&group_adults=1&req_adults=1&no_rooms=1&group_children=0&req_children=0&hpos=23&hapos=48&sr_order=popularity&srpvid=66691d0db14e0045&srepoch=1705637284&all_sr_blocks=111985101_383352414_1_1_0&highlighted_blocks=111985101_383352414_1_1_0&matching_block_id=111985101_383352414_1_1_0&sr_pri_blocks=111985101_383352414_1_1_0__10800&from_sustainable_property_sr=1&from=searchresults#hotelTmpl,"La Posada El Bambu se encuentra en el balneario El Pinar, Ciudad de la Costa, y ofrece una piscina al aire libre y habitaciones con WiFi gratuita. El alojamiento sirve un desayuno continental diario y facilita zona de barbacoa y bicicletas de uso gratuito, bajo petición.

Las habitaciones de la Posada El Bambu, con vistas al jardín y la piscina, disponen de TV de pantalla plana vía satélite, baño totalmente equipado con secador de pelo y artículos de aseo gratuitos, minibar y aire acondicionado. Algunas habitaciones incluyen cama extralargarga, microondas, utensilios de cocina y zona de estar.

Este bed and breakfast cuenta con recepción 24 horas, un salón compartido, solárium y un precioso jardín. En los alrededores del alojamiento se pueden practicar numerosas actividades, como ciclismo. El establecimiento sirve el desayuno en las habitaciones y ofrece servicios de limpieza y de entrega de comestibles.

Ell aeropuerto internacional de Carrasco Gral. Cesáreo L. Berisso está a 5 km de la Posada El Bambu."
Anastasio Hotel & Beach Club,US$314,"8,7",Fabuloso,168,https://cf.bstatic.com/xdata/images/hotel/square600/399573394.webp?k=9eec8bbffa0846f6a5de65c3126512af294bb5f0e8f78f433eaafce22c5a13d8&o=,https://www.booking.com/hotel/uy/anastasio-playa.es.html?aid=304142&label=gen173nr-1FCAQoggI46wdIClgEaO0BiAEBmAEKuAEXyAEM2AEB6AEB-AEDiAIBqAIDuAKa66etBsACAdICJDdmNDVkYzA0LTg4MzUtNDNlMC04ZTM3LWMxYTIxY2Y5MTYxYdgCBeACAQ&ucfs=1&arphpl=1&checkin=2024-01-23&checkout=2024-01-24&group_adults=1&req_adults=1&no_rooms=1&group_children=0&req_children=0&hpos=24&hapos=49&sr_order=popularity&srpvid=66691d0db14e0045&srepoch=1705637284&all_sr_blocks=155746829_95877058_2_1_0&highlighted_blocks=155746829_95877058_2_1_0&matching_block_id=155746829_95877058_2_1_0&sr_pri_blocks=155746829_95877058_2_1_0__31365&from_sustainable_property_sr=1&from=searchresults#hotelTmpl,"El establecimiento Anastasio Hotel & Beach Club, situado en José Ignacio, a 600 metros de la localidad, ofrece un centro de spa y bañera de hidromasaje. Además, alberga un bar y proporciona aparcamiento privado gratuito y WiFi gratuita en todas las zonas.

Las habitaciones del hotel disponen de aire acondicionado y TV de pantalla plana, mientras que algunas incluyen zona de estar. También tienen vistas al mar o al jardín y baño privado con bañera o ducha, bidet y artículos de aseo gratuitos.

Hay mostrador de información turística en las instalaciones.

El aeropuerto internacional Capitán Carlos A. Curbelo es el más cercano y está a 42 km."
