hotel,hotel_url,description,popular_facilities,highres_url,city,country
Tu Refugio en Boquete 2,https://www.booking.com/hotel/pa/apartamento-moderno-2bed-en-boquete.es.html?aid=2410095,"Tu Refugio en Boquete 2 se encuentra en Bajo Boquete.

Este apartamento de 2 dormitorios ofrece wifi gratis, TV de pantalla plana y cocina con nevera y fogones. Hay parking privado gratis en el apartamento.

El aeropuerto más cercano (Aeropuerto internacional Enrique Malek) está a 47 km del alojamiento.","Servicio de streaming (como Netflix), Prohibido fumar en todo el alojamiento, Cocina, WiFi gratis, Ventilador, Artículos de aseo gratis, Tetera / cafetera, Fogones, Ducha, Sofá, Entrada privada, Parking gratis, Español, TV, Mesa de comedor, Inglés, Bañera o ducha, Bañera, Papel higiénico, Toallas, Nevera, Zona de comedor, Mosquitera, TV de pantalla plana",https://cf.bstatic.com/xdata/images/hotel/max1024x768/540526368.jpg?k=8e272d14d8579f2ae017660694f595d6d6a7a48f5f8308ef095494aab19ede86&o=&hp=1,Boquete Bajo,Panamá
"Casa Cascada, Boquete full house",https://www.booking.com/hotel/pa/casa-cascada-boquete-full-house.es.html?aid=2410095,"Casa Cascada, Boquete full house se encuentra en Bajo Boquete y ofrece un balcón con vistas a la montaña y a la piscina, además de piscina al aire libre abierta todo el año, centro de fitness y sauna. Esta casa o chalet dispone de piscina privada, jardín, zona de barbacoa, wifi gratis y parking privado gratis.

La casa o chalet cuenta con una terraza y vistas a la ciudad e incluye 5 dormitorios, sala de estar, TV de pantalla plana por cable, cocina equipada y 4 baños con bidet y ducha. Hay toallas y ropa de cama en la casa o chalet.

En la casa o chalet, la clientela puede disfrutar de bañera de hidromasaje. Hay una serie de instalaciones para practicar deportes acuáticos en el propio alojamiento.

El aeropuerto (Aeropuerto internacional Enrique Malek) está a 47 km, y el alojamiento ofrece servicio de traslado de pago para ir o volver del aeropuerto.","Minigolf, Baño privado, Habitaciones comunicadas disponibles, Insonorización, Servicio de entrega de comestibles, Servicio de planchado, Detector de monóxido de carbono, Masaje de cabeza, Vistas a la ciudad, Zona de fumadores, Menú para niños, Vistas a la montaña, Lavadora, Toallas / sábanas (por un suplemento), Piscina privada, Zona de comedor exterior, Sala de juegos, Horno, Servicios de maquillaje, Sauna, Pista de tenis, Abierta todo el año, Playa, Canguro / servicios para niños, Registro de entrada / salida privado, Hipoalergénico, Entrada privada, Plancha para ropa, Masaje de espalda, Instalaciones para deportes acuáticos en el alojamiento, WC con barras de apoyo, TV, Gimnasio, Detectores de humo, Inglés, Ruta de bares, Masaje de cuello, Hervidor eléctrico, Chimenea, Cámaras de seguridad en las zonas comunitarias, Habitaciones sin humo, Bañera, Instalaciones de spa, Almuerzos para llevar, Camas extralargas (más de 2 metros), Suelo de madera o parquet, Masaje en pareja, Tarjeta de acceso, Guardaequipaje, Nevera, Acceso a pisos superiores en ascensor, Vistas a un lugar de interés, Para todas las edades, Balcón, Accesible para personas sordas, Cenas temáticas, Prohibido fumar en todo el alojamiento, Horario de apertura, Spa y centro de bienestar, Baño al aire libre, Fax / fotocopiadora, Acceso al salón executive, Zona de estar, Vistas al jardín, Masaje de manos, Secador de pelo, Fogones, Masajes, Tours a pie, Ducha, Menús para dietas especiales (bajo petición), Sofá, Vistas al río, Parking gratis, Terraza / solárium, Clases de cocina, Español, Adaptado personas de movilidad reducida, Piscina en la azotea, Zona privada de playa, Mesa de comedor, Plancha para pantalones, Servicio de lavandería, Senderismo, Traslado aeropuerto, Vistas al lago, Utensilios de planchado, Jardín, Habitaciones insonorizadas, Ropa de cama, Cuerda de emergencia en el baño, Manicura, Terraza, TV de pantalla plana, Bidet, Baños termales, Servicio de streaming (como Netflix), Vistas a la piscina, Campo de golf (a menos de 3 km), Cocina, Independiente, WiFi gratis, Calefacción, Vistas, Mobiliario exterior, Utensilios de cocina, Canales por cable, Productos de limpieza, Lavavajillas, Corte de pelo, Masaje de pies, Escritorio, Zona de juegos interior, Extintores, Piscina con vistas, Parking adaptado para personas de movilidad reducida, Enchufe cerca de la cama, Aseo adicional, Ventilador, Juegos de mesa / puzles, Piscina al aire libre, Equipamiento de tenis, Teléfono, Tetera / cafetera, Baños públicos, Bar, Zona de spa / relajación, Patio, Paquetes de spa / bienestar, Seguridad 24 horas, Vestidor, Pesca, Habitaciones familiares, Reproductor de CD, Toallas de playa/piscina, Suelo de baldosa / mármol, Adaptado para sillas de ruedas, Caja fuerte, Apartamento privado en edificio, Secadora de ropa, Billar, Bañera o ducha, Toda la unidad accesible en silla de ruedas, Exfoliación corporal, Tratamientos faciales, Sombrillas, Papel higiénico, Bañera de hidromasaje / jacuzzi, Masaje corporal completo, Servicio de conserjería, Llave de acceso, Tour o clase sobre cultura local, Tratamientos capilares, Tostadora, Toallas, Información turística, Acceso a pisos superiores solo mediante escaleras, Noches de cine, Bañera de hidromasaje, Tumbonas/sillas de playa, Vistas a un patio interior, Cámaras de seguridad fuera del alojamiento, Servicio de traslado, Barbacoa, Reproductor de DVD, Artículos de aseo gratis, Ascensor, Dardos, Libros, DVD o música para niños, Pedicura, Piscina climatizada, WC elevado, Habitaciones hipoalergénicas, Chimenea exterior, Servicios de belleza, Tratamientos corporales, Armario, Vídeo, Microondas, Minibar, Zona de comedor, WC, Zona de pícnic, Piscina infinita",https://cf.bstatic.com/xdata/images/hotel/max1024x768/539794270.jpg?k=f9af6b5d17512125a06effa949c98222a4650f7a4dab43c80ad35c152b091c45&o=&hp=1,Boquete Bajo,Panamá
Campestre House,https://www.booking.com/hotel/pa/campestre-lounge.es.html?aid=2410095,"Campestre House está en Alto Boquete y ofrece alojamiento con wifi gratis, jardín con terraza y vistas a la montaña.

El lodge ofrece servicio de alquiler de coches.

El aeropuerto más cercano (Aeropuerto internacional Enrique Malek) está a 41 km del alojamiento, que ofrece servicio de traslado de pago para ir o volver del aeropuerto.","WiFi gratis, Vistas, Masaje de cabeza, Cámaras de seguridad fuera del alojamiento, Mobiliario exterior, Zona de fumadores, Servicio de traslado, Masaje de pies, Zona de estar, Zona de juegos interior, Proporciona factura, Extintores, Juegos de mesa / puzles, Ventilador, Masaje de manos, Seguridad 24 horas, Alquiler de coches, Masajes, Habitaciones familiares, Vestidor, Sofá, Entrada privada, Parking gratis, Terraza / solárium, Masaje de espalda, Español, Suelo de baldosa / mármol, Detectores de humo, Inglés, Traslado aeropuerto, Masaje de cuello, Chimenea, Cámaras de seguridad en las zonas comunitarias, TV de pantalla plana, Habitaciones sin humo, Bañera, Masaje corporal completo, Armario, Jardín, Llave de acceso, Masaje en pareja, Información turística, Terraza, Zona de pícnic",https://cf.bstatic.com/xdata/images/hotel/max1024x768/503917698.jpg?k=40d6bf9b064f650dc8f1fd7c2803ed03ce21d061e2630baebd06f5a79b8b3504&o=&hp=1,Boquete Bajo,Panamá
Selina Boquete,https://www.booking.com/hotel/pa/fundadores-boquete.es.html?aid=2410095,"El Selina Boquete se encuentra a solo 10 minutos en coche del parque nacional Volcan Baru y ofrece conexión WiFi gratuita en todas las instalaciones y recepción 24 horas.Los jardines incluyen mesas de picnic y un arroyo.


El personal puede organizar excursiones y actividades, como rafting o senderismo. Se facilita aparcamiento privado gratuito. En las inmediaciones del hotel hay un supermercado abierto las 24 horas y varios bares y restaurantes.","Galerías de arte temporales, Baño privado, Zona TV / salón de uso compartido, Menú para niños, Proporciona factura, Sala de juegos, Cesta para mascotas, Canguro / servicios para niños, Registro de entrada / salida privado, Detectores de humo, Registro de entrada y salida exprés, Inglés, Ruta de bares, Cámaras de seguridad en las zonas comunitarias, Habitaciones sin humo, Vino / champán, Máquina expendedora (bebidas), Instalaciones de spa, Almuerzos para llevar, Tours en bici, Tarjeta de acceso, Guardaequipaje, Equipamiento de juegos para exterior, Restaurante, Cenas temáticas, Prohibido fumar en todo el alojamiento, Salas de reuniones / banquetes, Fruta, Fax / fotocopiadora, Alquiler de coches, Tours a pie, Parking gratis, Terraza / solárium, Español, Servicio de lavandería, Senderismo, Máquina expendedora (aperitivos), Cochecitos de bebé, Servicio de limpieza diario, Jardín, Alarma de seguridad, Clases de yoga, Ropa de cama, Terraza, WiFi gratis, Mobiliario exterior, Cocina compartida, Zona de juegos interior, Extintores, Clases de fitness, Juegos de mesa / puzles, Buen desayuno, Seguridad 24 horas, Bar, Discoteca / DJ, Habitaciones familiares, Alquiler de bicicletas, Piragüismo, Boles para mascotas, Billar, Sombrillas, Papel higiénico, Música / espectáculos en directo, Servicio de conserjería, Tour o clase sobre cultura local, Cafetería en el alojamiento, Toallas, Información turística, Noches de cine, Vistas a un patio interior, Cámaras de seguridad fuera del alojamiento, Ciclismo, Servicio de traslado, Bingo, Barandillas protectoras para bebés, Perchero, Dardos, Centro de negocios, Chimenea exterior, Happy hour, Tiro con arco, Taquillas, Zona de pícnic, Aeróbic",https://cf.bstatic.com/xdata/images/hotel/max1024x768/363251570.jpg?k=e0656253d8f9c89412dbf88e7b8e479f5166de3ac6df372c3c667b7ff988ebe4&o=&hp=1,Boquete Bajo,Panamá
Hotel Ladera,https://www.booking.com/hotel/pa/ladera.es.html?aid=2410095,"Nuestro Hotel Ladera tiene una ubicación inmejorable; se encuentra cerca del centro de Boquete y dentro de un ecosistema tranquilo y exuberante vegetación, donde nuestros clientes pueden encontrar fauna, flora y cascadas que invitan al descanso y la relajación.

Nuestras habitaciones ofrecen la limpieza y el confort que nuestros distinguidos clientes merecen, y nuestro Restaurante Palo Cortao ofrece una propuesta internacional con los mejores ingredientes de origen local, para deleite de los paladares más exigentes.

Nuestra propiedad ofrece aparcamiento gratuito y tenemos personal de recepción las 24 horas del día.

En Hotel Ladera contamos con los medios y personal calificado para brindar los servicios que demanda el cliente. Prestamos mucha atención a los detalles para que nuestros huéspedes se sientan satisfechos durante su estancia y se vayan con una buena experiencia en mente. Esta es nuestra mejor garantía ante ellos: consejos de auténticos profesionales, para la comodidad y el beneficio del viajero.","Baño privado, Servicio de planchado, Zona TV / salón de uso compartido, Menú para niños, Vistas a la montaña, Proporciona factura, Registro de entrada / salida privado, Hipoalergénico, Plancha para ropa, WC con barras de apoyo, TV, Detectores de humo, Registro de entrada y salida exprés, Inglés, Cámaras de seguridad en las zonas comunitarias, Habitaciones sin humo, Vino / champán, Servicio de habitaciones, Submarinismo, Guardaequipaje, Nevera, Balcón, Restaurante, Prohibido fumar en todo el alojamiento, Muy buen desayuno, Fruta, Fax / fotocopiadora, Snorkel, Secador de pelo, Alquiler de coches, Aire acondicionado, Ducha, Menús para dietas especiales (bajo petición), Parking gratis, Terraza / solárium, Español, Adaptado personas de movilidad reducida, Servicio de lavandería, Senderismo, Traslado aeropuerto, Servicio de limpieza diario, Jardín, Terraza, TV de pantalla plana, Campo de golf (a menos de 3 km), WiFi gratis, Vistas, Mobiliario exterior, Canales por cable, Escritorio, Extintores, Parking en un garaje, Parking adaptado para personas de movilidad reducida, Enchufe cerca de la cama, Aseo adicional, Ventilador, Teléfono, Seguridad 24 horas, Bar, Recepción 24 horas, Habitaciones familiares, Pesca, Caja fuerte, Adaptado para sillas de ruedas, Piragüismo, Papel higiénico, Canales de pago, Servicio de conserjería, Cafetería en el alojamiento, Toallas, Información turística, Mosquitera, Acceso a pisos superiores solo mediante escaleras, Cámaras de seguridad fuera del alojamiento, Ciclismo, Servicio de traslado, Equitación, Barbacoa, Artículos de aseo gratis, Perchero, Armario, WC",https://cf.bstatic.com/xdata/images/hotel/max1024x768/374509558.jpg?k=438e7ce2531e9664e14a1274864cbd00751bdb09c1265b6cd9cd4e478b25fac8&o=&hp=1,Boquete Bajo,Panamá
Villa Alejandro,https://www.booking.com/hotel/pa/villa-alejandro-qhh7-2v-bajo-boquete.es.html?aid=2410095,"Villa Alejandro, en Boquete, ofrece alojamiento solo para adultos con jardín, salón de uso común y terraza. El alojamiento ofrece cocina compartida, servicio de conserjería y guardaequipaje.

Las habitaciones incluyen TV de pantalla plana con canales por cable, nevera, cafetera, ducha, artículos de aseo gratuitos y armario. Todas las habitaciones están equipadas con hervidor, baño privado y wifi gratis, y algunas también ofrecen balcón (en algunos casos, con vistas a la ciudad ). En el hostal o pensión, todas las habitaciones tienen ropa de cama y toallas.

El aeropuerto más cercano (Aeropuerto internacional Enrique Malek) está a 45 km del alojamiento.","Zapatillas, Servicio de streaming (como Netflix), Baño privado, Zona TV / salón de uso compartido, Prohibido fumar en todo el alojamiento, WiFi gratis, Parking en la calle, Tetera/cafetera en todas las habitaciones, Mobiliario exterior, Utensilios de cocina, Canales por cable, Productos de limpieza, Extintores, Enchufe cerca de la cama, Cafetera, Artículos de aseo gratis, Alemán, Secador de pelo, Tetera / cafetera, Solo para adultos, Aire acondicionado, Ducha, Radio, Parking gratis, Terraza / solárium, Español, TV, Detectores de humo, Albornoz, Inglés, Servicio de lavandería, Bañera o ducha, Hervidor eléctrico, Habitaciones sin humo, Papel higiénico, Armario, Canales de pago, Nevera, Jardín, Servicio de conserjería, Microondas, Alarma de seguridad, Llave de acceso, Toallas, Guardaequipaje, Ropa de cama, WC, Terraza, TV de pantalla plana, Cocina compartida",https://cf.bstatic.com/xdata/images/hotel/max1024x768/343698243.jpg?k=9db6b0b6cb813856d961e99c76b03cea9b8b028cc92fd86ed704e2d2f38b10c2&o=&hp=1,Boquete Bajo,Panamá
