hotel,hotel_url,description,popular_facilities,highres_url,city,country
Casona Plaza Hotel Puno,https://www.booking.com/hotel/pe/casona-plaza.es.html?aid=2410095,"El Casona Plaza Hotel Puno alberga habitaciones cómodas con WiFi gratuita y se encuentra en el centro de Puno, a 7 calles del lago Titicaca. Ofrece una enoteca de estilo rural llena de arte artesanal, así como aparcamiento gratuito.

El Casona Plaza Hotel Puno está a solo 1 calle de la céntrica Plaza de Armas, a 2 calles de la catedral y a 18 km de las ruinas coloniales de Chucuito. Además, se puede practicar windsurf en el lago.

Las habitaciones del Hotel Casona están decoradas con muebles de madera y flores frescas. Todas incluyen aire acondicionado, TV por cable y set de café. Algunas tienen un jacuzzi privado.

Se sirve un desayuno con frutas tropicales, zumos naturales y huevos revueltos. Los huéspedes pueden disfrutar de la cocina regional y de una extensa carta de vinos en el restaurante. También hay servicio de habitaciones.

El Casona Plaza se encuentra a 45 minutos en coche del aeropuerto de Juliaca. Ofrece un servicio de confirmación de vuelo y una recepción abierta las 24 horas, así como servicio de enlace con el aeropuerto bajo petición.","Fruta, Prohibido fumar en todo el alojamiento, Servicio de planchado, Plancha para pantalones, Muy buen desayuno, Tours en bici, Traslado aeropuerto, Servicio de limpieza diario, Perchero, Happy hour, Salas de reuniones / banquetes, Servicio de despertador, Bañera o ducha, Caja fuerte, Tour o clase sobre cultura local, Armario, Papel higiénico, Servicio de lavandería, Seguridad 24 horas, Servicio de entrega de comestibles, Bar, Mobiliario exterior, WiFi gratis, TV, Servicio de conserjería, Cámaras de seguridad fuera del alojamiento, Detectores de humo, Suelo de moqueta, Inglés, Toallas / sábanas (por un suplemento), Menú para niños, Baños públicos, Alarma de seguridad, WC, Canales por cable, Proporciona factura, Servicio de traslado, Cámaras de seguridad en las zonas comunitarias, Servicio de habitaciones, Acceso a pisos superiores solo mediante escaleras, Acceso a pisos superiores en ascensor, Toallas, Vino / champán, Snack-bar, Artículos de aseo gratis, Secador de pelo, Cafetería en el alojamiento, Registro de entrada / salida privado, Información turística, Centro de negocios, Fax / fotocopiadora, Tours a pie, Ascensor, Bañera, Toda la unidad accesible en silla de ruedas, Baño privado, Español, Vistas a la ciudad, Máquina expendedora (bebidas), Habitaciones sin humo, Enchufe cerca de la cama, Restaurante, Extintores, Zona TV / salón de uso compartido, Recepción 24 horas, Guardaequipaje, Escritorio, Ropa de cama, TV de pantalla plana, Ducha, Calefacción, Teléfono, Habitaciones familiares, Tarjeta de acceso, Servicio de limpieza en seco",https://cf.bstatic.com/xdata/images/hotel/max1024x768/513777770.jpg?k=9cff10572060f6bf92a9327733ce024b948aba55ee9d466705551208ef5f62ae&o=&hp=1,Chincheros,Perú
Hotel Jose Antonio Puno,https://www.booking.com/hotel/pe/jose-antonio-puno.es.html?aid=2410095,"El Hotel Jose Antonio Puno dispone de restaurante y alojamiento en Puno. También proporciona conexión Wi-Fi gratuita.

Todas las habitaciones incluyen calefacción, baño privado, TV por cable, balcón y desayuno diario.

El Hotel Jose Antonio Puno dispone de servicio de enlace con el aeropuerto, recepción 24 horas, jardín, mostrador de información turística, consigna de equipaje y aparcamiento gratuito.

El establecimiento está a 7 km de la estación de autobuses y de la plaza principal de la ciudad y a 50 km del aeropuerto Inca Manco Capac.",Error al acceder a la página del hotel.,https://cf.bstatic.com/xdata/images/hotel/max1024x768/511628649.jpg?k=5bcc471ff692c815ef548f481b9ef20705e94e24d6abd76272ec3c5b27281abb&o=&hp=1,Chincheros,Perú
"MADA Guest House Puno ""Hospedaje""",https://www.booking.com/hotel/pe/mada-guest-house.es.html?aid=2410095,"MADA Guest House Puno ""Hospedaje"" está en Puno, a 9 min a pie de Estacion Terrestre, y dispone de servicio de conserjería, habitaciones libres de humo, salón de uso común, wifi gratis en todo el alojamiento y terraza. Cerca hay lugares de interés populares como Iglesia de San Antonio, Plaza de Armas de Puno y Estadio Enrique Torres Belón. El alojamiento está cerca de lugares de interés populares como Catedral de Puno, Museo Carlos Dreyer y Huajsapata Hill.

En el hostal o pensión, las habitaciones disponen de armario. Las habitaciones están equipadas con baño privado con ducha, artículos de aseo gratuitos y secador de pelo. En MADA Guest House Puno ""Hospedaje"", todas las habitaciones incluyen TV con canales por cable.

En el alojamiento se sirve todas las mañanas un desayuno americano.

Cerca del alojamiento hay puntos de interés como Mirador Kuntur Wasi, Casa del Corregidor y Balcón de Conde de Lemos. El aeropuerto (Aeropuerto Internacional Inca Manco Cápac) está a 46 km, y el alojamiento ofrece servicio de traslado de pago para ir o volver del aeropuerto.","Suelo de madera o parquet, Prohibido fumar en todo el alojamiento, Traslado aeropuerto, Servicio de limpieza diario, Terraza, Bañera o ducha, Armario, Papel higiénico, Servicio de lavandería, Mobiliario exterior, Servicio de conserjería, TV, Inglés, Alarma de seguridad, WC, Canales por cable, Servicio de traslado, Acceso a pisos superiores solo mediante escaleras, Terraza / solárium, Toallas, Vino / champán, Registro de entrada / salida privado, Artículos de aseo gratis, Secador de pelo, Wifi buena gratis (26 Mbps), Información turística, Zona de fumadores, Desayuno fantástico, Español, Baño privado, Fogones, Habitaciones sin humo, Enchufe cerca de la cama, Zona TV / salón de uso compartido, Extintores, Ducha, Secadora de ropa, Calefacción",https://cf.bstatic.com/xdata/images/hotel/max1024x768/495700758.jpg?k=fc278a241febf7a24deddf0b2425e0dece845c2e2fba7a75a50e63af6899d5b7&o=&hp=1,Chincheros,Perú
HOSTAL MILAGROS INN - samary inn,https://www.booking.com/hotel/pe/samary-inn.es.html?aid=2410095,"HOSTAL MILAGROS INN - samary inn está en Puno, a 4 min a pie de Plaza de Armas de Puno y a 300 metros de Casa del Corregidor. Este alojamiento ofrece servicio de habitaciones y recepción 24 horas, además de wifi gratis en todo el alojamiento. Este alojamiento libre de humo se encuentra a pocos pasos de Iglesia de San Antonio.

La posada u hostería ofrece algunas unidades con vistas disponen de, y todas tienen baño privado con bañera o ducha. En HOSTAL MILAGROS INN - samary inn, todas las habitaciones tienen TV de pantalla plana con canales por cable.

Cerca del alojamiento hay puntos de interés como Balcón de Conde de Lemos, Catedral de Puno y Museo Carlos Dreyer. El aeropuerto más cercano (Aeropuerto Internacional Inca Manco Cápac) está a 45 km.","Prohibido fumar en todo el alojamiento, Muy buen desayuno, Servicio de limpieza diario, Perchero, Salas de reuniones / banquetes, Bañera o ducha, Papel higiénico, Servicio de lavandería, Servicio de conserjería, WiFi gratis, TV, Inglés, Canales por cable, Servicio de habitaciones, Información turística, Toallas, Español, Baño privado, Enchufe cerca de la cama, Extintores, Recepción 24 horas, Guardaequipaje, TV de pantalla plana, Habitaciones familiares",https://cf.bstatic.com/xdata/images/hotel/max1024x768/197043547.jpg?k=868f415836e19290574b1226f0cc4a758e26d9d3c22abc3827b91ff448bf0ba4&o=&hp=1,Chincheros,Perú
Hostel Puno Backpackers,https://www.booking.com/hotel/pe/hostel-puno-backpackers.es.html?aid=2410095,"Hostel Puno Backpackers está en Puno, a 7 min a pie de Iglesia de San Antonio y a 800 metros de Plaza de Armas de Puno. Este alojamiento ofrece cocina compartida y recepción 24 horas, además de wifi gratis en todo el alojamiento. Catedral de Puno está a 11 min a pie del hostal o pensión y Museo Carlos Dreyer, a 900 metros.

Cerca del alojamiento hay puntos de interés como Casa del Corregidor, Estacion Terrestre y Balcón de Conde de Lemos. El aeropuerto (Aeropuerto Internacional Inca Manco Cápac) está a 46 km.","Cocina compartida, Recepción 24 horas, WiFi gratis, Inglés, Español",https://cf.bstatic.com/xdata/images/hotel/max1024x768/111659088.jpg?k=4779a83d07de14a967759fcabdd1a1b0cbe93067f7d9e9aaaf3d6efc8f3856c4&o=&hp=1,Chincheros,Perú
Kaaro Hotel Puno,https://www.booking.com/hotel/pe/kaaro.es.html?aid=2410095,"Kaaro Hotel Puno se encuentra en Puno, a 2 min a pie de Huajsapata Hill y a 200 metros de Museo Carlos Dreyer. Este alojamiento, que cuenta con servicio de conserjería, también ofrece restaurante. El alojamiento ofrece recepción 24 horas, traslado para ir o volver del aeropuerto, servicio de habitaciones y wifi gratis en todo el alojamiento.

En el hotel, todas las habitaciones cuentan con escritorio. Algunas unidades de este alojamiento tienen baño privado con ducha y artículos de aseo gratuitos, y también disponen de vistas a la ciudad. Todas las unidades del alojamiento están equipadas con TV de pantalla plana y secador de pelo.

Hay opciones buffet o a la carta de desayuno disponibles todos los días en Kaaro Hotel Puno.

Cerca del alojamiento hay puntos de interés como Plaza de Armas de Puno, Casa del Corregidor y Iglesia de San Antonio. El aeropuerto más cercano (Aeropuerto Internacional Inca Manco Cápac) está a 45 km del alojamiento.","Registro de entrada y salida exprés, Prohibido fumar en todo el alojamiento, Cambio de moneda, Traslado aeropuerto, Perchero, Bañera o ducha, Caja fuerte, Armario, Papel higiénico, Detectores de humo, Servicio de conserjería, WiFi gratis, TV, Cámaras de seguridad fuera del alojamiento, Inglés, Alarma de seguridad, Proporciona factura, Cámaras de seguridad en las zonas comunitarias, Servicio de habitaciones, Acceso a pisos superiores en ascensor, Toallas, Información turística, Artículos de aseo gratis, Secador de pelo, Ascensor, Español, Baño privado, Habitaciones sin humo, Enchufe cerca de la cama, Restaurante, Extintores, Recepción 24 horas, Servicio de despertador / alarma, Guardaequipaje, Escritorio, TV de pantalla plana, Ducha, Teléfono, Habitaciones familiares",https://cf.bstatic.com/xdata/images/hotel/max1024x768/420795517.jpg?k=73fcf93b5359649a6747ea08a6633e7c173e04b9aa5ce53f4331e884fa10026f&o=&hp=1,Chincheros,Perú
Huaytusive Inn Hotel,https://www.booking.com/hotel/pe/huaytusive.es.html?aid=2410095,"El Huaytusive Inn Hotel está ubicado a 1,6 km del lago Titicaca y del centro y la plaza principal de la ciudad de Puno. Ofrece desayuno y conexión WiFi de forma gratuita y se sitúa a 100 metros de la calle Jr. Lima, la principal de la localidad.

Las habitaciones del Huaytusive Inn Hotel disponen de baño privado o compartido. Algunas también cuentan con TV por cable y balcón con vistas a la ciudad. Además, hay servicio de habitaciones.

El Huaytusive Inn Hotel facilita recepción las 24 horas y servicio de viajes.

El aeropuerto internacional de Juliaca se encuentra a 42 km del Huaytusive Inn Hotel.","Prohibido fumar en todo el alojamiento, Llave de acceso, Servicio de limpieza diario, Seguridad 24 horas, Servicio de lavandería, Mobiliario exterior, Detectores de humo, WiFi gratis, Inglés, Cámaras de seguridad en las zonas comunitarias, Servicio de habitaciones, Zona de fumadores, Información turística, Terraza / solárium, Registro de entrada / salida privado, Español, Recepción 24 horas, Guardaequipaje, Buen desayuno, Desayuno en la habitación, Habitaciones familiares",https://cf.bstatic.com/xdata/images/hotel/max1024x768/199611034.jpg?k=94f7e7da6971fb0b98c49bc91309c5063a686856c0ac2ef450e6c34c3c045f48&o=&hp=1,Chincheros,Perú
Lake Titicaca Hotel,https://www.booking.com/hotel/pe/lake-titicaca.es.html?aid=2410095,"Lake Titicaca Hotel se encuentra en Puno, a 3,9 km de Estadio Enrique Torres Belón, y ofrece alojamiento con jardín, parking privado gratis, salón de uso común y restaurante. Este hotel de 4 estrellas ofrece bar. El alojamiento dispone de recepción 24 horas, traslado para ir o volver del aeropuerto, servicio de habitaciones y wifi gratis en todo el alojamiento.

En el hotel, todas las habitaciones tienen escritorio, TV de pantalla plana, baño privado, ropa de cama y toallas. Todas las unidades disponen de caja fuerte.

En Lake Titicaca Hotel se sirve todas las mañanas un desayuno buffet.

Puerto de Puno está a 3,9 km del alojamiento, y Malecón Ecoturístico Bahía de los Incas está a 4 km. El aeropuerto más cercano (Aeropuerto Internacional Inca Manco Cápac) está a 47 km.","Prohibido fumar en todo el alojamiento, Plancha para pantalones, Plancha para ropa, Parking gratis, Perchero, Happy hour, Bañera o ducha, Canguro / servicios para niños, Servicio de entrega de comestibles, Mobiliario exterior, Detectores de humo, WiFi gratis, Baños públicos, Canales por cable, Proporciona factura, Registro de entrada / salida privado, Jardín, Cafetería en el alojamiento, Centro de negocios, Almuerzos para llevar, Español, Máquina expendedora (bebidas), Zona TV / salón de uso compartido, Extintores, TV de pantalla plana, Ropa de cama, Habitaciones familiares, Adaptado personas de movilidad reducida, Tarjeta de acceso, Desayuno, Traslado aeropuerto, Tour o clase sobre cultura local, Armario, Alarma de seguridad, WC, Artículos de aseo gratis, Galerías de arte temporales, Fax / fotocopiadora, Habitaciones sin humo, Insonorización, Guardaequipaje, Minibar, Registro de entrada y salida exprés, Servicio de planchado, Servicio de limpieza diario, Salas de reuniones / banquetes, Habitaciones hipoalergénicas, Papel higiénico, Servicio de lavandería, Habitaciones insonorizadas, TV, Cámaras de seguridad fuera del alojamiento, Menú para niños, Snack-bar, Secador de pelo, Juegos de mesa / puzles, Productos de limpieza, Bañera, Baño privado, Aire acondicionado, Escritorio, Ducha, Calefacción, Teléfono, Canales vía satélite, Menús para dietas especiales (bajo petición), Cambio de moneda, Llave de acceso, Servicio de despertador, Caja fuerte, Seguridad 24 horas, Bar, Servicio de conserjería, Inglés, Servicio de traslado, Cámaras de seguridad en las zonas comunitarias, Servicio de habitaciones, Toallas, Información turística, Ascensor, Restaurante, Recepción 24 horas, Hipoalergénico, Desayuno en la habitación",https://cf.bstatic.com/xdata/images/hotel/max1024x768/529232364.jpg?k=c8097c7af13e14f1370fac5099a976f15054fac012ccb7ff088da2fe84db57f1&o=&hp=1,Chincheros,Perú
Sol Plaza Hotel,https://www.booking.com/hotel/pe/sol-plaza.es.html?aid=2410095,"El Sol Plaza ofrece habitaciones bien equipadas, con TV por cable y conexión inalámbrica a internet gratuita. Este encantador hotel está situado al lado de Plaza de Armas, en el corazón de Puno.

Los cuartos de baño privados del Sol Plaza Hotel tienen duchas de agua caliente y bañera separada. Las habitaciones están climatizadas y cuentan con una decoración rústica, con suelos enmoquetados. Si sufre mal de altura, puede solicitar oxígeno.

Los huéspedes están invitados a un desayuno bufé con zumos, panes y pasteles. Por la noche, el restaurante Sol sirve platos nacionales e internacionales. Hay servicio de habitaciones. Cerca del hotel hay lugares de ocio.

También hay servicio de lavandería y varios tratamientos de masaje. En recepción podrá obtener información sobre viajes al bonito lago Titicaca, billetes de autobús y excursiones a los pueblos andinos situados en los alrededores de Puno.","Prohibido fumar en todo el alojamiento, Plancha para pantalones, Masajes, Perchero, Terraza, Bañera o ducha, Toda la unidad en la planta baja, Detectores de humo, WiFi gratis, Masaje de pies, Baños públicos, Proporciona factura, Terraza / solárium, Registro de entrada / salida privado, Centro de negocios, Vistas a la montaña, Español, Enchufe cerca de la cama, Extintores, Zona TV / salón de uso compartido, TV de pantalla plana, Ropa de cama, Adaptado personas de movilidad reducida, Fruta, Traslado aeropuerto, Tour o clase sobre cultura local, Armario, Masaje de cabeza, Suelo de moqueta, Vistas a un lugar de interés, Alarma de seguridad, WC, Vino / champán, Artículos de aseo gratis, Masaje de espalda, Fax / fotocopiadora, Toda la unidad accesible en silla de ruedas, Habitaciones sin humo, Vistas, WC elevado, Guardaequipaje, Entrada privada, Buen desayuno, Minibar, Registro de entrada y salida exprés, Servicio de planchado, Masaje de manos, Servicio de limpieza diario, Barandillas protectoras para bebés, Salas de reuniones / banquetes, Habitaciones hipoalergénicas, Papel higiénico, Servicio de lavandería, Habitaciones insonorizadas, TV, Cámaras de seguridad fuera del alojamiento, Masaje corporal completo, Secador de pelo, Tours a pie, Bañera, Baño privado, Aire acondicionado, Escritorio, Adaptado para sillas de ruedas, Ducha, Calefacción, Teléfono, Suelo de madera o parquet, Cambio de moneda, Llave de acceso, Paquetes de spa / bienestar, Servicio de despertador, Caja fuerte, Seguridad 24 horas, Servicio de conserjería, Inglés, Toallas / sábanas (por un suplemento), Servicio de traslado, Portugués, Cámaras de seguridad en las zonas comunitarias, Servicio de habitaciones, Acceso a pisos superiores en ascensor, Toallas, Información turística, Ascensor, WC con barras de apoyo, Vistas a la ciudad, Recepción 24 horas, Masaje en pareja, Masaje de cuello, Desayuno en la habitación, Servicio de limpieza en seco, Bidet",https://cf.bstatic.com/xdata/images/hotel/max1024x768/218820245.jpg?k=4f22bef7930d171267b3aa3abeaa1596cf9669d4377d20f82f8ef68d43230250&o=&hp=1,Chincheros,Perú
Hostal los Uros,https://www.booking.com/hotel/pe/hostal-los-uros-puno12.es.html?aid=2410095,"Hostal los Uros está en Puno, a 2 min a pie de Parque Pino, y ofrece alojamiento con aire acondicionado y terraza. Este hotel de 2 estrellas ofrece servicio de conserjería y mostrador de información turística. El alojamiento dispone de recepción 24 horas, traslado para ir o volver del aeropuerto, cocina compartida y wifi gratis.

Todas las habitaciones de este alojamiento están equipadas con TV de pantalla plana.

Cerca del alojamiento hay puntos de interés como Estación de tren de Puno, Iglesia de San Juan y Arco Deustua. El aeropuerto (Aeropuerto Internacional Inca Manco Cápac) está a 45 km.","Parking en un garaje, Parking, Desayuno, Cambio de moneda, Traslado aeropuerto, Servicio de limpieza diario, Terraza, Tour o clase sobre cultura local, Seguridad 24 horas, Cocina compartida, Mobiliario exterior, Servicio de conserjería, WiFi gratis, Inglés, Hervidor eléctrico, Tarjetas de transporte público, Servicio de traslado, Proporciona factura, Registro de entrada / salida privado, Información turística, Fax / fotocopiadora, Adaptado personas de movilidad reducida, Español, Aire acondicionado, WC con barras de apoyo, Parking en la calle, Extintores, Recepción 24 horas, Guardaequipaje, TV de pantalla plana, Habitaciones familiares",https://cf.bstatic.com/xdata/images/hotel/max1024x768/315571196.jpg?k=cc6a05eb912f69ea0da564c9dcab161fa80132546ee258940bae3a30e9728d2b&o=&hp=1,Chincheros,Perú
Uros Qhantany Lodge,https://www.booking.com/hotel/pe/uros-suma-qhantani.es.html?aid=2410095,"El Uros Qhantany Lodge está situado en el lago Titicaca, en las islas flotantes de los uros, a 5 km de la costa de Puno. La costa de Puno queda a 30 minutos en barco.

Las habitaciones tienen vistas espectaculares al lago navegable más alto del mundo y han sido construidas con madera y arrecifes de totora. Están decoradas con objetos locales y disponen de baño privado, toallas y agua caliente las 24 horas.

El Uros Qhantany Lodge sirve un desayuno gratuito. En la isla es posible almorzar y cenar.","Entretenimiento nocturno, Sala de juegos, Parking en un garaje, Fruta, Vistas al jardín, Zona de comedor exterior, Instalaciones para deportes acuáticos en el alojamiento, Desayuno, Menús para dietas especiales (bajo petición), Sombrillas, Cambio de moneda, Traslado aeropuerto, Perchero, Terraza, Vistas a un patio interior, Tour o clase sobre cultura local, Zona de estar, Papel higiénico, Servicio de lavandería, Seguridad 24 horas, Toda la unidad en la planta baja, Mobiliario exterior, Servicio de conserjería, Inglés, Pesca, Vistas a un lugar de interés, Vistas al río, Servicio de traslado, Servicio de habitaciones, Tumbonas/sillas de playa, Terraza / solárium, Toallas, Vino / champán, Jardín, Artículos de aseo gratis, Snack-bar, Registro de entrada / salida privado, Información turística, Juegos de mesa / puzles, Zona de fumadores, Vistas a la montaña, Almuerzos para llevar, Español, Baño privado, Patio, Vistas a la ciudad, Balcón, Habitaciones sin humo, Vistas, Restaurante, Extintores, Zona de juegos para niños, Vistas al lago, Zona de pícnic, Tendedero, Recepción 24 horas, Guardaequipaje, Entrada privada, Parking privado, Ducha, Piragüismo, Desayuno en la habitación, Calefacción",https://cf.bstatic.com/xdata/images/hotel/max1024x768/322622717.jpg?k=420825ab4d0f6885863d8370e15a612db01fb21cfa32b522873c12eb0e440874&o=&hp=1,Chincheros,Perú
Maya Inn,https://www.booking.com/hotel/pe/maya-inn.es.html?aid=2410095,"Maya Inn está en Puno, a 2 min a pie de Estadio Enrique Torres Belón, y ofrece alojamiento con terraza y parking privado. El alojamiento está cerca de varios lugares de interés destacados, a unos 8 min a pie de Puerto de Puno, a 600 metros de Malecón Ecoturístico Bahía de los Incas y a 11 min a pie de Parque Pino. El alojamiento dispone de recepción 24 horas, servicio de traslado, servicio de habitaciones y wifi gratis en todo el alojamiento.

En el hostal o pensión, cada habitación incluye armario. El baño privado está equipado con ducha y artículos de aseo gratuitos. En Maya Inn, las habitaciones están equipadas con escritorio y TV de pantalla plana.

La clientela puede practicar actividades en Puno y alrededores, como ciclismo.

Cerca del alojamiento hay puntos de interés como Estacion Terrestre, Estación de tren de Puno y Plaza de Armas de Puno. El aeropuerto más cercano (Aeropuerto Internacional Inca Manco Cápac) está a 45 km.","Fruta, Prohibido fumar en todo el alojamiento, Servicio de planchado, Plancha para pantalones, Muy buen desayuno, Servicio de limpieza diario, Perchero, Terraza, Servicio de despertador, Bañera o ducha, Tour o clase sobre cultura local, Armario, Papel higiénico, Servicio de lavandería, Detectores de humo, WiFi gratis, Cámaras de seguridad fuera del alojamiento, Inglés, Baños públicos, Alarma de seguridad, Canales por cable, Servicio de traslado, Cámaras de seguridad en las zonas comunitarias, Servicio de habitaciones, Acceso a pisos superiores solo mediante escaleras, Toallas, Información turística, Artículos de aseo gratis, Cafetería en el alojamiento, Productos de limpieza, Tours a pie, Español, Baño privado, Habitaciones sin humo, Enchufe cerca de la cama, Extintores, Recepción 24 horas, Guardaequipaje, Escritorio, TV de pantalla plana, Parking privado, Ducha, Senderismo, Calefacción, Ciclismo, Habitaciones familiares",https://cf.bstatic.com/xdata/images/hotel/max1024x768/219680479.jpg?k=1c6fb545c9d50979065657bdb2ebd7c5c7ea9a100ba66ea7abe9880cf4f1c811&o=&hp=1,Chincheros,Perú
Uros TITIKAKA the Best lodge,https://www.booking.com/hotel/pe/uros-titikaka-they-best-lodge.es.html?aid=2410095,"Uros TITIKAKA the Best lodge, que cuenta con jardín, terraza, restaurante y wifi gratis, se encuentra en Puno, a 4,6 km de Estadio Enrique Torres Belón y a 4,7 km de Puerto de Puno. El alojamiento está a unos 4,7 km de Malecón Ecoturístico Bahía de los Incas, a 4,9 km de Arco Deustua y a 5,1 km de Parque Pino. El alojamiento ofrece servicio de habitaciones y recepción 24 horas.

En el hotel, cada habitación dispone de un balcón con vistas a la ciudad. En Uros TITIKAKA the Best lodge, todas las habitaciones están equipadas con aire acondicionado y baño privado.

Estación de tren de Puno está a 5,1 km del alojamiento, y Estacion Terrestre está a 5,2 km. El aeropuerto (Aeropuerto Internacional Inca Manco Cápac) está a 48 km, y el alojamiento ofrece servicio de traslado de pago para ir o volver del aeropuerto.","Suelo de madera o parquet, Vistas al jardín, Zona de comedor exterior, Mesa de comedor, Parking, Desayuno, Zona de comedor, Sombrillas, Aseo adicional, Traslado aeropuerto, Happy hour, Terraza, Bañera o ducha, Tour o clase sobre cultura local, Papel higiénico, WiFi gratis, Inglés, Pesca, Vistas a un lugar de interés, Servicio de traslado, Servicio de habitaciones, Tumbonas/sillas de playa, Terraza / solárium, Toallas, Vino / champán, Jardín, Juegos de mesa / puzles, Vistas a la montaña, Muebles de exterior, Español, Baño privado, Patio, Aire acondicionado, Vistas a la ciudad, Balcón, Habitaciones sin humo, Vistas, Restaurante, Enchufe cerca de la cama, Extintores, Vistas al lago, Recepción 24 horas, Calefacción, Escritorio, Entrada privada, Ducha, Desayuno en la habitación, Camas extralargas (más de 2 metros), Habitaciones familiares",https://cf.bstatic.com/xdata/images/hotel/max1024x768/455888094.jpg?k=f5361bb825a690f595871832d9e3cc09702f6cd7c5e9868dd4a87ca4a1361719&o=&hp=1,Chincheros,Perú
