hotel,hotel_url,description,popular_facilities,highres_url,city,country
HM HOTEL,https://www.booking.com/hotel/hn/hm-choluteca.es.html?aid=2410095,"HM HOTEL ofrece alojamiento en Choluteca. El hotel también ofrece wifi gratis y parking privado gratis.

Todas las unidades de este alojamiento están equipadas con TV de pantalla plana con canales por cable. En el hotel, todas las habitaciones tienen aire acondicionado y baño privado.

El personal de recepción está disponible a cualquier hora del día.

El aeropuerto (Aeropuerto Internacional de Toncontín) está a 135 km.","Plancha para ropa, WC, Baño privado, Aire acondicionado, Proporciona factura, Parking gratis, Habitaciones sin humo, Servicio de limpieza diario, Plancha para pantalones, Recepción 24 horas, Extintores, Habitaciones familiares, Seguridad 24 horas, TV de pantalla plana, Canales por cable, Español, WiFi gratis",https://cf.bstatic.com/xdata/images/hotel/max1024x768/172995401.jpg?k=932af524f09428a6cbc5c310b72002f7a92389c2f0513b48e864d828729bb14d&o=&hp=1,Choluteca,Honduras
Hotel Hacienda Gualiqueme,https://www.booking.com/hotel/hn/hacienda-gualiqueme.es.html?aid=2410095,"El Hotel Hacienda Gualiqueme está situado en Choluteca y cuenta con jardín y bar.

También cuenta con recepción 24 horas y restaurante.

Todas las habitaciones del hotel están equipadas con TV de pantalla plana.

Todas las habitaciones incluyen baño privado. Todas las mañanas se sirve un desayuno continental.","Piscina infantil, Adecuada para niños, Aire acondicionado, 2 piscinas, Gimnasio, Parking gratis, Habitaciones sin humo, Cenas temáticas, Francés, Bar, Recepción 24 horas, Abierta todo el año, Jardín, Muy buen desayuno, Servicio de habitaciones, WiFi gratis, Bar en la piscina, Habitaciones familiares, Inglés, Menú para niños, Español",https://cf.bstatic.com/xdata/images/hotel/max1024x768/269711735.jpg?k=4a8b1571ad89e29c70638d572b54c36c963e26ae4012b04ea39fc3c9c972919d&o=&hp=1,Choluteca,Honduras
Hotel Boutique Casa D' Luna,https://www.booking.com/hotel/hn/boutique-casa-d-luna.es.html?aid=2410095,"Hotel Boutique Casa D' Luna está en Choluteca y tiene terraza, bar y wifi gratis en todo el alojamiento. Las habitaciones están equipadas con patio con vistas a la piscina.

El hotel ofrece habitaciones con aire acondicionado, escritorio, caja fuerte, TV de pantalla plana, balcón y baño privado con ducha. En Hotel Boutique Casa D' Luna, todas las habitaciones disponen de zona de estar.

Hay servicio de planchado, parking privado gratis y centro de negocios, así como recepción 24 horas.

El aeropuerto más cercano (Aeropuerto Internacional de Toncontín) está a 136 km.","Papel higiénico, Caja fuerte, Servicio de despertador, Baño privado, Aire acondicionado, Parking gratis, Habitaciones sin humo, Salas de reuniones / banquetes, Patio, TV de pantalla plana, Canales por cable, Cama plegable, Vistas, Toallas, WC, Bar, Entrada privada, Centro de negocios, Buen desayuno, Vistas a la piscina, Recepción 24 horas, Servicio de lavandería, Terraza, Ducha, Artículos de aseo gratis, Servicio de planchado, Abierta todo el año, Escritorio, Acceso a pisos superiores solo mediante escaleras, Camas extralargas (más de 2 metros), WiFi gratis, Toda la unidad accesible en silla de ruedas, Tendedero, Piscina interior, Perchero, Toallas / sábanas (por un suplemento), Zona de estar, Habitaciones familiares, Inglés, Balcón",https://cf.bstatic.com/xdata/images/hotel/max1024x768/94494210.jpg?k=f239c0b11c3ce8a28e00e473c2c8f782c988679c1a72a81b463a945bd76209b9&o=&hp=1,Choluteca,Honduras
Posada San Lázaro,https://www.booking.com/hotel/hn/posada-san-lazaro.es.html?aid=2410095,"Posada San Lázaro, que tiene jardín y terraza, está en Choluteca. Hay un restaurante de cocina americana y parking privado gratis.

El aeropuerto más cercano (Aeropuerto Internacional de Toncontín) está a 158 km del alojamiento, que ofrece servicio de traslado de pago para ir o volver del aeropuerto.","Jardín, Parking gratis, Habitaciones sin humo, Restaurante, Traslado aeropuerto, Habitaciones familiares, Inglés, Terraza, Servicio de habitaciones, Español",https://cf.bstatic.com/xdata/images/hotel/max1024x768/534246358.jpg?k=787b064246513cd84d407dca7bc9cdee8cec853ed943dc833effcd4735537d32&o=&hp=1,Choluteca,Honduras
