hotel,hotel_url,description,popular_facilities,highres_url,city,country
Apartamento cerca de mar,https://www.booking.com/hotel/es/apartamento-cerca-de-mar.es.html?aid=2410095,"Apartamento cerca de mar está a 2 min a pie de Playa de La Mata y a 400 metros de Playa Torrelamata, y ofrece wifi gratis y terraza. Este apartamento ofrece acceso a una cocina totalmente equipada y a un balcón.

Este apartamento de 2 dormitorios ofrece TV de pantalla plana, aire acondicionado y sala de estar.

Playa Les Ortigues está a 14 min a pie del alojamiento, y Campo de golf Las Colinas está a 16 km. El aeropuerto más cercano (Aeropuerto de Alicante – Elche Miguel Hernández) está a 39 km.","Cocina, Terraza, Aire acondicionado, Vistas, Parking gratis, Calefacción, Inglés, WiFi gratis, Balcón, TV de pantalla plana, Español, Zona de cocina, Lavadora",https://cf.bstatic.com/xdata/images/hotel/max1024x768/526951462.jpg?k=8b014560ece9619db65e56022b7fa8f9fc6f0144d496f5e6b0624ad05b4fd08d&o=&hp=1,Ciudad Quesada,Costa Rica
A un paso del mar La Mata,https://www.booking.com/hotel/es/a-un-paso-dal-mar.es.html?aid=2410095,"El A un paso del mar La Mata ofrece alojamiento con cocina a 100 metros de la playa de La Mata, en La Mata. Esta casa ofrece alojamiento con aire acondicionado y terraza.

Esta casa cuenta con 2 dormitorios, TV de pantalla plana, zona de comedor y cocina con lavavajillas y microondas.

El aeropuerto más cercano es el de Alicante, ubicado a 39 km.","Papel higiénico, Baño privado, Aire acondicionado, Utensilios de planchado, Habitaciones sin humo, Suelo de baldosa / mármol, Zona de comedor exterior, Detectores de humo, Secador de pelo, TV de pantalla plana, Lavavajillas, Playa, Zona de cocina, Sofá cama, Plancha para ropa, Baño compartido, Hervidor eléctrico, Entrada privada, Nevera, Sofá, Enchufe cerca de la cama, Utensilios de cocina, Ducha, Terraza, Italiano, Lavadora, Zona de comedor, Cafetera, Prohibido fumar en todo el alojamiento, Tostadora, Mesa de comedor, Horno, Calefacción, Alemán, Microondas, WiFi gratis, Cocina, Tendedero, Ventilador, Perchero, Fogones, Productos de limpieza, Zona de estar, Armario, TV, Inglés, Muebles de exterior, Español",https://cf.bstatic.com/xdata/images/hotel/max1024x768/148309259.jpg?k=b7fa2ae716e81e57737efce3dce28322fdfe210d73f36825123cbfda11edd4bc&o=&hp=1,Ciudad Quesada,Costa Rica
Excelente Apartamento Ático,https://www.booking.com/hotel/es/excelente-apartamento-atico.es.html?aid=2410095,"Excelente Apartamento Ático se encuentra en Algorfa y ofrece piscina privada. Este alojamiento con aire acondicionado está a 13 km de Campo de golf Las Colinas y ofrece wifi gratis y parking privado en el propio alojamiento.

Este apartamento tiene acceso directo a una terraza y cuenta con 1 dormitorio independiente y cocina totalmente equipada. Se ofrece TV de pantalla plana.

Villamartin Plaza está a 24 km del alojamiento, y Parque natural de las Salinas de Santa Pola está a 26 km. El aeropuerto más cercano (Aeropuerto de Alicante – Elche Miguel Hernández) está a 46 km del alojamiento.","Cocina, Prohibido fumar en todo el alojamiento, TV de pantalla plana, Portugués, Aire acondicionado, Parking gratis, Terraza, Balcón, Piscina, Piscina privada, Español, WiFi gratis, Vistas",https://cf.bstatic.com/xdata/images/hotel/max1024x768/557072898.jpg?k=1398566e52d51e68fe4aa83dcf86565f10c4d8bd88a580af9e33a472fdff6564&o=&hp=1,Ciudad Quesada,Costa Rica
