hotel,hotel_url,description,popular_facilities,highres_url,city,country
HOTEL ALONSO DE ERCILLA,https://www.booking.com/hotel/cl/alonso-de-ercilla-concepcion.es.html?aid=2410095,"HOTEL ALONSO DE ERCILLA se encuentra en Concepción, a 16 min a pie de Universidad de Concepción, y ofrece alojamiento con salón de uso común, parking privado gratis, terraza y restaurante. Este hotel de 3 estrellas ofrece servicio de habitaciones, recepción 24 horas y wifi gratis. Este alojamiento libre de humo está a 2,3 km de Universidad de San Sebastián.

En el hotel, todas las habitaciones disponen de escritorio, TV de pantalla plana, baño privado, ropa de cama y toallas. Todas las unidades disponen de armario.

En HOTEL ALONSO DE ERCILLA se puede disfrutar de un desayuno buffet.

Estadio Municipal de Concepción está a 3,9 km del alojamiento, y Universidad del Bio-Bio está a 4,2 km. El aeropuerto más cercano (Aeropuerto Internacional Carriel Sur) está a 8 km.","Terraza, Inglés, TV de pantalla plana, Restaurante, Ropa de cama, Escritorio, Perchero, WiFi gratis, Bañera, Servicio de despertador, Muy buen desayuno, Prohibido fumar en todo el alojamiento, Español, Terraza / solárium, Guardaequipaje, Ducha, Salas de reuniones / banquetes, Armario, Toallas, Artículos de aseo gratis, Proporciona factura, Servicio de habitaciones, Parking gratis, Baño privado, Secador de pelo, Recepción 24 horas, Ascensor, Zona TV / salón de uso compartido, WC, Habitaciones familiares, Habitaciones sin humo, Papel higiénico",https://cf.bstatic.com/xdata/images/hotel/max1024x768/532098250.jpg?k=eaeb95d85bacc9496bc33cc1ae95e843549087056b3e103fe8f6c5e669079cfd&o=&hp=1,Coronel,Chile
Apart Hotel Castellon 176,https://www.booking.com/hotel/cl/apart-castellon-176.es.html?aid=2410095,"Apart Hotel Castellon 176 está en Concepción, en la región de Bío-Bío, cerca de Universidad de Concepción. Ofrece alojamiento con wifi gratis y parking privado gratis.

Algunas unidades tienen TV de pantalla plana por cable, cocina totalmente equipada con nevera y baño privado con bañera o ducha y artículos de aseo gratuitos.

En el apartahotel se puede usar la terraza.

Universidad de San Sebastián está a 2,5 km del alojamiento, y Estadio Municipal de Concepción está a 3,5 km. El aeropuerto (Aeropuerto Internacional Carriel Sur) está a 8 km.","Parking gratis, Baño privado, Terraza, Inglés, Prohibido fumar en todo el alojamiento, Habitaciones familiares, WiFi gratis, Español, Habitaciones sin humo",https://cf.bstatic.com/xdata/images/hotel/max1024x768/449740583.jpg?k=28c20ebf8b490da8e780e12c6563f1854df1b794a01e61fcd0a6c5a573568f15&o=&hp=1,Coronel,Chile
Hostal Bianca,https://www.booking.com/hotel/cl/hostal-bianca-concepcion.es.html?aid=2410095,"Hostal Bianca se encuentra en Concepción, a 2,6 km de Universidad de San Sebastián y a 2,8 km de Universidad de Concepción. Ofrece alojamiento con salón de uso común y wifi gratis en todo el alojamiento, además de parking privado gratis. El alojamiento está a 4,2 km de Estadio Municipal de Concepción, a 4,6 km de Universidad del Bio-Bio y a 13 km de Estadio CAP. El alojamiento ofrece servicio de habitaciones, recepción 24 horas y servicio de organización de tours.

En el hotel, cada habitación tiene armario. Las habitaciones del alojamiento están equipadas con TV y artículos de aseo gratuitos.

En Hostal Bianca se sirve todos los días un desayuno buffet.

Estadio El Morro está a 14 km del alojamiento. El aeropuerto más cercano (Aeropuerto Internacional Carriel Sur) está a 8 km del alojamiento.","Servicio de lavandería, Extintores, Llave de acceso, Zona de fumadores, Información turística, Plancha para pantalones, Perchero, WiFi gratis, Fax / fotocopiadora, Muy buen desayuno, TV, Prohibido fumar en todo el alojamiento, Español, Calefacción, Guardaequipaje, Servicio de planchado, Ducha, Salas de reuniones / banquetes, Armario, Servicio de limpieza diario, Artículos de aseo gratis, Seguridad 24 horas, Servicio de habitaciones, Parking gratis, Parking en un garaje, Secador de pelo, Recepción 24 horas, Máquina expendedora (bebidas), Zona TV / salón de uso compartido, WC, Acceso a pisos superiores solo mediante escaleras, Habitaciones familiares, Papel higiénico",https://cf.bstatic.com/xdata/images/hotel/max1024x768/217051653.jpg?k=269a34fda1b2ce230dcb614c90a1197edca3a851384371f6118771801f38fe7c&o=&hp=1,Coronel,Chile
Hotel Terrano Concepción,https://www.booking.com/hotel/cl/hotel-terrano.es.html?aid=2410095,"El Hotel Terrano Concepción ofrece alojamiento en el centro de Concepción, a solo 4 minutos a pie de la plaza principal. Alberga un restaurante y proporciona WiFi gratuita en todas las instalaciones. Desayuno incluido en todas nuestras habitaciones.

Todas las habitaciones del hotel están equipadas con TV de pantalla plana por cable. El baño es privado e incluye bañera o ducha. Las habitaciones disponen de calefacción.

La recepción está abierta las 24 horas. El aparcamiento también está incluido.

El aeropuerto más cercano es el aeropuerto internacional Carriel Sur, ubicado a 10 km del Hotel Terrano Concepción.","Acceso a pisos superiores en ascensor, Terraza, Inglés, Bar, Tarjeta de acceso, TV de pantalla plana, Servicio de lavandería, Extintores, Detector de monóxido de carbono, Restaurante, Ropa de cama, Zona de fumadores, Menús para dietas especiales (bajo petición), Toda la unidad accesible en silla de ruedas, WiFi gratis, Enchufe cerca de la cama, Happy hour, Bañera, Ventilador, Teléfono, Alarma de seguridad, Cámaras de seguridad en las zonas comunitarias, Servicio de despertador, TV, Prohibido fumar en todo el alojamiento, Menú para niños, Español, Centro de negocios, Calefacción, Caja fuerte, Sauna, Bañera o ducha, Guardaequipaje, Ducha, Salas de reuniones / banquetes, Armario, Toallas, Buen desayuno, Artículos de aseo gratis, Billar, Servicio de limpieza diario, Gimnasio, Cafetera, Sala de juegos, Proporciona factura, Canales por cable, Seguridad 24 horas, Servicio de habitaciones, Parking gratis, Baño privado, Parking en un garaje, Secador de pelo, Recepción 24 horas, Ascensor, WC, Accesible para personas sordas, Habitaciones familiares, Cámaras de seguridad fuera del alojamiento, Habitaciones sin humo, Papel higiénico",https://cf.bstatic.com/xdata/images/hotel/max1024x768/536550047.jpg?k=7bfad42807ce7e135472259908f457383a7e1eb6bae23657c6cbdcb4ca6e5b9a&o=&hp=1,Coronel,Chile
Hostal Concepcion,https://www.booking.com/hotel/cl/hostal-concepcion.es.html?aid=2410095,"El Hostal Concepcion está situado a solo 2 calles de la plaza principal de Concepción y ofrece un alojamiento con desayuno buffet gratuito diario. El establecimiento dispone de WiFi gratuita.

Las habitaciones del Hostal Concepcion cuentan con baño privado y TV por cable. Además, se ofrece aparcamiento gratuito.

Los huéspedes podrán visitar el Parque Ecuador o la Universidad de Concepción, situados a solo 500 metros del Hostal Concepcion. El aeropuerto más cercano se encuentra a 15 minutos en coche.","Inglés, TV de pantalla plana, Extintores, Ropa de cama, Zona de fumadores, Información turística, Zona de comedor, Perchero, WiFi gratis, Parking privado, Zona de estar, Registro de entrada / salida privado, Servicio de conserjería, Habitaciones sin humo, Suelo de madera o parquet, TV, Prohibido fumar en todo el alojamiento, Español, Guardaequipaje, Ducha, Armario, Mesa de comedor, Toallas, Buen desayuno, Servicio de limpieza diario, Proporciona factura, Canales por cable, Seguridad 24 horas, Cafetería en el alojamiento, Baño privado, Secador de pelo, Recepción 24 horas, WC, Habitaciones familiares, Tendedero, Papel higiénico",https://cf.bstatic.com/xdata/images/hotel/max1024x768/74235472.jpg?k=875c02d8599fefb9c334eb7cbad9a58cfd79b99916eaff1c3cac3073f58fffa4&o=&hp=1,Coronel,Chile
Hotel Diego de Almagro Concepción,https://www.booking.com/hotel/cl/diego-de-almagro-concepcion.es.html?aid=2410095,"Este hotel moderno se encuentra junto al río Bío Bío, a 10 minutos a pie del centro de Concepción, y goza de vistas panorámicas a la ciudad. También cuenta con piscina, sauna y WiFi gratuita.

Todas las habitaciones del Diego de Almagro son amplias y constan de aire acondicionado, TV por cable, WiFi y minibar. Algunas habitaciones disfrutan de vistas panorámicas a la ciudad o al río y al océano Pacífico.

Se facilita aparcamiento privado gratuito, según disponibilidad.

El restaurante sirve un menú completo a base de platos locales e internacionales. También hay un bar que sirve una carta extensa de bebidas con y sin alcohol.

El hotel Diego de Almagro dispone de sauna y centro de fitness. El alojamiento goza de una ubicación idónea para visitar Concepción, a solo 10 minutos a pie de la plaza de Armas y a 9 km del aeropuerto internacional Carriel Sur.","Tumbonas/sillas de playa, Acceso a pisos superiores en ascensor, Terraza, Bar, Tarjeta de acceso, Abierta todo el año, Servicio de lavandería, Extintores, Insonorización, Restaurante, Ropa de cama, Escritorio, Información turística, Zona de fumadores, Alquiler de coches, Plancha para pantalones, Adaptado personas de movilidad reducida, WiFi gratis, Enchufe cerca de la cama, Piscina climatizada, Registro de entrada y salida exprés, Bañera, Piscina interior, Registro de entrada / salida privado, Teléfono, Fruta, Servicio de conserjería, Fax / fotocopiadora, Cámaras de seguridad en las zonas comunitarias, Muy buen desayuno, TV, Prohibido fumar en todo el alojamiento, Minibar, Habitaciones insonorizadas, Español, Centro de negocios, Calefacción, Caja fuerte, Suelo de moqueta, Bañera o ducha, Guardaequipaje, Vistas a la ciudad, Sauna, Servicio de planchado, Ducha, Salas de reuniones / banquetes, Armario, Toallas, Gimnasio, Servicio de limpieza diario, Solo para adultos, Canales por cable, Baño privado, Vino / champán, Secador de pelo, Horario de apertura, Recepción 24 horas, Detectores de humo, Ascensor, WC, Aire acondicionado, Habitaciones sin humo, Papel higiénico",https://cf.bstatic.com/xdata/images/hotel/max1024x768/409083131.jpg?k=810ed2f14f14220dde51d82cf0dbb22d16024da9b8db437192c5aa628136b016&o=&hp=1,Coronel,Chile
