hotel,hotel_url,description,popular_facilities,highres_url,city,country
Mato Grosso Palace Hotel,https://www.booking.com/hotel/br/palace-mato-grosso.es.html?aid=2410095,"Located in the city centre of Cuiabá, Mato Grosso Palace Hotel features air-conditioned rooms, a restaurant, a fitness centre and a bar. Among the facilities at this property are a 24-hour front desk and room service, along with free WiFi throughout the property.

All rooms at Palace Mato Grosso are equipped with a cable TV, minibar and private bathroom. Room service and free WiFi are available.

Guests at Mato Grosso Palace Hotel can benefit from a daily breakfast buffet with seasonal fruits, natural juices and bread rolls.

The property also offers a business centre for guest use.

Palace Mato Grosso is 2 km from Goiabeiras Shopping mall and 3.5 km from Shopping Estação mall. The city’s bus station and Arena Pantanal stadium are both 3 km from this hotel. The nearest airport is Marechal Rondon International Airport, 7 km from Mato Grosso Palace Hotel.","Acceso a pisos superiores en ascensor, Bar, TV de pantalla plana, Servicio de lavandería, Extintores, Llave de acceso, Restaurante, Ropa de cama, Escritorio, Boles para mascotas, Zona de fumadores, Perchero, Adaptado personas de movilidad reducida, WiFi gratis, Enchufe cerca de la cama, Parking privado, Registro de entrada / salida privado, Teléfono, Fruta, Fax / fotocopiadora, Alarma de seguridad, Servicio de despertador, Entrada privada, Parking adaptado para personas de movilidad reducida, Muy buen desayuno, WC elevado, TV, Menú para niños, Minibar, Centro de negocios, Caja fuerte, Buffet para niños, Bañera o ducha, Guardaequipaje, Canales vía satélite, Servicio de planchado, Ducha, Salas de reuniones / banquetes, Servicio de despertador / alarma, Armario, Toallas, Gimnasio, Artículos de aseo gratis, Servicio de aparcacoches, Servicio de limpieza diario, Suelo de baldosa / mármol, Proporciona factura, Almuerzos para llevar, Canales por cable, Desayuno en la habitación, Servicio de limpieza en seco, Seguridad 24 horas, Servicio de habitaciones, WC con barras de apoyo, Parking en un garaje, Baño privado, Vino / champán, Adaptado para sillas de ruedas, Recepción 24 horas, Detectores de humo, Ascensor, WC, Aire acondicionado, Lavamanos más bajo, Habitaciones familiares, Portugués, Habitaciones sin humo, Papel higiénico",https://cf.bstatic.com/xdata/images/hotel/max1024x768/382917282.jpg?k=8d24bed7db1b794c40e017c65fed401672016f85ce87c145bb055e9d17c776b7&o=&hp=1,Cuiabá,Brasil
"Hotel Panorama, Cuiabá",https://www.booking.com/hotel/br/panorama-cuiaba.es.html?aid=2410095,"El OYO Hotel Panorama goza de una ubicación céntrica en Cuiabá, justo al lado del edificio municipal de Câmara, y ofrece conexión Wi-Fi gratuita y aparcamiento gratuito. Todas las habitaciones cuentan con TV vía satélite y baño privado con ducha. Los bares y restaurantes más populares de Cuiabá están a poca distancia a pie.

La recepción del hotel está abierta las 24 horas. El edificio tiene ascensor.

El hotel está a 5 km de la estación de autobuses de Cuiabá y a 10 km del aeropuerto internacional Marechal Rondon.","Parking gratis, Portugués, Prohibido fumar en todo el alojamiento, Cocina compartida, Servicio de lavandería, Servicio de limpieza diario, Recepción 24 horas, Parking adaptado para personas de movilidad reducida, Zona TV / salón de uso compartido, Aire acondicionado, Habitaciones familiares, Desayuno, WiFi gratis, Habitaciones sin humo",https://cf.bstatic.com/xdata/images/hotel/max1024x768/423810239.jpg?k=0a18d7fff1db2cf4a112119981db53a165bf8680b69fd7de839c5616b88714a2&o=&hp=1,Cuiabá,Brasil
Hotel Capital,https://www.booking.com/hotel/br/capital-cuiaba.es.html?aid=2410095,"El Hotel Capital ofrece habitaciones modernas, WiFi gratuita y aparcamiento gratuito. Se encuentra a solo 5 minutos en coche del centro comercial 3 Américas y a 15 minutos, también en coche, del centro de Cuiabá.

Las habitaciones del hotel Capital tienen suelo de baldosa de porcelana, TV LED, aire acondicionado, muebles hechos a medida y minibar. El baño privado cuenta con ducha a ras de suelo y secador de pelo.

Todos los días se sirve desayuno buffet con fruta fresca, cereales, pasteles y bollería. Hay servicio de habitaciones.

Además, este hotel dispone de recepción abierta las 24 horas, zona de ordenadores con conexión a internet y servicio de lavandería.

El río Coxipó y el parque Zé Bolo Flô están a 5 minutos a pie, mientras que el parque zoológico de Cuiabá se halla a 10 minutos en coche. La estación de autobuses de Coxipó se ubica a 15 minutos, también en coche.","Parking gratis, Portugués, Ducha, TV de pantalla plana, Servicio de lavandería, Toallas, Buen desayuno, Ropa de cama, Servicio de despertador, Recepción 24 horas, WC, Aire acondicionado, Jardín, WiFi gratis, Habitaciones sin humo, Centro de negocios, Servicio de habitaciones",https://cf.bstatic.com/xdata/images/hotel/max1024x768/84361914.jpg?k=050b545e5642ba756d04ccf39d08ada595a5fbd1ec99d723db226cca48777023&o=&hp=1,Cuiabá,Brasil
Advanced Hotel & Flats Cuiabá,https://www.booking.com/hotel/br/advanced-business-amp-flats.es.html?aid=2410095,"Advanced Hotel & Flats Cuiabá se encuentra en Cuiabá, a 5 km de Arena Pantanal, y ofrece alojamiento con piscina al aire libre, parking privado, centro de fitness y restaurante. Este hotel de 4 estrellas ofrece servicio de habitaciones, recepción 24 horas y wifi gratis. El bar es ideal para tomar algo.

En el hotel, todas las habitaciones cuentan con aire acondicionado, escritorio, TV de pantalla plana, baño privado, ropa de cama, toallas y balcón con vistas a la ciudad. Advanced Hotel & Flats Cuiabá dispone de algunas unidades con vistas a la montaña, y todas cuentan con patio. En el alojamiento, cada habitación cuenta con zona de estar.

En Advanced Hotel & Flats Cuiabá se sirve todos los días un desayuno buffet.

El hotel ofrece terraza solárium.

Parque Madre Bonifácia está a 2 km del alojamiento, y Museo de Muñecas y Juguetes está a 3,3 km. El aeropuerto más cercano (Aeropuerto internacional Marechal Rondon) está a 10 km del alojamiento.","Tarjeta de acceso, Abierta todo el año, Extintores, Adaptado personas de movilidad reducida, Vistas a la piscina, Zona de estar, Registro de entrada / salida privado, Piscina al aire libre, Teléfono, Servicio de conserjería, Alarma de seguridad, TV, Habitaciones insonorizadas, Salas de reuniones / banquetes, Servicio de aparcacoches, Para todas las edades, Spa y centro de bienestar, Cafetería en el alojamiento, Recepción 24 horas, Habitaciones familiares, Zona de cocina, Vistas, Tumbonas/sillas de playa, Restaurante, Escritorio, Zona de comedor, Vistas a un lugar de interés, Cuerda de emergencia en el baño, Patio, Servicio de despertador, Prohibido fumar en todo el alojamiento, Minibar, Ducha, Valla alrededor de la piscina, Artículos de aseo gratis, Horario de apertura, TV de pantalla plana, Ropa de cama, Enchufe cerca de la cama, Español, Vistas a la ciudad, Piscina en la azotea, Toallas, Gimnasio, Vestidor, Canales por cable, WC con barras de apoyo, Servicio de habitaciones, Baño privado, Adaptado para sillas de ruedas, Detectores de humo, Ascensor, WC, Taquillas, Papel higiénico, Inglés, Bar, Snack-bar, Servicio de lavandería, Llave de acceso, Insonorización, Sofá, WiFi gratis, Parking privado, Parking adaptado para personas de movilidad reducida, Mobiliario exterior, Muy buen desayuno, WC elevado, Terraza / solárium, Centro de negocios, Servicio de limpieza diario, Seguridad 24 horas, Parking en un garaje, Aire acondicionado, Lavamanos más bajo, Zona de spa / relajación, Habitaciones sin humo, Balcón",https://cf.bstatic.com/xdata/images/hotel/max1024x768/268694829.jpg?k=6534ab46456ecfbbd9c09b176fec0544c5ab2fe3f9b93389e6b9e16fc64c269e&o=&hp=1,Cuiabá,Brasil
Abudi Hotel,https://www.booking.com/hotel/br/abudi-palace.es.html?aid=2410095,"El Abudi Hotel se encuentra a solo 400 metros del animado centro de la ciudad de Cuiabá. Ofrece habitaciones con conexión Wi-Fi gratuita y TV por cable. Cuenta con recepción 24 horas. También tiene aparcamiento gratuito.

Las habitaciones del Abudi Hotel cuentan con aire acondicionado y suelo de baldosa. Todas tienen minibar, teléfono y baño privado.

Todas las mañanas se sirve un desayuno buffet internacional y local. En las inmediaciones del Abudi Hotel hay varios restaurantes y bares.

El Hotel Abudi Palace está a solo 850 metros de la catedral de Cuiabá y a 1,2 km de la iglesia de Nossa Senhora do Bom Despacho.","Inglés, TV de pantalla plana, Servicio de lavandería, Extintores, Restaurante, Perchero, WiFi gratis, Teléfono, Alarma de seguridad, Fax / fotocopiadora, Cámaras de seguridad en las zonas comunitarias, Muy buen desayuno, TV, Prohibido fumar en todo el alojamiento, Minibar, Caja fuerte, Francés, Guardaequipaje, Ducha, Salas de reuniones / banquetes, Armario, Servicio de limpieza diario, Canales por cable, Seguridad 24 horas, Parking gratis, Baño privado, Parking en un garaje, Recepción 24 horas, Ascensor, WC, Aire acondicionado, Habitaciones familiares, Portugués, Cámaras de seguridad fuera del alojamiento, Habitaciones sin humo",https://cf.bstatic.com/xdata/images/hotel/max1024x768/245622067.jpg?k=d80962982f115d424b62da54514ebbaa31312f6a95a16b32d2076929a073ddd7&o=&hp=1,Cuiabá,Brasil
Paiaguas Palace Hotel,https://www.booking.com/hotel/br/paiaguas-palace.es.html?aid=2410095,"El Paiaguas Palace se encuentra en el distrito financiero de Cuiabá, a 1 km del centro comercial Pantanal, y dispone de una piscina y zona de barbacoa. El establecimiento alberga un gimnasio y un restaurante que sirve el desayuno. Hay WiFi gratuita.

Las habitaciones tienen una decoración clásica y están equipadas con aire acondicionado, TV por cable, caja fuerte, minibar y baño privado con secador de pelo.

El Paiaguas Palace Hotel queda a 1 km del centro comercial Pantanal, a 4 km del Centro de Eventos do Pantanal y a 15 km del aeropuerto internacional Marechal Rondon. El aparcamiento privado es gratuito.","Tarjeta de acceso, Abierta todo el año, Extintores, Boles para mascotas, Adaptado personas de movilidad reducida, Piscina al aire libre, Teléfono, Fruta, Alarma de seguridad, TV, Caja fuerte, Salas de reuniones / banquetes, Servicio de aparcacoches, Para todas las edades, Cafetería en el alojamiento, Recepción 24 horas, Habitaciones familiares, Portugués, Tumbonas/sillas de playa, Restaurante, Escritorio, Toda la unidad accesible en silla de ruedas, Happy hour, Barbacoa, Fax / fotocopiadora, Cámaras de seguridad en las zonas comunitarias, Servicio de despertador, Minibar, Ducha, Servicio de despertador / alarma, Artículos de aseo gratis, Horario de apertura, TV de pantalla plana, Ropa de cama, Zona de fumadores, Perchero, Enchufe cerca de la cama, Menú para niños, Servicio de planchado, Armario, Toallas, Gimnasio, Apoyo visual: carteles táctiles, Canales por cable, Servicio de limpieza en seco, WC con barras de apoyo, Servicio de habitaciones, Baño privado, Adaptado para sillas de ruedas, Detectores de humo, Ascensor, Zona TV / salón de uso compartido, Cámaras de seguridad fuera del alojamiento, Suelo de baldosa / mármol, Acceso a pisos superiores en ascensor, Bar, Servicio de lavandería, Llave de acceso, Desayuno fabuloso, Menús para dietas especiales (bajo petición), Zona poco profunda, WiFi gratis, Parking privado, Parking adaptado para personas de movilidad reducida, Mobiliario exterior, WC elevado, Centro de negocios, Apoyo visual: braille, Guardaequipaje, Servicio de limpieza diario, Seguridad 24 horas, Parking en un garaje, Vino / champán, Secador de pelo, Aire acondicionado, Lavamanos más bajo, Habitaciones sin humo",https://cf.bstatic.com/xdata/images/hotel/max1024x768/176630933.jpg?k=200edfd4683749c6c002bf52a1cf31552fe517f0dfac353afaeaf5869a727df8&o=&hp=1,Cuiabá,Brasil
Hotel 365,https://www.booking.com/hotel/br/presidencial.es.html?aid=2410095,"El Hotel 365 ofrece aparcamiento gratuito y habitaciones con aire acondicionado y conexión Wi-Fi gratuita. Se encuentra a 2 km del centro industrial de Cuiabá y ofrece piscinas para adultos y niños, sala de juegos y centro de fitness.

Las habitaciones tienen suelo de baldosa y baño privado. TV por cable, minibar y teléfono.

El centro comercial 3 Américas está a 7 km del Hotel 365. La estación de autobuses de Cuiabá está a 13 km del hotel. El aeropuerto internacional Marechal Rondon está a 18 km.","Tumbonas/sillas de playa, Bar, Snack-bar, Abierta todo el año, Servicio de lavandería, Extintores, Llave de acceso, Restaurante, Sombrillas, Zona poco profunda, WiFi gratis, Fax / fotocopiadora, Cámaras de seguridad en las zonas comunitarias, Parking adaptado para personas de movilidad reducida, Muy buen desayuno, Terraza / solárium, Centro de negocios, Caja fuerte, Guardaequipaje, Servicio de planchado, Salas de reuniones / banquetes, Armario, Servicio de limpieza diario, Gimnasio, Billar, Adecuada para niños, Sala de juegos, Jardín, Desayuno en la habitación, Seguridad 24 horas, Servicio de habitaciones, Cafetería en el alojamiento, Parking gratis, Parking en un garaje, Vino / champán, Piscina infantil, Recepción 24 horas, Detectores de humo, Ascensor, Zona TV / salón de uso compartido, Aire acondicionado, Toallas de playa/piscina, 2 piscinas, Habitaciones familiares, Portugués, Cámaras de seguridad fuera del alojamiento, Suelo de baldosa / mármol",https://cf.bstatic.com/xdata/images/hotel/max1024x768/475047105.jpg?k=e506e7d7990ec596ac3f484b39e56f1ee9a71bd69aa6589d99859bf1059ed79d&o=&hp=1,Cuiabá,Brasil
HOSTEL DIKASA,https://www.booking.com/hotel/br/hostel-dikasa.es.html?aid=2410095,"HOSTEL DIKASA está en Cuiabá, a 5,3 km de Arena Pantanal, y dispone de alojamiento con jardín, parking privado, salón de uso común y terraza. Este alojamiento, que tiene habitaciones familiares, también ofrece barbacoa. El alojamiento ofrece recepción 24 horas, traslado para ir o volver del aeropuerto, cocina compartida y wifi gratis en todo el alojamiento.

En el hostal o pensión, cada habitación está equipada con armario. En HOSTEL DIKASA, las habitaciones incluyen ropa de cama y toallas.

Parque Madre Bonifácia está a 1,9 km del alojamiento, y Museo de Muñecas y Juguetes está a 5,3 km. El aeropuerto (Aeropuerto internacional Marechal Rondon) está a 8 km.","Terraza, Servicio de lavandería, Extintores, Llave de acceso, Ropa de cama, Plancha para ropa, Utensilios de planchado, Perchero, Cocina compartida, WiFi gratis, Enchufe cerca de la cama, Parking privado, Traslado aeropuerto, Barbacoa, Registro de entrada / salida privado, Ventilador, Servicio de despertador, Parking adaptado para personas de movilidad reducida, Mobiliario exterior, Terraza / solárium, Caja fuerte, Bañera o ducha, Ducha, Bidet, Armario, Toallas, Artículos de aseo gratis, Servicio de limpieza diario, Jardín, Proporciona factura, Suelo de baldosa / mármol, Parking en un garaje, Portugués, Secador de pelo, Recepción 24 horas, Zona TV / salón de uso compartido, WC, Aire acondicionado, Barandillas protectoras para bebés, Habitaciones familiares, Taquillas, Servicio de traslado, Habitaciones sin humo, Papel higiénico",https://cf.bstatic.com/xdata/images/hotel/max1024x768/499731448.jpg?k=5cc0e1db77804460d63faf5a597c55df5665c3b0cfa6076d9bf212c505b06580&o=&hp=1,Cuiabá,Brasil
MG Flats Hotel & Residence,https://www.booking.com/hotel/br/mg-flats-amp-residence.es.html?aid=2410095,"MG Flats Hotel & Residence se encuentra en Cuiabá, a 8,3 km de Arena Pantanal, y ofrece alojamiento con piscina al aire libre, parking privado gratis, centro de fitness y salón de uso común. Este alojamiento, que cuenta con recepción 24 horas, también cuenta con restaurante y terraza solárium. Este alojamiento libre de humo está a 5,2 km de Parque Madre Bonifácia.

En el hotel, cada habitación tiene escritorio. Las habitaciones del alojamiento tienen baño privado con ducha y secador de pelo, además de TV de pantalla plana y aire acondicionado. Algunas habitaciones también tienen balcón. En MG Flats Hotel & Residence, todas las habitaciones están equipadas con ropa de cama y toallas.

En el alojamiento se puede disfrutar de un desayuno buffet o continental.

Museo de Muñecas y Juguetes está a 8,5 km del alojamiento, y Parque Zé Bolo Flô está a 10 km. El aeropuerto más cercano (Aeropuerto internacional Marechal Rondon) está a 10 km del alojamiento.","Acceso a pisos superiores en ascensor, Tarjeta de acceso, Abierta todo el año, TV de pantalla plana, Extintores, Desayuno fabuloso, Restaurante, Ropa de cama, Escritorio, Sofá, Adaptado personas de movilidad reducida, Zona poco profunda, Enchufe cerca de la cama, Registro de entrada / salida privado, Piscina al aire libre, Servicio de despertador, Parking adaptado para personas de movilidad reducida, TV, Prohibido fumar en todo el alojamiento, Minibar, Terraza / solárium, Caja fuerte, Guardaequipaje, Ducha, Armario, Toallas, Gimnasio, Servicio de limpieza diario, Para todas las edades, Proporciona factura, Canales por cable, WC con barras de apoyo, Seguridad 24 horas, Parking gratis, Baño privado, Parking en un garaje, Adaptado para sillas de ruedas, Secador de pelo, Horario de apertura, Recepción 24 horas, Detectores de humo, Ascensor, Zona TV / salón de uso compartido, WC, Aire acondicionado, Habitaciones familiares, Portugués, Habitaciones sin humo, Papel higiénico",https://cf.bstatic.com/xdata/images/hotel/max1024x768/470524542.jpg?k=d676bce6b42ff10fe18df9de80fc11c3a8c45abd716eede4fedcab89defacb51&o=&hp=1,Cuiabá,Brasil
Hotel Cuiabá,https://www.booking.com/hotel/br/cuiaba-cuiaba.es.html?aid=2410095,"Hotel Cuiabá se encuentra en Cuiabá, a 4,7 km de Arena Pantanal y a 3,6 km de Parque Madre Bonifácia. Ofrece alojamiento con bar y wifi gratis en todo el alojamiento, además de parking privado gratis. Este hotel de 3 estrellas ofrece servicio de habitaciones y recepción 24 horas. Museo de Muñecas y Juguetes está a 5,3 km del hotel y Parque Zé Bolo Flô, a 6,5 km.

En el hotel, cada habitación tiene aire acondicionado y TV de pantalla plana.

Estadio Eurico Gaspar Dutra está a 1,7 km del alojamiento. El aeropuerto más cercano (Aeropuerto internacional Marechal Rondon) está a 6 km del alojamiento.","Parking gratis, Bar, Portugués, Papel higiénico, TV de pantalla plana, Servicio de aparcacoches, Buen desayuno, Recepción 24 horas, Parking adaptado para personas de movilidad reducida, Aire acondicionado, Habitaciones familiares, TV, WiFi gratis, Servicio de habitaciones",https://cf.bstatic.com/xdata/images/hotel/max1024x768/415858230.jpg?k=e45bd186a57b1a3c52efb5c638611a7c4ce9213ec2fe27b5fb940b7b0b08926a&o=&hp=1,Cuiabá,Brasil
"OYO Pousada ParanAi, CuiabAi",https://www.booking.com/hotel/br/pousada-parana-cuiaba.es.html?aid=2410095,"OYO Pousada ParanAi, CuiabAi está en Cuiabá, a 6,5 km de Arena Pantanal y a 2,1 km de Parque Madre Bonifácia. Este hotel de 5 estrellas tiene habitaciones con aire acondicionado, baño privado y wifi gratis. El alojamiento dispone de recepción 24 horas y mostrador de información turística.

Todas las habitaciones de este alojamiento están equipadas con TV. En el hotel, cada habitación dispone de ropa de cama y toallas.

En OYO Pousada ParanAi, CuiabAi se sirve cada mañana un desayuno continental.

Museo de Muñecas y Juguetes está a 5,4 km del alojamiento, y Parque Zé Bolo Flô está a 10 km. El aeropuerto (Aeropuerto internacional Marechal Rondon) está a 10 km.","Ropa de cama, Información turística, Desayuno, WiFi gratis, Enchufe cerca de la cama, Cámaras de seguridad en las zonas comunitarias, TV, Prohibido fumar en todo el alojamiento, Ducha, Toallas, Servicio de limpieza diario, Parking gratis, Baño privado, Recepción 24 horas, WC, Aire acondicionado, Habitaciones familiares, Portugués, Habitaciones sin humo, Papel higiénico",https://cf.bstatic.com/xdata/images/hotel/max1024x768/259728206.jpg?k=79d8252561217a775b94e968d8fc51f8f5f6ff262b3de1c6d3eecbb443518c5f&o=&hp=1,Cuiabá,Brasil
Zaffir Apartamento,https://www.booking.com/hotel/br/zaffir-apartamento.es.html?aid=2410095,"Zaffir Apartamento está en Cuiabá, en la región de Mato Grosso, cerca de Estadio Eurico Gaspar Dutra. Ofrece alojamiento con wifi gratis y parking privado gratis.

Arena Pantanal está a 4,3 km del alojamiento, y Parque Madre Bonifácia está a 3,5 km. El aeropuerto (Aeropuerto internacional Marechal Rondon) está a 6 km.","Parking gratis, Baño privado, Portugués, Prohibido fumar en todo el alojamiento, Servicio de lavandería, Llave de acceso, Alarma de seguridad, Habitaciones hipoalergénicas, Aire acondicionado, Habitaciones familiares, Habitaciones insonorizadas, WiFi gratis, Habitaciones sin humo, Seguridad 24 horas",https://cf.bstatic.com/xdata/images/hotel/max1024x768/505207882.jpg?k=e2c4d6ed2b479f6ddb19b4243a5a54a307776cc0a6570f6e42dba6893f3343b1&o=&hp=1,Cuiabá,Brasil
