hotel,hotel_url,description,popular_facilities,highres_url,city,country
Hotel Coliseo,https://www.booking.com/hotel/ve/coliseo.es.html?aid=2410095,"Hotel Coliseo está en Caracas, a 1,8 km de Univesidad de Venezuela, y dispone de alojamiento con terraza, parking privado gratis, restaurante y bar. Este hotel de 3 estrellas tiene wifi gratis, servicio de habitaciones y recepción 24 horas. Parque Los Caobos está a 2,7 km del hotel y Jardín Botánico, a 2,8 km.

Todas las habitaciones de este alojamiento están equipadas con TV de pantalla plana. En el hotel, las habitaciones tienen aire acondicionado y baño privado.

Complejo Cultural Teresa Carreño está a 3,4 km del alojamiento, y Estadio Olímpico está a 3,6 km. El aeropuerto (Aeropuerto internacional Simon Bolívar) está a 31 km.","Servicio de habitaciones, Baño privado, TV de pantalla plana, Recepción 24 horas, Parking gratis, WiFi gratis, Vistas, Español, Desayuno, Bar, Aire acondicionado, Terraza, Habitaciones sin humo",https://cf.bstatic.com/xdata/images/hotel/max1024x768/186962793.jpg?k=4672f0b71f83e13f3d2fbe8dda8b2f7549548e4570cd83af441a69e9587bbb45&o=&hp=1,El Hatillo,Venezuela
Apartamento tipo estudio,https://www.booking.com/hotel/ve/apartamento-tipo-estudio.es.html?aid=2410095,"Apartamento tipo estudio, que tiene vistas a la ciudad, dispone de alojamiento con jardín, salón de uso común y terraza a unos 9,1 km de Parque Los Caobos. Este alojamiento ofrece parking privado gratis y acceso a un balcón.

Este apartamento con aire acondicionado consta de 2 dormitorios, una sala de estar, una cocina totalmente equipada con nevera y cafetera, y 1 baño con ducha y artículos de aseo gratuitos. Hay toallas y ropa de cama en el apartamento.

Univesidad de Venezuela está a 10 km del alojamiento, y Complejo Cultural Teresa Carreño está a 10 km. El aeropuerto (Aeropuerto internacional Simon Bolívar) está a 38 km, y el alojamiento ofrece servicio de traslado de pago para ir o volver del aeropuerto.","Baño privado, Zona TV / salón de uso compartido, Servicio de entrega de comestibles, Noches de cine, Cocina, Independiente, Vistas, Vistas a la ciudad, Balcón, Utensilios de cocina, Canales por cable, Canales vía satélite, Zona de fumadores, Productos de limpieza, Fruta, Servicio de traslado, Vistas a un lugar de interés, Escritorio, Toallas / sábanas (por un suplemento), Zona de estar, Vistas a la montaña, Proporciona factura, Extintores, Parking en un garaje, Horno, Vistas al jardín, Enchufe cerca de la cama, Aseo adicional, Ventilador, Cafetera, Cambio de moneda, Artículos de aseo gratis, Perchero, Secador de pelo, Tetera / cafetera, Fogones, Seguridad 24 horas, Aire acondicionado, Habitaciones familiares, Ducha, Radio, Sofá, Entrada privada, Parking gratis, Plancha para ropa, Español, TV, Suelo de baldosa / mármol, Mesa de comedor, Plancha para pantalones, Apartamento privado en edificio, Ruta de bares, Traslado aeropuerto, Bañera o ducha, Hervidor eléctrico, Utensilios de planchado, Toda la unidad accesible en silla de ruedas, Habitaciones sin humo, Papel higiénico, Cámaras de seguridad en las zonas comunitarias, Armario, Nevera, Toda la unidad en la planta baja, Zona de cocina, Jardín, Tostadora, Toallas, Información turística, Ropa de cama, Acceso a pisos superiores en ascensor, Zona de comedor, WC, Terraza, TV de pantalla plana, Acceso a pisos superiores solo mediante escaleras",https://cf.bstatic.com/xdata/images/hotel/max1024x768/265879843.jpg?k=cb99a7cccf8d385dbdc2c47376a4eb4089957795b29839ceaadd0f0cd752ea1c&o=&hp=1,El Hatillo,Venezuela
Encantador PentHouse,https://www.booking.com/hotel/ve/hermoso-penthouse-familiar.es.html?aid=2410095,"Encantador PentHouse está en Caracas, a 6,8 km de Complejo Cultural Teresa Carreño, a 7 km de Galeria de Arte Nacional y a 7,1 km de Museo de Bellas Artes. Este alojamiento con aire acondicionado está a 6,1 km de Parque Los Caobos y ofrece wifi gratis y parking privado en el propio alojamiento.

Este apartamento cuenta con 1 dormitorio, TV de pantalla plana y cocina.

Univesidad de Venezuela está a 7,5 km del alojamiento, y Jardín Botánico está a 7,9 km. El aeropuerto más cercano (Aeropuerto internacional Simon Bolívar) está a 34 km.","Habitaciones comunicadas disponibles, Prohibido fumar en todo el alojamiento, Cocina, TV de pantalla plana, Parking gratis, WiFi gratis, Zona de cocina, Cama plegable, Vistas, Español, Aire acondicionado, Lavadora",https://cf.bstatic.com/xdata/images/hotel/max1024x768/577348888.jpg?k=612410c59903cdc2ff4b825e69dca9c9169cdece0c2b73c0a907908931cf8b1a&o=&hp=1,El Hatillo,Venezuela
"Paraíso Urbano, Exclusivo Apartamento en El Rosal - Caracas",https://www.booking.com/hotel/ve/paraiso-urbano-exclusivo-apartamento-en-el-rosal-caracas.es.html?aid=2410095,"Paraíso Urbano, Exclusivo Apartamento en El Rosal - Caracas está en Caracas, a 4,8 km de Parque Los Caobos, a 5,1 km de Jardín Botánico y a 5,4 km de Complejo Cultural Teresa Carreño. Este alojamiento con aire acondicionado está a 4,7 km de Univesidad de Venezuela y ofrece wifi gratis y parking privado en el propio alojamiento.

El apartamento cuenta con balcón y vistas a la ciudad, y tiene 1 dormitorio, una sala de estar, TV de pantalla plana, una zona de cocina equipada con nevera y horno, y 2 baños con ducha. Hay toallas y ropa de cama en el apartamento.

Galeria de Arte Nacional está a 5,7 km del alojamiento, y Museo de Bellas Artes está a 5,8 km. El aeropuerto más cercano (Aeropuerto internacional Simon Bolívar) está a 32 km.","Baño privado, Prohibido fumar en todo el alojamiento, WiFi gratis, Vistas, Tendedero, Vistas a la ciudad, Balcón, Productos de limpieza, Baño compartido, Lavadora, Zona de estar, Horno, Perchero, Secador de pelo, Tetera / cafetera, Aire acondicionado, Habitaciones familiares, Ducha, Entrada privada, Plancha para ropa, Parking gratis, Español, TV, Apartamento privado en edificio, Inglés, Sofá cama, Bañera o ducha, Utensilios de planchado, Habitaciones sin humo, Papel higiénico, Zona de cocina, Microondas, Ropa de cama, Toallas, Nevera, Zona de comedor, WC, TV de pantalla plana",https://cf.bstatic.com/xdata/images/hotel/max1024x768/568172632.jpg?k=ad778c787ba32b48b5ffcda4c9b3188685fa1987f4dcc55303771701c4f16e03&o=&hp=1,El Hatillo,Venezuela
