hotel,price,score,avg_review,reviews_count,image_links,hotel_url,popular_facilities,city,country,description
Lovely spacious house with big garden,US$46,"9,1",Fantástico,14,https://cf.bstatic.com/xdata/images/hotel/max1024x768/390066549.webp?k=b564fbb1fc061af8a581a91c0b39a0485664ce8fe3ff960196a6fcc18b6912fe&o=,https://www.booking.com/hotel/al/lovely-spacious-house-with-big-garden.es.html?aid=2410095,"Zona de estar, Ducha, Productos de limpieza, TV de pantalla plana, Jardín, Bañera, Papel higiénico, Bidet, Bañera o ducha, Entrada privada, Plancha para ropa, Registro de entrada / salida privado, Prohibido fumar en todo el alojamiento, Aire acondicionado, Cocina, WiFi gratis, Nevera, Utensilios de planchado, Italiano, Sofá cama, Mosquitera, Baño privado, Suelo de baldosa / mármol, Habitaciones familiares, Inglés, Lavadora, Vistas, Armario, Vistas al jardín, Habitaciones sin humo, Sofá, Microondas, Parking gratis, WC, Alarma de seguridad",Elbasan,Albania,"Lovely spacious house with big garden es un alojamiento con wifi gratis y vistas al jardín que está en Elbasan. El alojamiento, que se encuentra a 40 km de Plaza Skanderbeg, dispone de jardín y parking privado gratis.

La casa o chalet tiene aire acondicionado y también ofrece TV de pantalla plana, cocina totalmente equipada con nevera, zona de estar, lavadora y 1 baño con bidet, ducha y bañera.

Teleférico Dajti Ekspres está a 42 km del alojamiento, y Former Residence of Enver Hoxha está a 39 km. El aeropuerto más cercano (Aeropuerto Internacional de Tirana-Madre Teresa) está a 52 km."
Comfy Elbasan Apartment,US$34,ver...,,ver...,https://cf.bstatic.com/xdata/images/hotel/max1024x768/520441535.webp?k=a69e2357b3ba4360f85891442eb0e9cab3c3bdf8c97b75b420d9633d235804d6&o=,https://www.booking.com/hotel/al/comfy-elbasan-apartment.es.html?aid=2410095,"Zona de estar, Ducha, Apartamento privado en edificio, TV de pantalla plana, Balcón, Perchero, Papel higiénico, Escritorio, Zapatillas, Secador de pelo, Plancha para ropa, Prohibido fumar en todo el alojamiento, Calefacción, TV, Vistas a la ciudad, Cocina, Aire acondicionado, WiFi gratis, Nevera, Servicio de streaming (como Netflix), Sofá cama, Mesa de comedor, Baño privado, Habitaciones familiares, Toallas, Inglés, Lavadora, Vistas, Habitaciones sin humo, Sofá, Parking gratis, WC, Horno, Minibar",Elbasan,Albania,"Comfy Elbasan Apartment está en Elbasan, a 41 km de Plaza Skanderbeg y a 43 km de Teleférico Dajti Ekspres, y ofrece wifi gratis y aire acondicionado. Este apartamento está a 40 km de Former Residence of Enver Hoxha y a 40 km de Grand Park of Tirana.

El apartamento cuenta con balcón y vistas a la ciudad, y tiene 2 dormitorios, una sala de estar, TV de pantalla plana, una cocina equipada con nevera y horno, y 1 baño con ducha.

Postbllok - Checkpoint Monument está a 40 km del alojamiento, y Bektashi World Centre está a 43 km. El aeropuerto más cercano (Aeropuerto Internacional de Tirana-Madre Teresa) está a 53 km."
Villa Ceni 3,US$22,"8,0",Muy bien,5,https://cf.bstatic.com/xdata/images/hotel/max1024x768/454656249.webp?k=4d3d1282161e387f9cff5ad3dc2ebcd041e4f647ae91920bc94c84e2b8ff82a0&o=,https://www.booking.com/hotel/al/villa-ceni-3.es.html?aid=2410095,"Ducha, Apartamento privado en edificio, TV de pantalla plana, Jardín, Griego, Papel higiénico, Bidet, Bañera o ducha, Chimenea exterior, Tetera / cafetera, Secador de pelo, Registro de entrada / salida privado, Prohibido fumar en todo el alojamiento, Extintores, TV, Artículos de aseo gratis, Cocina, Aire acondicionado, Zona de comedor exterior, WiFi gratis, Nevera, Zona de comedor, Barbacoa, Toda la unidad en la planta baja, Patio, Mesa de comedor, Toallas, Inglés, Lavadora, Albanés, Mobiliario exterior, Vistas al jardín, Habitaciones sin humo, Parking gratis, Hervidor eléctrico, Cámaras de seguridad fuera del alojamiento, WC, Horno, Ropa de cama",Elbasan,Albania,"Villa Ceni 3, que cuenta con vistas al jardín, dispone de alojamiento con patio y hervidor a unos 41 km de Teleférico Dajti Ekspres. El alojamiento, que se encuentra a 38 km de Plaza Skanderbeg, ofrece jardín y parking privado gratis.

Este apartamento tiene aire acondicionado y cuenta con 1 dormitorio, TV de pantalla plana, zona de comedor y cocina con nevera y horno. Hay toallas y ropa de cama en el apartamento.

Former Residence of Enver Hoxha está a 37 km del alojamiento, y Grand Park of Tirana está a 38 km. El aeropuerto más cercano (Aeropuerto Internacional de Tirana-Madre Teresa) está a 50 km del alojamiento."
Sunshine Place,US$51,"8,9",Fabuloso,32,https://cf.bstatic.com/xdata/images/hotel/max1024x768/428035822.webp?k=8f833be823488d5487acbfdbc6fb550a4f766032d49c88b287bc9c584ff81143&o=,https://www.booking.com/hotel/al/sunshine-place.es.html?aid=2410095,"Ducha, Productos de limpieza, Apartamento privado en edificio, TV de pantalla plana, Lavavajillas, Perchero, Bañera, Balcón, Papel higiénico, Bidet, Bañera o ducha, Suelo de madera o parquet, Zapatillas, Escritorio, Secador de pelo, Vistas a la montaña, Secadora de ropa, Plancha para ropa, Prohibido fumar en todo el alojamiento, Calefacción, TV, Vistas a la ciudad, Cocina, Aire acondicionado, WiFi gratis, Nevera, Italiano, Sofá cama, Trona, Fogones, Mesa de comedor, Enchufe cerca de la cama, Suelo de baldosa / mármol, Habitaciones familiares, Toallas, Inglés, Lavadora, Utensilios de cocina, Vistas, Armario, Habitaciones sin humo, Sofá, Bañera de hidromasaje, Accesible para personas sordas, Parking gratis, WC, Horno, Acceso a pisos superiores en ascensor",Elbasan,Albania,"Sunshine Place está en Elbasan, a 40 km de Plaza Skanderbeg y a 43 km de Teleférico Dajti Ekspres, y ofrece aire acondicionado. Este apartamento con vistas a la ciudad y a la montaña también incluye wifi gratis.

El apartamento tiene balcón, 2 dormitorios, sala de estar y cocina bien equipada con nevera y lavavajillas. Hay TV de pantalla plana.

Former Residence of Enver Hoxha está a 39 km del alojamiento, y Grand Park of Tirana está a 40 km. El aeropuerto (Aeropuerto Internacional de Tirana-Madre Teresa) está a 52 km."
Elbasan view point,US$31,ver...,,ver...,https://cf.bstatic.com/xdata/images/hotel/max1024x768/527638521.webp?k=b238624d3851a2d7284fb9e5ba01ae0f764f4bcc3a3d270dc2d62d43f19f2554&o=,https://www.booking.com/hotel/al/elbasan-view-point.es.html?aid=2410095,"Vestidor, Zona de estar, Productos de limpieza, TV de pantalla plana, Lavavajillas, Perchero, Bañera, Balcón, Alemán, Papel higiénico, Bañera o ducha, Secadora de ropa, Plancha para ropa, Prohibido fumar en todo el alojamiento, Tostadora, Calefacción, TV, Aire acondicionado, Cocina, WiFi gratis, Italiano, Francés, Mesa de comedor, Baño privado, Inglés, Lavadora, Vistas, Armario, Habitaciones sin humo, Sofá, Suelo de moqueta, Bañera de hidromasaje, Parking gratis, WC, Horno",Elbasan,Albania,"Elbasan view point se encuentra en Elbasan y ofrece alojamiento con balcón y wifi gratis. Este apartamento está a 41 km de Plaza Skanderbeg y a 43 km de Teleférico Dajti Ekspres.

Este apartamento con aire acondicionado se compone de 2 dormitorios independientes, una cocina totalmente equipada con lavavajillas y horno, y 1 baño. Se ofrece TV de pantalla plana.

Former Residence of Enver Hoxha está a 40 km del alojamiento, y Grand Park of Tirana está a 40 km. El aeropuerto más cercano (Aeropuerto Internacional de Tirana-Madre Teresa) está a 53 km."
Kulla Relax,US$43,"9,3",Fantástico,19,https://cf.bstatic.com/xdata/images/hotel/max1024x768/361138423.webp?k=cfce32aa8a774ffe18224da588097bdcbff110f21ce637655d319ca3c403f5b1&o=,https://www.booking.com/hotel/al/kulla-relax.es.html?aid=2410095,"Desayuno, Baño privado, Terraza, Parking gratis, Prohibido fumar en todo el alojamiento, Aire acondicionado, Inglés, WiFi gratis, Griego, Alemán, Italiano, Parking adaptado para personas de movilidad reducida",Elbasan,Albania,"Kulla Relax se encuentra en Elbasan y ofrece alojamiento con wifi gratis y parking privado gratis.

Algunas unidades incluyen terraza y/o balcón con vistas al jardín.

El aeropuerto más cercano (Aeropuerto Internacional de Tirana-Madre Teresa) está a 74 km del alojamiento."
VILA BAKRI kati 2,US$66,ver...,,ver...,https://cf.bstatic.com/xdata/images/hotel/max1024x768/520374326.webp?k=c372e1215045495b6dacfd5917d01a876d2b175f73412c16f41fdb93b9df6afd&o=,https://www.booking.com/hotel/al/vila-bakri-elbasan.es.html?aid=2410095,"Ducha, Productos de limpieza, Desayuno, Terraza, Balcón, Jardín, TV de pantalla plana, Seguridad 24 horas, Acceso a pisos superiores solo mediante escaleras, Cámaras de seguridad en las zonas comunitarias, Papel higiénico, Bañera o ducha, Alquiler de coches, Entrada privada, Vistas a un patio interior, Suelo de madera o parquet, Zapatillas, Secador de pelo, Prohibido fumar en todo el alojamiento, Calefacción, TV, Artículos de aseo gratis, Aire acondicionado, WiFi gratis, Cafetería en el alojamiento, Servicio de streaming (como Netflix), Italiano, Mosquitera, Bar, Restaurante, Llave de acceso, Baño privado, Enchufe cerca de la cama, Toallas, Albornoz, Inglés, Armario, Vistas al jardín, Habitaciones sin humo, Baño adicional, Parking gratis, Cámaras de seguridad fuera del alojamiento, WC, Alarma de seguridad",Elbasan,Albania,"VILA BAKRI kati 2 se encuentra en Elbasan, a 38 km de Plaza Skanderbeg, y ofrece alojamiento con jardín, parking privado gratis, terraza y restaurante. El alojamiento cuenta con bar y se encuentra a 41 km de Teleférico Dajti Ekspres. Las habitaciones tienen aire acondicionado, vistas al jardín, armario y wifi gratis.

En el hotel, cada habitación cuenta con balcón. Cada habitación incluye baño privado con ducha, artículos de aseo gratuitos y secador de pelo. Las habitaciones del alojamiento están equipadas con TV de pantalla plana y zapatillas.

En VILA BAKRI kati 2 se sirve todos los días un desayuno italiano.

Former Residence of Enver Hoxha está a 38 km del alojamiento, y Grand Park of Tirana está a 38 km. El aeropuerto más cercano (Aeropuerto Internacional de Tirana-Madre Teresa) está a 51 km del alojamiento."
OceOce II,US$55,ver...,,ver...,https://cf.bstatic.com/xdata/images/hotel/max1024x768/458436109.webp?k=490e2c8bfdf97eecaa8f6b87bb5ef0ea22782f2a408cc54d98337108a095ae6e&o=,https://www.booking.com/hotel/al/oceoce-ii.es.html?aid=2410095,"Zona de estar, Ducha, Productos de limpieza, TV de pantalla plana, Balcón, Perchero, Bañera, Papel higiénico, Bañera o ducha, Canales vía satélite, Entrada privada, Suelo de madera o parquet, Zapatillas, Escritorio, Secador de pelo, Caja fuerte, Secadora de ropa, Plancha para ropa, Prohibido fumar en todo el alojamiento, Calefacción, TV, Artículos de aseo gratis, Cocina, Canales de pago, Aire acondicionado, WiFi gratis, Servicio de streaming (como Netflix), Sofá cama, Suelo de baldosa / mármol, Habitaciones familiares, Albornoz, Inglés, Lavadora, Ventilador, Insonorización, Vistas, Armario, Canales por cable, Habitaciones sin humo, Sofá, Suelo de moqueta, Parking gratis, WC",Elbasan,Albania,"OceOce II se encuentra en Elbasan y ofrece alojamiento a 40 km de Plaza Skanderbeg, a 43 km de Teleférico Dajti Ekspres y a 40 km de Former Residence of Enver Hoxha. Este apartamento ofrece wifi gratis, una cocina totalmente equipada y un balcón.

Este apartamento de 1 dormitorio ofrece TV de pantalla plana vía satélite, aire acondicionado y sala de estar.

Grand Park of Tirana está a 40 km del alojamiento, y Postbllok - Checkpoint Monument está a 40 km. El aeropuerto más cercano (Aeropuerto Internacional de Tirana-Madre Teresa) está a 53 km del alojamiento."
ViLa Bakri,US$35,ver...,,ver...,https://cf.bstatic.com/xdata/images/hotel/max1024x768/520872157.webp?k=35ab66f589c8ee5bba182f9185e6703987d072ad77e6654e8cda6164d0e6aaf7&o=,https://www.booking.com/hotel/al/vila-bakri-elbasan1.es.html?aid=2410095,"Ducha, Desayuno, Terraza, Balcón, Jardín, TV de pantalla plana, Papel higiénico, Zapatillas, Secador de pelo, Prohibido fumar en todo el alojamiento, Calefacción, Artículos de aseo gratis, Aire acondicionado, WiFi gratis, Nevera, Italiano, Bar, Baño privado, Toallas, Inglés, Armario, Parking gratis, WC",Elbasan,Albania,"ViLa Bakri es un alojamiento con jardín, terraza y bar que se encuentra en Elbasan, a 41 km de Teleférico Dajti Ekspres, a 38 km deFormer Residence of Enver Hoxha y a 38 km de Grand Park of Tirana. Este alojamiento con aire acondicionado está a 38 km de Plaza Skanderbeg y ofrece wifi gratis y parking privado en el propio alojamiento.

El bed and breakfast tiene TV de pantalla plana.

En el bed and breakfast se puede disfrutar de un desayuno italiano.

Postbllok - Checkpoint Monument está a 38 km del alojamiento, y Bektashi World Centre está a 40 km. El aeropuerto más cercano (Aeropuerto Internacional de Tirana-Madre Teresa) está a 51 km."
Best Apartments,US$49,"7,8",Bien,6,https://cf.bstatic.com/xdata/images/hotel/max1024x768/478027289.webp?k=09632bbe8a558f4aa0e6d8317a284cad6c0dbce7a2e9ac5c63c5004ba5f30df8&o=,https://www.booking.com/hotel/al/best-apartments-elbasan.es.html?aid=2410095,"TV de pantalla plana, Baño privado, Balcón, Prohibido fumar en todo el alojamiento, Calefacción, Cocina, Inglés, WiFi gratis, Lavadora, Vistas",Elbasan,Albania,"Best Apartments está en Elbasan y ofrece alojamiento con balcón y wifi gratis. Este apartamento está a 41 km de Plaza Skanderbeg y a 44 km de Teleférico Dajti Ekspres.

El apartamento de 1 dormitorio tiene sala de estar con TV de pantalla plana, cocina totalmente equipada y 1 baño.

Former Residence of Enver Hoxha está a 40 km del alojamiento, y Grand Park of Tirana está a 41 km. El aeropuerto más cercano (Aeropuerto Internacional de Tirana-Madre Teresa) está a 53 km."
Home Sweet Home,US$88,10,Excepcional,1,https://cf.bstatic.com/xdata/images/hotel/max1024x768/515262951.webp?k=642fe39368c2fdd6e36c49214305614daf33133eda93be2c1bba6b20b8d0e8dc&o=,https://www.booking.com/hotel/al/home-sweet-home-elbasan.es.html?aid=2410095,"TV de pantalla plana, Balcón, Griego, Papel higiénico, Secador de pelo, Plancha para ropa, Prohibido fumar en todo el alojamiento, Calefacción, Aire acondicionado, Cocina, WiFi gratis, Nevera, Italiano, Fogones, Habitaciones familiares, Toallas, Inglés, Lavadora, Vistas, Albanés, Habitaciones sin humo, Microondas, Horno, Ropa de cama",Elbasan,Albania,"Home Sweet Home se encuentra en Elbasan, a 41 km de Plaza Skanderbeg y a 43 km de Teleférico Dajti Ekspres, y ofrece wifi gratis y aire acondicionado. Este apartamento está a 40 km de Former Residence of Enver Hoxha y a 40 km de Grand Park of Tirana.

El apartamento dispone de balcón, 2 dormitorios, sala de estar y cocina bien equipada con nevera y horno. Hay toallas y ropa de cama en el apartamento.

Postbllok - Checkpoint Monument está a 40 km del alojamiento, y Pyramid of Tirana está a 40 km. El aeropuerto más cercano (Aeropuerto Internacional de Tirana-Madre Teresa) está a 53 km del alojamiento."
Vilat Alpine Golden Gjinar,US$87,10,Excepcional,4,https://cf.bstatic.com/xdata/images/hotel/max1024x768/516486027.webp?k=99be0f9a99eb12b8eff381b7fb7cd7d53f14e5bd406fc8e7af0f3114f6af3c9f&o=,https://www.booking.com/hotel/al/vilat-alpine-golden-gjinar.es.html?aid=2410095,"Zona de estar, Desayuno, TV de pantalla plana, Lavavajillas, Balcón, Toallas / sábanas (por un suplemento), Bañera, Jardín, Papel higiénico, Bidet, Bañera o ducha, Canales vía satélite, Cafetera, Entrada privada, Zapatillas, Escritorio, Secador de pelo, Vistas a la montaña, Prohibido fumar en todo el alojamiento, Tostadora, Calefacción, TV, Cocina, Chimenea, WiFi gratis, Nevera, Zona de comedor, Italiano, Sofá cama, Mesa de comedor, Baño privado, Habitaciones familiares, Toallas, Inglés, Vistas, Armario, Vistas al jardín, Habitaciones sin humo, Sofá, Parking gratis, Zona de cocina, WC",Elbasan,Albania,"Vilat Alpine Golden Gjinar es un alojamiento con wifi gratis y vistas al jardín que se encuentra en Elbasan. Esta villa dispone de jardín y parking privado gratis.

La villa cuenta con un balcón y vistas a la montaña e incluye 1 dormitorio, sala de estar, TV de pantalla plana vía satélite, cocina equipada y 1 baño con bidet y bañera. Para mayor comodidad, el alojamiento puede ofrecer toallas y ropa de cama por un suplemento.

En la villa se sirve todos los días un desayuno continental.

El aeropuerto más cercano (Aeropuerto Internacional de Tirana-Madre Teresa) está a 74 km del alojamiento."
Relax,US$52,ver...,,ver...,https://cf.bstatic.com/xdata/images/hotel/max1024x768/497978440.webp?k=cfbc1a9594a564b1fc8bef3e362388f0c9d50dd4a27f8c1b09b00a7ea8bdd4cd&o=,https://www.booking.com/hotel/al/relax-elbasan.es.html?aid=2410095,"Vistas al jardín, Terraza, Prohibido fumar en todo el alojamiento, Balcón, Parking gratis, Zona de cocina, Cocina, Inglés, Lavadora, Italiano, Vistas",Elbasan,Albania,"Relax es un alojamiento con vistas al jardín que está en Elbasan, a 44 km de Plaza Skanderbeg y a 47 km de Teleférico Dajti Ekspres. Este alojamiento ofrece parking privado gratis y acceso a un balcón.

La villa tiene terraza, 1 dormitorio, sala de estar y cocina bien equipada.

Former Residence of Enver Hoxha está a 43 km del alojamiento, y Grand Park of Tirana está a 43 km. El aeropuerto más cercano (Aeropuerto Internacional de Tirana-Madre Teresa) está a 56 km."
Bujtina Bezhani Gjinar,US$81,10,Excepcional,3,https://cf.bstatic.com/xdata/images/hotel/max1024x768/489256750.webp?k=41f42c241ef186950062a4ed81ec464db913fef6c170d2762826b2e296480884&o=,https://www.booking.com/hotel/al/bujtina-bezhani-gjinar.es.html?aid=2410095,"Desayuno, TV de pantalla plana, Balcón, Jardín, Alemán, Suelo de madera o parquet, Plancha para ropa, Prohibido fumar en todo el alojamiento, Calefacción, Cocina, Chimenea, WiFi gratis, Italiano, Sofá cama, Habitaciones familiares, Inglés, Lavadora, Vistas, Armario, Vistas al jardín, Habitaciones sin humo, Sofá, Parking gratis, Minibar",Elbasan,Albania,"Bujtina Bezhani Gjinar es un alojamiento con wifi gratis y vistas al jardín que se encuentra en Elbasan. Este apartamento tiene jardín y parking privado gratis.

El apartamento dispone de balcón, 2 dormitorios, sala de estar y cocina bien equipada con minibar. Se ofrece TV de pantalla plana.

El aeropuerto más cercano (Aeropuerto Internacional de Tirana-Madre Teresa) está a 73 km."
Bujtinat Peci,US$54,ver...,,ver...,https://cf.bstatic.com/xdata/images/hotel/max1024x768/498497176.webp?k=67a67c78bcf8b1a447908aa0b989994bd54c7464b800591276313623cc6076d7&o=,https://www.booking.com/hotel/al/bujtinat-peci.es.html?aid=2410095,"Vistas al jardín, Habitaciones sin humo, Prohibido fumar en todo el alojamiento, TV de pantalla plana, Terraza, Balcón, Parking gratis, Calefacción, Zona de cocina, Jardín, Cocina, Habitaciones familiares, Aire acondicionado, Inglés, WiFi gratis, Lavadora, Italiano, Vistas",Elbasan,Albania,"Bujtinat Peci se encuentra en Elbasan y ofrece alojamiento con balcón y wifi gratis. Este apartamento dispone de jardín y parking privado gratis.

Este apartamento da a una terraza con vistas al jardín y cuenta con 1 dormitorio y cocina totalmente equipada. Se ofrece TV de pantalla plana.

El aeropuerto más cercano (Aeropuerto Internacional de Tirana-Madre Teresa) está a 74 km del alojamiento."
Shtepia Tradites Gjinar,US$81,"8,8",Fabuloso,9,https://cf.bstatic.com/xdata/images/hotel/max1024x768/525855300.webp?k=ce3278b46700531890d42e74b8477ea9cd60a3d32238d5f05fe55e39ceee673f&o=,https://www.booking.com/hotel/al/shtepia-tradites-gjinar.es.html?aid=2410095,"Vistas al jardín, TV de pantalla plana, Terraza, Balcón, Parking gratis, Calefacción, Prohibido fumar en todo el alojamiento, Aire acondicionado, Cocina, Español, Minibar, Inglés, WiFi gratis, Lavadora, Alemán, Italiano, Vistas",Elbasan,Albania,"Shtepia Tradites Gjinar, que está en Elbasan, ofrece alojamiento con balcón. Este alojamiento ofrece parking privado gratis, wifi gratis y acceso a una terraza.

Esta casa o chalet de 3 dormitorios ofrece TV de pantalla plana, aire acondicionado y sala de estar. La cocina está equipada con minibar.

El aeropuerto más cercano (Aeropuerto Internacional de Tirana-Madre Teresa) está a 74 km."
