hotel,hotel_url,description,popular_facilities,highres_url,city,country
Palo Alto Glamping Hotel,https://www.booking.com/hotel/cr/palo-alto-glamping.es.html?aid=2410095,"Palo Alto Glamping Hotel está en Quesada, a 42 km de Catarata La Fortuna, y dispone de alojamiento con piscina al aire libre, parking privado gratis, centro de fitness y jardín. Este alojamiento ofrece salón de uso común y servicio de conserjería, además de wifi gratis en todo el alojamiento. El hotel tiene terraza, vistas a la montaña, restaurante y bar.

En el hotel, las habitaciones están equipadas con armario, ropa de cama y un balcón con vistas al jardín. Cada habitación cuenta con baño privado con ducha, artículos de aseo gratuitos y secador de pelo. En Palo Alto Glamping Hotel, todas las habitaciones incluyen aire acondicionado y caja fuerte.

El desayuno está disponible todas las mañanas e incluye opciones a la carta, continentales o americanas.

En el alojamiento, la clientela puede disfrutar de bañera de hidromasaje. La zona es ideal para practicar senderismo, y en Palo Alto Glamping Hotel hay alquiler de bicicletas.

Aguas termales de Kalambu está a 41 km del alojamiento, y Catarata Tesoro Escondido está a 49 km. El aeropuerto (Aeropuerto de Fortuna) está a 30 km, y el alojamiento ofrece servicio de traslado de pago para ir o volver del aeropuerto.","Fax / fotocopiadora, Baño privado, Vino / champán, Registro de entrada / salida privado, Salas de reuniones / banquetes, Snack-bar, Masajes, Bar, Nevera, Habitaciones insonorizadas, Mobiliario exterior, Tour o clase sobre cultura local, Piscina al aire libre, WiFi gratis, Música / espectáculos en directo, Minibar, Toallas / sábanas (por un suplemento), Terraza / solárium, Piscina infinita, Proporciona factura, Masaje de pies, Papel higiénico, Ropa de cama, Vistas al jardín, Eventos deportivos en directo (emisión), Habitaciones sin humo, Cenas temáticas, Desayuno en la habitación, Secador de pelo, WC, Tours en bici, Servicio de traslado, Zona de spa / relajación, Senderismo, Servicio de conserjería, Enchufe cerca de la cama, Almuerzos para llevar, Ducha, Parking adaptado para personas de movilidad reducida, Zona TV / salón de uso compartido, Toallas de playa/piscina, Zona de pícnic, Clases de cocina, Servicio de limpieza diario, Clases de fitness, Información turística, Fruta, Masaje corporal completo, Paquetes de spa / bienestar, Tumbonas/sillas de playa, Tetera / cafetera, Menú para niños, Balcón, Vistas a la montaña, Tetera/cafetera en todas las habitaciones, Cámaras de seguridad fuera del alojamiento, Aire acondicionado, Gimnasio, Aseo adicional, Parking gratis, Traslado aeropuerto, Adaptado para sillas de ruedas, Piscina con vistas, Patio, Sombrillas, Seguridad 24 horas, Piscina en la azotea, Horario de apertura, Cámaras de seguridad en las zonas comunitarias, Cafetería en el alojamiento, Supermercado pequeño en el alojamiento, Entretenimiento nocturno, Plancha para pantalones, Servicio de lavandería, Terraza, Artículos de aseo gratis, Alquiler de bicicletas, Zona de comedor, Jardín, Baño al aire libre, Masaje en pareja, Mesa de comedor, Servicio de entrega de comestibles, Extintores, Masaje de cabeza, Zona de estar, Habitaciones familiares, Desayuno, Español, Masaje de cuello, Caja fuerte, Alarma de seguridad, Zona de comedor exterior, Juegos de mesa / puzles, Zona de juegos interior, Menús para dietas especiales (bajo petición), Lavamanos más bajo, Toallas, Plancha para ropa, Masaje de manos, Bañera o ducha, Barbacoa, Entrada privada, Masaje de espalda, Restaurante, Silla de masajes, Abierta todo el año, Tours a pie, Servicio de planchado, Lavadora, Llave de acceso, Spa y centro de bienestar, Acceso al salón executive, Prohibido fumar en todo el alojamiento, Happy hour, Máquina expendedora (bebidas), Clases de yoga, Calefacción, Solo para adultos, Adaptado personas de movilidad reducida, Instalaciones de spa, Bañera de hidromasaje / jacuzzi, Habitaciones hipoalergénicas, Armario, Bar en la piscina, Inglés",https://cf.bstatic.com/xdata/images/hotel/max1024x768/521994994.jpg?k=1e861d0e654e9945084b458610c62f01703b4d746031a8135c64033af4798223&o=&hp=1,La Fortuna,Costa Rica
Hotel Lavas Tacotal,https://www.booking.com/hotel/cr/lavas-tacotal-la-fortuna-san-carlos.es.html?aid=2410095,"El Hotel Lavas Tacotal se encuentra en Fortuna y ofrece piscina al aire libre y restaurante. Ofrece excelentes vistas al volcán Arenal, desayuno gratuito y conexión Wi-Fi gratuita.

Las habitaciones disponen de TV por cable y aire acondicionado. Los bungalows tienen terraza privada con vistas al jardín.

El volcán Arenal se encuentra a 10 minutos en coche y las cascadas del río Fortuna, a 20 minutos en coche. El aeropuerto internacional Juan Santamaría está a 79 km.","Masaje de pies, Piscina infantil, Masaje de cuello, Papel higiénico, Ropa de cama, Fax / fotocopiadora, Inglés, Baño privado, Aire acondicionado, Parking gratis, Habitaciones sin humo, Detectores de humo, Piscina con vistas, Secador de pelo, TV de pantalla plana, Canales por cable, Seguridad 24 horas, Toallas, Masaje de manos, Servicio de traslado, Zona de spa / relajación, Masajes, Masaje de espalda, Servicio de conserjería, Enchufe cerca de la cama, Terraza, Artículos de aseo gratis, Ducha, Abierta todo el año, Parking adaptado para personas de movilidad reducida, Jardín, Vestidor, Mobiliario exterior, Cafetera, Llave de acceso, Prohibido fumar en todo el alojamiento, Masaje en pareja, Toallas de playa/piscina, Zona poco profunda, Piscina pequeña, Servicio de limpieza diario, Masaje corporal completo, Información turística, Alquiler de coches, Piscina al aire libre, Extintores, Para todas las edades, Muy buen desayuno, Masaje de cabeza, Paquetes de spa / bienestar, WiFi gratis, Instalaciones de spa, Perchero, Productos de limpieza, Zona de estar, Tumbonas/sillas de playa, Armario, Habitaciones familiares, TV, Balcón, Proporciona factura, Español",https://cf.bstatic.com/xdata/images/hotel/max1024x768/521761549.jpg?k=935cf0754ae4fec64aa7e2aafaa3e53aafaa1ddb556b31f6fdfebbf8da092e70&o=&hp=1,La Fortuna,Costa Rica
Orquideas Boutique Hotel,https://www.booking.com/hotel/cr/orquideas-boutique.es.html?aid=2410095,"Orquideas Boutique Hotel se encuentra en Fortuna, a 4,4 km de Catarata La Fortuna, y ofrece alojamiento con piscina al aire libre, parking privado gratis, jardín y restaurante. El alojamiento cuenta con bar y se encuentra a 6,5 km de Aguas termales de Kalambu. El alojamiento dispone de bañera de hidromasaje, wifi gratis en todo el alojamiento y habitaciones familiares.

Las habitaciones del alojamiento disponen de baño privado con bañera o ducha, TV de pantalla plana y aire acondicionado. Algunas habitaciones también están equipadas con balcón. Todas las habitaciones cuentan con nevera.

El hotel ofrece desayuno continental o americano.

Parque Mistico Arenal Hanging Bridges está a 22 km del alojamiento, y Sky Adventures Arenal está a 23 km. El aeropuerto más cercano (Aeropuerto de Fortuna) está a 9 km del alojamiento.","Papel higiénico, Baño privado, Aire acondicionado, Parking gratis, Habitaciones sin humo, Detectores de humo, TV de pantalla plana, Canales por cable, Vistas, Toallas, Bañera o ducha, Bar, Baños públicos, Nevera, Restaurante, Abierta todo el año, Parking adaptado para personas de movilidad reducida, Jardín, Baño al aire libre, Información turística, Extintores, Piscina al aire libre, Desayuno fabuloso, Para todas las edades, WiFi gratis, Bañera de hidromasaje / jacuzzi, TV, Habitaciones familiares, Inglés, Español",https://cf.bstatic.com/xdata/images/hotel/max1024x768/408149831.jpg?k=20ad084b21bae989f95db89793be40858b2af886760d787206e3f150f70b8418&o=&hp=1,La Fortuna,Costa Rica
"Volcano Lodge, Hotel & Thermal Experience",https://www.booking.com/hotel/cr/volcano-lodge.es.html?aid=2410095,"El Volcano Lodge, Hotel & Thermal Experience está ubicado entre jardines tropicales exuberantes, a los pies del volcán Arenal de Costa Rica, y ofrece piscina al aire libre y una zona con WiFi gratuita. Las habitaciones tienen aire acondicionado y terraza.

Asimismo, todas las habitaciones disponen de suelo de baldosa, TV por cable, cafetera y escritorio. El baño privado cuenta con ducha y secador de pelo.

Este lodge incluye el desayuno en la tarifa. Cuenta con bar, restaurante y bar cafetería. Se proporciona un servicio de habitaciones.

Este lodge ofrece aparcamiento gratuito. Los huéspedes pueden organizar excursiones para practicar descensos en tirolina o visitar los baños termales cercanos.","Baños termales, Baño privado, Vino / champán, Detectores de humo, Zona de juegos para niños, Canales por cable, Bar, Nevera, Escritorio, Mobiliario exterior, Tarjeta de acceso, Servicio de habitaciones, WiFi gratis, Música / espectáculos en directo, TV, Papel higiénico, Vistas al jardín, Servicio de despertador, Eventos deportivos en directo (emisión), Habitaciones sin humo, Teléfono, Secador de pelo, WC, Tours en bici, Servicio de traslado, Senderismo, Enchufe cerca de la cama, Almuerzos para llevar, Ducha, Parking adaptado para personas de movilidad reducida, Zona TV / salón de uso compartido, Toallas de playa/piscina, Servicio de limpieza diario, Información turística, Fruta, Perchero, Billar, Tumbonas/sillas de playa, Tetera / cafetera, Menú para niños, Piscina infantil, Tetera/cafetera en todas las habitaciones, Adecuada para niños, Aire acondicionado, Parking gratis, Traslado aeropuerto, Sala de juegos, Patio, Sombrillas, Seguridad 24 horas, Cafetería en el alojamiento, Supermercado pequeño en el alojamiento, Dardos, Guardaequipaje, Recepción 24 horas, Servicio de lavandería, Terraza, Artículos de aseo gratis, Jardín, Baño al aire libre, Extintores, Alquiler de coches, Taquillas, Habitaciones familiares, Desayuno fantástico, Español, Caja fuerte, 2 piscinas, Juegos de mesa / puzles, TV de pantalla plana, Toda la unidad en la planta baja, Menús para dietas especiales (bajo petición), Toallas, Bañera o ducha, Restaurante, Abierta todo el año, Tours a pie, Cambio de moneda, Llave de acceso, Prohibido fumar en todo el alojamiento, Happy hour, Equitación, Adaptado personas de movilidad reducida, Bañera de hidromasaje / jacuzzi, Ventilador, Armario, Bar en la piscina, Inglés, Baño de vapor",https://cf.bstatic.com/xdata/images/hotel/max1024x768/246157250.jpg?k=a0d61fb6b6b599470b645223a1c9cf7a87ce78697d89597c9fc1a45c76bff4a8&o=&hp=1,La Fortuna,Costa Rica
Hotel Kokoro Mineral Hot Springs,https://www.booking.com/hotel/cr/kokoro.es.html?aid=2410095,"El Hotel Kokoro ofrece vistas al volcán Arenal y dispone de spa, piscina panorámica y habitaciones y villas ecológicas ubicadas en jardines tropicales. El establecimiento se encuentra en un bello lugar de La Palma, a 2 km del parque nacional Arenal.

Las amplias habitaciones y villas del Hotel Kokoro tienen decoración costarricense atractiva y mobiliario de madera. Hay aire acondicionado, nevera y TV por cable.

El restaurante Umami elabora cocina costarricense con matices japoneses.

El spa Wakami ofrece diversos tratamientos, y el Kokoro cuenta además con aguas termales y bañera de hidromasaje en sus jardines.

La zona es ideal para hacer senderismo, rafting y tirolina. El lago de Pueblo Nuevo y la localidad de La Fortuna están a 10 y a 7 km respectivamente.","Baños termales, Papel higiénico, Caja fuerte, Fax / fotocopiadora, Inglés, Baño privado, Vino / champán, Aire acondicionado, Registro de entrada / salida privado, Parking gratis, Traslado aeropuerto, Desayuno en la habitación, Sombrillas, Secador de pelo, Canales por cable, Menús para dietas especiales (bajo petición), Toallas, Cafetería en el alojamiento, Bañera o ducha, WC, Servicio de traslado, Masajes, Baños públicos, Guardaequipaje, Senderismo, Nevera, Restaurante, Servicio de conserjería, Silla de masajes, Enchufe cerca de la cama, Servicio de lavandería, Terraza, Ducha, Tours a pie, Almuerzos para llevar, Abierta todo el año, Jardín, Spa y centro de bienestar, Cambio de moneda, Servicio de limpieza en seco, Happy hour, Equitación, Menú para niños, Toallas de playa/piscina, Chino, Servicio de limpieza diario, Piragüismo, Tour o clase sobre cultura local, Fruta, Piscina al aire libre, Información turística, Registro de entrada y salida exprés, Muy buen desayuno, Servicio de habitaciones, Extintores, Para todas las edades, WiFi gratis, Paquetes de spa / bienestar, Secadora de ropa, Ventilador, Perchero, Zona de estar, Tumbonas/sillas de playa, Armario, Habitaciones familiares, Pesca, TV, Balcón, Proporciona factura, Español",https://cf.bstatic.com/xdata/images/hotel/max1024x768/241258444.jpg?k=3c0e5a2cb408bb14967fa52e8ce6a39e407139e7d395072ae49945cb5da24a6f&o=&hp=1,La Fortuna,Costa Rica
