hotel,hotel_url,description,popular_facilities,highres_url,city,country
Dreams Playa Bonita All Inclusive,https://www.booking.com/hotel/pa/intercontinental-playa-bonita-resort-amp-spa.es.html?aid=2410095,"El Dreams Playa Bonita Resort & Spa ofrece 5 piscinas al aire libre, spa con servicio de masajes y centro de fitness. Se encuentra en una zona privada, en la playa más cercana a la ciudad de Panamá, situada a solo 17 km. 

Las habitaciones y suites tienen una decoración fresca, aire acondicionado, utensilios de planchado, escritorio, cafetera, TV por cable, minibar y secador de pelo. El baño es privado y puede incluir ducha o bañera.

Los bares del vestíbulo y de la piscina sirven bebidas variadas.

El Dreams Playa Bonita Resort & Spa se encuentra a 20 minutos en coche del centro de Panamá y está cerca de muchos lugares de interés turístico, como el centro histórico de Panamá.

El establecimiento ofrece un ambiente familiar. Para más información, pueden consultar las condiciones.","Minigolf, Baño privado, Servicio de planchado, Masaje de cabeza, Zona de fumadores, Menú para niños, Cajero automático en el hotel, Servicios de maquillaje, Servicio de despertador, Sauna, Abierta todo el año, Playa, Canguro / servicios para niños, Registro de entrada / salida privado, Hipoalergénico, Instalaciones para deportes acuáticos en el alojamiento, WC con barras de apoyo, Masaje de espalda, TV, Gimnasio, Detectores de humo, Zona de juegos para niños, Inglés, Masaje de cuello, Cámaras de seguridad en las zonas comunitarias, Vino / champán, Habitaciones sin humo, Servicio de habitaciones, Instalaciones de spa, Masaje en pareja, Tarjeta de acceso, Guardaequipaje, Para todas las edades, Club infantil, Restaurante, Equipamiento de juegos para exterior, Cenas temáticas, Prohibido fumar en todo el alojamiento, Muy buen desayuno, Taquillas en el gimnasio / spa, Spa y centro de bienestar, Salas de reuniones / banquetes, Eventos deportivos en directo (emisión), Fruta, Fax / fotocopiadora, Supermercado pequeño en el alojamiento, Caja fuerte para ordenador portátil, Masaje de manos, Lavamanos más bajo, Alquiler de coches, Aire acondicionado, Tours a pie, Masajes, Ducha, Menús para dietas especiales (bajo petición), Clases de cocina, Español, Buffet para niños, Adaptado personas de movilidad reducida, Zona privada de playa, Plancha para pantalones, Servicio de lavandería, Senderismo, Traslado aeropuerto, Ping pong, Servicio de limpieza diario, Jardín, Alarma de seguridad, Clases de yoga, Habitaciones insonorizadas, Piscina infantil, Ropa de cama, Manicura, Terraza, TV de pantalla plana, WiFi gratis, Vistas, Pediluvio, Mobiliario exterior, Canales por cable, Corte de pelo, Masaje de pies, Zona de juegos interior, Servicio de limpieza en seco, Extintores, Zona poco profunda, Clases de fitness, Piscina con vistas, Karaoke, Parking adaptado para personas de movilidad reducida, Juegos de mesa / puzles, Teléfono, Seguridad 24 horas, Peluquería / salón de belleza, Bar, Recepción 24 horas, Paquetes de spa / bienestar, Zona de spa / relajación, Discoteca / DJ, Toallas de playa/piscina, Baño de vapor, Situado frente a la playa, Suelo de baldosa / mármol, Caja fuerte, Adaptado para sillas de ruedas, Piragüismo, Billar, Bañera o ducha, Tratamientos faciales, Exfoliación corporal, Papel higiénico, Música / espectáculos en directo, Masaje corporal completo, Bañera de hidromasaje / jacuzzi, Servicio de conserjería, Tratamientos capilares, Entretenimiento nocturno, Cafetería en el alojamiento, Toallas, Desayuno en la habitación, Información turística, Acceso a pisos superiores solo mediante escaleras, Noches de cine, 7 restaurantes, Tumbonas/sillas de playa, Cámaras de seguridad fuera del alojamiento, Adecuada para niños, Servicio de traslado, Apoyo visual: braille, Bingo, Snack-bar, Ascensor, Peinado, Centro de negocios, Personal de animación, Pedicura, Piscina climatizada, WC elevado, Vistas al mar, 3 piscinas, Servicios de belleza, Tratamientos corporales, Armario, Bar en la piscina, Envoltura corporal, Piscina infinita, Happy hour, Tiro con arco, WC, Aeróbic",https://cf.bstatic.com/xdata/images/hotel/max1024x768/242216676.jpg?k=ac7dc7ad0fea4b6e51f5adae84b399fc4a125c1efbb9d200938a0bb09de17978&o=&hp=1,Las Juntas,Panamá
B&D Lodgings,https://www.booking.com/hotel/pa/draj.es.html?aid=2410095,"B&D Lodgings se encuentra en Tocumen, a 19 km de Estadio Rommel Fernández, y ofrece alojamiento con piscina al aire libre, parking privado gratis, jardín y terraza. El alojamiento ofrece bar y se encuentra a 26 km de Estadio Nacional Rod Carew. El alojamiento dispone de cocina compartida y wifi gratis en todo el alojamiento.

En el albergue, cada habitación está equipada con armario. En B&D Lodgings, todas las habitaciones incluyen aire acondicionado y baño privado.

Ancon Hill está a 33 km del alojamiento, y Puente de Las Americas está a 34 km. El aeropuerto (Aeropuerto internacional de Tocumen) está a 5 km, y el alojamiento ofrece servicio de traslado de pago para ir o volver del aeropuerto.","Baño privado, WiFi gratis, Cámaras de seguridad fuera del alojamiento, Servicio de traslado, Toallas / sábanas (por un suplemento), Zona de estar, Parking en un garaje, Barbacoa, Karaoke, Enchufe cerca de la cama, Piscina al aire libre, Perchero, Seguridad 24 horas, Abierta todo el año, Bar, Baños públicos, Aire acondicionado, Habitaciones familiares, Vestidor, Sofá, Entrada privada, Parking gratis, Terraza / solárium, Español, Suelo de baldosa / mármol, Plancha para pantalones, Inglés, Sofá cama, Traslado aeropuerto, Cámaras de seguridad en las zonas comunitarias, Utensilios de planchado, Armario, Jardín, Habitaciones insonorizadas, Piscina infantil, Ropa de cama, Para todas las edades, Terraza, Cocina compartida",https://cf.bstatic.com/xdata/images/hotel/max1024x768/184178428.jpg?k=f17037e6882be813debafb57c0d2fd23c85c9e5baa42b5057583e4402020d844&o=&hp=1,Las Juntas,Panamá
Decapolis Hotel Panama City,https://www.booking.com/hotel/pa/radisson-decapolis-panama-city.es.html?aid=2410095,"Este hotel elegante está ubicado en la ciudad de Panamá y tiene gimnasio y piscina climatizada al aire libre. Ofrece habitaciones con conexión WiFi gratuita y vistas a la ciudad o al mar.

El Decapolis Hotel Panama City presenta un diseño moderno y elegante que incluye obras de arte panameño originales. Todas las habitaciones son elegantes y disponen de aire acondicionado, TV de pantalla plana por cable, cafetera y minibar.
El Decapolis Hotel Panama se encuentra junto al centro comercial Multicentro y el casino Majestic, a solo 400 metros de la bahía de Panamá. Hay aparcamiento privado gratuito.

Las habitaciones con vistas al mar y a la ciudad están sujetas a disponibilidad.","Baño privado, Servicio de planchado, Zona TV / salón de uso compartido, Detector de monóxido de carbono, Insonorización, Habitaciones comunicadas disponibles, Masaje de cabeza, Zona de fumadores, Proporciona factura, Cajero automático en el hotel, Servicio de despertador, Cafetera, Sauna, Abierta todo el año, Hipoalergénico, Entrada privada, Plancha para ropa, WC con barras de apoyo, Masaje de espalda, TV, Gimnasio, Detectores de humo, Inglés, Masaje de cuello, Cámaras de seguridad en las zonas comunitarias, Habitaciones sin humo, Bañera, Vino / champán, Servicio de habitaciones, Instalaciones de spa, Almuerzos para llevar, Masaje en pareja, Tarjeta de acceso, Guardaequipaje, Nevera, Acceso a pisos superiores en ascensor, Para todas las edades, Restaurante, Servicio de aparcacoches, Prohibido fumar en todo el alojamiento, Horario de apertura, Spa y centro de bienestar, Salas de reuniones / banquetes, Eventos deportivos en directo (emisión), Fruta, Fax / fotocopiadora, Caja fuerte para ordenador portátil, Masaje de manos, Secador de pelo, Aire acondicionado, Entrenador personal, Masajes, Ducha, Menús para dietas especiales (bajo petición), Parking gratis, Terraza / solárium, Español, Adaptado personas de movilidad reducida, Plancha para pantalones, Servicio de lavandería, Utensilios de planchado, Servicio de limpieza diario, Alarma de seguridad, Habitaciones insonorizadas, Ropa de cama, Terraza, TV de pantalla plana, WiFi gratis, Mobiliario exterior, Masaje de pies, Escritorio, Extintores, Parking en un garaje, Zona poco profunda, Piscina con vistas, Karaoke, Enchufe cerca de la cama, Parking adaptado para personas de movilidad reducida, Buen desayuno, Piscina al aire libre, Teléfono, Tetera / cafetera, Seguridad 24 horas, Bar, Recepción 24 horas, Paquetes de spa / bienestar, Zona de spa / relajación, Baños públicos, Habitaciones familiares, Toallas de playa/piscina, Baño de vapor, 3 restaurantes, Suelo de baldosa / mármol, Caja fuerte, Bañera o ducha, Papel higiénico, Música / espectáculos en directo, Masaje corporal completo, Bañera de hidromasaje / jacuzzi, Valla alrededor de la piscina, Servicio de conserjería, Cafetería en el alojamiento, Toallas, Desayuno en la habitación, Información turística, Piscina pequeña, Tumbonas/sillas de playa, Casino, Tetera/cafetera en todas las habitaciones, Cambio de moneda, Artículos de aseo gratis, Snack-bar, Perchero, Ascensor, WC elevado, Habitaciones hipoalergénicas, Armario, Bar en la piscina, Happy hour, WC",https://cf.bstatic.com/xdata/images/hotel/max1024x768/232824462.jpg?k=5df1a6d08a70295be11271261457752dd1074b08261a364fcd266347468f8d5d&o=&hp=1,Las Juntas,Panamá
Pacific Coast Hotel,https://www.booking.com/hotel/pa/pacific-coast-playa-veracruz.es.html?aid=2410095,"Pacific Coast Hotel tiene piscina al aire libre, centro de fitness, jardín y restaurante en Playa Bonita Village. Este hotel de 3 estrellas ofrece bar y habitaciones con aire acondicionado, wifi gratis y baño privado. Playa de Veracruz está a 9 min a pie del hotel y Playa Venao, a 2 km.

Todas las habitaciones de este alojamiento están equipadas con TV de pantalla plana con canales vía satélite. En el hotel, las habitaciones tienen ropa de cama y toallas.

El personal de recepción habla tanto inglés como español y está dispuesto a ayudar en cualquier momento.

Puente de Las Americas está a 13 km del alojamiento, y Ancon Hill está a 20 km. El aeropuerto (Aeropuerto internacional de Panamá Pacífico) está a 3 km.","Restaurante, Baño privado, WiFi gratis, Tumbonas/sillas de playa, Horario de apertura, Canales vía satélite, Zona poco profunda, Desayuno, Piscina al aire libre, Abierta todo el año, Recepción 24 horas, Bar, Aire acondicionado, Habitaciones familiares, Ducha, Español, Gimnasio, Inglés, Bañera o ducha, Habitaciones sin humo, Papel higiénico, Sombrillas, Jardín, Toallas, Ropa de cama, Para todas las edades, WC, TV de pantalla plana",https://cf.bstatic.com/xdata/images/hotel/max1024x768/437362653.jpg?k=b805e631b0954817e6e82a8b01250cec3e5e04cb5968314edea1d4c84e9fc8c3&o=&hp=1,Las Juntas,Panamá
Riu Plaza Panamá,https://www.booking.com/hotel/pa/riu-plaza-panama.es.html?aid=2410095,"El Riu Plaza Panama está ubicado en el distrito financiero y ofrece habitaciones elegantes con WiFi gratuita. Tiene piscina al aire libre con bañera de hidromasaje. Se halla a solo 300 metros del santuario nacional del Corazón de María.

Las habitaciones son amplias, presentan una decoración floral colorida y disponen de zona de estar y TV de pantalla plana con canales por cable. Se ofrece café gratuito a la llegada. Algunas habitaciones tienen vistas a la ciudad.

El hotel alberga el Sushi Lounge, el restaurante Arts, el Capital Take Away, el Studio 50 y el Ibiza Lounge, donde se puede tomar una copa junto a la piscina.

El Riu Plaza tiene gimnasio y sala de conferencias.

El parque nacional Metropolitano queda a 3 km.","Servicio de planchado, Insonorización, Vistas a la ciudad, Zona de fumadores, Menú para niños, Toallas / sábanas (por un suplemento), Proporciona factura, Servicio de despertador, Cafetera, Abierta todo el año, Hipoalergénico, Plancha para ropa, Suelo de moqueta, TV, Gimnasio, Detectores de humo, Registro de entrada y salida exprés, Inglés, Habitaciones sin humo, Bañera, Servicio de habitaciones, Vino / champán, Almuerzos para llevar, Tarjeta de acceso, Guardaequipaje, Nevera, Para todas las edades, Restaurante, Servicio de aparcacoches, Prohibido fumar en todo el alojamiento, Salas de reuniones / banquetes, Fruta, Fax / fotocopiadora, 6 restaurantes, Secador de pelo, Alquiler de coches, Aire acondicionado, Sofá, Terraza / solárium, Español, Adaptado personas de movilidad reducida, Plancha para pantalones, Servicio de lavandería, Servicio de limpieza diario, Jardín, Ropa de cama, Terraza, TV de pantalla plana, WiFi gratis, Mobiliario exterior, Canales por cable, Escritorio, Servicio de limpieza en seco, Extintores, Parking en un garaje, Zona poco profunda, Parking adaptado para personas de movilidad reducida, Enchufe cerca de la cama, Piscina al aire libre, Teléfono, Seguridad 24 horas, Bar, Recepción 24 horas, Solárium, Habitaciones familiares, Toallas de playa/piscina, Caja fuerte, Sombrillas, Papel higiénico, Desayuno fantástico, Reloj despertador, Servicio de conserjería, Entretenimiento nocturno, Cafetería en el alojamiento, Toallas, Desayuno en la habitación, Información turística, Tumbonas/sillas de playa, Canales vía satélite, Artículos de aseo gratis, Snack-bar, Perchero, Ascensor, Centro de negocios, Servicio de despertador / alarma, Armario, Bar en la piscina, Parking privado, Happy hour, WC",https://cf.bstatic.com/xdata/images/hotel/max1024x768/306373203.jpg?k=45c6adfc2fe537075a0c031dadd435ff609cbbebd5451ec1a0fda79e3d00adf0&o=&hp=1,Las Juntas,Panamá
Cresta Inn,https://www.booking.com/hotel/pa/cresta-inn.es.html?aid=2410095,"Este hotel está situado en el exclusivo barrio de La Cresta de Panamá, junto a la avenida Vía España. Ofrece piscina exterior, bañera de hidromasaje y habitaciones con aire acondicionado, WiFi gratuita y balcón privado.

Las habitaciones del Cresta Inn cuentan con TV de pantalla plana por cable y caja fuerte. El baño privado está equipado con albornoz y secador de pelo. 

El restaurante propone especialidades internacionales. También hay un bar y un bar junto a la piscina.

El personal de la recepción 24 horas ofrece servicio de venta de entradas para visitas guiadas, espectáculos en directo y actividades al aire libre. También se ofrece un servicio de enlace con el aeropuerto bajo petición y por un suplemento. El aeropuerto de Tocumen está a menos de 20 minutos en coche.","Restaurante, Baño privado, Servicio de planchado, Prohibido fumar en todo el alojamiento, WiFi gratis, Tumbonas/sillas de playa, Canales por cable, Zona de fumadores, Fax / fotocopiadora, Escritorio, Extintores, Parking en un garaje, Cambio de moneda, Buen desayuno, Servicio de despertador, Piscina al aire libre, Artículos de aseo gratis, Snack-bar, Teléfono, Abierta todo el año, Secador de pelo, Ascensor, Bar, Recepción 24 horas, Aire acondicionado, Alquiler de coches, Registro de entrada / salida privado, Habitaciones familiares, Ducha, Centro de negocios, Plancha para ropa, Toallas de playa/piscina, Parking gratis, Español, Gimnasio, Caja fuerte, Inglés, Servicio de lavandería, Habitaciones sin humo, Servicio de limpieza diario, Servicio de habitaciones, Armario, Desayuno en la habitación, Guardaequipaje, Información turística, WC, Terraza, TV de pantalla plana",https://cf.bstatic.com/xdata/images/hotel/max1024x768/324934234.jpg?k=65848185abd89f3065df17b55d4e04c11b767fe5ea3b9d6effd0a1de3631119d&o=&hp=1,Las Juntas,Panamá
Hotel Montreal,https://www.booking.com/hotel/pa/montreal.es.html?aid=2410095,"El Hotel Montreal está situado en el corazón de la ciudad de Panamá y dispone de una piscina pequeña en la azotea. Ofrece alojamientos con aire acondicionado y WiFi gratuita, así como aparcamiento gratuito. Hay recepción 24 horas.

Las habitaciones del Hotel Montreal tienen suelo de baldosa y una decoración sencilla. Todas incluyen TV por cable y baño privado con bañera o ducha. Hay servicio de habitaciones disponible.

El hotel se encuentra en la zona comercial de la ciudad, con numerosos bares, restaurantes y tiendas en los alrededores. El restaurante del Hotel Montreal sirve cocina típica panameña e internacional.

El centro histórico de Panamá, conocido como Casco Viejo, se halla a 15 minutos en coche. Por un suplemento, se puede reservar servicio de traslado al aeropuerto, centros comerciales y destinos turísticos.","Restaurante, Baño privado, Servicio de planchado, Prohibido fumar en todo el alojamiento, WiFi gratis, Vistas a la ciudad, Canales por cable, Zona de fumadores, Fax / fotocopiadora, Servicio de limpieza en seco, Servicio de despertador, Snack-bar, Teléfono, Ascensor, Bar, Recepción 24 horas, Aire acondicionado, Registro de entrada / salida privado, Habitaciones familiares, Sofá, Parking gratis, Terraza / solárium, Español, Suelo de baldosa / mármol, Habitaciones hipoalergénicas, Caja fuerte, Registro de entrada y salida exprés, Servicio de lavandería, Inglés, Habitaciones sin humo, Servicio de limpieza diario, Servicio de habitaciones, Armario, Servicio de conserjería, Almuerzos para llevar, Desayuno en la habitación, Guardaequipaje, Información turística, WC, Terraza, TV de pantalla plana",https://cf.bstatic.com/xdata/images/hotel/max1024x768/21579724.jpg?k=ff67c0c3364eaca8505b840b802ec8ee6f31e6b7141bdafd21b64efcb6c13dc3&o=&hp=1,Las Juntas,Panamá
Plaza Paitilla Inn,https://www.booking.com/hotel/pa/plaza-paitilla-inn.es.html?aid=2410095,"El Plaza Paitilla Inn ofrece vistas panorámicas de la bahía de Panamá y cuenta con un lounge bar, piscina al aire libre y terrazas solárium. La propiedad también cuenta con un centro de negocios equipado y un gimnasio.

Las habitaciones cuentan con minibar y TV de pantalla plana por cable. En el caso de las habitaciones Ejecutivas, se encuentran ubicadas en los pisos superiores y ofrecen vistas panorámicas de la ciudad y la bahía. Todos los baños cuentan con secador de pelo y artículos de aseo.

El restaurante del Plaza Paitilla Inn está especializado en platos internacionales. Hay servicio de habitaciones disponible.

Hay un centro comercial a solo 6 minutos en coche del Plaza Paitilla y el centro comercial Albrook Mall está a 15 minutos en coche. El casco antiguo de Panamá está a 10 km y el Museo del Canal de Panamá, a 7 km. El establecimiento cuenta con 2 mostradores de información turística para ayudar a los huéspedes a organizar excursiones.

El aeropuerto internacional Marcos A. Gelabert se encuentra a 10 minutos en coche del Plaza Paitilla Inn.","Baño privado, Servicio de planchado, Zona TV / salón de uso compartido, Zona de fumadores, Menú para niños, Proporciona factura, Abierta todo el año, TV, Gimnasio, Detectores de humo, Inglés, Cámaras de seguridad en las zonas comunitarias, Habitaciones sin humo, Vino / champán, Servicio de habitaciones, Tarjeta de acceso, Guardaequipaje, Para todas las edades, Restaurante, Servicio de aparcacoches, Prohibido fumar en todo el alojamiento, Muy buen desayuno, Horario de apertura, Spa y centro de bienestar, Salas de reuniones / banquetes, Fruta, Fax / fotocopiadora, Zona de estar, Caja fuerte para ordenador portátil, Secador de pelo, Aire acondicionado, Ducha, Parking gratis, Terraza / solárium, Español, Adaptado personas de movilidad reducida, Mesa de comedor, Servicio de lavandería, Servicio de limpieza diario, Alarma de seguridad, Habitaciones insonorizadas, Piscina infantil, Terraza, TV de pantalla plana, WiFi gratis, Mobiliario exterior, Canales por cable, Productos de limpieza, Escritorio, Servicio de limpieza en seco, Extintores, Zona poco profunda, Piscina con vistas, Karaoke, Enchufe cerca de la cama, Parking adaptado para personas de movilidad reducida, Teléfono, Seguridad 24 horas, Peluquería / salón de belleza, Bar, Recepción 24 horas, Baños públicos, Toallas de playa/piscina, Suelo de baldosa / mármol, Caja fuerte, Billar, Bañera o ducha, Sombrillas, Papel higiénico, Reloj despertador, Toallas, Piscina pequeña, 2 piscinas, Tumbonas/sillas de playa, Parking en la calle, Cámaras de seguridad fuera del alojamiento, Adecuada para niños, Artículos de aseo gratis, Perchero, Ascensor, Servicio de despertador / alarma, Armario, Happy hour, Zona de comedor, WC",https://cf.bstatic.com/xdata/images/hotel/max1024x768/146638586.jpg?k=817be757b6c1930793399f62730d274222b664add8284958d574584a3a28ed83&o=&hp=1,Las Juntas,Panamá
Hotel Ojos Del Rio,https://www.booking.com/hotel/pa/ojos-del-rio.es.html?aid=2410095,"El Hotel Ojos Del Rio está a solo 2,6 km del parque nacional Metropolitano, en Ciudad de Panamá. Este establecimiento ofrece un centro de fitness y un salón compartido. Dispone de conexión WiFi gratuita.

Algunas de las habitaciones del hotel disponen de balcón, mesa de comedor y TV de pantalla plana con canales de pago. El baño privado cuenta con bañera o ducha y secador de pelo. También hay caja fuerte y aire acondicionado.

El Hotel Ojos Del Rio ofrece recepción 24 horas, terraza, salas para banquetes, consigna de equipaje, servicio de lavandería y aparcamiento gratuito.

El hotel está a 2,1 km del Museo del Canal de Panamá y a 2,2 km del palacio presidencial.","Restaurante, Baño privado, Servicio de entrega de comestibles, Zona TV / salón de uso compartido, Prohibido fumar en todo el alojamiento, WiFi gratis, Acceso a pisos superiores en ascensor, Canales por cable, Salas de reuniones / banquetes, Fruta, Menú para niños, Fax / fotocopiadora, Servicio de traslado, Toallas / sábanas (por un suplemento), Parking en un garaje, Karaoke, Enchufe cerca de la cama, Parking adaptado para personas de movilidad reducida, Buen desayuno, Snack-bar, Teléfono, Secador de pelo, Ascensor, Bar, Recepción 24 horas, Aire acondicionado, Lavamanos más bajo, Baños públicos, Habitaciones familiares, Ducha, Vestidor, Centro de negocios, Menús para dietas especiales (bajo petición), Entrada privada, Plancha para ropa, Parking gratis, Español, TV, Gimnasio, Buffet para niños, Caja fuerte, Suelo de baldosa / mármol, Plancha para pantalones, Adaptado personas de movilidad reducida, Adaptado para sillas de ruedas, Inglés, Máquina expendedora (aperitivos), Bañera o ducha, Traslado aeropuerto, Utensilios de planchado, Habitaciones sin humo, Papel higiénico, Servicio de habitaciones, Vino / champán, Servicio de limpieza diario, Máquina expendedora (bebidas), Armario, Jardín, Servicio de conserjería, Almuerzos para llevar, Cafetería en el alojamiento, Toallas, Desayuno en la habitación, Minibar, Ropa de cama, Guardaequipaje, Terraza, TV de pantalla plana, Acceso a pisos superiores solo mediante escaleras",https://cf.bstatic.com/xdata/images/hotel/max1024x768/175285860.jpg?k=43b982e3f70cb001122e1a7a663034ac442674ef0664e6d19baed29fffffc8a9&o=&hp=1,Las Juntas,Panamá
Express Inn PTY Aeropuerto Internacional Panama,https://www.booking.com/hotel/pa/express-inn-pty-aeropuerto-internacional-panama.es.html?aid=2410095,"This simple hotel is located right next to the Tocumen International Airport and offers its guests a small outdoor pool, shuttle service from the Hotel to the Airport. Free WiFi is provided in all areas of the hotel.

The comfortable rooms at the Express Inn PTY Aeropuerto Internacional Panamá are equipped and have a private bathroom with a shower and toilet.

Airport shuttle services are free at scheduled times and there is also free on-site parking.

The popular Metromall shopping center is a 10-minute drive away. Downtown Panama City is less than 30 minutes away by car.","Baño privado, Servicio de entrega de comestibles, Prohibido fumar en todo el alojamiento, WiFi gratis, Tumbonas/sillas de playa, Cámaras de seguridad fuera del alojamiento, Mobiliario exterior, Zona de fumadores, Fax / fotocopiadora, Proporciona factura, Extintores, Parking en un garaje, Parking adaptado para personas de movilidad reducida, Piscina al aire libre, Artículos de aseo gratis, Abierta todo el año, Seguridad 24 horas, Recepción 24 horas, Traslado aeropuerto (gratis), Aire acondicionado, Habitaciones familiares, Ducha, Parking gratis, Español, Detectores de humo, Inglés, Traslado aeropuerto, Cámaras de seguridad en las zonas comunitarias, Habitaciones sin humo, Sombrillas, Alarma de seguridad, Tour o clase sobre cultura local, Almuerzos para llevar, Habitaciones insonorizadas, Guardaequipaje, Información turística, Piscina pequeña, Para todas las edades, WC, Terraza",https://cf.bstatic.com/xdata/images/hotel/max1024x768/505093306.jpg?k=9975f50f3e4f92d35f8ade0c9848b1deb91063fbb4a64aea2ee489cc55241927&o=&hp=1,Las Juntas,Panamá
