hotel,hotel_url,description,popular_facilities,highres_url,city,country
MARINN PLACE Financial District,https://www.booking.com/hotel/pa/hyatt-place-panama-city-downtonw.es.html?aid=2410095,"El MARINN PLACE Financial District se encuentra en la Ciudad de Panamá, en Panamá, y ofrece una piscina al aire libre y un restaurante. Se proporciona WiFi gratuita.

Las habitaciones disponen de aire acondicionado. El baño privado incluye ducha y artículos de aseo gratuitos. También tienen sofá, escritorio con silla y utensilios de planchado.

El Marinn Place Panama City Downtown alberga un centro de fitness. Se facilita aparcamiento gratuito.

El hotel se encuentra a 2,4 km del parque natural metropolitano, a 3,1 km del Museo del Canal de Panamá y a 3,2 km del Palacio Presidencial.","Restaurante, Servicio de aparcacoches, Servicio de planchado, Servicio de entrega de comestibles, Prohibido fumar en todo el alojamiento, WiFi gratis, Tumbonas/sillas de playa, Apoyo visual: carteles táctiles, Cámaras de seguridad fuera del alojamiento, Salas de reuniones / banquetes, Zona de fumadores, Fruta, Menú para niños, Fax / fotocopiadora, Servicio de traslado, Servicio de limpieza en seco, Supermercado pequeño en el alojamiento, Proporciona factura, Extintores, Parking en un garaje, Apoyo visual: braille, Español, Zona poco profunda, Piscina con vistas, Buen desayuno, Piscina al aire libre, Snack-bar, Abierta todo el año, Seguridad 24 horas, Ascensor, Bar, Recepción 24 horas, Aire acondicionado, Lavamanos más bajo, Habitaciones familiares, Centro de negocios, Menús para dietas especiales (bajo petición), Toallas de playa/piscina, Parking gratis, Terraza / solárium, WC con barras de apoyo, WC elevado, 3 restaurantes, Gimnasio, Habitaciones hipoalergénicas, Detectores de humo, Caja fuerte, Plancha para pantalones, Adaptado personas de movilidad reducida, Servicio de lavandería, Adaptado para sillas de ruedas, Inglés, Cámaras de seguridad en las zonas comunitarias, Vino / champán, Habitaciones sin humo, Servicio de habitaciones, Servicio de limpieza diario, Sombrillas, Valla alrededor de la piscina, Alarma de seguridad, Llave de acceso, Tour o clase sobre cultura local, Almuerzos para llevar, Happy hour, Cafetería en el alojamiento, Desayuno en la habitación, Guardaequipaje, Información turística, Tarjeta de acceso, Terraza",https://cf.bstatic.com/xdata/images/hotel/max1024x768/524644747.jpg?k=9a5129305bb650c97f99595d6d8995d17dff5a63e58a95c6fae91e1024dfd64c&o=&hp=1,Las Juntas,Panamá
Hotel Milan Panama,https://www.booking.com/hotel/pa/milan-panama.es.html?aid=2410095,"El Hotel Milan Panama, situado a 2 km del Parque natural metropolitano, alberga un restaurante y un bar y ofrece WiFi gratis. El aparcamiento privado es gratuito.

Algunas habitaciones tienen baño privado con bañera de hidromasaje, mientras que otras incluyen secador de pelo y artículos de aseo gratuitos. Algunos alojamientos disponen de zona de estar. Todos están equipados con TV de pantalla plana.

Además, la recepción abre 24 horas.

El Museo del Canal de Panamá está a 3,6 km del Hotel Milan Panamá, mientras que el Palacio Presidencial se halla a 3,7 km.","Restaurante, Baño privado, WiFi gratis, Tendedero, Vistas a la ciudad, Canales por cable, Escritorio, Zona de estar, Enchufe cerca de la cama, Servicio de despertador, Buen desayuno, Francés, Artículos de aseo gratis, Teléfono, Perchero, Secador de pelo, Bar, Recepción 24 horas, Aire acondicionado, Habitaciones familiares, Ducha, Sofá, Parking gratis, Español, TV, Suelo de baldosa / mármol, Caja fuerte, Inglés, Servicio de lavandería, Bañera o ducha, Habitaciones sin humo, Papel higiénico, Servicio de habitaciones, Armario, Toallas, Guardaequipaje, Ropa de cama, WC, Portugués, TV de pantalla plana",https://cf.bstatic.com/xdata/images/hotel/max1024x768/48249000.jpg?k=77fe02b2e326d3b71962062d29470d3c16b818b20e57d70613215240ab7ef3ae&o=&hp=1,Las Juntas,Panamá
Tryp by Wyndham Panama Centro,https://www.booking.com/hotel/pa/tryp-panama-centro.es.html?aid=2410095,"El Tryp by Wyndham Panama Centro se encuentra a 1 km del centro de la ciudad de Panamá y a 10 minutos en coche del aeropuerto internacional de Panamá. Cuenta con piscina exterior, centro de fitness y azotea con vistas a la ciudad.

Las habitaciones disponen de aire acondicionado, WiFi gratis, escritorio, utensilios de planchado, TV por cable de pantalla plana, cafetera, mininevera y baño con secador de pelo, ducha y artículos de aseo gratuitos. Todas las habitaciones ofrecen vistas a la ciudad.

El restaurante Gastro Bar at 5-0-7 ofrece un ambiente animado con sabor mediterráneo.

Los centros comerciales Multiplaza y Albrook Mall se hallan a 10 minutos en coche del hotel.

El canal de Panamá está a 12 km del hotel y la bahía de Panamá, a 10 minutos en coche. El hotel está muy bien situado a 250 metros de la estación de metro de El Carmen.","Baño privado, Servicio de planchado, Vistas a la ciudad, Zona de fumadores, Menú para niños, Proporciona factura, Cafetera, Abierta todo el año, Plancha para ropa, WC con barras de apoyo, TV, Gimnasio, Detectores de humo, Inglés, Cámaras de seguridad en las zonas comunitarias, Habitaciones sin humo, Vino / champán, Máquina expendedora (bebidas), Servicio de habitaciones, Suelo de madera o parquet, Tarjeta de acceso, Acceso a pisos superiores en ascensor, Para todas las edades, Restaurante, Prohibido fumar en todo el alojamiento, Horario de apertura, Spa y centro de bienestar, Salas de reuniones / banquetes, Fruta, Fax / fotocopiadora, Supermercado pequeño en el alojamiento, Caja fuerte para ordenador portátil, Secador de pelo, Lavamanos más bajo, Alquiler de coches, Aire acondicionado, Ducha, Menús para dietas especiales (bajo petición), Parking gratis, Español, Buffet para niños, Adaptado personas de movilidad reducida, Piscina en la azotea, Servicio de lavandería, Máquina expendedora (aperitivos), Servicio de limpieza diario, Alarma de seguridad, Habitaciones insonorizadas, Terraza, TV de pantalla plana, Servicio de streaming (como Netflix), WiFi gratis, Vistas, Mobiliario exterior, Canales por cable, Escritorio, Servicio de limpieza en seco, Extintores, Parking en un garaje, Parking adaptado para personas de movilidad reducida, Enchufe cerca de la cama, Buen desayuno, Piscina al aire libre, Teléfono, Tetera / cafetera, Seguridad 24 horas, Bar, Recepción 24 horas, Habitaciones familiares, Caja fuerte, Adaptado para sillas de ruedas, Bañera o ducha, Toda la unidad accesible en silla de ruedas, Papel higiénico, Reloj despertador, Toallas, Tumbonas/sillas de playa, Cámaras de seguridad fuera del alojamiento, Tetera/cafetera en todas las habitaciones, Servicio de traslado, Ascensor, Centro de negocios, WC elevado, Habitaciones hipoalergénicas, Servicio de despertador / alarma, Armario, Happy hour, WC",https://cf.bstatic.com/xdata/images/hotel/max1024x768/186138911.jpg?k=c6bad16d9ddbf9698a07b518cfca1161e2df31fe062477474fb9f43cca25555a&o=&hp=1,Las Juntas,Panamá
Discovery,https://www.booking.com/hotel/pa/discovery.es.html?aid=2410095,"El moderno hotel Discovery está situado en el centro de la ciudad de Panamá.  Hay conexión Wi-Fi gratuita en todo el establecimiento y aparcamiento cubierto gratuito con seguridad las 24 horas.

Habitación con 1 cama extragrande o 2 camas dobles. Todas tienen teléfono, aire acondicionado y TV por cable. El baño es privado e incluye bañera o ducha.

El hotel sirve desayunos y alberga una cafetería. La recepción está abierta las 24 horas y ofrece servicio de cambio de divisa. Los registros de entrada y salida privados también están disponibles.","Baño privado, Zona TV / salón de uso compartido, Prohibido fumar en todo el alojamiento, WiFi gratis, Cámaras de seguridad fuera del alojamiento, Mobiliario exterior, Canales por cable, Zona de fumadores, Toallas / sábanas (por un suplemento), Proporciona factura, Extintores, Parking en un garaje, Parking adaptado para personas de movilidad reducida, Desayuno, Aseo adicional, Enchufe cerca de la cama, Cambio de moneda, Artículos de aseo gratis, Snack-bar, Teléfono, Seguridad 24 horas, Ascensor, Bar, Recepción 24 horas, Aire acondicionado, Baños públicos, Registro de entrada / salida privado, Habitaciones familiares, Parking gratis, Español, Adaptado personas de movilidad reducida, TV, Detectores de humo, Inglés, Bañera o ducha, Cámaras de seguridad en las zonas comunitarias, Toda la unidad accesible en silla de ruedas, Habitaciones sin humo, Papel higiénico, Servicio de habitaciones, Servicio de limpieza diario, Máquina expendedora (bebidas), Alarma de seguridad, Toallas, Información turística, Zona de comedor, TV de pantalla plana, Acceso a pisos superiores solo mediante escaleras",https://cf.bstatic.com/xdata/images/hotel/max1024x768/97272537.jpg?k=916e137e2ffce37b6447d501ce21caf418be80f08fc6001bd4ac352e36110729&o=&hp=1,Las Juntas,Panamá
Studio Coliving Hotel,https://www.booking.com/hotel/pa/studio-coliving.es.html?aid=2410095,"Studio Coliving Hotel dispone de piscina al aire libre, centro de fitness, salón de uso común y terraza en Panamá. Este alojamiento ofrece restaurante, cocina compartida y recepción 24 horas, además de wifi gratis en todo el alojamiento. Hay bañera de hidromasaje y vistas a la ciudad.

El hotel ofrece habitaciones con aire acondicionado, escritorio, caja fuerte, TV de pantalla plana y baño privado con ducha. En Studio Coliving Hotel, cada habitación incluye ropa de cama y toallas.

Hay opciones a la carta o americanas de desayuno disponibles todos los días en el alojamiento.

Puente de Las Americas está a 7,2 km del alojamiento, y Ancon Hill está a 7,6 km. El aeropuerto más cercano (Aeropuerto internacional de Albrook Marcos A. Gelabert) está a 8 km del alojamiento.","Baño privado, Zona TV / salón de uso compartido, Servicio de entrega de comestibles, Detector de monóxido de carbono, Vistas a la ciudad, Zona de fumadores, Menú para niños, Proporciona factura, Zona de comedor exterior, Abierta todo el año, Plancha para ropa, WC con barras de apoyo, TV, Gimnasio, Detectores de humo, Inglés, Cámaras de seguridad en las zonas comunitarias, Habitaciones sin humo, Máquina expendedora (bebidas), Almuerzos para llevar, Tarjeta de acceso, Guardaequipaje, Nevera, Acceso a pisos superiores en ascensor, Accesible para personas sordas, Solo para adultos, Restaurante, Prohibido fumar en todo el alojamiento, Horario de apertura, Salas de reuniones / banquetes, Fruta, Supermercado pequeño en el alojamiento, Caja fuerte para ordenador portátil, Secador de pelo, Alquiler de coches, Aire acondicionado, Ducha, Parking gratis, Terraza / solárium, Español, Adaptado personas de movilidad reducida, Piscina en la azotea, Máquina expendedora (aperitivos), Utensilios de planchado, Alarma de seguridad, Ropa de cama, Terraza, TV de pantalla plana, WiFi gratis, Vistas, Mobiliario exterior, Escritorio, Extintores, Zona poco profunda, Parking adaptado para personas de movilidad reducida, Desayuno, Enchufe cerca de la cama, Piscina al aire libre, Teléfono, Seguridad 24 horas, Peluquería / salón de belleza, Recepción 24 horas, Baños públicos, Solárium, Habitaciones familiares, Suelo de baldosa / mármol, Caja fuerte, Adaptado para sillas de ruedas, Toda la unidad accesible en silla de ruedas, Sombrillas, Papel higiénico, Bañera de hidromasaje / jacuzzi, Reloj despertador, Cafetería en el alojamiento, Toallas, Información turística, Tumbonas/sillas de playa, Cámaras de seguridad fuera del alojamiento, Canales vía satélite, Servicio de traslado, Artículos de aseo gratis, Ascensor, WC elevado, Habitaciones hipoalergénicas, Armario, Minibar, WC, Cocina compartida",https://cf.bstatic.com/xdata/images/hotel/max1024x768/504329959.jpg?k=f973e083d2c2ddb2193396fb457b4fa72373c4574fd2b6ff829ac2f07aeb4c8b&o=&hp=1,Las Juntas,Panamá
Hotel Principe,https://www.booking.com/hotel/pa/principe.es.html?aid=2410095,"El Hotel Principe se encuentra en la ciudad de Panamá, a solo 10 minutos en coche del centro histórico. Ofrece piscina al aire libre y restaurante, así como aparcamiento y conexión Wi-Fi gratuitos.

Las modernas habitaciones del hotel están equipadas con aire acondicionado, TV de pantalla plana, caja fuerte y baño privado con ducha y aseo. El establecimiento también dispone de suites amplias.

El restaurante del hotel sirve cocina japonesa e internacional y está abierto de 11:00 a 22:00. A 1 km del Hotel Principe también se pueden encontrar otras opciones.

El centro comercial Albrook está a unos 15 minutos en coche, mientras que el Canal de Panamá se encuentra a 20 minutos en coche.","Baño privado, Restaurante, Servicio de entrega de comestibles, Detector de monóxido de carbono, Prohibido fumar en todo el alojamiento, Insonorización, WiFi gratis, Vistas a la ciudad, Canales por cable, Salas de reuniones / banquetes, Servicio de traslado, Fax / fotocopiadora, Supermercado pequeño en el alojamiento, Escritorio, Proporciona factura, Extintores, Parking en un garaje, Enchufe cerca de la cama, Servicio de despertador, Piscina al aire libre, Artículos de aseo gratis, Teléfono, Perchero, Secador de pelo, Seguridad 24 horas, Bar, Recepción 24 horas, Aire acondicionado, Alquiler de coches, Ascensor, Abierta todo el año, Ducha, Centro de negocios, Parking gratis, Español, Adaptado personas de movilidad reducida, TV, Suelo de baldosa / mármol, Detectores de humo, Caja fuerte, Registro de entrada y salida exprés, Servicio de lavandería, Inglés, Traslado aeropuerto, Cámaras de seguridad en las zonas comunitarias, Habitaciones sin humo, Papel higiénico, Servicio de habitaciones, Servicio de limpieza diario, Armario, Servicio de conserjería, Alarma de seguridad, Almuerzos para llevar, 2 restaurantes, Cafetería en el alojamiento, Toallas, Guardaequipaje, Información turística, Ropa de cama, Tarjeta de acceso, Habitaciones insonorizadas, WC, Terraza, TV de pantalla plana, Bidet",https://cf.bstatic.com/xdata/images/hotel/max1024x768/24086003.jpg?k=bf42d5f1246002ea514af3a1f9eadb0139feddf09eba11fcd80a48f615425d3f&o=&hp=1,Las Juntas,Panamá
Chelox Panama Airport,https://www.booking.com/hotel/pa/apartamento-cerca-del-aeropuerto.es.html?aid=2410095,"Chelox Panama Airport se encuentra en Cabuya, a 25 km de Estadio Nacional Rod Carew, y ofrece alojamiento con terraza, wifi gratis, servicio de conserjería y mostrador de información turística. El alojamiento, que está a 16 km de Estadio Rommel Fernández, dispone de jardín y parking privado gratis.

Este apartamento con aire acondicionado consta de 1 dormitorio, una sala de estar, una cocina totalmente equipada con nevera y 1 baño con ducha y artículos de aseo gratuitos. Hay toallas y ropa de cama en el apartamento.

Puente de Las Americas está a 34 km del alojamiento, y Ancon Hill está a 34 km. El aeropuerto (Aeropuerto internacional de Tocumen) está a 3 km, y el alojamiento ofrece servicio de traslado de pago para ir o volver del aeropuerto.","Baño privado, Servicio de planchado, Servicio de entrega de comestibles, Prohibido fumar en todo el alojamiento, Cocina, WiFi gratis, Accesible para personas sordas, Tendedero, Vistas a un patio interior, Mobiliario exterior, Utensilios de cocina, Zona de fumadores, Productos de limpieza, Servicio de traslado, Masaje de pies, Lavadora, Servicio de limpieza en seco, Proporciona factura, Tarjetas de transporte público, Horno, Vistas al jardín, Parking adaptado para personas de movilidad reducida, Enchufe cerca de la cama, Ventilador, Artículos de aseo gratis, Perchero, Masaje de manos, Tetera / cafetera, Seguridad 24 horas, Patio, Masajes, Aire acondicionado, Registro de entrada / salida privado, Ducha, Entrada privada, Plancha para ropa, Parking gratis, Terraza / solárium, Masaje de espalda, Español, Adaptado personas de movilidad reducida, TV, Suelo de baldosa / mármol, Habitaciones hipoalergénicas, Mesa de comedor, Apartamento privado en edificio, Secadora de ropa, Plancha para pantalones, Servicio de lavandería, Inglés, Traslado aeropuerto, Masaje de cuello, Utensilios de planchado, Habitaciones sin humo, Papel higiénico, Bañera, Masaje corporal completo, Servicio de limpieza diario, Armario, Toda la unidad en la planta baja, Zona de cocina, Microondas, Ropa de cama, Jardín, Servicio de conserjería, Llave de acceso, Tostadora, Camas extralargas (más de 2 metros), Toallas, Minibar, Guardaequipaje, Nevera, Información turística, Zona de comedor, Terraza, TV de pantalla plana",https://cf.bstatic.com/xdata/images/hotel/max1024x768/497464287.jpg?k=0136db8dd8350c9630f411baaf4b7d5291a87751a054712042cd658b10528787&o=&hp=1,Las Juntas,Panamá
Hotel Caracas,https://www.booking.com/hotel/pa/caracas.es.html?aid=2410095,"Hotel Caracas, que se encuentra a 3,8 km de Puente de Las Americas y a 5,1 km de Ancon Hill, ofrece habitaciones con aire acondicionado y baño privado en Panamá. Este alojamiento ofrece servicio de habitaciones y recepción 24 horas, además de wifi gratis en todo el alojamiento. Este alojamiento libre de humo está a 12 km de Estadio Nacional Rod Carew.

En el hotel, todas las habitaciones disponen de escritorio, TV de pantalla plana, baño privado, ropa de cama y toallas.

En Hotel Caracas se puede disfrutar de un desayuno a la carta o continental.

Estadio Rommel Fernández está a 15 km del alojamiento, y Museo del Canal Interoceánico de Panamá está a 6 min a pie. El aeropuerto más cercano (Aeropuerto internacional de Albrook Marcos A. Gelabert) está a 5 km.","Baño privado, Prohibido fumar en todo el alojamiento, WiFi gratis, Cámaras de seguridad fuera del alojamiento, Escritorio, Proporciona factura, Extintores, Desayuno, Artículos de aseo gratis, Seguridad 24 horas, Recepción 24 horas, Solo para adultos, Aire acondicionado, Ducha, Español, TV, Detectores de humo, Plancha para pantalones, Inglés, Cámaras de seguridad en las zonas comunitarias, Habitaciones sin humo, Máquina expendedora (bebidas), Servicio de habitaciones, Servicio de limpieza diario, Papel higiénico, Llave de acceso, Toallas, Ropa de cama, TV de pantalla plana, Acceso a pisos superiores solo mediante escaleras",https://cf.bstatic.com/xdata/images/hotel/max1024x768/498098244.jpg?k=fbbea8b19f67a1e6877e0929e45da69ba72fe941626f340a20cb1899ced900ee&o=&hp=1,Las Juntas,Panamá
