hotel,hotel_url,description,popular_facilities,highres_url,city,country
Bellísimo y cómodo apartamento en Colinas de Bello Monte,https://www.booking.com/hotel/ve/bellisimo-y-comodo-apartamento-en-colinas-de-bello-monte.es.html?aid=2410095,"Bellísimo y cómodo apartamento en Colinas de Bello Monte, que tiene vistas a la ciudad, dispone de alojamiento con balcón a unos 3,4 km de Parque Los Caobos. Este alojamiento con aire acondicionado está a 3,3 km de Univesidad de Venezuela y ofrece wifi gratis y parking privado en el propio alojamiento.

Este apartamento tiene 1 dormitorio, cocina con nevera y horno, TV de pantalla plana, zona de estar y 1 baño con ducha. Hay toallas y ropa de cama en el apartamento.

Complejo Cultural Teresa Carreño está a 4,1 km del alojamiento, y Jardín Botánico está a 4,3 km. El aeropuerto más cercano (Aeropuerto internacional Simon Bolívar) está a 31 km.","Servicio de streaming (como Netflix), Insonorización, Independiente, Cocina, Cama plegable, Prohibido fumar en todo el alojamiento, WiFi gratis, Accesible para personas sordas, Vistas, Calefacción, Vistas a la ciudad, Balcón, Utensilios de cocina, Productos de limpieza, Italiano, Supermercado pequeño en el alojamiento, Vistas a la montaña, Zona de estar, Parking en un garaje, Horno, Parking adaptado para personas de movilidad reducida, Enchufe cerca de la cama, Cambio de moneda, Artículos de aseo gratis, Perchero, Seguridad 24 horas, Peluquería / salón de belleza, Ascensor, Aire acondicionado, Habitaciones familiares, Ducha, Sofá, Vistas al río, Parking gratis, Español, TV, Caja fuerte, Mesa de comedor, Apartamento privado en edificio, Inglés, Bañera o ducha, Toda la unidad accesible en silla de ruedas, Cámaras de seguridad en las zonas comunitarias, Habitaciones sin humo, Papel higiénico, Armario, Nevera, Zona de cocina, Microondas, Suelo de madera o parquet, Habitaciones insonorizadas, Toallas, Guardaequipaje, Adosado, Ropa de cama, Acceso a pisos superiores en ascensor, Zona de comedor, WC, TV de pantalla plana",https://cf.bstatic.com/xdata/images/hotel/max1024x768/579690435.jpg?k=38c5580c49079d879ea0f6f8154de2c0884507b2d61d64bc8a386eed637517e2&o=&hp=1,Los Teques,Venezuela
apartosuite Sabana Grande,https://www.booking.com/hotel/ve/apartosuite-sabana-grande.es.html?aid=2410095,"Apartosuite Sabana Grande se encuentra en Caracas, a 1,9 km de Univesidad de Venezuela, a 2,6 km de Complejo Cultural Teresa Carreño y a 3 km de Jardín Botánico. Este alojamiento con aire acondicionado está a 1,9 km de Parque Los Caobos y ofrece wifi gratis y parking privado en el propio alojamiento.

El apartamento cuenta con balcón y vistas a la ciudad, y dispone de 1 dormitorio, una sala de estar, TV de pantalla plana, una cocina equipada con nevera y 2 baños con bañera o ducha. Para mayor comodidad, el alojamiento puede ofrecer toallas y ropa de cama por un suplemento.

En la recepción se hablan varios idiomas, como inglés, español y italiano.

Galeria de Arte Nacional está a 3 km del alojamiento, y Museo de Bellas Artes está a 3,1 km. El aeropuerto más cercano (Aeropuerto internacional Simon Bolívar) está a 31 km del alojamiento, que ofrece servicio de traslado de pago para ir o volver del aeropuerto.","Servicio de streaming (como Netflix), Baño privado, Prohibido fumar en todo el alojamiento, Cocina, WiFi gratis, Vistas, Vistas a la ciudad, Cámaras de seguridad fuera del alojamiento, Canales por cable, Italiano, Toallas / sábanas (por un suplemento), Lavadora, Zona de estar, Proporciona factura, Extintores, Parking en un garaje, Barbacoa, Enchufe cerca de la cama, Ventilador, Seguridad 24 horas, Ascensor, Recepción 24 horas, Aire acondicionado, Registro de entrada / salida privado, Habitaciones familiares, Vestidor, Sofá, Parking gratis, Español, Suelo de baldosa / mármol, Caja fuerte, Apartamento privado en edificio, Inglés, Sofá cama, Bañera o ducha, Traslado aeropuerto, Cámaras de seguridad en las zonas comunitarias, Habitaciones sin humo, Papel higiénico, Armario, Zona de cocina, Suelo de madera o parquet, Toallas, Nevera, Acceso a pisos superiores en ascensor, Zona de comedor, Balcón, TV de pantalla plana",https://cf.bstatic.com/xdata/images/hotel/max1024x768/500220882.jpg?k=e864d6fd7ae118428f4077bdcd5ec762eb24d39a5d2736ee90abd53aa38484ad&o=&hp=1,Los Teques,Venezuela
