hotel,hotel_url,description,popular_facilities,highres_url,city,country
Como en Casa,https://www.booking.com/hotel/ve/como-en-casa.es.html?aid=2410095,"Como en Casa se encuentra a 1,8 km de Galeria de Arte Nacional y ofrece alojamiento consalón de uso común, terraza y cocina compartida. Se ofrece wifi gratis.

Hay una cocina totalmente equipada y un baño compartido.

Museo de Bellas Artes está a 3,3 km del alojamiento, y Parque Los Caobos está a 3,5 km. El aeropuerto más cercano (Aeropuerto internacional Simon Bolívar) está a 25 km del alojamiento, que ofrece servicio de traslado de pago para ir o volver del aeropuerto.","Zona TV / salón de uso compartido, Cocina, WiFi gratis, Baño compartido, Servicio de traslado, Desayuno, Enchufe cerca de la cama, Perchero, Ascensor, Aire acondicionado, Tours a pie, Habitaciones familiares, Español, Inglés, Traslado aeropuerto, Papel higiénico, Zona de cocina, Toallas, Ropa de cama, Terraza, Cocina compartida",https://cf.bstatic.com/xdata/images/hotel/max1024x768/494622270.jpg?k=1f7fd55ae78fb0e73babee053b6932452d453bc4f72fd04c2cf731d108b59b65&o=&hp=1,Los Teques,Venezuela
JW Marriott Caracas,https://www.booking.com/hotel/ve/jw-marriott-caracas.es.html?aid=2410095,"El JW Marriot se encuentra en la zona de El Rosal y ofrece interiores elegantes y una piscina relajante. El restaurante Sur sirve cocina mediterránea e italiana.

Las habitaciones del JW Marriott Caracas presentan una decoración clásica y disponen de baño de mármol y ventanas amplias.  Todas cuentan con instalaciones modernas, como aire acondicionado y TV por cable. Algunas tienen una zona de estar independiente.

Por las mañanas se sirve un desayuno buffet abundante con cruasanes y fruta.

El JW Marriott se encuentra en el centro de Caracas, a 18 km del aeropuerto Simón Bolívar. Se encuentra a poca distancia a pie del centro comercial Centro Lido y ofrece aparcamiento gratuito y conexión Wi-Fi gratuita en las zonas comunes.","Restaurante, Baño privado, Servicio de aparcacoches, Servicio de planchado, Zona TV / salón de uso compartido, Muy buen desayuno, Tumbonas/sillas de playa, Vistas a la ciudad, Taquillas en el gimnasio / spa, Spa y centro de bienestar, Canales por cable, Salas de reuniones / banquetes, Menú para niños, Fax / fotocopiadora, Escritorio, Servicio de limpieza en seco, Proporciona factura, Extintores, Parking en un garaje, Servicio de despertador, Piscina al aire libre, Sauna, Snack-bar, Teléfono, Abierta todo el año, Secador de pelo, Seguridad 24 horas, Bar, Recepción 24 horas, Aire acondicionado, Ascensor, Peluquería / salón de belleza, Entrenador personal, Baños públicos, Masajes, Centro de negocios, Radio, Menús para dietas especiales (bajo petición), Sofá, Plancha para ropa, Toallas de playa/piscina, Español, Adaptado personas de movilidad reducida, Gimnasio, Alquiler de bicicletas, TV, Buffet para niños, Detectores de humo, Caja fuerte, Servicio de lavandería, Suelo de baldosa / mármol, Inglés, Bañera o ducha, Servicios de belleza, Cámaras de seguridad en las zonas comunitarias, Utensilios de planchado, Habitaciones sin humo, Bañera, Servicio de habitaciones, Papel higiénico, Vino / champán, Servicio de limpieza diario, Instalaciones de spa, Reloj despertador, Parking privado, Servicio de conserjería, Alarma de seguridad, WiFi, Toallas, Desayuno en la habitación, Guardaequipaje, Ropa de cama, WC, Terraza, TV de pantalla plana",https://cf.bstatic.com/xdata/images/hotel/max1024x768/430467495.jpg?k=eb4174047826d66bdf0bc76892cf55be73438592006afff87c8b8897d10c0e4f&o=&hp=1,Los Teques,Venezuela
Hotel CCT Caracas,https://www.booking.com/hotel/ve/cct-caracas.es.html?aid=2410095,"Hotel CCT Caracas tiene piscina al aire libre, centro de fitness, restaurante y bar en Caracas. Este hotel de 5 estrellas ofrece servicio de habitaciones, recepción 24 horas y wifi gratis. Este alojamiento libre de humo está a 5,8 km de Univesidad de Venezuela.

El hotel ofrece habitaciones con aire acondicionado, escritorio, cafetera, nevera, caja fuerte, TV de pantalla plana y baño privado con bidet. Las unidades disponen de armario.

Puedes jugar al tenis en Hotel CCT Caracas.

Jardín Botánico está a 6,2 km del alojamiento, y Parque Los Caobos está a 6,2 km. El aeropuerto más cercano (Aeropuerto internacional Simon Bolívar) está a 34 km.","Baño privado, Servicio de planchado, Servicio de entrega de comestibles, Vistas a la ciudad, Menú para niños, Toallas / sábanas (por un suplemento), Piscina privada, Proporciona factura, Servicio de despertador, Cafetera, Pista de tenis, Abierta todo el año, Entrada privada, Plancha para ropa, TV, Gimnasio, Detectores de humo, Cámaras de seguridad en las zonas comunitarias, Habitaciones sin humo, Vino / champán, Servicio de habitaciones, Instalaciones de spa, Almuerzos para llevar, Suelo de madera o parquet, Tarjeta de acceso, Guardaequipaje, Nevera, Acceso a pisos superiores en ascensor, Restaurante, Prohibido fumar en todo el alojamiento, Taquillas en el gimnasio / spa, Spa y centro de bienestar, Salas de reuniones / banquetes, Fruta, Fax / fotocopiadora, Supermercado pequeño en el alojamiento, Secador de pelo, Aire acondicionado, Ducha, Parking gratis, Español, Mesa de comedor, Plancha para pantalones, Servicio de lavandería, Servicio de limpieza diario, Alarma de seguridad, TV de pantalla plana, Bidet, Campo de golf (a menos de 3 km), WiFi gratis, Canales por cable, Productos de limpieza, Escritorio, Extintores, Clases de fitness, Parking adaptado para personas de movilidad reducida, Desayuno, Enchufe cerca de la cama, Piscina al aire libre, Teléfono, Seguridad 24 horas, Peluquería / salón de belleza, Bar, Recepción 24 horas, Paquetes de spa / bienestar, Zona de spa / relajación, Baños públicos, Habitaciones familiares, Toallas de playa/piscina, Caja fuerte, Toda la unidad accesible en silla de ruedas, Sombrillas, Papel higiénico, Música / espectáculos en directo, Toallas, Tumbonas/sillas de playa, Cámaras de seguridad fuera del alojamiento, Comedia en vivo, Servicio de traslado, Artículos de aseo gratis, Perchero, Ascensor, Centro de negocios, Armario, Zona de comedor, WC, Aeróbic",https://cf.bstatic.com/xdata/images/hotel/max1024x768/313425497.jpg?k=4b65ef59d5d2f51fd3cb08b5a7dae7a51a1a7e0f08cd843d9710ae5fd92127c2&o=&hp=1,Los Teques,Venezuela
Hotel Coliseo,https://www.booking.com/hotel/ve/coliseo.es.html?aid=2410095,"Hotel Coliseo está en Caracas, a 1,8 km de Univesidad de Venezuela, y dispone de alojamiento con terraza, parking privado gratis, restaurante y bar. Este hotel de 3 estrellas tiene wifi gratis, servicio de habitaciones y recepción 24 horas. Parque Los Caobos está a 2,7 km del hotel y Jardín Botánico, a 2,8 km.

Todas las habitaciones de este alojamiento están equipadas con TV de pantalla plana. En el hotel, las habitaciones tienen aire acondicionado y baño privado.

Complejo Cultural Teresa Carreño está a 3,4 km del alojamiento, y Estadio Olímpico está a 3,6 km. El aeropuerto (Aeropuerto internacional Simon Bolívar) está a 31 km.","Servicio de habitaciones, Baño privado, TV de pantalla plana, Recepción 24 horas, Parking gratis, WiFi gratis, Vistas, Español, Desayuno, Bar, Aire acondicionado, Terraza, Habitaciones sin humo",https://cf.bstatic.com/xdata/images/hotel/max1024x768/186962793.jpg?k=4672f0b71f83e13f3d2fbe8dda8b2f7549548e4570cd83af441a69e9587bbb45&o=&hp=1,Los Teques,Venezuela
Meliá Caracas,https://www.booking.com/hotel/ve/gran-melia-caracas.es.html?aid=2410095,"El Melia es un hotel de lujo situado en la Sabana Grande de Caracas y cuenta con piscina al aire libre con bañera de hidromasaje y sauna. Ofrece habitaciones elegantes de estilo clásico europeo y 3 restaurantes de primera clase.

Todas las elegantes habitaciones del Meliá Caracas cuentan con un cuarto de baño con bañera y secador de pelo. Las comodidades modernas incluyen tvs con recepción por cable y aire acondicionado.

Los huéspedes serán recibidos en un impresionante vestíbulo con lámparas de araña de cristal y tapices españoles del siglo XVI. Los huéspedes tienen acceso gratuito a las instalaciones del hotel, que incluyen un gimnasio bien equipado con actividades cardiovasculares y de fitness y un centro de negocios con conexión Wi-Fi y por cable.

El Meliá Caracas Hotel está cerca de lugares de interés como el bulevar Sabana Grande, la plaza Bolívar, llena de tiendas y cafeterías, y el parque nacional Cerro El Ávila. La estación de metro Sabana Grande está situada a 2 calles al norte del hotel.","Restaurante, Servicio de planchado, WiFi gratis, Spa y centro de bienestar, Parking en el alojamiento, Canales por cable, Salas de reuniones / banquetes, Supermercado pequeño en el alojamiento, Escritorio, Servicio de limpieza en seco, Proporciona factura, Parking en un garaje, Desayuno, Piscina al aire libre, Sauna, Teléfono, Abierta todo el año, Seguridad 24 horas, Ascensor, Recepción 24 horas, Peluquería / salón de belleza, Aire acondicionado, Ducha, Menús para dietas especiales (bajo petición), Español, TV, Gimnasio, Caja fuerte, Servicio de lavandería, Bañera, Servicio de habitaciones, Servicio de limpieza diario, Desayuno en la habitación, Guardaequipaje, WC",https://cf.bstatic.com/xdata/images/hotel/max1024x768/505944936.jpg?k=f0e8bbbd9a4bb289e156cc5ce0e28f82eb2d4946c37df760f70cde8859935799&o=&hp=1,Los Teques,Venezuela
Apartamento cerca del Boulevard de Sabana Grande y zona comercial,https://www.booking.com/hotel/ve/apartamento-cerca-del-boulevard-de-sabana-grande-y-zona-comercial.es.html?aid=2410095,"Apartamento cerca del Boulevard de Sabana Grande y zona comercial, que tiene vistas a la ciudad, ofrece alojamiento con terraza y balcón a unos 1,9 km de Univesidad de Venezuela. El alojamiento, que está a 1,9 km de Parque Los Caobos, dispone de jardín y parking privado gratis.

Este apartamento con aire acondicionado consta de 1 dormitorio, una sala de estar, una cocina totalmente equipada con nevera y cafetera, y 1 baño con ducha y artículos de aseo gratuitos. Hay toallas y ropa de cama en el apartamento.

Complejo Cultural Teresa Carreño está a 2,6 km del alojamiento, y Jardín Botánico está a 3 km. El aeropuerto más cercano (Aeropuerto internacional Simon Bolívar) está a 29 km del alojamiento, que ofrece servicio de traslado de pago para ir o volver del aeropuerto.","Servicio de streaming (como Netflix), Baño privado, Prohibido fumar en todo el alojamiento, Cocina, WiFi gratis, Vistas, Vistas a la ciudad, Balcón, Cámaras de seguridad fuera del alojamiento, Utensilios de cocina, Zona de fumadores, Productos de limpieza, Italiano, Servicio de traslado, Vistas a la montaña, Lavadora, Toallas / sábanas (por un suplemento), Zona de estar, Proporciona factura, Extintores, Zona de comedor exterior, Horno, Vistas al jardín, Enchufe cerca de la cama, Servicio de despertador, Cafetera, Artículos de aseo gratis, Secador de pelo, Tetera / cafetera, Fogones, Ascensor, Patio, Aire acondicionado, Seguridad 24 horas, Libros, DVD o música para niños, Registro de entrada / salida privado, Muebles de exterior, Habitaciones familiares, Ducha, Sofá, Parking gratis, Español, TV, Suelo de baldosa / mármol, Detectores de humo, Caja fuerte, Mesa de comedor, Apartamento privado en edificio, Registro de entrada y salida exprés, Inglés, Sofá cama, Traslado aeropuerto, Bañera o ducha, Hervidor eléctrico, Cámaras de seguridad en las zonas comunitarias, Habitaciones sin humo, Papel higiénico, Protector de enchufes para niños, Jardín, Zona de cocina, Microondas, Ropa de cama, Alarma de seguridad, Tostadora, Suelo de madera o parquet, Toallas, Minibar, Nevera, Vistas a un lugar de interés, Zona de comedor, WC, Terraza, TV de pantalla plana",https://cf.bstatic.com/xdata/images/hotel/max1024x768/579654875.jpg?k=7779fe12cb3f3277b32d2b2204116100f3257e538f12e6f9ac0c611f6f1f481b&o=&hp=1,Los Teques,Venezuela
Suite ejecutiva en el CCCT,https://www.booking.com/hotel/ve/suite-ejecutiva-en-el-ccct.es.html?aid=2410095,"Suite ejecutiva en el CCCT, que cuenta con vistas a la ciudad, ofrece alojamiento con terraza y balcón a unos 5,5 km de Univesidad de Venezuela. Este apartamento con vistas a la montaña y a la piscina también tiene wifi gratis.

Este apartamento tiene aire acondicionado y cuenta con 2 dormitorios, TV de pantalla plana, zona de comedor, cocina con nevera y sala de estar.

Parque Los Caobos está a 5,7 km del alojamiento, y Jardín Botánico está a 5,9 km. El aeropuerto más cercano (Aeropuerto internacional Simon Bolívar) está a 32 km del alojamiento.","Vistas a la piscina, Prohibido fumar en todo el alojamiento, Cocina, WiFi gratis, Calefacción, Vistas, Vistas a la ciudad, Utensilios de cocina, Vistas a la montaña, Escritorio, Piscina privada, Horno, Vistas al jardín, Cafetera, Artículos de aseo gratis, Perchero, Secador de pelo, Aire acondicionado, Sofá, Plancha para ropa, Español, Piscina, Caja fuerte, Mesa de comedor, Secadora de ropa, Papel higiénico, Armario, Zona de cocina, Microondas, Tostadora, Camas extralargas (más de 2 metros), Nevera, Zona de comedor, Balcón, Terraza, TV de pantalla plana",https://cf.bstatic.com/xdata/images/hotel/max1024x768/578463687.jpg?k=4371a86aa3f77a12fdbc2bd77aa06d80b1ccc648f791dda69bfc074ad381851b&o=&hp=1,Los Teques,Venezuela
Lidotel Caracas,https://www.booking.com/hotel/ve/centro-lido.es.html?aid=2410095,"El Hotel Centro Lido está ubicado en el distrito financiero Centro Lido y ofrece habitaciones modernas con conexión inalámbrica a internet gratuita y TV de pantalla plana. Las instalaciones del hotel incluyen un gimnasio y un spa.

Todas las habitaciones del Hotel Centro Lido están equipadas con aire acondicionado, TV vía satélite y baño de mármol privado. Algunas habitaciones tienen una amplia zona de estar.

Los huéspedes pueden participar en las clases de aeróbic del gimnasio bien equipado. También hay un spa con salas de masajes, una sauna y un baño de vapor.

El restaurante del Hotel Centro Lido, Le Nouveau, sirve cocina gourmet internacional y local. Servicio de habitaciones disponible las 24 horas, 7 días de la semana.

Hay muchas tiendas, cines, restaurantes y bares dentro del distrito financiero Centro Lido.","Restaurante, Baño privado, Servicio de aparcacoches, Servicio de planchado, Zona TV / salón de uso compartido, Muy buen desayuno, Prohibido fumar en todo el alojamiento, Habitaciones comunicadas disponibles, Spa y centro de bienestar, Mobiliario exterior, Canales por cable, Salas de reuniones / banquetes, Corte de pelo, Servicio de traslado, Fax / fotocopiadora, Escritorio, Servicio de limpieza en seco, Proporciona factura, Baños públicos, Clases de fitness, Cafetera, Sauna, Artículos de aseo gratis, Teléfono, Secador de pelo, Ascensor, Bar, Recepción 24 horas, Aire acondicionado, Peluquería / salón de belleza, Entrenador personal, Zona de spa / relajación, Tinte, Peinado, Habitaciones familiares, Ducha, Centro de negocios, Radio, Pedicura, Plancha para ropa, Terraza / solárium, Suelo de moqueta, Servicios de depilación, Adaptado personas de movilidad reducida, Gimnasio, Español, Caja fuerte, Plancha para pantalones, Inglés, Servicio de lavandería, Servicios de belleza, Tratamientos faciales, Utensilios de planchado, Exfoliación corporal, Habitaciones sin humo, Papel higiénico, Servicio de habitaciones, Servicio de limpieza diario, Instalaciones de spa, Tratamientos corporales, Masajes, Reloj despertador, Nevera, Parking privado, Tratamientos capilares, Toallas, Desayuno en la habitación, Guardaequipaje, Ropa de cama, Información turística, Tarjeta de acceso, Manicura, Terraza, TV de pantalla plana",https://cf.bstatic.com/xdata/images/hotel/max1024x768/444872694.jpg?k=fe902fb1dc25ba19128d63732074c67e76957973d0557610bb3403e7941c9aba&o=&hp=1,Los Teques,Venezuela
Sorokaima,https://www.booking.com/hotel/ve/sorokaima.es.html?aid=2410095,"Sorokaima está en Caracas, a 13 km de Univesidad de Venezuela y a 13 km de Parque Los Caobos. Ofrece alojamiento con jardín y wifi gratis en todo el alojamiento, además de parking privado gratis. El alojamiento se encuentra a 13 km de Jardín Botánico, a 14 km de Complejo Cultural Teresa Carreño y a 14 km de Estadio Olímpico. Cada habitación está equipada con patio con vistas a la montaña.

En el hostal o pensión, cada habitación dispone de aire acondicionado, escritorio, terraza con vistas a la ciudad, baño privado, TV de pantalla plana, ropa de cama y toallas. Todas las habitaciones cuentan con cafetera, y algunas también ofrecen cocina con microondas. Todas las habitaciones cuentan con nevera.

En Sorokaima se sirve cada mañana un desayuno a la carta.

Museo de los niños de Caracas está a 14 km del alojamiento, y Galeria de Arte Nacional está a 14 km. El aeropuerto (Aeropuerto internacional Simon Bolívar) está a 41 km, y el alojamiento ofrece servicio de traslado de pago para ir o volver del aeropuerto.","Servicio de streaming (como Netflix), Baño privado, Servicio de planchado, Servicio de entrega de comestibles, WiFi gratis, Vistas a la ciudad, Vistas a un patio interior, Cámaras de seguridad fuera del alojamiento, Mobiliario exterior, Servicio de traslado, Menú para niños, Vistas a la montaña, Escritorio, Toallas / sábanas (por un suplemento), Extintores, Zona de comedor exterior, Vistas al jardín, Desayuno, Enchufe cerca de la cama, Juegos de mesa / puzles, Cafetera, Servicio de despertador, Seguridad 24 horas, Patio, Aire acondicionado, Libros, DVD o música para niños, Habitaciones familiares, Ducha, Menús para dietas especiales (bajo petición), Entrada privada, Plancha para ropa, Parking gratis, Terraza / solárium, Español, TV, Suelo de baldosa / mármol, Servicio de despertador / alarma, Servicio de lavandería, Bañera o ducha, Traslado aeropuerto, Cámaras de seguridad en las zonas comunitarias, Habitaciones sin humo, Papel higiénico, Servicio de limpieza diario, Armario, Reloj despertador, Nevera, Jardín, Servicio de conserjería, Protector de enchufes para niños, Llave de acceso, Toallas, Guardaequipaje, Información turística, Ropa de cama, WC, Terraza, TV de pantalla plana, Acceso a pisos superiores solo mediante escaleras",https://cf.bstatic.com/xdata/images/hotel/max1024x768/425957477.jpg?k=b2a0849e415f9f1b6e2c38f439692007e53e625281bb51d9c19caad777ed4a3a&o=&hp=1,Los Teques,Venezuela
Posadas Le Petit Inn,https://www.booking.com/hotel/ve/posadas-le-petit-inn.es.html?aid=2410095,"Posadas Le Petit Inn está en Caracas, a 18 km de Univesidad de Venezuela y a 18 km de Parque Los Caobos, y ofrece alojamiento con wifi gratis, aire acondicionado, jardín y terraza.

Jardín Botánico está a 18 km del alojamiento, y Complejo Cultural Teresa Carreño está a 19 km. El aeropuerto (Aeropuerto internacional Simon Bolívar) está a 46 km, y el alojamiento ofrece servicio de traslado de pago para ir o volver del aeropuerto.","Galerías de arte temporales, Noches de cine, Servicio de planchado, Cenas temáticas, Campo de golf (a menos de 3 km), Servicio de entrega de comestibles, Prohibido fumar en todo el alojamiento, WiFi gratis, Tumbonas/sillas de playa, Cámaras de seguridad fuera del alojamiento, Mobiliario exterior, Salas de reuniones / banquetes, Eventos deportivos en directo (emisión), Comedia en vivo, Zona de fumadores, Baño compartido, Servicio de traslado, Menú para niños, Proporciona factura, Extintores, Barbacoa, Snack-bar, Seguridad 24 horas, Baños públicos, Aire acondicionado, Tours a pie, Solárium, Registro de entrada / salida privado, Habitaciones familiares, Centro de negocios, Parking gratis, Terraza / solárium, Español, Buffet para niños, Caja fuerte, Plancha para pantalones, Registro de entrada y salida exprés, Servicio de lavandería, Inglés, Ruta de bares, Traslado aeropuerto, Cámaras de seguridad en las zonas comunitarias, Habitaciones sin humo, Música / espectáculos en directo, Bañera, Papel higiénico, TV de pantalla plana, Vino / champán, Servicio de limpieza diario, Jardín, Servicio de conserjería, Alarma de seguridad, Almuerzos para llevar, Tours en bici, Toallas, Ropa de cama, Terraza, Zona de pícnic",https://cf.bstatic.com/xdata/images/hotel/max1024x768/477947889.jpg?k=e2edd169171df907f39978e6e73b717e37df007980193c988abd48df7a5a9335&o=&hp=1,Los Teques,Venezuela
"Paraíso Urbano, Exclusivo Apartamento en El Rosal - Caracas",https://www.booking.com/hotel/ve/paraiso-urbano-exclusivo-apartamento-en-el-rosal-caracas.es.html?aid=2410095,"Paraíso Urbano, Exclusivo Apartamento en El Rosal - Caracas está en Caracas, a 4,8 km de Parque Los Caobos, a 5,1 km de Jardín Botánico y a 5,4 km de Complejo Cultural Teresa Carreño. Este alojamiento con aire acondicionado está a 4,7 km de Univesidad de Venezuela y ofrece wifi gratis y parking privado en el propio alojamiento.

El apartamento cuenta con balcón y vistas a la ciudad, y tiene 1 dormitorio, una sala de estar, TV de pantalla plana, una zona de cocina equipada con nevera y horno, y 2 baños con ducha. Hay toallas y ropa de cama en el apartamento.

Galeria de Arte Nacional está a 5,7 km del alojamiento, y Museo de Bellas Artes está a 5,8 km. El aeropuerto más cercano (Aeropuerto internacional Simon Bolívar) está a 32 km.","Baño privado, Prohibido fumar en todo el alojamiento, WiFi gratis, Vistas, Tendedero, Vistas a la ciudad, Balcón, Productos de limpieza, Baño compartido, Lavadora, Zona de estar, Horno, Perchero, Secador de pelo, Tetera / cafetera, Aire acondicionado, Habitaciones familiares, Ducha, Entrada privada, Plancha para ropa, Parking gratis, Español, TV, Apartamento privado en edificio, Inglés, Sofá cama, Bañera o ducha, Utensilios de planchado, Habitaciones sin humo, Papel higiénico, Zona de cocina, Microondas, Ropa de cama, Toallas, Nevera, Zona de comedor, WC, TV de pantalla plana",https://cf.bstatic.com/xdata/images/hotel/max1024x768/568172632.jpg?k=ad778c787ba32b48b5ffcda4c9b3188685fa1987f4dcc55303771701c4f16e03&o=&hp=1,Los Teques,Venezuela
apartosuite,https://www.booking.com/hotel/ve/apartosuite.es.html?aid=2410095,"Apartosuite está en Caracas, a 14 km de Parque Los Caobos, a 14 km de Jardín Botánico y a 15 km de Complejo Cultural Teresa Carreño, y dispone de balcón. El alojamiento, que se encuentra a 14 km de Univesidad de Venezuela, ofrece terraza y parking privado gratis.

Este apartamento con aire acondicionado consta de 1 dormitorio, una sala de estar, una cocina totalmente equipada con nevera y cafetera, y 2 baños con ducha. Se ofrece TV de pantalla plana con canales por cable y reproductor de Blu-ray.

Estadio Olímpico está a 15 km del alojamiento, y Museo de los niños de Caracas está a 15 km. El aeropuerto más cercano (Aeropuerto internacional Simon Bolívar) está a 42 km.","Baño privado, Insonorización, Independiente, Cocina, Cama plegable, Balcón, Utensilios de cocina, Canales por cable, Escritorio, Lavadora, Baño adicional, Toallas / sábanas (por un suplemento), Zona de estar, Zona de comedor exterior, Horno, Enchufe cerca de la cama, Aseo adicional, Cafetera, Perchero, Tetera / cafetera, Fogones, Patio, Aire acondicionado, Muebles de exterior, Habitaciones familiares, Vestidor, Ducha, Sofá, Entrada privada, Parking gratis, Plancha para ropa, Terraza, Español, TV, Suelo de baldosa / mármol, Mesa de comedor, Plancha para pantalones, Secadora de ropa, Apartamento privado en edificio, Inglés, Sofá cama, Bañera o ducha, Toda la unidad accesible en silla de ruedas, Habitaciones sin humo, Papel higiénico, Armario, Zona de cocina, Microondas, Ropa de cama, Tostadora, Toallas, Nevera, Acceso a pisos superiores en ascensor, WC, Reproductor de Blu-ray, TV de pantalla plana",https://cf.bstatic.com/xdata/images/hotel/max1024x768/272432835.jpg?k=2e8c32113957b8ed12c470f6b2d900c794945a40429bfe3be1353be6a3c1ce19&o=&hp=1,Los Teques,Venezuela
