hotel,hotel_url,description,popular_facilities,highres_url,city,country
Clarion Hotel Real Tegucigalpa,https://www.booking.com/hotel/hn/hotel-alameda-calle-principal-tegucigalpa.es.html?aid=2410095,"El Clarion Hotel Real Tegucigalpa se encuentra en pleno centro financiero y de ocio de la ciudad. El hotel cuenta con centro de negocios, centro de fitness totalmente equipado, spa y piscina al aire libre.

Todas las habitaciones disponen de aire acondicionado, caja fuerte, TV por cable y baño de mármol con ducha, bañera y secador de pelo.

Las Cuatro Estaciones, el restaurante del establecimiento, propone platos informales locales y cocina internacional en un ambiente distendido. Hay servicio de habitaciones las 24 horas. Los huéspedes también pueden visitar la taberna al aire libre, para comer en un ambiente distendido junto a la piscina, o disfrutar de sushi en el restaurante Sushi2Go.

El hotel proporciona aparcamiento gratuito y alberga 14 salas de reuniones con capacidad para un máximo de 800 personas donde se pueden celebrar convenciones, bodas, conciertos y otros eventos sociales.

El hotel queda a 6 km del aeropuerto internacional Toncontín y cuenta con servicio de enlace con el aeropuerto en horario regular.","Servicio de despertador / alarma, Fax / fotocopiadora, Servicios de belleza, Baño privado, Manicura, Vino / champán, Salas de reuniones / banquetes, Detectores de humo, Canales por cable, Snack-bar, Ascensor, Masajes, Bar, Zona de fumadores, Habitaciones insonorizadas, Servicio de limpieza en seco, Escritorio, Mobiliario exterior, Peluquería / salón de belleza, Tarjeta de acceso, Piscina al aire libre, Servicio de habitaciones, WiFi gratis, Galerías de arte temporales, Música / espectáculos en directo, Servicios de maquillaje, Peinado, Terraza / solárium, TV, Proporciona factura, Cajero automático en el hotel, Masaje de pies, Papel higiénico, Ropa de cama, Servicio de despertador, Eventos deportivos en directo (emisión), Habitaciones sin humo, Desayuno en la habitación, Teléfono, Secador de pelo, WC, Servicio de traslado, Acceso a pisos superiores en ascensor, Bañera, Buen desayuno, Sofá, Almuerzos para llevar, Ducha, Corte de pelo, Parking adaptado para personas de movilidad reducida, Reloj despertador, Insonorización, Zona TV / salón de uso compartido, Toallas de playa/piscina, Zona de pícnic, Zona poco profunda, Servicio de limpieza diario, Masaje corporal completo, Fruta, Tumbonas/sillas de playa, Tetera / cafetera, Buffet para niños, Menú para niños, Radio, WC con barras de apoyo, Tetera/cafetera en todas las habitaciones, Cámaras de seguridad fuera del alojamiento, Aire acondicionado, Gimnasio, Suelo de moqueta, Parking gratis, Adaptado para sillas de ruedas, Sala de juegos, Sombrillas, Seguridad 24 horas, Horario de apertura, Cámaras de seguridad en las zonas comunitarias, Cafetería en el alojamiento, Guardaequipaje, Centro de negocios, Plancha para pantalones, Recepción 24 horas, Servicio de lavandería, Terraza, Masaje en pareja, Soporte para iPod, Piscina pequeña, Caja fuerte para ordenador portátil, Extintores, Alquiler de coches, Registro de entrada y salida exprés, Masaje de cabeza, Discoteca / DJ, Karaoke, Secadora de ropa, Habitaciones familiares, Español, Masaje de cuello, Caja fuerte, Alarma de seguridad, Tinte, Utensilios de planchado, Tratamientos faciales, Juegos de mesa / puzles, TV de pantalla plana, Menús para dietas especiales (bajo petición), Francés, Toallas, Plancha para ropa, Masaje de manos, Bañera o ducha, Barbacoa, Masaje de espalda, Restaurante, Abierta todo el año, Servicio de planchado, Cambio de moneda, Vistas a un lugar de interés, Prohibido fumar en todo el alojamiento, Happy hour, Bañera de hidromasaje, Tratamientos capilares, Para todas las edades, Adaptado personas de movilidad reducida, Pedicura, Armario, Inglés",https://cf.bstatic.com/xdata/images/hotel/max1024x768/300369019.jpg?k=270016e223e4b2ee15c16eb5ac004216f5dfae9502455954d2fc3865ec37cdd6&o=&hp=1,Olanchito,Honduras
Hotel Santa Maria de Comayagua,https://www.booking.com/hotel/hn/santa-maria-de-comayagua.es.html?aid=2410095,"Hotel Santa Maria de Comayagua tiene piscina al aire libre, jardín, terraza y restaurante en Comayagua. Este alojamiento, que tiene habitaciones familiares, también ofrece zona de juegos infantil. El alojamiento dispone de servicio de habitaciones, recepción 24 horas y cambio de moneda.

Algunas habitaciones incluyen cocina con nevera y fogones.

El aeropuerto (Aeropuerto internacional de Palmerola) está a 16 km.","Piscina infantil, Caja fuerte, Adecuada para niños, Vino / champán, 2 piscinas, Aire acondicionado, Parking gratis, Habitaciones sin humo, Salas de reuniones / banquetes, Zona de juegos para niños, Desayuno en la habitación, Sombrillas, Seguridad 24 horas, Menús para dietas especiales (bajo petición), Bar, Guardaequipaje, Restaurante, Buen desayuno, Recepción 24 horas, Equipamiento de juegos para exterior, Servicio de lavandería, Almuerzos para llevar, Terraza, Abierta todo el año, Servicio de planchado, Jardín, Cambio de moneda, Mobiliario exterior, Llave de acceso, Prohibido fumar en todo el alojamiento, Toallas de playa/piscina, Servicio de limpieza diario, Extintores, Para todas las edades, Servicio de habitaciones, WiFi gratis, Terraza / solárium, Tumbonas/sillas de playa, Habitaciones familiares, Inglés, Menú para niños, Español",https://cf.bstatic.com/xdata/images/hotel/max1024x768/291198431.jpg?k=6765af488f5ee265994dfa236d8af01d382e2c645b06339894354bcc84db971b&o=&hp=1,Olanchito,Honduras
Infinity Bay Spa & Beach Resort,https://www.booking.com/hotel/hn/infinity-bay-spa-amp-beach-resort.es.html?aid=2410095,"El Infinity Bay Spa & Beach Resort se encuentra a 20 metros de la playa de West Bay. Cuenta con conexión Wi-Fi gratuita, piscina con cascada y un arrecife de coral justo en frente.

Las villas presentan una decoración moderna y cuentan con muebles de madera, aire acondicionado, zona de estar y TV por cable de pantalla plana. Los alojamientos disponen de balcón con vistas al jardín y a la piscina. Disponen de cocina con fogones, nevera y cafetera, así como de baño con ducha y artículos de aseo gratuitos.

El Infinity Bay Spa & Beach Resort alberga el restaurante La Palapa, donde se sirve el desayuno, platos de marisco y ensaladas. También hay un bar dentro de la piscina.

En el Infinity Bay se pueden organizar actividades como equitación, piragüismo, pesca, senderismo y buceo. El establecimiento dispone de servicio de alquiler de bicicletas, sauna y gimnasio.

Este complejo se encuentra a 2 km del puente colgante del parque Gumbalimba y a 15 minutos en coche del aeropuerto internacional Juan Manuel Gálvez.","Servicio de despertador / alarma, Servicios de depilación, Servicios de belleza, Baño privado, Manicura, Vino / champán, Salas de reuniones / banquetes, Canales por cable, Playa, Snack-bar, Ascensor, Masajes, Bar, Nevera, Escritorio, Mobiliario exterior, Tostadora, Tarjeta de acceso, Tour o clase sobre cultura local, Piscina al aire libre, Muy buen desayuno, Servicio de habitaciones, WiFi gratis, Música / espectáculos en directo, Servicios de maquillaje, Submarinismo, Toallas / sábanas (por un suplemento), Terraza / solárium, Piscina infinita, Traslado aeropuerto (gratis), TV, Proporciona factura, Cajero automático en el hotel, Exfoliación corporal, Papel higiénico, Ropa de cama, Servicio de despertador, Eventos deportivos en directo (emisión), Suelo de baldosa / mármol, Cenas temáticas, Habitaciones sin humo, Desayuno en la habitación, Teléfono, Secador de pelo, Vistas, WC, Tratamientos corporales, Servicio de traslado, Zona de spa / relajación, Acceso a pisos superiores en ascensor, Senderismo, Bañera, Servicio de conserjería, Enchufe cerca de la cama, Sofá, Utensilios de cocina, Ducha, Almuerzos para llevar, Parking adaptado para personas de movilidad reducida, Situado frente a la playa, Toallas de playa/piscina, Zona poco profunda, Servicio de limpieza diario, Clases de fitness, Información turística, Fruta, Paquetes de spa / bienestar, Aeróbic, Tumbonas/sillas de playa, Tetera / cafetera, Menú para niños, Balcón, WC con barras de apoyo, Tetera/cafetera en todas las habitaciones, Cámaras de seguridad fuera del alojamiento, Aire acondicionado, Gimnasio, Parking gratis, Traslado aeropuerto, Adaptado para sillas de ruedas, Piscina con vistas, Patio, Sombrillas, Seguridad 24 horas, Entrenador personal, Horario de apertura, Cámaras de seguridad en las zonas comunitarias, Cafetería en el alojamiento, Supermercado pequeño en el alojamiento, Guardaequipaje, Recepción 24 horas, Servicio de lavandería, Terraza, Artículos de aseo gratis, Zona de comedor, Jardín, Cafetera, Servicio de entrega de comestibles, Horno, Microondas, Extintores, Alquiler de coches, Karaoke, Zona de estar, Habitaciones familiares, Español, Caja fuerte, Alarma de seguridad, Inglés, Utensilios de planchado, Tratamientos faciales, Juegos de mesa / puzles, Campo de golf (a menos de 3 km), TV de pantalla plana, Menús para dietas especiales (bajo petición), Sofá cama, Toallas, Plancha para ropa, Bañera o ducha, Snorkel, Barbacoa, Restaurante, Abierta todo el año, Tours a pie, Servicio de planchado, Llave de acceso, Spa y centro de bienestar, Prohibido fumar en todo el alojamiento, Happy hour, Equitación, Clases de yoga, Tratamientos capilares, Piragüismo, Para todas las edades, Instalaciones para deportes acuáticos en el alojamiento, Adaptado personas de movilidad reducida, Instalaciones de spa, Ciclismo, Pedicura, Ventilador, Armario, Bar en la piscina, Pesca",https://cf.bstatic.com/xdata/images/hotel/max1024x768/34366399.jpg?k=9d3a427b4ad76d264b2505d2eb73dd7391bc637904dd3f00b5c0bee2d22a2973&o=&hp=1,Olanchito,Honduras
Cotan Ecolodge,https://www.booking.com/hotel/hn/cotan-ecolodge.es.html?aid=2410095,"Cotan Ecolodge está en La Esperanza y cuenta con jardín. Este alojamiento ofrece restaurante, servicio de habitaciones y servicio de conserjería, además de wifi gratis. Hay parking privado gratis y hotel también dispone de alquiler de bicicletas para descubrir los alrededores.

Todas las habitaciones de este alojamiento están equipadas con cafetera. Cada habitación dispone de baño privado con ducha, y algunas también ofrecen vistas al lago. En el hotel, las habitaciones disponen de zona de estar.

En Cotan Ecolodge se sirve cada mañana un desayuno continental.

La clientela puede practicar actividades en La Esperanza y alrededores, como senderismo y ciclismo.

El aeropuerto (Aeropuerto internacional de Palmerola) está a 116 km.","Vistas a la montaña, Papel higiénico, Vistas al jardín, Baño privado, Parking gratis, Habitaciones sin humo, Salas de reuniones / banquetes, Juegos de mesa / puzles, Adaptado para sillas de ruedas, Desayuno en la habitación, Seguridad 24 horas, Cámaras de seguridad en las zonas comunitarias, Toallas, Supermercado pequeño en el alojamiento, WC, Entrada privada, Proporciona factura, Senderismo, Restaurante, Servicio de conserjería, Sofá, Ducha, Alquiler de bicicletas, Jardín, Cafetera, Prohibido fumar en todo el alojamiento, Zona de pícnic, Información turística, Extintores, Adaptado personas de movilidad reducida, Servicio de habitaciones, WiFi gratis, Minibar, Ciclismo, Zona de estar, TV, Habitaciones familiares, Inglés, Desayuno, Español",https://cf.bstatic.com/xdata/images/hotel/max1024x768/534229965.jpg?k=487b826b73a9f6a883f9871f05233568a0f2c59c17b512d0a0598d10e4188d27&o=&hp=1,Olanchito,Honduras
Paradise Beach Hotel,https://www.booking.com/hotel/hn/paradise-hotels-amp-resorts.es.html?aid=2410095,"El Paradise Beach Hotel ofrece 2 piscinas al aire libre y un desayuno incluido en el precio. Está en West Bay y proporciona conexión Wi-Fi gratuita.

Los alojamientos disponen de TV de pantalla plana, aire acondicionado, nevera, baño privado con ducha y toallas, caja fuerte y ventilador.

Este establecimiento alberga 3 restaurantes que sirven comida italiana, buffets y mariscos. También hay un bar junto a la playa.

El Paradise Beach Hotel cuenta con servicio gratuito de enlace con el aeropuerto, recepción 24 horas, terraza y mostrador de información turística.

Este complejo está a 20 minutos en coche del aeropuerto de Roatán y a 200 metros de una zona de restaurantes. Además, ofrece aparcamiento gratuito.","Windsurf, Baño privado, Vino / champán, Salas de reuniones / banquetes, Playa, Masajes, Bar, Zona de fumadores, Nevera, Escritorio, Mobiliario exterior, Tarjeta de acceso, Tour o clase sobre cultura local, Piscina al aire libre, Muy buen desayuno, Servicio de habitaciones, WiFi gratis, Música / espectáculos en directo, Submarinismo, Juguetes para la piscina, Toallas / sábanas (por un suplemento), Terraza / solárium, Traslado aeropuerto (gratis), TV, Proporciona factura, Papel higiénico, Eventos deportivos en directo (emisión), Habitaciones sin humo, Cenas temáticas, Desayuno en la habitación, WC, Tours en bici, Servicio de traslado, Zona de spa / relajación, Senderismo, Servicio de conserjería, Canguro / servicios para niños, Almuerzos para llevar, Ducha, Situado frente a la playa, Toallas de playa/piscina, Zona poco profunda, Servicio de limpieza diario, Masaje corporal completo, Información turística, Fruta, Perchero, Tumbonas/sillas de playa, Menú para niños, Cámaras de seguridad fuera del alojamiento, Aire acondicionado, Gimnasio, Parking gratis, Traslado aeropuerto, Piscina con vistas, Patio, Sombrillas, Seguridad 24 horas, Entrenador personal, Cámaras de seguridad en las zonas comunitarias, Cafetería en el alojamiento, Entretenimiento nocturno, Guardaequipaje, Centro de negocios, Recepción 24 horas, Servicio de lavandería, Terraza, Artículos de aseo gratis, Jardín, Zona privada de playa, Extintores, Alquiler de coches, Zona de estar, Habitaciones familiares, Español, Masaje de cuello, Caja fuerte, Inglés, Campo de golf (a menos de 3 km), TV de pantalla plana, Menús para dietas especiales (bajo petición), Toallas, Bañera o ducha, Snorkel, Masaje de espalda, Restaurante, Equipamiento de juegos para exterior, Silla de masajes, Abierta todo el año, Tours a pie, Happy hour, Equitación, Clases de yoga, Calefacción, Piragüismo, Instalaciones para deportes acuáticos en el alojamiento, Parking en un garaje, Taquillas en el gimnasio / spa, Ciclismo, Armario, Pesca",https://cf.bstatic.com/xdata/images/hotel/max1024x768/539619345.jpg?k=2cb267f2af6dcb1c4e2793df041128290bc445e9b02a1ab39a9a7c38e207e5a6&o=&hp=1,Olanchito,Honduras
Sunset Hut Hostel,https://www.booking.com/hotel/hn/sunset-hut-hostel.es.html?aid=2410095,"Sunset Hut Hostel dispone de piscina al aire libre, jardín, salón de uso común y terraza en Omoa. El alojamiento tiene bar y zona de playa privada. Hay un restaurante de cocina americana y parking privado gratis.

Algunas de las habitaciones también están equipadas con cocina con nevera, horno y microondas.

Puedes jugar al billar, al ping-pong y a los dardos en el albergue.

En la recepción 24 horas se hablan varios idiomas, como inglés y español.

El aeropuerto (Aeropuerto de Puerto Barrios) está a 70 km, y el alojamiento ofrece servicio de traslado de pago para ir o volver del aeropuerto.","Papel higiénico, Inglés, Vino / champán, Cámaras de seguridad fuera del alojamiento, Aire acondicionado, Parking gratis, Habitaciones sin humo, Salas de reuniones / banquetes, Traslado aeropuerto, Juegos de mesa / puzles, Sala de juegos, Piscina con vistas, Noches de cine, Sombrillas, Seguridad 24 horas, Playa, Menús para dietas especiales (bajo petición), Horario de apertura, Español, Cámaras de seguridad en las zonas comunitarias, Snack-bar, Equipamiento de bádminton, Snorkel, WC, Cocina compartida, Tours en bici, Barbacoa, Servicio de traslado, Bar, Entretenimiento nocturno, Dardos, Ping pong, Senderismo, Proporciona factura, Restaurante, Servicio de conserjería, Recepción 24 horas, Zona de fumadores, Servicio de lavandería, Almuerzos para llevar, Terraza, Ducha, Bingo, Tours a pie, Abierta todo el año, Situado frente a la playa, Jardín, Mobiliario exterior, Cambio de moneda, Happy hour, Llave de acceso, Zona TV / salón de uso compartido, Baño al aire libre, Zona privada de playa, Servicio de entrega de comestibles, Zona de pícnic, Servicio de limpieza diario, Tour o clase sobre cultura local, Información turística, Piscina al aire libre, Instalaciones para deportes acuáticos en el alojamiento, Extintores, Solo para adultos, Servicio de habitaciones, Para todas las edades, Comedia en vivo, Karaoke, Música / espectáculos en directo, Billar, Baños públicos, Terraza / solárium, Tumbonas/sillas de playa, Pesca, Desayuno, Parque acuático",https://cf.bstatic.com/xdata/images/hotel/max1024x768/553289286.jpg?k=34997cc6b14b2a8e706f2ac6ac9eb7585b4ff46734bb6603ff0c673bcc8d2837&o=&hp=1,Olanchito,Honduras
