hotel,hotel_url,description,popular_facilities,highres_url,city,country
Pesky Pelican House,https://www.booking.com/hotel/hn/pesky-pelican-house.es.html?aid=2410095,"Pesky Pelican House, que tiene piscina al aire libre, jardín y zona de playa privada, ofrece alojamiento en Chachaguala con wifi gratis y vistas a la montaña. La villa, que cuenta con parking privado gratis, está en una zona en la que se pueden practicar actividades como senderismo, pesca y dardos.

La villa tiene 5 dormitorios, 6 baños, ropa de cama, toallas, TV de pantalla plana con canales vía satélite, zona de comedor, cocina totalmente equipada y terraza con vistas al mar. Para mayor comodidad, el alojamiento puede ofrecer toallas y ropa de cama por un suplemento.

En la villa, la clientela puede usar la barbacoa.","Baño privado, Canales por cable, Playa, Chimenea exterior, Zona de fumadores, Nevera, Vistas a la piscina, Escritorio, Mobiliario exterior, Piscina de agua salada, Tostadora, Chimenea, Piscina al aire libre, Servicio de habitaciones, WiFi gratis, Trona, Tendedero, Juguetes para la piscina, Toallas / sábanas (por un suplemento), Terraza / solárium, Piscina infinita, TV, Ropa de cama, Papel higiénico, Vistas al jardín, Habitaciones sin humo, Suelo de baldosa / mármol, Secador de pelo, Vistas, Libros, DVD o música para niños, WC, Senderismo, Servicio de conserjería, Sofá, Enchufe cerca de la cama, Utensilios de cocina, Ducha, Parking adaptado para personas de movilidad reducida, Situado frente a la playa, Insonorización, Toallas de playa/piscina, Zona de pícnic, Servicio de limpieza diario, Información turística, Canales vía satélite, Perchero, Videojuegos, Tumbonas/sillas de playa, Tetera / cafetera, Balcón, Radio, Vistas a la montaña, Aire acondicionado, Aseo adicional, Parking gratis, Piscina con vistas, Patio, Sombrillas, Noches de cine, Seguridad 24 horas, Piscina en la azotea, Lavavajillas, Zona de cocina, Horario de apertura, Dardos, Plancha para pantalones, Servicio de lavandería, Terraza, Artículos de aseo gratis, Zona de comedor, Jardín, Cafetera, Baño al aire libre, Zona privada de playa, Mesa de comedor, Horno, Boles para mascotas, Microondas, Extintores, Karaoke, Cocina, Fogones, Productos de limpieza, Zona de estar, Habitaciones familiares, Español, Inglés, Utensilios de planchado, Zona de comedor exterior, Juegos de mesa / puzles, TV de pantalla plana, Toda la unidad en la planta baja, Zona de juegos interior, Toallas, Plancha para ropa, Bañera o ducha, Barbacoa, Entrada privada, Equipamiento de juegos para exterior, Pesca, Abierta todo el año, Servicio de planchado, Vistas al mar, Llave de acceso, Prohibido fumar en todo el alojamiento, Independiente, Calefacción, Para todas las edades, Instalaciones para deportes acuáticos en el alojamiento, Ventilador, Armario, Bar en la piscina, Servicio de streaming (como Netflix), Piscina privada",https://cf.bstatic.com/xdata/images/hotel/max1024x768/580601143.jpg?k=f317daa25fe0344686f8d60854deb072320dd0eb44621919671d9bf96eb8793e&o=&hp=1,Omoa,Honduras
Muchilena fishing club & suites,https://www.booking.com/hotel/hn/muchilena-fishing-club.es.html?aid=2410095,"Muchilena fishing club & suites, que cuenta con piscina al aire libre, jardín y terraza, ofrece alojamiento en Muchilena con wifi gratis y vistas al mar. Este apartamento dispone de parking privado gratis y servicio de habitaciones.

Este apartamento con aire acondicionado consta de 1 dormitorio, una sala de estar, una zona de cocina totalmente equipada con nevera y cafetera, y 1 baño con ducha y artículos de aseo gratuitos. Hay toallas y ropa de cama en el apartamento.

El apartamento tiene zona de playa privada y barbacoa.

El aeropuerto más cercano (Aeropuerto de Puerto Barrios) está a 73 km del alojamiento.","Baño privado, Registro de entrada / salida privado, Canales por cable, Playa, Chimenea exterior, Bar, Nevera, Escritorio, Mobiliario exterior, Chimenea, Piscina al aire libre, Servicio de habitaciones, Tendedero, Apartamento privado en edificio, TV, Ropa de cama, Papel higiénico, Servicio de despertador, Vistas al jardín, Eventos deportivos en directo (emisión), Habitaciones sin humo, Albornoz, Desayuno en la habitación, Vistas, Libros, DVD o música para niños, WC, Servicio de traslado, Senderismo, Sofá, Enchufe cerca de la cama, Utensilios de cocina, Ducha, Suelo de madera o parquet, Situado frente a la playa, Wifi rápida gratis (71 Mbps), Zona de pícnic, Camas extralargas (más de 2 metros), Habitaciones comunicadas disponibles, Tetera / cafetera, Balcón, Vistas a la montaña, Aire acondicionado, Parking gratis, Patio, Lavavajillas, Zona de cocina, Entretenimiento nocturno, Servicio de lavandería, Terraza, Artículos de aseo gratis, Zona de comedor, Jardín, Cafetera, Zona privada de playa, Mesa de comedor, Horno, Piscina pequeña, Microondas, Extintores, Fogones, Zona de estar, Habitaciones familiares, Desayuno, Español, Inglés, Zona de comedor exterior, Vistas a un patio interior, TV de pantalla plana, Toda la unidad en la planta baja, Toallas, Bañera o ducha, Snorkel, Barbacoa, Entrada privada, Pesca, Abierta todo el año, Tours a pie, Vistas al mar, Lavadora, Llave de acceso, Vistas a un lugar de interés, Piragüismo, Para todas las edades, Ventilador, Independiente, Piscina privada",https://cf.bstatic.com/xdata/images/hotel/max1024x768/460816645.jpg?k=d873817df51fd9337fb0ebf75c0845f33111e23b5bcb63c1e2bdda9d909e6c74&o=&hp=1,Omoa,Honduras
MiCasa Stays,https://www.booking.com/hotel/hn/casa-habitacion-cortes.es.html?aid=2410095,"El MiCasa Stays se encuentra en Puerto Cortés y ofrece alojamiento con patio y WiFi gratuita. El alojamiento tiene vistas a la montaña y está a 50 km de San Pedro Sula.

El alojamiento está equipado con TV de pantalla plana por cable.

También hay un jardín.","Papel higiénico, Ropa de cama, Fax / fotocopiadora, Alarma de seguridad, Baño privado, Inglés, Aire acondicionado, Suelo de moqueta, Parking gratis, Habitaciones sin humo, Detectores de humo, Patio, TV de pantalla plana, Canales por cable, Toda la unidad en la planta baja, Toallas, Bañera o ducha, WC, Servicio de traslado, Centro de negocios, Zona de fumadores, Enchufe cerca de la cama, Servicio de lavandería, Ducha, Artículos de aseo gratis, Servicio de planchado, Zona de comedor, Jardín, Vestidor, Mobiliario exterior, Escritorio, Cambio de moneda, Prohibido fumar en todo el alojamiento, Mesa de comedor, Servicio de limpieza diario, Extintores, Camas extralargas (más de 2 metros), Parking en un garaje, WiFi gratis, Ventilador, Perchero, Zona de estar, Armario, TV, Servicio de streaming (como Netflix), Proporciona factura, Español",https://cf.bstatic.com/xdata/images/hotel/max1024x768/374042999.jpg?k=83039a24b99112d814996f08d6f223ee579ee035bb5c213b495020c72a02d0d9&o=&hp=1,Omoa,Honduras
Refugio de la Montaña B&B,https://www.booking.com/hotel/hn/refugio-de-la-montana-b-amp-b.es.html?aid=2410095,"Refugio de la Montaña B&B está en San Pedro Sula y ofrece alojamiento con balcón o patio, wifi gratis y TV de pantalla plana, además de piscina al aire libre y jardín.

Hay un baño privado con ducha y artículos de aseo gratuitos en cada unidad, además de secador de pelo.

El bed and breakfast dispone de terraza, además de barbacoa.

El aeropuerto más cercano (Aeropuerto Internacional Ramón Villeda Morales) está a 23 km.","Papel higiénico, Ropa de cama, Inglés, Baño privado, Vino / champán, Aire acondicionado, Aseo adicional, Utensilios de planchado, Parking gratis, Habitaciones sin humo, Salas de reuniones / banquetes, Suelo de baldosa / mármol, Detectores de humo, Desayuno en la habitación, Secador de pelo, TV de pantalla plana, Canales por cable, Menús para dietas especiales (bajo petición), Vistas, Cámaras de seguridad en las zonas comunitarias, Toallas, Bañera o ducha, WC, Cocina compartida, Barbacoa, Guardaequipaje, Proporciona factura, Habitaciones insonorizadas, Enchufe cerca de la cama, Terraza, Ducha, Artículos de aseo gratis, Abierta todo el año, Parking adaptado para personas de movilidad reducida, Jardín, Llave de acceso, Mobiliario exterior, Prohibido fumar en todo el alojamiento, Baño al aire libre, Piscina privada, Zona poco profunda, Servicio de limpieza diario, Extintores, Piscina al aire libre, Camas extralargas (más de 2 metros), Parking en un garaje, WiFi gratis, Secadora de ropa, Ventilador, Perchero, Productos de limpieza, Terraza / solárium, Tumbonas/sillas de playa, Armario, Habitaciones familiares, TV, Menú para niños, Desayuno, Español",https://cf.bstatic.com/xdata/images/hotel/max1024x768/386355185.jpg?k=ec507ca516f990e28b3d7cbec7ffcd3fd40c1b46e9701a3ca5f9e2f1cfe5b708&o=&hp=1,Omoa,Honduras
Stylish Condo In Tribeca,https://www.booking.com/hotel/hn/stylish-condo-in-tribeca.es.html?aid=2410095,"Stylish Condo In Tribeca está en San Pedro Sula y ofrece piscina al aire libre y terraza. Este apartamento tiene piscina privada, jardín y parking privado gratis.

Este apartamento tiene aire acondicionado y cuenta con 3 dormitorios, TV de pantalla plana por cable, zona de comedor y cocina con nevera y horno.

El aeropuerto (Aeropuerto Internacional Ramón Villeda Morales) está a 24 km.","Papel higiénico, Aire acondicionado, Parking gratis, Habitaciones sin humo, Sombrillas, Secador de pelo, TV de pantalla plana, Canales por cable, Horario de apertura, Vistas, Toallas, Plancha para ropa, Bañera o ducha, WC, Nevera, Terraza, Ducha, Abierta todo el año, Zona de comedor, Jardín, Vestidor, Prohibido fumar en todo el alojamiento, Tostadora, Mesa de comedor, Horno, Bañera de hidromasaje, Zona poco profunda, Microondas, Para todas las edades, Piscina al aire libre, WiFi gratis, Cocina, Bañera de hidromasaje / jacuzzi, Fogones, Piscina infinita, Tumbonas/sillas de playa, Tetera / cafetera, Inglés, Balcón, Piscina privada, Español",https://cf.bstatic.com/xdata/images/hotel/max1024x768/541910851.jpg?k=06b078238c7f7163eac98f9f7ae223ea95ad285897ad6c9373bbf559f4b143c5&o=&hp=1,Omoa,Honduras
Moderno y acogedor condominio en zona exclusiva,https://www.booking.com/hotel/hn/moderno-y-lujoso-condominio-en-zona-exclusiva.es.html?aid=2410095,"Moderno y acogedor condominio en zona exclusiva, que cuenta con piscina al aire libre abierta todo el año y vistas a la montaña, se encuentra en San Pedro Sula. Este apartamento ofrece parking privado gratis, salón de uso común y wifi gratis.

Este apartamento con aire acondicionado consta de 2 dormitorios, una sala de estar, una cocina totalmente equipada con nevera y cafetera, y 2 baños con ducha y artículos de aseo gratuitos. Hay toallas y ropa de cama en el apartamento.

El aeropuerto más cercano (Aeropuerto Internacional Ramón Villeda Morales) está a 21 km del alojamiento.","Vistas a la montaña, Ropa de cama, Papel higiénico, Inglés, Baño privado, Aire acondicionado, Cámaras de seguridad fuera del alojamiento, Gimnasio, Suelo de moqueta, Parking gratis, Habitaciones sin humo, Utensilios de planchado, Seguridad 24 horas, TV de pantalla plana, Canales por cable, Horario de apertura, Vistas, Cámaras de seguridad en las zonas comunitarias, Toallas, Plancha para ropa, Supermercado pequeño en el alojamiento, Bañera o ducha, Barbacoa, Ascensor, Entrada privada, Baños públicos, Acceso a pisos superiores en ascensor, Proporciona factura, Nevera, Zona de fumadores, Sofá, Enchufe cerca de la cama, Utensilios de cocina, Artículos de aseo gratis, Ducha, Abierta todo el año, Parking adaptado para personas de movilidad reducida, Servicio de lavandería, Lavadora, Zona de comedor, Vestidor, Cafetera, Mobiliario exterior, Piscina de agua salada, Servicio de limpieza en seco, Zona TV / salón de uso compartido, Mesa de comedor, Horno, Zona poco profunda, Tobogán de agua, Microondas, Para todas las edades, Piscina al aire libre, Extintores, Parking en un garaje, WiFi gratis, Cocina, Secadora de ropa, Minibar, Apartamento privado en edificio, Fogones, Productos de limpieza, Toallas / sábanas (por un suplemento), Zona de estar, Tumbonas/sillas de playa, Tetera / cafetera, Armario, Habitaciones familiares, Servicio de streaming (como Netflix), TV, Balcón, Piscina privada, Español",https://cf.bstatic.com/xdata/images/hotel/max1024x768/371836049.jpg?k=0d5ede9acb6443e247670db689cbf7bc4898055ef0fbd25b29436b72061b92c8&o=&hp=1,Omoa,Honduras
Casa en residencial Puertas del Sol,https://www.booking.com/hotel/hn/casa-en-residencial-puertas-del-sol.es.html?aid=2410095,"Casa en residencial Puertas del Sol se encuentra en San Pedro Sula y ofrece terraza. Esta casa o chalet dispone de piscina privada, jardín y parking privado gratis.

Esta casa o chalet con aire acondicionado consta de 5 dormitorios independientes, una sala de estar, una cocina totalmente equipada y 4 baños. Se ofrece TV de pantalla plana.

La casa o chalet ofrece bañera de hidromasaje.

El aeropuerto más cercano (Aeropuerto Internacional Ramón Villeda Morales) está a 20 km del alojamiento.","Cocina, Jardín, Bañera de hidromasaje / jacuzzi, TV de pantalla plana, Baño compartido, Aire acondicionado, Bañera de hidromasaje, Parking gratis, Terraza, Balcón, Piscina, Piscina privada, Español, WiFi gratis, Lavadora",https://cf.bstatic.com/xdata/images/hotel/max1024x768/566151651.jpg?k=c121cd6c0e1404cedf781e2a6d999e95375fdc2e533922fa2633d2808128d45e&o=&hp=1,Omoa,Honduras
DaVinciHouse,https://www.booking.com/hotel/hn/davincihouse.es.html?aid=2410095,"DaVinciHouse, que cuenta con piscina al aire libre, terraza y bar, ofrece alojamiento en San Pedro Sula con wifi gratis y vistas a la montaña. Este alojamiento ofrece piscina privada y parking privado gratis.

Esta casa o chalet tiene aire acondicionado y cuenta con 4 dormitorios, TV de pantalla plana, zona de comedor y cocina con nevera y horno.

El aeropuerto más cercano (Aeropuerto Internacional Ramón Villeda Morales) está a 24 km del alojamiento.","Vistas a la montaña, Papel higiénico, Inglés, Aire acondicionado, Parking gratis, Habitaciones sin humo, Zona de comedor exterior, Patio, Secador de pelo, TV de pantalla plana, Zona de cocina, Horario de apertura, Vistas, Toallas, WC, Bar, Nevera, Terraza, Ducha, Abierta todo el año, Zona de comedor, Prohibido fumar en todo el alojamiento, Tostadora, Mesa de comedor, Toallas de playa/piscina, Horno, Microondas, Para todas las edades, Piscina al aire libre, WiFi gratis, Cocina, Minibar, Fogones, Piscina infinita, Tumbonas/sillas de playa, Tetera / cafetera, TV, Servicio de streaming (como Netflix), Muebles de exterior, Balcón, Piscina privada, Español",https://cf.bstatic.com/xdata/images/hotel/max1024x768/549602479.jpg?k=c1822c457f4a9d89ef10af9b417959eb6253ecffd508e71dc2c8616d2f081b11&o=&hp=1,Omoa,Honduras
