hotel,price,score,avg_review,reviews_count,image_links,hotel_url,popular_facilities,city,country,description
Quality Hotel Melbourne Airport,US$120,"8,2",Muy bien,3.173,https://cf.bstatic.com/xdata/images/hotel/max1024x768/367031459.webp?k=a7ff436ffd67a5db760d9f513cfc4c94e3b009272a0945578603050ae35ca25f&o=,https://www.booking.com/hotel/au/quality-melbourne-airport.es.html?aid=2410095,"Guardaequipaje, Seguridad 24 horas, Tetera/cafetera en todas las habitaciones, Toallas, Servicio de despertador, Prohibido fumar en todo el alojamiento, Suelo de moqueta, Servicio de conserjería, Plancha para ropa, Baño privado, Fax / fotocopiadora, Artículos de aseo gratis, Calefacción, Taquillas, Bar, Cámaras de seguridad fuera del alojamiento, Ropa de cama, Enchufe cerca de la cama, Ducha, Servicio de despertador / alarma, Servicio de lavandería, Reloj despertador, Chino, Aire acondicionado, Traslado aeropuerto, Ascensor, Máquina expendedora (aperitivos), TV de pantalla plana, Terraza, Registro de entrada / salida privado, Horario de apertura, Centro de negocios, Servicio de limpieza en seco, Tarjeta de acceso, Habitaciones sin humo, Parking en la calle, Vino / champán, Salas de reuniones / banquetes, Inglés, WiFi gratis, Utensilios de planchado, De temporada, Parking adaptado para personas de movilidad reducida, Para todas las edades, Parking privado, Tarjetas de transporte público, Máquina expendedora (bebidas), Zona TV / salón de uso compartido, Registro de entrada y salida exprés, Escritorio, Detectores de humo, Instalaciones de spa, Papel higiénico, Armario, WC, Hervidor eléctrico, Nevera, TV, Extintores, Piscina al aire libre, Piscina de agua salada, Secador de pelo, Tetera / cafetera, Cámaras de seguridad en las zonas comunitarias, Jardín, Teléfono, Habitaciones familiares, Alarma de seguridad, Servicio de traslado, Mobiliario exterior, Zona de pícnic, Proporciona factura, Desayuno fabuloso, Recepción 24 horas, Traslado aeropuerto (gratis)",Sunbury,Australia,"Quality Hotel Melbourne Airport is 7 minutes' drive from Melbourne Tullamarine Airport. It offers free WiFi, a free 24-hour airport shuttle and free overnight Parking during your stay. Long Term parking is available. Guests also enjoy a swimming pool and an outdoor spa.

The air-conditioned rooms feature a seating area, a TV with free cable channels, a work desk and tea/coffee making facilities.

Our Restaurant and Bar are only Opened Monday to Friday. On Weekends, our Bar and Restaurant are completely closed. Our Restaurant only offers Breakfast and Dinner from Monday to Friday.

Quality Hotel Melbourne Airport is 20 minutes' drive from central Melbourne. There are bus stops within metres of the hotel."
"Holiday Inn Melbourne Airport, an IHG Hotel",US$183,"8,2",Muy bien,6.452,https://cf.bstatic.com/xdata/images/hotel/max1024x768/449814889.webp?k=544da96bcc92237b0d3ba057f171ad10bac93e382b4eb806ed20eea5fe1a6aac&o=,https://www.booking.com/hotel/au/holiday-inn-melbourne-airport.es.html?aid=2410095,"Snack-bar, Seguridad 24 horas, Toallas, Apoyo visual: carteles táctiles, Baño privado, Servicio de habitaciones, Fax / fotocopiadora, Zona de fumadores, Servicio de lavandería, Proporciona factura, Traslado aeropuerto, Ascensor, Restaurante, Centro de negocios, Servicio de limpieza en seco, Caja fuerte para ordenador portátil, Habitaciones sin humo, Menús para dietas especiales (bajo petición), Servicio de limpieza diario, Utensilios de planchado, Acceso a pisos superiores solo mediante escaleras, Acceso a pisos superiores en ascensor, Papel higiénico, Hervidor eléctrico, WC, TV, Buen desayuno, Secador de pelo, Servicio de despertador, Prohibido fumar en todo el alojamiento, Suelo de moqueta, Menú para niños, Cámaras de seguridad fuera del alojamiento, Bar, Servicio de despertador / alarma, Aire acondicionado, Canales vía satélite, Parking privado, Escritorio, Plancha para pantalones, Nevera, Extintores, Teléfono, Caja fuerte, Mobiliario exterior, Recepción 24 horas, Guardaequipaje, Canales por cable, Desayuno en la habitación, Artículos de aseo gratis, Calefacción, Ropa de cama, Cafetería en el alojamiento, TV de pantalla plana, Tarjeta de acceso, Salas de reuniones / banquetes, Adaptado para sillas de ruedas, WiFi gratis, WC con barras de apoyo, Detectores de humo, Armario, Tetera / cafetera, Cámaras de seguridad en las zonas comunitarias, Habitaciones familiares, Servicio de planchado, Servicio de traslado, Bañera, Parking adaptado para personas de movilidad reducida, Traslado aeropuerto (gratis), Tetera/cafetera en todas las habitaciones, Plancha para ropa, Ducha, Reloj despertador, Apoyo visual: braille, Adaptado personas de movilidad reducida, Radio, Inglés, Cuerda de emergencia en el baño, Jardín, Gimnasio, Habitaciones insonorizadas",Sunbury,Australia,"Located only 400 metres from the airport terminals, Holiday Inn Melbourne Airport offers complimentary shuttle service 24 hours. Guests enjoy sound-proofed rooms, a fitness centre, restaurant and bar. On-site parking is available. WiFi is available through the property.

All of the rooms at Holiday Inn Melbourne Airport feature a refrigerator and tea/coffee making facilities. They offer an LCD satellite TV, work desk and minibar. The hotel offers 24-hour room service and there are monitors in the lobby providing live flight information both day and night.

The restaurant serves modern Australian cuisine and local wines and the bar offers drinks and coffee.

Holiday Inn Melbourne Airport is close to a range of local attractions including Westfield Shopping Centre, UrbnSurf and Essendon's DFO shopping complex are less than 15 minutes’ drive away. Holiday Inn Melbourne is 22 km away from the centre of Melbourne."
Mantra Melbourne Airport,US$137,"7,8",Bien,3.610,https://cf.bstatic.com/xdata/images/hotel/max1024x768/68783554.webp?k=58d791f6464c3c51f163ff96b6c2cc3c0cb8aacb876906a6102a4c18b5ca3a71&o=,https://www.booking.com/hotel/au/mantra-tullamarine.es.html?aid=2410095,"Seguridad 24 horas, Toallas, Baño privado, Servicio de habitaciones, Fax / fotocopiadora, Zona de fumadores, Spa y centro de bienestar, Chino, Proporciona factura, Abierta todo el año, Traslado aeropuerto, Ascensor, Piscina climatizada, Restaurante, Centro de negocios, Servicio de limpieza en seco, Habitaciones sin humo, Italiano, Buffet para niños, Servicio de limpieza diario, Utensilios de planchado, Parking en el alojamiento, Happy hour, Albanés, Acceso a pisos superiores en ascensor, Papel higiénico, Hervidor eléctrico, WC, TV, Buen desayuno, Secador de pelo, Alarma de seguridad, Parking en un garaje, Servicio de despertador, Prohibido fumar en todo el alojamiento, Suelo de moqueta, Menú para niños, Cámaras de seguridad fuera del alojamiento, Bar, Servicio de despertador / alarma, Piscina interior, Hindi, Piscina con vistas, Aire acondicionado, Horario de apertura, Canales vía satélite, Escritorio, Insonorización, Plancha para pantalones, Nevera, Extintores, Teléfono, Caja fuerte, Recepción 24 horas, Guardaequipaje, Servicio de conserjería, Sauna, Bañera o ducha, Artículos de aseo gratis, Calefacción, Ropa de cama, Cafetería en el alojamiento, TV de pantalla plana, Tarjeta de acceso, Vino / champán, Salas de reuniones / banquetes, WiFi gratis, Detectores de humo, Instalaciones de spa, Armario, Tetera / cafetera, Cámaras de seguridad en las zonas comunitarias, Habitaciones familiares, Servicio de planchado, Servicio de traslado, Parking adaptado para personas de movilidad reducida, Traslado aeropuerto (gratis), Tetera/cafetera en todas las habitaciones, Plancha para ropa, Enchufe cerca de la cama, Ducha, Piscina en la azotea, Reloj despertador, Baño de vapor, Adaptado personas de movilidad reducida, Radio, Inglés, Para todas las edades, Registro de entrada y salida exprés, Filipino, Jardín, Gimnasio, Habitaciones insonorizadas",Sunbury,Australia,"El Mantra Tullamarine es un hotel moderno situado a 9 minutos en coche del aeropuerto internacional de Melbourne y ofrece servicio gratuito de enlace con el aeropuerto y piscina cubierta con vistas a la ciudad. Hay conexión WiFi gratuita.

Las habitaciones del Mantra Tullamarine Hotel tienen aire acondicionado, zona de estar y TV vía satélite de pantalla plana. Algunas también cuentan con bañera de hidromasaje en el baño.

El restaurante Woodlands sirve platos de cocina australiana y europea elaborados con ingredientes frescos de la zona. En el bar salón Woodlands se puede disfrutar de tés de hierbas y bocadillos, todo biológico.

El Mantra Tullamarine alberga una sauna y centro de fitness.

Además, el The Mantra Tullamarine Hotel se encuentra a 17 km del centro de Melbourne y a 5 minutos en coche del parque Gladstone."
Ciloms Airport Lodge,US$137,"7,9",Bien,5.857,https://cf.bstatic.com/xdata/images/hotel/max1024x768/57612662.webp?k=e594e3609065a7fc6a41a1568681dd226bb972e649116e9baa264dd6f25ce62e&o=,https://www.booking.com/hotel/au/ciloms-airport-lodge.es.html?aid=2410095,"Billar, Snack-bar, Toallas, Apoyo visual: carteles táctiles, Lavamanos más bajo, Baño privado, Servicio de habitaciones, Fax / fotocopiadora, Toda la unidad en la planta baja, Libros, DVD o música para niños, Zona de fumadores, Servicio de lavandería, Chino, Toallas de playa/piscina, Proporciona factura, Abierta todo el año, Traslado aeropuerto, Ascensor, Piscina climatizada, Restaurante, Habitaciones sin humo, Menús para dietas especiales (bajo petición), Servicio de limpieza diario, Utensilios de planchado, Máquina expendedora (bebidas), Acceso a pisos superiores en ascensor, Papel higiénico, Hervidor eléctrico, WC, TV, Buen desayuno, Secador de pelo, Servicio de despertador, Prohibido fumar en todo el alojamiento, Suelo de moqueta, Menú para niños, Croata, Cámaras de seguridad fuera del alojamiento, Bar, Servicio de despertador / alarma, Piscina interior, Aire acondicionado, Máquina expendedora (aperitivos), Horario de apertura, Microondas, Canales vía satélite, Parking privado, Escritorio, Insonorización, Nevera, Extintores, Campo de golf (a menos de 3 km), Teléfono, Recepción 24 horas, Guardaequipaje, Secadora de ropa, Canales por cable, Sauna, Desayuno en la habitación, Perchero, Artículos de aseo gratis, Calefacción, Ropa de cama, Reproductor de DVD, Cafetería en el alojamiento, TV de pantalla plana, Vino / champán, Salas de reuniones / banquetes, Adaptado para sillas de ruedas, WiFi gratis, WC con barras de apoyo, Lavadora, Detectores de humo, Armario, Hipoalergénico, Piscina de agua salada, Tetera / cafetera, Cámaras de seguridad en las zonas comunitarias, Habitaciones familiares, Servicio de traslado, Traslado aeropuerto (gratis), WC elevado, Tetera/cafetera en todas las habitaciones, Plancha para ropa, Enchufe cerca de la cama, Ducha, Reloj despertador, Llave de acceso, Adaptado personas de movilidad reducida, Radio, Inglés, Zona poco profunda, Habitaciones insonorizadas",Sunbury,Australia,"Just a 7 minutes’ drive from Melbourne International Airport, Ciloms Lodge features free WiFi access and indoor swimming pool. A free airport shuttle is available at any time of the day. Air-conditioned rooms come with a flat-screen satellite TV.

Ciloms Airport Lodge is a 25-minute drive from the Melbourne city centre. Melbourne Zoo and the University of Melbourne are each 20 minutes’ drive away.

All rooms come with en suite bathrooms with a hairdryer. Each room includes a refrigerator, microwave and tea and coffee making facilities.
The 24-hour front desk can arrange and luggage storage services."
Melbourne Airport Motel,US$118,"8,4",Muy bien,1.024,https://cf.bstatic.com/xdata/images/hotel/max1024x768/174496902.webp?k=e627d54962ed10b2c508be4121922b3fa79db7f93ec7e3f9d70c04a846fb388e&o=,https://www.booking.com/hotel/au/melbourne-airport-motel.es.html?aid=2410095,"WC elevado, Tetera/cafetera en todas las habitaciones, Toallas, Suelo de moqueta, Plancha para ropa, Lavamanos más bajo, Baño privado, Desayuno en la habitación, Bañera o ducha, Toallas / sábanas (por un suplemento), Artículos de aseo gratis, Fax / fotocopiadora, Cámaras de seguridad fuera del alojamiento, Zona de fumadores, Muebles de exterior, Ropa de cama, Ducha, Enchufe cerca de la cama, Calefacción, Reloj despertador, Patio, Llave de acceso, Aire acondicionado, TV de pantalla plana, Registro de entrada / salida privado, Adaptado personas de movilidad reducida, Microondas, Servicio de streaming (como Netflix), Parking gratis, Habitaciones sin humo, Inglés, Adaptado para sillas de ruedas, WiFi gratis, Balcón, Servicio de limpieza diario, Utensilios de planchado, WC con barras de apoyo, Registro de entrada y salida exprés, Detectores de humo, Acceso a pisos superiores solo mediante escaleras, Papel higiénico, Hervidor eléctrico, WC, Nevera, TV, Extintores, Secador de pelo, Tetera / cafetera, Teléfono, Habitaciones familiares, Alarma de seguridad, Caja fuerte, Proporciona factura, Parking adaptado para personas de movilidad reducida",Sunbury,Australia,"El Melbourne Airport Motel se encuentra a 3,2 km de las terminales del aeropuerto de Melbourne. Se encuentra a 5 minutos en coche del aeropuerto de Melbourne Tullamarine y a 20 minutos en coche del centro de la ciudad.

Todas las habitaciones están equipadas con aire acondicionado, microondas, tostadora, hervidor de agua, ducha, artículos de aseo gratuitos y escritorio. Las habitaciones del motel tienen baño privado y WiFi gratuita. Todas las habitaciones incluyen nevera.

El Melbourne Airport Motel está a solo 1 km del centro comercial Gladstone Park y a 3,2 km de UrbnSurf. El centro comercial Westfield del Airport West está a menos de 10 minutos y el centro comercial Essendon DFO, a 15 minutos."
Nightcap at Coolaroo Hotel,US$106,"8,3",Muy bien,303,https://cf.bstatic.com/xdata/images/hotel/max1024x768/92065666.webp?k=f526885122b70cef9a2a1da9ad3b0884bfdb5c1b012a411f39224896110edad5&o=,https://www.booking.com/hotel/au/coolaroo.es.html?aid=2410095,"Billar, Guardaequipaje, Snack-bar, Almuerzos para llevar, Toallas, Prohibido fumar en todo el alojamiento, Zona de juegos interior, Menú para niños, Cajero automático en el hotel, Baño privado, Servicio de habitaciones, Fax / fotocopiadora, Artículos de aseo gratis, Vistas, Cámaras de seguridad fuera del alojamiento, Bar, Zona de fumadores, Calefacción, Enchufe cerca de la cama, Ducha, Toda la unidad en la planta baja, Sala de juegos, Aire acondicionado, Cafetería en el alojamiento, Restaurante, TV de pantalla plana, Registro de entrada / salida privado, Barandillas protectoras para bebés, Terraza / solárium, Eventos deportivos en directo (emisión), Parking gratis, Tarjeta de acceso, Habitaciones sin humo, Parking en la calle, Zona de juegos para niños, Vino / champán, Menús para dietas especiales (bajo petición), Salas de reuniones / banquetes, Inglés, WiFi gratis, Servicio de limpieza diario, Utensilios de planchado, Zona TV / salón de uso compartido, Escritorio, Detectores de humo, Papel higiénico, Armario, WC, Hervidor eléctrico, Nevera, TV, Extintores, Cámaras de seguridad en las zonas comunitarias, Jardín, Dardos, Plancha para ropa, Habitaciones familiares, Alarma de seguridad, Suelo de moqueta, Mobiliario exterior, Parking adaptado para personas de movilidad reducida",Sunbury,Australia,"El Coolaroo Hotel cuenta con un bistró y un parque infantil cubierto. Está situado a 5 minutos en coche del centro comercial Broadmeadows y ofrece habitaciones con TV.

El bistró Coolaroo sirve platos deliciosos, como parmesana de pollo, asado del día y cesta de pescado. También hay un bar que ofrece bebidas refrescantes.

El Coolaroo Hotel está a menos de 10 minutos en coche del circuito de carreras The Meadows Melbourne Greyhound y del circuito de carreras Broadmeadows Motor. El aeropuerto de Melbourne está a 15 minutos en coche.

Todas las habitaciones están equipadas con escritorio, utensilios de planchado, teléfono y nevera.  El baño privado incluye ducha y aseo. En la recepción se ofrecen secadores de pelo y reproductores de DVD bajo petición."
Hume Villa Motor Inn,US$97,"8,1",Muy bien,622,https://cf.bstatic.com/xdata/images/hotel/max1024x768/2438171.webp?k=3b248838e76fb683491f0711c7df02d12aca58c1decca535301469f4ac8df6e1&o=,https://www.booking.com/hotel/au/hume-villa-motor-inn.es.html?aid=2410095,"Guardaequipaje, Seguridad 24 horas, Prohibido fumar en todo el alojamiento, Fax / fotocopiadora, Calefacción, Cámaras de seguridad fuera del alojamiento, Zona de fumadores, Servicio de lavandería, Llave de acceso, Aire acondicionado, Terraza, Adaptado personas de movilidad reducida, Parking gratis, Servicio de limpieza en seco, Habitaciones sin humo, Zona de juegos para niños, Vino / champán, Inglés, WiFi gratis, Servicio de limpieza diario, Detectores de humo, Extintores, Cámaras de seguridad en las zonas comunitarias, Jardín, Habitaciones familiares, Alarma de seguridad, Caja fuerte, Proporciona factura, Mobiliario exterior, Parking adaptado para personas de movilidad reducida",Sunbury,Australia,"El Hume Villa Motor Inn está situado en Fawkner y ofrece alojamiento económico, bañera de hidromasaje doble y conexión Wi-Fi gratuita. La estación de Gowrie está a menos de 5 minutos a pie.

Las habitaciones del Hume Villa Inn son amplias y están equipadas con artículos de aseo y aire acondicionado.

El Hume Villa Motor Inn está a 15 km del aeropuerto internacional de Melbourne."
PARKROYAL Melbourne Airport,US$250,"7,7",Bien,4.925,https://cf.bstatic.com/xdata/images/hotel/max1024x768/518715977.webp?k=4cf20b5fa696890bf77b848d16e9fbc78f6c8a56755968da0bfe615260193db3&o=,https://www.booking.com/hotel/au/parkroyal-melbourne-airport.es.html?aid=2410095,"Snack-bar, Seguridad 24 horas, Toallas, Baño privado, Servicio de habitaciones, Fax / fotocopiadora, Albornoz, Zona de fumadores, Servicio de lavandería, Chino, Toallas de playa/piscina, Abierta todo el año, Ascensor, Restaurante, Habitaciones hipoalergénicas, Rumano, Centro de negocios, Servicio de limpieza en seco, Caja fuerte para ordenador portátil, Alemán, Habitaciones sin humo, Cafetera, Menús para dietas especiales (bajo petición), Francés, Italiano, Servicio de limpieza diario, Utensilios de planchado, Información turística, Parking en el alojamiento, Acceso a pisos superiores en ascensor, Papel higiénico, Hervidor eléctrico, WC, Guiado auditivo, TV, Buen desayuno, Secador de pelo, Sofá, Alarma de seguridad, Turco, Parking en un garaje, Canales de pago, Servicio de despertador, Prohibido fumar en todo el alojamiento, Suelo de moqueta, Menú para niños, Croata, Vistas, Cámaras de seguridad fuera del alojamiento, Bar, Servicio de despertador / alarma, Piscina interior, Hindi, Aire acondicionado, Indonesio, Horario de apertura, Taquillas en el gimnasio / spa, Canales vía satélite, Tamil, Árabe, Plancha para pantalones, Extintores, Nevera, Campo de golf (a menos de 3 km), Teléfono, Caja fuerte, Recepción 24 horas, Guardaequipaje, Canales por cable, Tumbonas/sillas de playa, Bañera de hidromasaje / jacuzzi, Servicio de conserjería, Cajero automático en el hotel, Sauna, Desayuno en la habitación, Bañera o ducha, Artículos de aseo gratis, Calefacción, Ropa de cama, Cafetería en el alojamiento, Servicio de aparcacoches, TV de pantalla plana, Panyabí, Zapatillas, Tarjeta de acceso, Vino / champán, Salas de reuniones / banquetes, Coreano, Adaptado para sillas de ruedas, WiFi gratis, WC con barras de apoyo, Detectores de humo, Instalaciones de spa, Armario, Tetera / cafetera, Vietnamita, Cámaras de seguridad en las zonas comunitarias, Zona de spa / relajación, Habitaciones familiares, Servicio de planchado, Bañera, Fruta, Parking adaptado para personas de movilidad reducida, WC elevado, Tetera/cafetera en todas las habitaciones, Bosnio, Alquiler de coches, Plancha para ropa, Ducha, Reloj despertador, Baño de vapor, Polaco, Adaptado personas de movilidad reducida, Radio, Inglés, Para todas las edades, Sueco, Minibar, Registro de entrada y salida exprés, Canguro / servicios para niños, Filipino, Gimnasio, Proporciona factura, Zona de estar",Sunbury,Australia,"Offering a connection to the airport terminals via a pedestrian skybridge, this award-winning hotel is located in Melbourne and features an indoor heated pool, spa, sauna and steam room.

You can choose to re-energise with a workout in the 24-hour onsite fitness centre, which features state-of-the-art equipment. Grab a bite to eat or a drink, in the restaurant, bar or café or enjoy your meal or snack from the comfort of your room, from the mini fridge or 24-hour room service.

All guest rooms and suites at PARKROYAL Melbourne Airport  feature thoughtful touches such as pillow menus, bathrobes and slippers, plus free WiFi, LCD TVs with satellite channels and toiletries. Enjoy views of the runway, city skyline or the Macedon Ranges. Business-friendly amenities include complimentary newspapers and telephones. Additionally, rooms include an iron/ironing board and blackout curtains. In-room massages and hypoallergenic bedding can be requested. Housekeeping is provided on a daily basis.

PARKROYAL Melbourne Airport is just 20 minutes’ drive from Melbourne city centre. Melbourne Zoo is 19 km from the property, while DFO Essendon is a 20-minute drive away."
Gisborne Peak Winery Short Term Stays,US$187,"8,5",Muy bien,144,https://cf.bstatic.com/xdata/images/hotel/max1024x768/485591623.webp?k=b0dac7308c956674b6df913704c15770212b9733a561c3b46cfde11d09b00ce4&o=,https://www.booking.com/hotel/au/gisborne-peak-winery-eco-cottages.es.html?aid=2410095,"Billar, WC elevado, Snack-bar, Tetera/cafetera en todas las habitaciones, Toallas, Vistas a la montaña, Mantas eléctricas, Plancha para ropa, Baño privado, Desayuno en la habitación, Bañera o ducha, Artículos de aseo gratis, Vistas, Perchero, Bar, Mesa de comedor, Ropa de cama, Enchufe cerca de la cama, Ducha, Cámaras de seguridad fuera del alojamiento, Zona de fumadores, Calefacción, Patio, Tostadora, Llave de acceso, Aire acondicionado, Juegos de mesa / puzles, Cafetería en el alojamiento, Desayuno excepcional, Restaurante, TV de pantalla plana, Terraza, Registro de entrada / salida privado, Adaptado personas de movilidad reducida, Microondas, Zona de comedor, Vistas al lago, Barbacoa, Parking gratis, Utensilios de cocina, Habitaciones sin humo, Vino / champán, Menús para dietas especiales (bajo petición), Inglés, Adaptado para sillas de ruedas, WiFi gratis, Utensilios de planchado, WC con barras de apoyo, De temporada, Minibar, Registro de entrada y salida exprés, Detectores de humo, Solo para adultos, Papel higiénico, Armario, WC, Vistas al jardín, Hervidor eléctrico, Nevera, TV, Piscina al aire libre, Zona de comedor exterior, Tetera / cafetera, Extintores, Sofá, Jardín, Entrada privada, Vistas a un lugar de interés, Zona de pícnic, Proporciona factura, Mobiliario exterior, Zona de estar",Sunbury,Australia,"El Gisborne Peak Winery Eco-Cottages se encuentra a 15 minutos en coche del centro de Gisborne y del club de golf de Gisborne. Ofrece zona de barbacoa y aparcamiento gratuito. Incluye productos de desayuno gratuitos. Cada cabaña cuenta con recursos energéticos sostenibles y renovables.

Las cabañas son solo para adultos y cuentan con zona de cocina con microondas, nevera y set de té y café. También incluye barbacoa al aire libre, sartén eléctrica, utensilios de planchado y TV de pantalla plana. Atención: la conexión WiFi no es fiable en la colina hasta las cabañas. Las cabañas ofrecen un desayuno gratuito con huevos, beicon, pan, yogur, cereales, leche, mermeladas y mantequilla.

También hay un Four Bedroom Guest House independiente disponible en el establecimiento. El desayuno no está incluido en el precio.

El Cellar Door Cafe sirve aperitivos y pizzas al horno de leña. Todos están situados en los terrenos de un viñedo y los huéspedes pueden dar un paseo por el hermoso jardín.

El Eco-Cottages Gisborne Peak Winery se encuentra a 20 minutos en coche de Kyneton y de la roca colgante. Daylesford y Melbourne están a 50 minutos en coche."
