hotel,price,score,avg_review,reviews_count,image_links,hotel_url,popular_facilities,city,country,description
The Harry Potter Suite,US$76,ver...,,ver...,https://cf.bstatic.com/xdata/images/hotel/max1024x768/531223978.webp?k=7a7f85e1498cdc2bbc6bc868a2a583d5fc582a88dba393015f411dbc124ebfdb&o=,https://www.booking.com/hotel/au/the-harry-potter-suite.es.html?aid=2410095,"Prohibido fumar en todo el alojamiento, Inglés, Baño privado, WiFi gratis, Japonés",Surry Hills,Australia,"The Harry Potter Suite, que está a 2,8 km de Centro de Convenciones Internacional de Sídney y a 2,9 km de Museo Hyde Park Barracks, ofrece habitaciones en Sídney. El alojamiento está a unos 3,1 km de Galería de arte de Nueva Gales del Sur, a 3,1 km de Museo Marítimo Nacional de Australia y a 3,3 km de Centro de eventos The Star. Este alojamiento libre de humo se encuentra a 14 min a pie de Estación Central de Sídney.

Las habitaciones del alojamiento tienen baño privado y wifi gratis.

Real Jardín Botánico de Sídney está a 5 km del alojamiento, y Estación de autobús y tren Bondi Junction está a 5,1 km. El aeropuerto más cercano (Aeropuerto Kingsford Smith de Sídney) está a 7 km del alojamiento."
Your B&B steps into Oxford St,US$1.545,ver...,,ver...,https://cf.bstatic.com/xdata/images/hotel/max1024x768/520218684.webp?k=c49b19ef9fed79bf3922bdc5473ad30f767ebc3cb162fe2f0b880b0d834c2b78&o=,https://www.booking.com/hotel/au/your-b-amp-b-steps-into-oxford-st.es.html?aid=2410095,"Filipino, TV de pantalla plana, WiFi gratis, Calefacción, Zona de cocina, Tailandés",Surry Hills,Australia,"Your B&B steps into Oxford St se encuentra en el barrio de Surry Hills, en Sídney, a 18 min a pie de Museo Hyde Park Barracks, a 1,7 km de Galería de arte de Nueva Gales del Sur y a 2,6 km de Centro de Convenciones Internacional de Sídney. El alojamiento está a 16 min a pie de Estación Central de Sídney y dispone de wifi gratis en todo el alojamiento.

Este apartamento cuenta con 1 dormitorio, TV de pantalla plana y zona de cocina.

Real Jardín Botánico de Sídney está a 2,8 km del alojamiento, y Museo Marítimo Nacional de Australia está a 2,8 km. El aeropuerto más cercano (Aeropuerto Kingsford Smith de Sídney) está a 8 km del alojamiento."
The Pacific House,US$48,"8,5",Muy bien,2.238,https://cf.bstatic.com/xdata/images/hotel/max1024x768/407141764.webp?k=a34681da7bbeb5fa3d652a40072e82abf880e65ea367bb404f8f6fcb3b2a15f9&o=,https://www.booking.com/hotel/au/the-pacific-house.es.html?aid=2410095,"Guardaequipaje, Almuerzos para llevar, Seguridad 24 horas, Vistas a la ciudad, Alquiler de coches, Prohibido fumar en todo el alojamiento, Suelo de moqueta, Servicio de entrega de comestibles, Solo para adultos, Vistas, Calefacción, Taquillas, Cocina compartida, Cámaras de seguridad fuera del alojamiento, Ropa de cama, Enchufe cerca de la cama, Ducha, Zona de fumadores, Servicio de lavandería, Clases de yoga, Aire acondicionado, Juegos de mesa / puzles, Ascensor, Terraza, Alquiler de bicicletas, Adaptado personas de movilidad reducida, Eventos deportivos en directo (emisión), Español, Toda la unidad accesible en silla de ruedas, Caja fuerte para ordenador portátil, Alemán, Habitaciones sin humo, Vino / champán, Personal de animación, Inglés, Noches de cine, Entretenimiento nocturno, Adaptado para sillas de ruedas, Francés, Italiano, WiFi gratis, Servicio de limpieza diario, WC con barras de apoyo, Tours a pie, Parking, Zona TV / salón de uso compartido, Registro de entrada y salida exprés, Detectores de humo, Equipamiento de bádminton, Acceso a pisos superiores en ascensor, Armario, WC, Ruta de bares, Extintores, Buen desayuno, Cámaras de seguridad en las zonas comunitarias, Caja fuerte, Proporciona factura, Mobiliario exterior, Recepción 24 horas, Parking en un garaje",Surry Hills,Australia,"The Pacific House está muy bien situado en el barrio de Woolloomooloo, Sídney, a 6 min a pie de Museo Hyde Park Barracks, a 400 metros de Galería de arte de Nueva Gales del Sur y a 12 min a pie de Real Jardín Botánico de Sídney. Todas las opciones de alojamiento de este albergue de 4 estrellas tienen vistas a la ciudad, salón de uso común y terraza. El alojamiento ofrece ocio nocturno y cocina compartida.

En el albergue, cada habitación cuenta con armario. Todas las habitaciones tienen caja fuerte y wifi gratis, y algunas también ofrecen balcón. Todas las unidades disponen de ropa de cama.

En el alojamiento se puede disfrutar de un desayuno buffet, continental o vegetariano.

En la recepción 24 horas se hablan varios idiomas, como alemán, inglés, español y francés.

Cerca del alojamiento hay puntos de interés como Centro de Convenciones Internacional de Sídney, Circular Quay y Ópera de Sídney. El aeropuerto más cercano (Aeropuerto Kingsford Smith de Sídney) está a 11 km."
YHA Sydney Central,US$45,"7,7",Bien,4.869,https://cf.bstatic.com/xdata/images/hotel/max1024x768/440057339.webp?k=930604e57fb3ca7f920361cd5449912d2f2b923437db1e0d6dabd3c022283887&o=,https://www.booking.com/hotel/au/sydney-central-yha.es.html?aid=2410095,"Guardaequipaje, Supermercado pequeño en el alojamiento, Seguridad 24 horas, Desayuno, Alquiler de coches, Prohibido fumar en todo el alojamiento, Suelo de moqueta, Fax / fotocopiadora, Calefacción, Taquillas, Bar, Cocina compartida, Ropa de cama, Enchufe cerca de la cama, Piscina interior, Ducha, Cámaras de seguridad fuera del alojamiento, Servicio de lavandería, Discoteca / DJ, Piscina en la azotea, Hindi, Portugués, Aire acondicionado, Abierta todo el año, Cafetería en el alojamiento, Máquina expendedora (aperitivos), Ascensor, Restaurante, Mandarín, Terraza, Polaco, Adaptado personas de movilidad reducida, Terraza / solárium, Karaoke, Barbacoa, Tarjeta de acceso, Español, Alemán, Habitaciones sin humo, Personal de animación, Salas de reuniones / banquetes, Noches de cine, Entretenimiento nocturno, Inglés, Francés, Italiano, WiFi gratis, Holandés, Parking adaptado para personas de movilidad reducida, Tours a pie, Parking privado, Información turística, Zona de fumadores, Máquina expendedora (bebidas), Para todas las edades, Zona TV / salón de uso compartido, Detectores de humo, Papel higiénico, WC, Urdú, Extintores, Cámaras de seguridad en las zonas comunitarias, Filipino, Proporciona factura, Recepción 24 horas, Parking en un garaje",Surry Hills,Australia,"This award-winning hostel, with indoor pool is housed in a heritage listed building opposite Central Station in Sydney CBD (Central Business District). Guests enjoy panoramic views of the city from the rooftop outdoor area.

YHA Sydney Central offers shared dormitory accommodation as well as private rooms. Guests have access to a free WiFi throughout the Hostel, 2 kitchens, spacious dining and lounge areas and a guest laundry. There is an on-site cinema where guests can catch the latest films.

The hostel has its own travel agency, café, restaurant and BBQ facilities. Located in the basement, Schirrmo's Bar is open for drinks most evenings.

Sydney International Airport is 10 km from YHA Sydney Central and is directly accessible from Central Station. Activities include pizza nights, walking tours, movie nights with free popcorn and rooftop BBQs. The Haymarket stop for the light rail is located at the doorstep of YHA Sydney Central."
VENUS Surry Hills - FEMALE ONLY HOSTEL - Long stay negotiable,US$33,"8,1",Muy bien,431,https://cf.bstatic.com/xdata/images/hotel/max1024x768/462360607.webp?k=44d6e43934003140fbe5b1b242c17557ad29b2d574870878f7c86352b7d15fe5&o=,https://www.booking.com/hotel/au/sydney-city-stay.es.html?aid=2410095,"Seguridad 24 horas, Prohibido fumar en todo el alojamiento, Bañera o ducha, Toallas / sábanas (por un suplemento), Artículos de aseo gratis, Taquillas, Cocina compartida, Cámaras de seguridad fuera del alojamiento, Ropa de cama, Solo para adultos, Ducha, Servicio de lavandería, Aire acondicionado, Indonesio, Japonés, Español, Habitaciones sin humo, Francés, Inglés, Coreano, WiFi gratis, Servicio de limpieza diario, Zona TV / salón de uso compartido, Registro de entrada y salida exprés, Detectores de humo, Papel higiénico, WC, Extintores, Cámaras de seguridad en las zonas comunitarias",Surry Hills,Australia,"VENUS Surry Hills - FEMALE ONLY HOSTEL - Long stay negotiable se encuentra en Sídney, a 17 min a pie de Estación Central de Sídney, y dispone de salón de uso común, habitaciones libres de humo y wifi gratis. El alojamiento está a unos 1,8 km de Museo Hyde Park Barracks, a 1,9 km de Galería de arte de Nueva Gales del Sur y a 3,4 km de Estación de autobús y tren Bondi Junction. Centro de Convenciones Internacional de Sídney está a 3,5 km de la posada u hostería y Real Jardín Botánico de Sídney, a 3,6 km.

Las habitaciones incluyen ropa de cama.

Museo Marítimo Nacional de Australia está a 3,7 km del alojamiento, y Centro de eventos The Star está a 3,9 km. El aeropuerto más cercano (Aeropuerto Kingsford Smith de Sídney) está a 8 km del alojamiento."
Maze Backpackers - Sydney,US$38,"7,0",Bien,2.652,https://cf.bstatic.com/xdata/images/hotel/max1024x768/352128157.webp?k=e0262d6778721122401d9bd55f0ea42ebe9cf442c3d409f8e73422163aba60af&o=,https://www.booking.com/hotel/au/maze-backpackers.es.html?aid=2410095,"Billar, Guardaequipaje, Seguridad 24 horas, Toallas, Prohibido fumar en todo el alojamiento, Suelo de moqueta, Plancha para ropa, Solo para adultos, Taquillas, Cocina compartida, Cámaras de seguridad fuera del alojamiento, Ropa de cama, Enchufe cerca de la cama, Ducha, Ventilador, Servicio de lavandería, Hindi, Persa, Portugués, Chino, Sala de juegos, Turco, Máquina expendedora (aperitivos), Polaco, Terraza / solárium, Español, Tarjeta de acceso, Habitaciones sin humo, Francés, Inglés, Noches de cine, Italiano, WiFi gratis, Utensilios de planchado, Tours a pie, Máquina expendedora (bebidas), Happy hour, Zona TV / salón de uso compartido, Detectores de humo, Acceso a pisos superiores solo mediante escaleras, Árabe, Papel higiénico, Baño compartido, WC, Extintores, Checo, Cámaras de seguridad en las zonas comunitarias, Proporciona factura, Mobiliario exterior, Recepción 24 horas",Surry Hills,Australia,"El Maze Backpackers es un albergue de ambiente animado que goza de una ubicación excelente en el distrito financiero de Sídney, a 5 minutos a pie de la estación central. Ofrece recepción 24 horas y servicio de lavandería. La Darling Harbour está a 12 minutos a pie.

El Maze Backpackers Sydney dispone de habitaciones privadas y compartidas sencillas con baño compartido. Cuenta con zona de salón compartida con TV y la sala de juegos con mesa de billar.

Hay consigna de equipaje y taquillas. El establecimiento proporciona secadores de pelo y utensilios de planchado.

El Maze Backpackers Sydney ocupa un edificio protegido y tiene cocina totalmente equipada. En los alrededores hay restaurantes, bares, discotecas y tiendas. Aparcamientos cercanos: aparcamiento de Capital Square y aparcamiento de World Square (ambos de pago)."
The Downing Hostel,US$29,"7,2",Bien,217,https://cf.bstatic.com/xdata/images/hotel/max1024x768/484139162.webp?k=ef4269f55e2194c6481a4981cbcaf12c858ce22885f8cd1d03c16477e98ba63b&o=,https://www.booking.com/hotel/au/strattons-hostel.es.html?aid=2410095,"Guardaequipaje, Prohibido fumar en todo el alojamiento, Senderismo, Perchero, Toallas / sábanas (por un suplemento), Fax / fotocopiadora, Taquillas, Bar, Cocina compartida, Ropa de cama, Cámaras de seguridad fuera del alojamiento, Ducha, Solo para adultos, Ventilador, Servicio de lavandería, Productos de limpieza, Llave de acceso, Aire acondicionado, Juegos de mesa / puzles, Restaurante, Terraza, Registro de entrada / salida privado, 2 restaurantes, Karaoke, Español, Tarjeta de acceso, Alemán, Ciclismo, Habitaciones sin humo, Francés, Inglés, Noches de cine, Entretenimiento nocturno, WiFi gratis, Servicio de limpieza diario, Chimenea, Tours a pie, Zona TV / salón de uso compartido, Registro de entrada y salida exprés, Detectores de humo, Papel higiénico, Baño compartido, WC, Ruta de bares, Extintores, Hipoalergénico, Cámaras de seguridad en las zonas comunitarias, Alarma de seguridad, Caja fuerte, Zona de pícnic, Mobiliario exterior",Surry Hills,Australia,"El The Downing Hostel está rodeado de restaurantes, cafeterías y discotecas en el distrito financiero de Sídney y ofrece conexión WiFi gratuita, cocina compartida y bar/restaurante. Se encuentra a 150 meters de Hyde Park y a 2 minutos a pie de la estación de tren Museum.

El Downing Hostel se encuentra a 15 minutos a pie de la estación central y de la terminal de autobuses. La ópera de Sídney está a 2,5 km del albergue. El aeropuerto internacional de Sídney está a 15 minutos en tren. En la recepción se pueden organizar diversas actividades, como tiro con arco, bolos y tenis.

El Downing Hostel Sydney, solo para adultos, ofrece habitaciones privadas y compartidas. Todos los huéspedes tienen acceso a un baño compartido y a una lavandería y utensilios de planchado de uso gratuito. Hay un bistró en la planta baja que ofrece una variedad de comidas. Los huéspedes pueden guardar sus objetos de valor en la oficina."
The Ultimo,US$262,"8,1",Muy bien,3.989,https://cf.bstatic.com/xdata/images/hotel/max1024x768/483934749.webp?k=177a216030357e6632679e1d3635a31f4fa167eeca91b2b039ced624e40851d5&o=,https://www.booking.com/hotel/au/aarons-sydney.es.html?aid=2410095,"Guardaequipaje, Seguridad 24 horas, Cesta para mascotas, Servicio de despertador, Prohibido fumar en todo el alojamiento, Suelo de moqueta, Baño privado, Fax / fotocopiadora, Artículos de aseo gratis, Calefacción, Cámaras de seguridad fuera del alojamiento, Ventilador, Ropa de cama, Ducha, Servicio de lavandería, Reloj despertador, Aire acondicionado, Ascensor, Máquina expendedora (aperitivos), Polaco, TV de pantalla plana, Adaptado personas de movilidad reducida, Tarjeta de acceso, Habitaciones sin humo, Boles para mascotas, Inglés, WiFi gratis, Servicio de limpieza diario, Utensilios de planchado, Parking privado, Tailandés, Máquina expendedora (bebidas), Detectores de humo, Hervidor eléctrico, WC, Nevera, TV, Extintores, Secador de pelo, Cámaras de seguridad en las zonas comunitarias, Teléfono, Habitaciones familiares, Alarma de seguridad, Proporciona factura, Recepción 24 horas",Surry Hills,Australia,"The Ultimo features modern accommodation in the vibrant Chinatown district. Constructed in 1911 as a key component in Haymarket’s transition to become Sydney’s fresh fruit market, the heritage-listed building is a reminder of Sydney’s bustling and vibrant commercial heritage which continues to this day.

The Ultimo is just a 3-minute walk from bus and light rail stops. It is only a 5-minute walk from the Central Train Station, providing easy access to all of Sydney’s attractions

After an extensive refurbishment in 2016, the hotel features 95 rooms across seven categories from cozy Ultimo single rooms to spacious Ultimo Courtyard rooms. (The Courtyard room type also welcomes your furry friends!). We provide complimentary WiFi, and a barista coffee station in the lobby to round up your stay at The Ultimo Hotel in Sydney’s vibrant Chinatown neighborhood."
VENUS Potts Point - FEMALE ONLY HOSTEL - Long stay negotiable,US$30,"7,8",Bien,547,https://cf.bstatic.com/xdata/images/hotel/max1024x768/430476486.webp?k=1f9c38207ec62803601be33b9b785a2e3287dacd05ef823ccddb635625ff5237&o=,https://www.booking.com/hotel/au/venus-potts-point-sydney.es.html?aid=2410095,"Tetera/cafetera en todas las habitaciones, Prohibido fumar en todo el alojamiento, Solo para adultos, Toallas / sábanas (por un suplemento), Cocina, Taquillas, Cocina compartida, Mesa de comedor, Ropa de cama, Enchufe cerca de la cama, Ducha, Cámaras de seguridad fuera del alojamiento, Indonesio, Terraza, Microondas, Zona de comedor, Japonés, Utensilios de cocina, Español, Habitaciones sin humo, Francés, Inglés, Coreano, WiFi gratis, Registro de entrada y salida exprés, Detectores de humo, Baño compartido, Hervidor eléctrico, WC, Nevera, Extintores, Tetera / cafetera, Cámaras de seguridad en las zonas comunitarias",Surry Hills,Australia,"VENUS Potts Point - FEMALE ONLY HOSTEL - Long stay negotiable se encuentra en Sídney, a 15 min a pie de Museo Hyde Park Barracks, y dispone de terraza, habitaciones libres de humo y wifi gratis. El alojamiento está a unos menos de 1 km de Galería de arte de Nueva Gales del Sur, a 2,7 km de Estación Central de Sídney y a 17 min a pie de Real Jardín Botánico de Sídney. Centro de Convenciones Internacional de Sídney está a 3,9 km del albergue y Museo Marítimo Nacional de Australia, a 4 km.

Todas las habitaciones de este alojamiento están equipadas con hervidor. Todas las habitaciones disponen de baño compartido con ducha, y algunas también ofrecen vistas a la ciudad. Todas las unidades disponen de ropa de cama.

Centro de eventos The Star está a 4,2 km del alojamiento, y Puente de la Bahía de Sídney está a 4,9 km. El aeropuerto más cercano (Aeropuerto Kingsford Smith de Sídney) está a 12 km."
Mad Monkey Broadway,US$30,"7,5",Bien,754,https://cf.bstatic.com/xdata/images/hotel/max1024x768/130619556.webp?k=925cd2e34aac4f81058c5e3ca49773c349e3d7415d0f5b39c6ebe0f24b178303&o=,https://www.booking.com/hotel/au/mad-monkey-backpackers-on-broadway.es.html?aid=2410095,"Guardaequipaje, Prohibido fumar en todo el alojamiento, Solo para adultos, Taquillas, Cocina compartida, Cámaras de seguridad fuera del alojamiento, Ropa de cama, Enchufe cerca de la cama, Ducha, Servicio de lavandería, Sala de juegos, Llave de acceso, Aire acondicionado, Juegos de mesa / puzles, Comedia en vivo, Habitaciones sin humo, Inglés, Entretenimiento nocturno, WiFi gratis, Zona TV / salón de uso compartido, Detectores de humo, Acceso a pisos superiores solo mediante escaleras, Papel higiénico, WC, Ruta de bares, Extintores, Secador de pelo, Cámaras de seguridad en las zonas comunitarias, Alarma de seguridad, Habitaciones insonorizadas",Surry Hills,Australia,"El Mad Monkey Broadway se encuentra a menos de 10 minutos a pie de la Universidad de Tecnología de Sídney. Los huéspedes disfrutan de conexión WiFi gratuita en todas las instalaciones.

El baño es compartido. El establecimiento alberga una cocina compartida.

El Mad Monkey Backpackers queda a 10 minutos en coche de los numerosos restaurantes y bares del puerto Darling. La estación central está a 15 minutos a pie, mientras que Pitt St Mall y Hyde Park se hallan a 10 minutos en coche. La emblemática ópera de Sídney se encuentra a 15 minutos en coche."
VENUS Harbourside - FEMALE ONLY HOSTEL,US$31,"7,7",Bien,565,https://cf.bstatic.com/xdata/images/hotel/max1024x768/482698495.webp?k=2b43732471bdb12f622ccaff5c976f635f14bdafa330d434c650d333c7091a41&o=,https://www.booking.com/hotel/au/sydney-darling-harbour-pyrmont.es.html?aid=2410095,"Prohibido fumar en todo el alojamiento, Solo para adultos, Toallas / sábanas (por un suplemento), Calefacción, Artículos de aseo gratis, Cocina compartida, Taquillas, Ropa de cama, Enchufe cerca de la cama, Ducha, Cámaras de seguridad fuera del alojamiento, Servicio de lavandería, Indonesio, Terraza, Japonés, Español, Habitaciones sin humo, Francés, Inglés, Coreano, WiFi gratis, Servicio de limpieza diario, Zona TV / salón de uso compartido, Registro de entrada y salida exprés, Detectores de humo, Papel higiénico, WC, Nevera, Extintores, Cámaras de seguridad en las zonas comunitarias, Suelo de moqueta",Surry Hills,Australia,"VENUS Harbourside - FEMALE ONLY HOSTEL is located a 3-minute walk from Pyrmont Bay Light Rail Station with direct connections to Central Station and the Domestic and International Airports. It is 270 metres from Pyrmont Bay Ferry Wharf and a 5-minute walk from the Star Casino. It offers a rooftop terrace and free WiFi access.

VENUS Harbourside - FEMALE ONLY HOSTEL is a 10-minute walk from Sydney's city centre. It is a short 10-minute ferry trip from Circular Quay and the Sydney Opera House. The property is 5 minutes' walk from ICC Sydney (International Convention Centre Sydney) and 8 minutes' drive from Chinatown."
VENUS Central Sydney - FEMALE ONLY HOSTEL,US$33,"7,8",Bien,514,https://cf.bstatic.com/xdata/images/hotel/max1024x768/461686911.webp?k=0dc6beb98fd2f347f03d1ca05a36553f9301999d7a79ef01a974e6cafc2e402c&o=,https://www.booking.com/hotel/au/venus-surry-hills.es.html?aid=2410095,"Seguridad 24 horas, Vistas a la ciudad, Prohibido fumar en todo el alojamiento, Suelo de moqueta, Solo para adultos, Toallas / sábanas (por un suplemento), Taquillas, Cocina compartida, Cámaras de seguridad fuera del alojamiento, Ropa de cama, Enchufe cerca de la cama, Ducha, Servicio de lavandería, Aire acondicionado, Indonesio, Japonés, Español, Habitaciones sin humo, Francés, Inglés, Coreano, WiFi gratis, Servicio de limpieza diario, Zona TV / salón de uso compartido, Registro de entrada y salida exprés, Detectores de humo, WC, Extintores, Entrada privada, Cámaras de seguridad en las zonas comunitarias, Proporciona factura",Surry Hills,Australia,"VENUS Central Sydney - FEMALE ONLY HOSTEL se encuentra en Sídney, a 7 min a pie de Estación Central de Sídney, y dispone de salón de uso común, habitaciones libres de humo y wifi gratis. El alojamiento está a 15 min a pie de Museo Hyde Park Barracks, a 1,7 km de Galería de arte de Nueva Gales del Sur y a 18 min a pie de Centro de Convenciones Internacional de Sídney. Hay vistas a la ciudad.

Todas las unidades disponen de ropa de cama.

Real Jardín Botánico de Sídney está a 2,1 km del alojamiento, y Museo Marítimo Nacional de Australia está a 1,9 km. El aeropuerto más cercano (Aeropuerto Kingsford Smith de Sídney) está a 8 km."
"Secret Garden Backpackers, Sydney",US$33,"7,3",Bien,505,https://cf.bstatic.com/xdata/images/hotel/max1024x768/80415128.webp?k=e4cf7a2a732a82a4e4ba79b0859c8b6b915a84f20de5d33ee0f59b40145bc8ea&o=,https://www.booking.com/hotel/au/secret-garden-backpackers-sydney.es.html?aid=2410095,"Guardaequipaje, Suelo de moqueta, Fax / fotocopiadora, Toallas / sábanas (por un suplemento), Taquillas, Cocina compartida, Zona de fumadores, Ropa de cama, Enchufe cerca de la cama, Ducha, Ventilador, Servicio de lavandería, Sala de juegos, Juegos de mesa / puzles, Terraza, Terraza / solárium, Barbacoa, Español, Alemán, Habitaciones sin humo, Personal de animación, Inglés, Noches de cine, Entretenimiento nocturno, Francés, Italiano, WiFi gratis, Tours a pie, Máquina expendedora (bebidas), Zona TV / salón de uso compartido, Detectores de humo, Papel higiénico, Baño compartido, WC, Jardín, Proporciona factura, Mobiliario exterior",Surry Hills,Australia,"El Secret Garden Backpackers es un establecimiento joven y animado situado a menos de 10 minutos a pie de la estación central de tren de Sídney. Ofrece habitaciones compartidas modernas con baño compartido, cocina y lavadora. Hay WiFi gratuita en todas las habitaciones y zonas comunes.

Los huéspedes pueden disfrutar de bingo musical en el jardín o karaoke en Scruffy Murphys, excursiones de un día los fines de semana y tortitas gratuitas los domingos.

También hay una sala de TV y el parque Prince Alfred. Tome el tren, que le llevará a la Ópera en unos 10 minutos.

Las tiendas, restaurantes y bares de Surry Hills están a 10 minutos a pie del Secret Garden Backpackers. El puerto Darling se encuentra a 25 minutos a pie. El aeropuerto Kingsford Smith es el más cercano y está a 6 km del Secret Garden Backpackers."
