hotel,hotel_url,description,popular_facilities,highres_url,city,country
Seguridad y Tranquilidad,https://www.booking.com/hotel/ve/seguridad-y-tranquilidad.es.html?aid=2410095,"Seguridad y Tranquilidad es un alojamiento con wifi gratis y vistas a la montaña que se encuentra en Caracas. El alojamiento, que está a 11 km de Univesidad de Venezuela, dispone de jardín y parking privado gratis.

Esta casa o chalet tiene 3 dormitorios, cocina con nevera y lavavajillas, TV de pantalla plana, zona de estar y 1 baño con bañera o ducha. Hay toallas y ropa de cama en la casa o chalet.

Parque Los Caobos está a 11 km del alojamiento, y Jardín Botánico está a 11 km. El aeropuerto más cercano (Aeropuerto internacional Simon Bolívar) está a 38 km.","Prohibido fumar en todo el alojamiento, Cocina, WiFi gratis, Vistas, Tendedero, Utensilios de cocina, Lavavajillas, Vistas a la montaña, Escritorio, Lavadora, Toallas / sábanas (por un suplemento), Zona de estar, Horno, Vistas al jardín, Enchufe cerca de la cama, Ventilador, Perchero, Tetera / cafetera, Fogones, Habitaciones familiares, Sofá, Entrada privada, Parking gratis, Plancha para ropa, Español, Mesa de comedor, Inglés, Secadora de ropa, Bañera o ducha, Habitaciones sin humo, Papel higiénico, Armario, Jardín, Zona de cocina, Microondas, Ropa de cama, Toallas, Guardaequipaje, Nevera, Zona de comedor, WC, TV de pantalla plana, Acceso a pisos superiores solo mediante escaleras",https://cf.bstatic.com/xdata/images/hotel/max1024x768/574562093.jpg?k=a65a553620dc2bf9a5e65b2b7eb3986cb0bf52177e350bed930cdbc1bdf08ba4&o=&hp=1,Trujillo,Venezuela
Apto de Lujo Santa Eduvigis,https://www.booking.com/hotel/ve/apto-de-lujo-santa-eduvigis.es.html?aid=2410095,"Apto de Lujo Santa Eduvigis, que se encuentra en Caracas, ofrece alojamiento con piscina privada, vistas al jardín y balcón. El alojamiento, que está a 7,5 km de Parque Los Caobos, dispone de terraza y parking privado gratis.

Este apartamento de 3 dormitorios ofrece TV de pantalla plana, aire acondicionado y sala de estar. El alojamiento ofrece cocina.

Complejo Cultural Teresa Carreño está a 8,1 km del alojamiento, y Univesidad de Venezuela está a 8,2 km. El aeropuerto (Aeropuerto internacional Simon Bolívar) está a 35 km.","Cocina, Parking gratis, WiFi gratis, Piscina, Vistas al jardín, Vistas, Español, Inglés, Aire acondicionado, Balcón, Terraza, TV de pantalla plana, Piscina privada",https://cf.bstatic.com/xdata/images/hotel/max1024x768/578123622.jpg?k=7438b3a9febce478b73d7e2ccc8e3a0e2e4bc3b9562c84cdb4c3a0554fb9810d&o=&hp=1,Trujillo,Venezuela
