hotel,hotel_url,description,popular_facilities,highres_url,city,country
Sea Eye Hotel - Sunset Building,https://www.booking.com/hotel/hn/tropical-sunset.es.html?aid=2410095,"El Tropical Sunset se encuentra en Utila y dispone de zona de playa privada y vistas a la bahía de Utila. Hay conexión WiFi y aparcamiento privado, ambos gratuitos.

Las habitaciones disponen de aire acondicionado y zona de estar. Incluye un baño privado con ducha y artículos de aseo gratuitos. Las habitaciones incluyen ropa de cama y ventilador. Algunas cuentan con cocina.

En el Tropical Sunset hay un jardín y una terraza con hamacas. En el alojamiento y sus alrededores es posible practicar diversas actividades, como golf, ciclismo y equitación.

A 5 minutos a pie del Tropical Sunset hay numerosos centros de buceo. El aeropuerto de Utila está situado a 5 minutos en coche.","Masaje de pies, Masaje de cuello, Papel higiénico, Ropa de cama, Vistas al jardín, Caja fuerte, Baño privado, Inglés, Aire acondicionado, Eventos deportivos en directo (emisión), Registro de entrada / salida privado, Parking gratis, Habitaciones sin humo, Suelo de baldosa / mármol, Patio, Noches de cine, Sombrillas, Seguridad 24 horas, TV de pantalla plana, Canales por cable, Playa, Toallas, Masaje de manos, Bañera o ducha, Snorkel, WC, Barbacoa, Masajes, Bar, Baños públicos, Guardaequipaje, Masaje de espalda, Restaurante, Ruta de bares, Terraza, Ducha, Artículos de aseo gratis, Alquiler de bicicletas, Parking adaptado para personas de movilidad reducida, Situado frente a la playa, Jardín, Mobiliario exterior, Llave de acceso, Happy hour, Zona privada de playa, Equitación, Zona de pícnic, Parking en la calle, Servicio de limpieza diario, Piragüismo, Tour o clase sobre cultura local, Fruta, Información turística, Instalaciones para deportes acuáticos en el alojamiento, Discoteca / DJ, Registro de entrada y salida exprés, Extintores, Masaje corporal completo, Masaje de cabeza, WiFi gratis, Música / espectáculos en directo, Submarinismo, Ciclismo, Ventilador, Perchero, Terraza / solárium, Armario, Habitaciones familiares, Pesca, TV, Menú para niños, Desayuno, Español",https://cf.bstatic.com/xdata/images/hotel/max1024x768/418610472.jpg?k=8760036fa619ed715678e5019c316609dec80669536f09590165dbe730a8e60d&o=&hp=1,Utila,Honduras
Fenix House Rental in Utila,https://www.booking.com/hotel/hn/fenix-house-rental-in-utila.es.html?aid=2410095,"Fenix House Rental in Utila se encuentra en Útila y ofrece alojamiento con balcón y wifi gratis. Este apartamento está a 14 min a pie de Playa de Chepes y a 1,6 km de Playa Bando.

El apartamento cuenta con 3 dormitorios, una cocina totalmente equipada con nevera y microondas, y 1 baño con ducha.

El apartamento ofrece servicio de alquiler de coches.

El aeropuerto más cercano (Aeropuerto de Utila) está a pocos pasos del alojamiento.","Papel higiénico, Aire acondicionado, Toallas, Baño compartido, Servicio de traslado, Nevera, Ducha, Zona de comedor, Prohibido fumar en todo el alojamiento, Tostadora, Mesa de comedor, Servicio de limpieza diario, Microondas, Alquiler de coches, WiFi gratis, Cocina, Ventilador, Tetera / cafetera, Inglés, Balcón, Español",https://cf.bstatic.com/xdata/images/hotel/max1024x768/582115362.jpg?k=fae0da3e61755662268788672db82fa8592c36229d63ec578259578cdd85ee0a&o=&hp=1,Utila,Honduras
