hotel,price,score,avg_review,reviews_count,image_links,hotel_url,popular_facilities,city,country,description
Комфортная квартира в Ванадзоре,US$39,"9,5",Excepcional,19,https://cf.bstatic.com/xdata/images/hotel/max1024x768/446344670.webp?k=70e33862026eb81981bcf5bfc561ded3791e5dadff882b1ce8058ee4706d0c9c&o=,https://www.booking.com/hotel/am/komfortnaia-kvartira-v-vanadzore.es.html?aid=2410095,"Zona de estar, Ducha, Productos de limpieza, Apartamento privado en edificio, Ruso, Wifi rápida gratis (121 Mbps), TV de pantalla plana, Perchero, Acceso a pisos superiores solo mediante escaleras, Papel higiénico, Detector de monóxido de carbono, Bañera o ducha, Entrada privada, Suelo de madera o parquet, Zapatillas, Tetera / cafetera, Secador de pelo, Plancha para ropa, Prohibido fumar en todo el alojamiento, Calefacción, TV, Artículos de aseo gratis, Cocina, Cama plegable, Vistas a la ciudad, Proporciona factura, Utensilios de planchado, Nevera, Sofá cama, Toda la unidad en la planta baja, Fogones, Mesa de comedor, Baño privado, Enchufe cerca de la cama, Suelo de baldosa / mármol, Habitaciones familiares, Toallas, Inglés, Lavadora, Utensilios de cocina, Insonorización, Vistas, Armario, Canales por cable, Habitaciones sin humo, Sofá, Tendedero, Microondas, Parking gratis, Hervidor eléctrico, WC, Ropa de cama",Vanadzor,Armenia,"Комфортная квартира в Ванадзоре está en Vanadzor. Tiene vistas a la ciudad y wifi gratis en todo el alojamiento.

El apartamento de 1 dormitorio dispone de sala de estar con TV de pantalla plana con canales por cable, cocina totalmente equipada con nevera y microondas, y 1 baño con ducha. Hay toallas y ropa de cama en el apartamento.

El aeropuerto (Aeropuerto internacional de Shirak) está a 65 km."
Комфортная квартира в центре,US$37,"9,3",Fantástico,12,https://cf.bstatic.com/xdata/images/hotel/max1024x768/431578874.webp?k=6486c6d0c0e056eef843fc0b492f2654f2916d90846451ec068b89f130d55d5b&o=,https://www.booking.com/hotel/am/komfortnaia-kvartira-v-tsentre-vanadzor.es.html?aid=2410095,"Ruso, TV de pantalla plana, Prohibido fumar en todo el alojamiento, Parking gratis, Calefacción, Wifi rápida gratis (89 Mbps), Aire acondicionado, Cocina, Inglés, Lavadora, Vistas",Vanadzor,Armenia,"Комфортная квартира в центре se encuentra en Vanadzor. Este apartamento ofrece wifi gratis y una cocina totalmente equipada.

Este apartamento de 1 dormitorio ofrece TV de pantalla plana, aire acondicionado y sala de estar.

El aeropuerto más cercano (Aeropuerto internacional de Shirak) está a 65 km del alojamiento."
Sochiner Hotel,US$50,"8,0",Muy bien,1,https://cf.bstatic.com/xdata/images/hotel/max1024x768/483356647.webp?k=77d7be2240ff890bd65b03a4d05fab298e6b797c06ebddefd2af82c7be6da8c2&o=,https://www.booking.com/hotel/am/sochiner-vanadzor1.es.html?aid=2410095,"Vestidor, Ducha, Productos de limpieza, Ruso, Terraza, TV de pantalla plana, Balcón, Jardín, Perchero, Recepción 24 horas, Papel higiénico, Detector de monóxido de carbono, Bañera o ducha, Vistas a un patio interior, Zapatillas, Escritorio, Tetera / cafetera, Vistas a la montaña, Prohibido fumar en todo el alojamiento, Calefacción, Artículos de aseo gratis, Vistas a la ciudad, Cocina, Zona de comedor exterior, Aire acondicionado, WiFi gratis, Tetera/cafetera en todas las habitaciones, Barbacoa, Nevera, Mosquitera, Patio, Baño privado, Enchufe cerca de la cama, Toallas, Albornoz, Lavadora, Utensilios de cocina, Muebles de exterior, Vistas, Parking adaptado para personas de movilidad reducida, Insonorización, Armario, Vistas al jardín, Habitaciones sin humo, Parking gratis, Hervidor eléctrico, WC, Protector de enchufes para niños, Ropa de cama",Vanadzor,Armenia,"Sochiner Hotel se encuentra en Vanadzor y ofrece alojamiento de 3 estrellas con jardín. Hotel ofrece parking privado gratis y wifi gratis.

En el hotel, todas las habitaciones cuentan con aire acondicionado, escritorio, TV de pantalla plana, baño privado, ropa de cama, toallas y terraza con vistas a la ciudad. Todas las unidades cuentan con nevera.

El personal de recepción siempre está dispuesto a ayudar.

El aeropuerto más cercano (Aeropuerto internacional de Shirak) está a 77 km del alojamiento."
Kirovakan Vacation House,US$136,ver...,,ver...,https://cf.bstatic.com/xdata/images/hotel/max1024x768/489411403.webp?k=ec08eb23bffafc360e583cae19470d36ceb8c1c4deb7e622a5d05749ab6d84c9&o=,https://www.booking.com/hotel/am/kirovakan-vacation-house.es.html?aid=2410095,"Vistas al jardín, Ruso, TV de pantalla plana, Terraza, Prohibido fumar en todo el alojamiento, Parking gratis, Calefacción, Cocina, Inglés, WiFi gratis",Vanadzor,Armenia,"Kirovakan Vacation House se encuentra en Vanadzor. Se ofrece wifi gratis en todo el alojamiento.

Esta casa o chalet tiene acceso directo a una terraza con vistas al jardín y cuenta con 1 dormitorio y cocina totalmente equipada. Se ofrece TV de pantalla plana.

El aeropuerto más cercano (Aeropuerto internacional de Shirak) está a 68 km."
